id,title,pagerank,betweenness,in_degree,out_degree
gr-qc/0612060,"Gravitational waves from intermediate-mass-ratio inspirals for
  ground-based detectors",6.239405990466855e-06,1.990182755160072e-06,2.0,1.0
gr-qc/0402021,"Travelling Magnetic Waves due to Plasma Surrounding a Slow Rotating
  Compact Gravitational Source",5.78235499898746e-06,0.0,5.0,0.0
astro-ph/9709113,A Complexity-Brightness Correlation in Gamma Ray Bursts,4.308677856146974e-06,0.0,4.0,1.0
gr-qc/0407033,Superfluid Picture for Rotating Space-Times,3.795771689869602e-06,6.00930136268756e-06,7.0,10.0
hep-ex/0305008,Can We Detect Tachyons Now?,1.8950380516170012e-06,0.0,1.0,0.0
gr-qc/0501080,Black hole formation through fragmentation of toroidal polytropes,1.3189329710618589e-06,0.0,0.0,6.0
astro-ph/0609009,The optical spectral slope variability of 17 blazars,,,,
astro-ph/0701129,"Optical multi-band observations of BL Lacertae during the outburst of
  2005",,,,
astro-ph/0702731,"Chaotic Accretion in a Non-Stationary Electromagnetic Field of a Slowly
  Rotating Compact Star",,,,
