id,title,pagerank,betweenness,in_degree,out_degree
cond-mat/0309074,"On the scaling approach to electron-electron interactions in a chaotic
  quantum dot",8.533795544363637e-06,4.025471918811888e-06,1.0,1.0
cond-mat/0210708,"A survey of rigorous results on random Schroedinger operators for
  amorphous solids",8.514781206969677e-06,0.0,6.0,3.0
cond-mat/0311283,Quantum-to-classical crossover of mesoscopic conductance fluctuations,8.498498392195023e-06,0.0,1.0,1.0
quant-ph/0510194,Beam Splitter for Spin Waves in Quantum Spin Network,8.487303825008172e-06,4.739597013710599e-07,3.0,1.0
cond-mat/9908285,K-matrices for non-abelian quantum Hall states,8.472130342425925e-06,2.0453096548999617e-06,12.0,4.0
cond-mat/0011301,Vortex charge in mesoscopic superconductors,8.463085190167575e-06,0.0,5.0,0.0
cond-mat/0202353,Magnetic field effects in energy relaxation mediated by Kondo impurities,8.41184057615729e-06,0.0,5.0,1.0
cond-mat/0409334,"Manifestation of the spin-Hall effect through transport measurements in
  the mesoscopic regime",8.406867065734628e-06,0.0,18.0,8.0
cond-mat/0701535,"Duality, the Semi-Circle Law and Quantum Hall Bilayers",8.381906926324503e-06,0.0,13.0,0.0
quant-ph/0507256,"An approximate method for treating dispersion in one-way quantum
  channels",8.374188312809688e-06,0.0,1.0,0.0
cond-mat/0703324,The Resonant Light Absorption by Semiconductor Quantum Dots,8.36535078738492e-06,0.0,6.0,0.0
cond-mat/0606387,The electron lifetime in Luttinger liquids,8.322786874923267e-06,7.05363940445526e-06,3.0,2.0
quant-ph/0211070,Numerical study of induced vortex tunneling,8.303616482760369e-06,0.0,2.0,1.0
cond-mat/0507638,Population inversion of driven two-level systems in a structureless bath,8.300775528000548e-06,0.0,4.0,0.0
cond-mat/0603525,Level Repulsion in Constrained Gaussian Random-Matrix Ensembles,8.283100837007206e-06,1.990182755160072e-06,8.0,1.0
cond-mat/0207622,"Non-Perturbative Aspects of Fano Resonances in Quantum Dots: An Exact
  Treatment",8.27878764656286e-06,1.3861969438925876e-07,3.0,3.0
cond-mat/0005435,"Ballistic reflection at a side-gate in a
  superconductor-semiconductor-superconductor structure",8.275131714366213e-06,0.0,2.0,1.0
cond-mat/0701045,Andreev reflection in bilayer graphene,8.262517575868211e-06,1.341766366660461e-07,6.0,1.0
cond-mat/0605361,"Scattering wave function approach to multi-terminal mesoscopic system
  with spin-orbit coupling",8.258030591444184e-06,1.3624478237906293e-06,5.0,1.0
cond-mat/0207533,Mesoscopic Stern-Gerlach device to polarize spin currents,8.257979514539714e-06,1.0569373607026584e-05,8.0,4.0
quant-ph/0312120,"Quantum chaos and random matrix theoryfor fidelity decay in quantum
  computationswith static imperfections",8.252155463990402e-06,2.227317199588914e-06,6.0,3.0
cond-mat/0602101,Defect mediated melting and the breaking of quantum double symmetries,8.248805534786513e-06,5.985400375593351e-06,3.0,3.0
cond-mat/0106100,"Charge fluctuation induced dephasing in a gated mesoscopic
  interferometer",8.247243198805713e-06,1.990182755160072e-06,3.0,1.0
cond-mat/9811288,Fun with Quantum Dots,8.2423730702189e-06,0.0,7.0,0.0
cond-mat/9705224,The field theory of Skyrme lattices in quantum Hall ferromagnets,8.237040560836613e-06,0.0,5.0,0.0
cond-mat/0611491,"Formation of a ""Cluster Molecule"" (C20)2 and its thermal stability",8.221360442886334e-06,0.0,5.0,0.0
cond-mat/0301380,"Comments on ""Fractional Quantum Hall Effect of Composite Fermions, W.
  Pan, et al, Phys. Rev. Lett. 90, 016801 (2003)",8.21783265268436e-06,4.956891750258761e-07,7.0,1.0
quant-ph/0403100,Coherent quantum control of $\Lambda$-atoms through the stochastic limit,8.214794669420375e-06,0.0,1.0,0.0
cond-mat/0103089,Random-matrix ensembles in p-wave vortices,8.205913555668346e-06,1.585809350231984e-05,14.0,6.0
cond-mat/0405155,Universality of the one dimensional Bose gas with delta interaction,8.197067677843613e-06,0.0,4.0,0.0
cond-mat/0311159,"Electron spin dynamics in quantum dots and related nanostructures due to
  hyperfine interaction with nuclei",8.196214524296294e-06,1.20920929837773e-07,7.0,2.0
cond-mat/0609395,Conductance through an array of quantum dots,8.193639712517484e-06,0.0,3.0,0.0
cond-mat/0407258,"Investigation of trial wavefunction approach to bilayer Quantum Hall
  systems",8.191834965778438e-06,3.980365510320144e-06,3.0,2.0
cond-mat/0002256,Theoretical Perspectives on Spintronics and Spin-Polarized Transport,8.166632750719518e-06,2.3605502268736525e-05,7.0,3.0
cond-mat/0602585,"Readout methods and devices for Josephson-junction-based solid-state
  qubits",8.165264398503224e-06,3.7681884034408728e-06,5.0,1.0
cond-mat/0611447,"Cotunneling through quantum dots coupled to magnetic leads: zero-bias
  anomaly for non-collinear magnetic configurations",8.16223899910849e-06,0.0,4.0,0.0
cond-mat/0408220,"Collective Spin Dynamics in the ""Coherence Window"" for Quantum
  Nanomagnets",8.158727828111437e-06,1.990182755160072e-06,7.0,1.0
cond-mat/0111397,Mesoscopic Coulomb Drag,8.134374558677189e-06,0.0,6.0,0.0
cond-mat/0501394,"Microwave photoconductivity of a two-dimensional electron gas due to
  intra-Landau-level transitions",8.131676513178567e-06,0.0,6.0,0.0
cond-mat/9807393,"Universal critical temperature for Kosterlitz-Thouless transitions in
  bilayer quantum magnets",8.12399500596072e-06,1.990182755160072e-06,8.0,2.0
cond-mat/0211036,"The effect of large quantum fluctuation on the noise of a
  single-electron transistor",8.122939776858358e-06,0.0,2.0,1.0
cond-mat/0203080,Ferromagnetism in Diluted Magnetic Semiconductor Heterojunction Systems,8.100436099126888e-06,0.0,13.0,0.0
cond-mat/0509636,Fermat Principle for spinning light,8.098448324710736e-06,2.389811646069158e-06,8.0,5.0
cond-mat/9911188,Charge fluctuations and dephasing in coulomb coupled conductors,8.097454971801076e-06,5.238916102393263e-05,10.0,10.0
cond-mat/0410181,Parity measurement of one- and two-electron double well systems,8.096248150370285e-06,2.8603733517508066e-07,4.0,2.0
cond-mat/9811035,"Quantum conductivity corrections in two dimensional long-range
  disordered systems with strong spin-orbit splitting of electron spectrum",8.086660239112333e-06,0.0,12.0,0.0
cond-mat/0205226,"Universal Behavior of the Resistance Noise across the Metal-Insulator
  Transition in Silicon Inversion Layers",8.06555163531981e-06,8.84960432544885e-06,4.0,3.0
cond-mat/0601338,"Semi-fermionic representation for spin systems under equilibrium and
  non-equilibrium conditions",8.060764082815134e-06,0.0,4.0,0.0
cond-mat/0601674,Electric Dipole Induced Spin Resonance in Quantum Dots,8.048324916822344e-06,9.95091377580036e-06,2.0,9.0
cond-mat/0610768,"Cotunneling through two-level quantum dots weakly coupled to
  ferromagnetic leads",8.029440718137995e-06,7.4260550565674335e-09,2.0,1.0
cond-mat/0607397,"Generation of twin Fock states via transition from a two-component Mott
  insulator to a superfluid",7.997567404155693e-06,3.5138594484735573e-06,4.0,1.0
cond-mat/0505511,"Visibility of current and shot noise in electrical Mach-Zehnder and
  Hanbury Brown Twiss interferometers",7.976689727481044e-06,1.990182755160072e-06,7.0,1.0
cond-mat/0404411,"Microwave absorption/reflection and magneto-transport experiments on
  high-mobility electron gas",7.976370802546962e-06,1.5241482933267514e-05,6.0,7.0
cond-mat/9903045,Non-abelian Exclusion Statistics,7.965809067625568e-06,0.0,8.0,8.0
cond-mat/0112330,Charge densities and charge noise in mesoscopic conductors,7.959488284768919e-06,2.628031045945939e-05,9.0,5.0
cond-mat/0011307,Proximity Action theory of superconductive nanostructures,7.95387005303919e-06,0.0,4.0,0.0
cond-mat/0508176,Detecting a true quantum pump effect,7.947039565103987e-06,0.0,5.0,0.0
cond-mat/0502106,"Magnetic field symmetry of pump currents of adiabatically driven
  mesoscopic structures",7.942585867089828e-06,1.9117887320338936e-05,8.0,3.0
cond-mat/0310276,Josephson effect in quasi one-dimensional unconventional superconductors,7.90905687321013e-06,0.0,5.0,0.0
cond-mat/0407427,Effective temperature of a dissipative driven mesoscopic system,7.906548091393833e-06,3.980365510320144e-06,8.0,2.0
cond-mat/0612492,"Scattering by magnetic and spin-orbit impurities and the Josephson
  current in superconductor-ferromagnet-superconductor junctions",7.894176381104642e-06,0.0,3.0,1.0
cond-mat/0503716,Spintronic transport and Kondo effect in quantum dots,7.889781025218622e-06,0.0,10.0,0.0
cond-mat/0209349,"Correlation energy, quantum phase transition, and bias potential effects
  in quantum Hall bilayers at nu=1",7.87514894125274e-06,0.0,5.0,0.0
cond-mat/0009393,"Comment on ``Anomalous crossover between thermal and shot noise in
  macroscopic diffusive conductors''",7.86004039283512e-06,0.0,5.0,0.0
cond-mat/0201292,"BCS and Generalized BCS Superconductivity in Relativistic Quantum Field
  Theory. II. Numerical Calculations",7.847926423594564e-06,0.0,8.0,0.0
cond-mat/0104243,"An Investigation of Orientational Symmetry-Breaking Mechanisms in High
  Landau Levels",7.841961366014318e-06,1.4852110113134864e-08,7.0,3.0
quant-ph/0509175,Topological Quantum Computing with Only One Mobile Quasiparticle,7.841634112514532e-06,7.626944718946894e-07,4.0,2.0
cond-mat/0507309,"Flux-dependent Kondo temperature in an Aharonov-Bohm interferometer with
  an in-line quantum dot",7.832381316061474e-06,1.3983261671516476e-05,3.0,2.0
hep-th/0505129,LLL vs. LLM: Half BPS Sector of N=4 SYM Equals to Quantum Hall System,7.816904590496316e-06,2.06321806450145e-05,35.0,25.0
hep-th/0408002,"Quantized Normal Matrices: Some Exact Results and Collective Field
  Formulation",7.782346044114297e-06,9.640989556078423e-09,7.0,2.0
cond-mat/0507178,"Intrinsic phonon decoherence and quantum gates in coupled lateral
  quantum dot charge qubits",7.782192399882099e-06,2.5480661980142613e-06,6.0,1.0
cond-mat/0404614,Well-defined quasiparticles in interacting metallic grains,7.779723942893308e-06,3.2008879163405e-07,3.0,2.0
hep-th/0508062,Oscillator potential for the four-dimensional Hall effect,7.778082577860424e-06,7.561451318784973e-07,13.0,3.0
cond-mat/0506671,"Quantum-classical correspondence in the wavefunctions of Andreev
  billiards",7.769974044805896e-06,2.0050348652732067e-06,5.0,2.0
cond-mat/0611485,Long-range-correlated disorder in graphene,7.767801524940343e-06,1.2202775100339964e-06,7.0,1.0
cond-mat/0609714,"Theoretical Evidence for the Berry-Phase Mechanism of Anomalous Hall
  Transport: First-principles Studies on CuCr$_2$Se$_{4-x}$Br$_x$",7.76476927339523e-06,0.0,2.0,0.0
cond-mat/0302025,Andreev bound states in ferromagnet-superconductor nanostructures,7.760241011919146e-06,0.0,2.0,0.0
cond-mat/0207287,"Electromodulation of the Magnetoresistance in Diluted Magnetic
  Semiconductors Based Heterostructures",7.759570657696439e-06,0.0,5.0,0.0
cond-mat/0610633,Quantum versus classical hyperfine-induced dynamics in a quantum dot,7.758666923476738e-06,0.0,4.0,0.0
cond-mat/0603053,"Non-activated transport of strongly interacting two-dimensional holes in
  GaAs",7.751200038505384e-06,2.985274132740108e-06,2.0,2.0
cond-mat/0506531,Intrinsic Spin Hall Edges,7.748422668594304e-06,7.111608796622386e-08,12.0,5.0
cond-mat/0603306,Theory of Spin Hall Effects in Semiconductors,7.747845858649266e-06,9.544037715733503e-05,7.0,25.0
quant-ph/0412084,Optimized design of universal two-qubit gates,7.746524406460737e-06,5.843497574201196e-05,7.0,1.0
cond-mat/0402590,"Quantized charge pumping by surface acoustic waves in ballistic quasi-1D
  channels",7.728024042067783e-06,0.0,7.0,0.0
cond-mat/0506588,"Imaging mesoscopic spin Hall flow: Spatial distribution of local spin
  currents and spin densities in and out of multiterminal spin-orbit coupled
  semiconductor nanostructures",7.701477475641153e-06,2.3170890733584386e-07,19.0,2.0
cond-mat/0603142,"""Wormhole"" geometry for entrapping topologically-protected qubits in
  non-Abelian quantum Hall states and probing them with voltage and noise
  measurements",7.69659052357225e-06,4.942347907338399e-06,4.0,3.0
cond-mat/9812186,"The Chern-Simons Fermi Liquid Description of Fractional Quantum Hall
  States",7.695282554317237e-06,0.0,7.0,6.0
cond-mat/0612229,"A gentle introduction to the functional renormalization group: the Kondo
  effect in quantum dots",7.689484352983531e-06,0.0,1.0,0.0
cond-mat/0211618,"Electrical quantum measurement of a two-level system at arbitrary
  voltage and temperature",7.689160564573609e-06,2.900230612288788e-05,10.0,12.0
hep-th/0611300,Thermodynamical Properties of Hall Systems,7.679789481659712e-06,0.0,8.0,0.0
cond-mat/0111201,Dipole and Quadrupole Skyrmions in S=1 (Pseudo)Spin Systems,7.668026612744852e-06,1.990182755160072e-06,4.0,1.0
cond-mat/0510782,Leggett-Garg inequality with a kicked quantum pump,7.656196681409988e-06,7.964832338629045e-06,2.0,4.0
cond-mat/0612275,Spin torque and force due to current for general spin textures,7.653218095497128e-06,0.0,3.0,2.0
cond-mat/0407233,"Cyclostationary measurement of low-frequency odd moments of current
  fluctuations",7.641142767783039e-06,1.990182755160072e-06,7.0,1.0
cond-mat/0001355,"Phase interference of spin tunneling in an arbitrarily directed magnetic
  field",7.636610949740357e-06,0.0,11.0,0.0
cond-mat/0202241,Noise through Quantum Pumps,7.631575001314568e-06,0.0,8.0,3.0
cond-mat/0507526,Reduced visibility of quantum oscillations in the spin-boson model,7.621540474104751e-06,5.966146830345301e-07,5.0,2.0
cond-mat/0605205,"Non-universal suppression of the excitation gap in chaotic Andreev
  billiards: Superconducting terminals as sensitive probes for scarred states",7.618822370119251e-06,0.0,3.0,0.0
cond-mat/0401456,Dynamical Spin-Blockade in a quantum dot with paramagnetic leads,7.6050873593557935e-06,0.0,5.0,1.0
cond-mat/0102451,"Stability and Activation Gaps of Parafermionic Hall States in the Second
  Landau Level",7.604001393459384e-06,7.249467750736255e-08,15.0,3.0
cond-mat/9907126,Statistics of energy levels and eigenfunctions in disordered systems,7.588997972052934e-06,0.0,8.0,11.0
cond-mat/0105252,Twocomponent Fermi vapour in a 2D rotating trap,7.5832650682163955e-06,0.0,6.0,0.0
cond-mat/0407029,"Noise and Full Counting Statistics of Incoherent Multiple Andreev
  Reflection",7.581875282148768e-06,2.8223597249556085e-06,6.0,2.0
cond-mat/0212065,Loschmidt Echo and Lyapunov Exponent in a Quantum Disordered System,7.5751237736749475e-06,2.1897579848053216e-05,5.0,1.0
cond-mat/0510495,"Temperature effects on microwave-induced resistivity oscillations and
  zero resistance states in 2D electron systems",7.549043811294415e-06,0.0,3.0,0.0
cond-mat/0407279,"Non-vanishing spin Hall currents in disordered spin-orbit coupling
  systems",7.547588276501015e-06,3.9569651336018046e-05,18.0,17.0
cond-mat/0603792,Bose-Einstein condensates in fast rotation,7.533682948057822e-06,0.0,8.0,0.0
cond-mat/0411338,"Microwave induced resistance oscillations on a high-mobility 2DEG:
  absorption/reflection and temperature damping experiments",7.527201370701542e-06,4.726684043505171e-06,8.0,4.0
cond-mat/0006333,"Continuous quantum measurement of two coupled quantum dots using a point
  contact: A quantum trajectory approach",7.505959291099999e-06,0.0001044492858275,16.0,7.0
cond-mat/0111001,Stripe and bubble phases in quantum Hall systems,7.499360089762185e-06,0.0001482591477587,9.0,19.0
cond-mat/0501141,"Full counting statistics of super-Poissonian shot noise in multi-level
  quantum dots",7.493905063797359e-06,4.081653675115557e-06,5.0,1.0
cond-mat/0401364,Resistance of superconducting nanowires connected to normal metal leads,7.493491090399999e-06,1.990182755160072e-06,1.0,2.0
cond-mat/0203134,Multifractality at the spin quantum Hall transition,7.492000349200315e-06,1.3196365936641471e-05,6.0,2.0
quant-ph/0701148,"Inelastic collisions in an exactly solvable two-mode Bose-Einstein
  Condensate",7.446976296167724e-06,0.0,6.0,0.0
cond-mat/0006432,The fractional quantum Hall effect in infinite layer systems,7.438169647252852e-06,7.4260550565674335e-09,4.0,2.0
cond-mat/9610144,"Charge-Relaxation and Dwell Time in the fluctuating Admittance of a
  Chaotic Cavity",7.422564472206039e-06,0.0,2.0,2.0
cond-mat/0404123,Entangled Hanbury Brown Twiss effects with edge states,7.415771109731196e-06,0.0,11.0,0.0
cond-mat/0607125,"Topologically protected quantum gates for computation with non-Abelian
  anyons in the Pfaffian quantum Hall state",7.415619365117313e-06,0.0,14.0,1.0
cond-mat/0304201,Numerical Analysis of the Stub Transistor,7.407642223541491e-06,0.0,5.0,0.0
cond-mat/0402548,Spin and Current Variations in Josephson Junctions,7.40443613058615e-06,0.0,2.0,0.0
cond-mat/0107318,Renormalization group for network models of Quantum Hall transitions,7.3870578010220174e-06,1.8466452342754317e-05,11.0,3.0
cond-mat/9906170,Luttinger liquid behavior in multi-wall carbon nanotubes,7.376834361087243e-06,0.0,3.0,0.0
cond-mat/0509038,"Shot noise and spin-orbit coherent control of entangled and spin
  polarized electrons",7.376465209551443e-06,0.0,5.0,0.0
cond-mat/0611190,"Molecular junctions in the Coulomb blockade regime: rectification and
  nesting",7.37136818688287e-06,0.0,2.0,1.0
cond-mat/9612115,Screening of persistent currents in mesoscopic metal rings,7.37136818688287e-06,0.0,2.0,1.0
cond-mat/0106229,"Theory of combined exciton-cyclotron resonance in a two-dimensional
  electron gas: The strong magnetic field regime",7.37136818688287e-06,0.0,2.0,1.0
cond-mat/9907001,Plateaux Transitions in the Pairing Model:Topology and Selection Rule,7.364112083464815e-06,3.6393274565077154e-08,7.0,1.0
cond-mat/0306731,"Quasiclassical fluctuations of the superconductor proximity gap in a
  chaotic system",7.354904651991219e-06,6.537493296487577e-05,2.0,2.0
cond-mat/0609460,Large spin-orbit effects in small quantum dots,7.345064983613176e-06,0.0,3.0,0.0
cond-mat/0310632,"Spin-Dependent Transport through the Finite Array of Quantum Dots: Spin
  Gun",7.343032366235184e-06,0.0,5.0,0.0
cond-mat/0510842,"Longitudinal and spin-Hall conductance of a two-dimensional Rashba
  system with arbitrary disorder",7.339923290980011e-06,0.0,14.0,0.0
cond-mat/0212049,Tunneling measurement of quantum spin oscillations,7.323842214001065e-06,3.772846018644586e-05,6.0,4.0
cond-mat/0005328,"Properties of strongly correlated two-dimensional electron gas in
  semiconductor layers",7.3149591251186576e-06,9.406336404985413e-08,9.0,4.0
cond-mat/0603184,Viscosity of a two-dimensional Fermi liquid,7.285589248964673e-06,9.95091377580036e-07,4.0,1.0
cond-mat/0701570,"Numerical Renormalization Group Approach to a Quantum Dot Coupled to
  Normal and Superconducting Leads",7.268514000272844e-06,0.0,4.0,0.0
cond-mat/9906320,Dephasing in Disordered Conductors due to Fluctuating Electric Fields,7.242578395866874e-06,0.0,5.0,0.0
cond-mat/0210033,Quantum Disorder and Quantum Chaos in Andreev Billiards,7.242452451375663e-06,2.587794535837336e-05,4.0,2.0
cond-mat/0508031,"Quantum Hall states of atomic Bose gases: density profiles in
  single-layer and multi-layer geometries",7.240591003684034e-06,9.97213107596198e-06,2.0,2.0
cond-mat/0212522,Quantum Andreev map: A paradigm of quantum chaos in superconductivity,7.239981268939086e-06,0.0,3.0,0.0
cond-mat/0504137,Non-collinear single-electron spin-valve transistors,7.2197699223779375e-06,0.0,7.0,2.0
cond-mat/0611783,Stochastic dynamics of a Josephson junction threshold detector,7.218403623633127e-06,0.0,2.0,1.0
cond-mat/0307663,Universal Intrinsic Spin-Hall Effect,7.209414350375058e-06,0.0001147136467766,7.0,19.0
cond-mat/0607531,"Three dimensional topological invariants for time reversal invariant
  Hamiltonians and the three dimensional quantum spin Hall effect",7.198245620086339e-06,3.8037979440923577e-05,10.0,5.0
cond-mat/0402459,"Broken symmetry, excitons, gapless modes and topological excitations in
  Trilayer Quantum Hall systems",7.1789451229030735e-06,0.0,5.0,1.0
cond-mat/0211223,"Comments on ``Evidence of Landau Levels and Interactions in Low-Lying
  Excitations of Composite Fermions ..."" by Dujovne, Pinczuk, Kang, Dennis,
  Pfeiffer and West, cond-mat/0211022",7.177552356739808e-06,4.956891750258761e-07,10.0,2.0
cond-mat/0209666,"Violation of classical electrodynamics by composite fermions in the
  quantum Hall effect",7.161308027793705e-06,1.7587593026987382e-06,8.0,7.0
cond-mat/0703162,"Decoherence and interactions in an electronic Mach-Zehnder
  interferometer",7.154332865698797e-06,0.0,3.0,2.0
cond-mat/0402492,"Fulde-Ferrell-Larkin-Ovchinnikov-like state in
  Ferromagnet-Superconductor Proximity System",7.151298378099254e-06,0.0,1.0,0.0
cond-mat/0311503,Phonon effects in molecular transistors: Quantum and classical treatment,7.130657824038629e-06,1.8936440394246959e-07,5.0,9.0
cond-mat/0309634,Spin detection in quantum dots by electric currents,7.130546788999904e-06,0.0,7.0,0.0
cond-mat/0607174,Composite Dirac fermions in graphene,7.127885513210061e-06,1.990182755160072e-06,6.0,4.0
cond-mat/0302504,"Quantum dots in high magnetic fields: Rotating-Wigner-molecule versus
  composite-fermion approach",7.118035683628067e-06,0.0,2.0,1.0
cond-mat/0609441,Protected qubit based on a superconducting current mirror,7.117927044719592e-06,0.0,12.0,0.0
cond-mat/0607774,Band Collapse and the Quantum Hall Effect in Graphene,7.107045511167282e-06,0.0,4.0,0.0
cond-mat/0609016,"Self-consistent calculation of the electron distribution near a
  Quantum-Point Contact in the integer Quantum Hall Effect",7.106387714380375e-06,0.0,7.0,1.0
nlin/0512058,Periodic-Orbit Approach to Universality in Quantum Chaos,7.10626618824865e-06,1.167069674154958e-05,3.0,4.0
cond-mat/0509607,The Non-Dissipative Spin-Hall Current,7.095977514042987e-06,0.0,5.0,2.0
cond-mat/0502380,Kondo screening cloud in a double-quantum dot system,7.093307845797646e-06,0.0,5.0,0.0
cond-mat/0008041,"Confinement symmetry, mobility anisotropy, and metallic behavior in
  (311)A GaAs 2D holes",7.092568122043998e-06,0.0,1.0,2.0
cond-mat/0510664,"Non-equilibrium spin polarization effects in spin-orbit coupling system
  and contacting metallic leads",7.085073853446566e-06,0.0,2.0,2.0
cond-mat/0202455,Strongly Correlated States in Low Dimensions (Thesis),7.083792599523426e-06,3.002558103939804e-05,8.0,4.0
cond-mat/0304417,Spontaneous Pseudospin Spiral Order in Bilayer Quantum Hall Systems,7.082954994738908e-06,0.0,2.0,0.0
cond-mat/9809357,"Phase diagram and validity of one-parameter scaling near the
  two-dimensional metal-insulator transition",7.073634241749689e-06,0.0,5.0,4.0
astro-ph/0406504,Could dark energy be measured in the lab?,7.071144143704372e-06,1.5943216658781552e-05,14.0,15.0
cond-mat/0311656,"Microwave Rectificatin of the Current at the Metal-Metal Junction for
  Dilute 2D Metals",7.063509368603028e-06,0.0,1.0,0.0
cond-mat/0302162,"Current carrying Andreev bound states in a Superconductor-Ferromagnet
  proximity system",7.059568873628188e-06,1.990182755160072e-06,5.0,1.0
cond-mat/0608022,Voltage generation by ferromagnetic resonance,7.05802233216888e-06,3.980365510320144e-06,1.0,3.0
cond-mat/0609005,"Oscillatory multiband dynamics of free particles: The ubiquity of
  zitterbewegung effects",7.056026499977056e-06,7.471102832147775e-06,4.0,2.0
cond-mat/0203509,"Collective modes, chaotic behavior and self-trapping in the dynamics of
  three coupled Bose-Einstein condensates",7.055574304339453e-06,2.9704220226269734e-08,5.0,2.0
cond-mat/0305556,"Comments on `` Scattering of bunched fractionally charged
  quasiparticles"" by Chung, Heiblem and Umansky, cond-mat/0305325",7.053204494339654e-06,0.0,6.0,0.0
cond-mat/0504646,Simulation of Si:P spin-based quantum computer architecture,7.051733244167259e-06,0.0,5.0,0.0
cond-mat/0006388,Enhancement of magnetoresistance in manganite multilayers,7.0486228431182624e-06,0.0,1.0,1.0
cond-mat/0310353,"Pions versus Magnons: From QCD to Antiferromagnets and Quantum Hall
  Ferromagnets",7.047355236655387e-06,0.0,8.0,0.0
quant-ph/0002077,The Physical Implementation of Quantum Computation,7.047135248855001e-06,0.0008665020472483,37.0,43.0
cond-mat/9911316,Interaction and Quantum Decoherence in Disordered Conductors,7.046256429347393e-06,0.0,4.0,0.0
cond-mat/0412269,Density correlations in ultracold atomic Fermi gases,7.042993577828245e-06,1.4414867527620868e-05,4.0,4.0
cond-mat/0409084,"Statistics of Impedance, Local Density of States, and Reflection in
  Quantum Chaotic Systems with Absorption",7.0255801818158665e-06,5.970548265480216e-06,6.0,2.0
cond-mat/0506292,Coherence Network in the Quantum Hall Bilayer,7.020756355425245e-06,0.0,3.0,0.0
quant-ph/0608119,Decoherence of Anyonic Charge in Interferometry Measurements,6.998299180474708e-06,0.0,15.0,0.0
cond-mat/0504444,"A minimal approach for the local statistical properties of a
  one-dimensional disordered wire",6.997989812416306e-06,0.0,6.0,0.0
cond-mat/0703717,"Testable signatures of quantum non-locality in a two-dimensional chiral
  p-wave superconductor",6.986177860273269e-06,0.0,4.0,0.0
cond-mat/0409005,Quantum Phases in Partially Filled Landau Levels,6.98211569758162e-06,0.0,3.0,0.0
cond-mat/0703179,Transient regime in non-linear transport through many-level quantum dots,6.97420651173292e-06,0.0,2.0,0.0
cond-mat/0401515,"Discrete easy-axis tilting in Mn12-acetate, as determined by EPR:
  implications for the magnetic quantum tunneling mechanism",6.971911797582502e-06,0.0,3.0,3.0
cond-mat/0311612,Topological spin pumps I,6.969627668157548e-06,1.743387726107343e-05,9.0,2.0
cond-mat/0606676,"Qubit feedback and control with kicked quantum nondemolition
  measurements: A quantum Bayesian analysis",6.965725387324989e-06,0.0,5.0,1.0
cond-mat/9905023,"Coulomb blockade conductance peak fluctuations in quantum dots and the
  independent particle model",6.961748917578442e-06,0.0,7.0,0.0
