id,title,pagerank,betweenness,in_degree,out_degree
cond-mat/0109060,Magnetolocalization in disordered quantum wires,6.085609230594169e-06,0.0,5.0,0.0
cond-mat/0304182,Charge and currents distribution in graphs,6.083347640134804e-06,0.0,4.0,0.0
cond-mat/0511478,Recent Advances in Studies of Current Noise,6.081726088812796e-06,9.163422542896113e-06,4.0,7.0
cond-mat/0402616,Thermal conduction of carbon nanotubes using molecular dynamics,6.078430374041914e-06,0.0,3.0,4.0
cond-mat/0408526,Creation and detection of mobile and non-local spin-entangled electrons,6.074346413531169e-06,0.0,6.0,1.0
cond-mat/0404366,Transport spectroscopy of Kondo quantum dots coupled by RKKY interaction,6.072248228268742e-06,5.389462943085212e-05,2.0,4.0
cond-mat/0301441,Quantum Shuttle in Phase Space,6.07107513430861e-06,0.0,9.0,3.0
cond-mat/0703225,"Theory of electron-phonon interaction in a nonequilibrium open
  electronic system",6.067853226447038e-06,0.0,3.0,0.0
cond-mat/0502606,Magnetoconductance through a vibrating molecule in the Kondo regime,6.061797079493977e-06,0.0,1.0,0.0
cond-mat/0402568,"Magneto-transport and magneto-optical properties of ferromagnetic
  (III,Mn)V semicondcutors: a review",6.048280336493841e-06,0.0,7.0,1.0
cond-mat/0011413,"Strong Coupling Fixed Points of Current Interactions and Disordered
  Fermions in 2D",6.041566523511071e-06,1.0720205810155248e-05,19.0,7.0
cond-mat/9810282,"Schwinger-Keldysh Approach to Disordered and Interacting Electron
  Systems: Derivation of Finkelstein's Renormalization Group Equations",6.0292146615176925e-06,9.030436650313698e-05,3.0,3.0
cond-mat/0608533,Valley filter and valley valve in graphene,6.026362016901514e-06,7.960731020640288e-06,6.0,4.0
cond-mat/0408570,Decoherence of Rabi oscillations in a single quantum dot,6.018896484305298e-06,0.0,1.0,0.0
cond-mat/0609457,"Functional renormalization group for non-equilibrium quantum many-body
  problems",6.016992528703317e-06,1.4772454565305872e-07,7.0,1.0
cond-mat/0502021,"Crossed conductance in FSF double junctions: role of out-of-equilibrium
  populations",6.004973256310084e-06,1.990182755160072e-06,3.0,1.0
math-ph/0308030,Colored Hofstadter butterflies,6.004646517197675e-06,0.0,5.0,0.0
cond-mat/0310496,Production and detection of three-qubit entanglement in the Fermi sea,5.991286976438222e-06,8.348266270564029e-07,8.0,1.0
cond-mat/0404135,"Charge ordering and interlayer phase coherence in quantum Hall
  superlattices",5.9888484104749545e-06,0.0,1.0,0.0
cond-mat/0304597,Spin Current Through a Magnetic-Oscillating Quantum Dot,5.98162732222666e-06,0.0,7.0,0.0
cond-mat/0510182,2D SNS junction with Rashba spin-orbit interaction,5.97418274391733e-06,0.0,4.0,0.0
cond-mat/0502220,Spin Photovoltaic Effect in Quantum Wires with Rashba Interaction,5.966110146359929e-06,0.0,1.0,0.0
cond-mat/0407283,Sign of the crossed conductances at a FSF double interface,5.963783085531604e-06,0.0,2.0,3.0
cond-mat/0506552,Vibration-assisted tunneling through competing molecular states,5.95990196099373e-06,5.002885424312612e-05,7.0,10.0
cond-mat/0410089,Rectification in Luttinger liquids,5.956440704112947e-06,0.0,3.0,0.0
cond-mat/0403744,"Green's function for magnetically incoherent interacting electrons in
  one dimension",5.956398799931429e-06,0.0,1.0,1.0
cond-mat/0609333,"Andreev Bound States in the Kondo Quantum Dots Coupled to
  Superconducting Leads",5.956398799931429e-06,0.0,1.0,0.0
cond-mat/0002087,Striped quantum Hall phases,5.954283985897652e-06,0.0003949442492167,11.0,5.0
cond-mat/0606589,Quantum transport of massless Dirac fermions in graphene,5.951958347673656e-06,9.40102534702092e-05,3.0,15.0
cond-mat/0010441,"Ground state spin and Coulomb blockade peak motion in chaotic quantum
  dots",5.942676087739554e-06,0.0,7.0,7.0
cond-mat/0508470,Electron-vibration interaction in transport through atomic gold wires,5.940909437526948e-06,3.980365510320144e-06,4.0,2.0
quant-ph/0108073,Quantum Information in Space and Time,5.939628062762797e-06,6.24538747910973e-08,11.0,6.0
quant-ph/9911062,Atomic Quantum Computer,5.933783535874169e-06,0.0,8.0,5.0
cond-mat/0603731,"Signature of the electron-electron interaction in the magnetic field
  dependence of nonlinear I-V characteristics in mesoscopic conductors",5.933154089214736e-06,4.302158008558098e-07,5.0,3.0
cond-mat/0408094,Reply to the Comment of M. V. Cheremisin (cond-mat/0408050),5.931486723668134e-06,0.0,3.0,0.0
cond-mat/0209629,Noisy quantum measurement of solid-state qubits: Bayesian approach,5.930359020890062e-06,4.249800904341084e-06,10.0,5.0
cond-mat/0701480,Nuclear Spins as Quantum Memory in Semiconductor Nanostructures,5.925839447058761e-06,0.0,3.0,0.0
cond-mat/0703531,Two Anderson Impurity problem: Kondo-doublets beyond the Kondo Limit,5.924125668078249e-06,0.0,3.0,0.0
cond-mat/0607278,"Dictionary between scattering matrix and Keldysh formalisms for quantum
  transport driven by time-periodic fields",5.920025279927699e-06,0.0,2.0,0.0
cond-mat/0407583,Do quantum dots allow one access to pseudogap Kondo physics?,5.90598555800466e-06,7.4260550565674335e-09,3.0,1.0
cond-mat/0311220,Flux Qubit in Charge-Phase Regime,5.899704499880486e-06,5.439520179123927e-05,3.0,2.0
cond-mat/0612494,"Transmission phase lapses in quantum dots: the role of dot-lead coupling
  asymmetry",5.898853040463978e-06,0.0,4.0,0.0
cond-mat/0511375,"1/f noise in a dilute GaAs two-dimensional hole system in the insulating
  phase",5.898628635590931e-06,0.0,4.0,0.0
cond-mat/0603755,"Kinetic magnetoelectric effect in a 2D semiconductor strip due to
  boundary-confinement induced spin-orbit coupling",5.898260790204026e-06,3.7130275282837164e-09,4.0,3.0
cond-mat/0012015,"Role of a parallel magnetic field in two dimensional disordered clusters
  containing a few correlated electrons",5.892156534480754e-06,3.934856812441045e-06,9.0,4.0
cond-mat/0205127,Phase separation in the two-dimensional electron liquid in MOSFETs,5.891020018007002e-06,1.020110110687281e-06,3.0,6.0
cond-mat/0510452,Resonant inelastic tunneling in molecular junctions,5.889295791534616e-06,0.0,4.0,0.0
cond-mat/0208239,Quantum properties of atomic-sized conductors,5.88191722879669e-06,0.0,3.0,7.0
cond-mat/0304206,"Symmetry of Magnetic Quantum Tunneling in Single Molecule Magnet
  Mn12-acetate",5.881085172641151e-06,0.0,1.0,1.0
cond-mat/0410773,Wigner Crystallization in inhomogeneous one dimensional wires,5.881085172641151e-06,0.0,1.0,1.0
cond-mat/0610124,"Spin-density induced by electromagnetic wave in two-dimensional electron
  gas",5.881085172641151e-06,0.0,1.0,1.0
cond-mat/0305310,"Persistent current in ballistic mesoscopic rings with Rashba spin-orbit
  coupling",5.87684730439981e-06,0.0,4.0,0.0
cond-mat/0505131,"Spin Hall effect, Hall effect and spin precession in diffusive normal
  metals",5.871838724996441e-06,0.0,3.0,0.0
cond-mat/9810289,A Field Theory for Partially Polarized Quantum Hall States,5.871223961575432e-06,0.0,3.0,0.0
cond-mat/0412573,Chain of Superconducting Loops as a Possible Quantum Register,5.86903993406996e-06,0.0,11.0,0.0
cond-mat/0308003,Fermi liquid behavior of metallic 2D holes at high temperatures,5.862607428220248e-06,0.0,3.0,1.0
cond-mat/0409643,"Quantum master equation approach to quantum transport through mesoscopic
  systems",5.860734900318134e-06,1.6189551877908658e-06,4.0,1.0
cond-mat/9709225,"Phenomenological Understanding of a Transport Regime with Reflection
  Symmetry in the Quantum Hall System in a Composite Fermion Picture",5.853749086126992e-06,0.0,4.0,2.0
cond-mat/0203009,"Exact results for a tunnel-coupled pair of trapped Bose-Einstein
  condensates",5.852848398048031e-06,0.0,2.0,5.0
cond-mat/0401361,Full Counting Statistics of a charge shuttle,5.842235096502634e-06,4.826935786768832e-08,4.0,3.0
cond-mat/0508340,"Consistency in Formulation of Spin Current and Torque Associated with a
  Variance of Angular Momentum",5.840425212585215e-06,0.0,5.0,2.0
cond-mat/0106005,"The critical exponent of the localization length at the Anderson
  transition in 3D disordered systems is larger than 1",5.840337303289136e-06,0.0,11.0,6.0
cond-mat/0103098,"Interactions in Chaotic Nanoparticles: Fluctuations in Coulomb Blockade
  Peak Spacings",5.835826955416975e-06,0.0,5.0,5.0
cond-mat/0203287,"Possible Pairing-Induced Even-Denominator Fractional Quantum Hall Effect
  in the Lowest Landau Level",5.835122313800201e-06,0.0,3.0,0.0
cond-mat/0506553,Non-extensive thermodynamics of transition-metal nanoclusters,5.832180035703107e-06,0.0,9.0,0.0
cond-mat/0507098,Magnetostatic field noise near metallic surfaces,5.8282700076900455e-06,0.0,4.0,0.0
cond-mat/0508465,"Magnetic Field Effects on Quasiparticles in Strongly Correlated Local
  Systems",5.827926256977218e-06,2.071869360782313e-06,2.0,2.0
cond-mat/0103516,"Aharonov-Bohm oscillations and spin transport in a mesoscopic ring with
  a magnetic impurity",5.826059864766919e-06,0.0,4.0,0.0
cond-mat/0504086,"Diagrammatic Analysis of the Unitary Group for Double Barrier Ballistic
  Cavities: Equivalence with Circuit Theory",5.823312980342088e-06,0.0,2.0,0.0
cond-mat/0501191,Auxiliary-level-assisted operations with charge qubits in semiconductors,5.822240253621178e-06,0.0,6.0,0.0
cond-mat/0610691,Mode statistics in random lasers,5.821996350622634e-06,0.0,1.0,0.0
cond-mat/0409320,"Transport properties of single channel quantum wires with an impurity:
  Influence of finite length and temperature on average current and noise",5.821522703781585e-06,1.990182755160072e-06,2.0,2.0
cond-mat/0503187,"Non-Abelian gauge potentials for ultra-cold atoms with degenerate dark
  states",5.813196217803882e-06,0.0,3.0,0.0
cond-mat/9810148,"S-matrix network models for coherent waves in random media: construction
  and renormalization",5.808938542060753e-06,0.0,1.0,3.0
cond-mat/0210469,Quantum critical fluctuations in disordered d-wave superconductors,5.808576287961386e-06,0.0,2.0,0.0
cond-mat/0611562,"Inelastic transport theory from first-principles: methodology and
  applications for nanoscale devices",5.799365868426763e-06,0.0,4.0,3.0
cond-mat/0212552,Fractional charge in quantum Hall effect,5.794525046808893e-06,0.0001728936639665,3.0,11.0
cond-mat/0409158,Vibrational Sidebands and Kondo-effect in Molecular Transistors,5.78954059716232e-06,7.4260550565674335e-09,4.0,2.0
cond-mat/0306603,"Measuring Luttinger Liquid Correlations from Charge Fluctuations in a
  Nanoscale Structure",5.787806451177719e-06,0.0,2.0,0.0
cond-mat/0512620,Shot noise in chaotic cavities with an arbitrary number of open channels,5.781824174771858e-06,0.0,3.0,0.0
cond-mat/0207440,Quantum Interferometry with Electrons: Outstanding Challenges,5.781783873115026e-06,0.0,7.0,5.0
cond-mat/0504274,Decoherence of Phase Qubit using High-Tc Superconductor,5.776455118632589e-06,0.0,3.0,0.0
cond-mat/0001412,High-field noise in metallic diffusive conductors,5.77629323906533e-06,5.970548265480216e-06,7.0,1.0
cond-mat/0608539,"Dynamics of edge Majorana fermions in $\nu=\frac{5}2$ fractional quantum
  Hall effects",5.749481316885458e-06,0.0,3.0,0.0
cond-mat/0307307,"Crossed Andreev Reflection in Structures Consisting of a Superconductor
  with Ferromagnetic Leads",5.745455927038632e-06,0.0,2.0,0.0
cond-mat/9907148,"Mesoscopic fluctuations of the ground state spin of a small metal
  particle",5.74534861856223e-06,0.0,5.0,1.0
cond-mat/0406647,"Super-poissonian noise, negative differential conductance, and
  relaxation effects in transport through molecules, quantum dots and nanotubes",5.7450044045008814e-06,2.0529681473074883e-05,2.0,6.0
cond-mat/0405300,"Modulating Unpolarized Current in Quantum Spintronics: Visibility of
  Spin-Interference Effects in Multichannel Aharonov-Casher Mesoscopic Rings",5.744355323495864e-06,0.0,3.0,2.0
cond-mat/0102415,"Hall Coefficient and electron-electron interaction of 2D electrons in
  Si-MOSFET's",5.742334881611724e-06,0.0,5.0,0.0
cond-mat/0101215,Optical dipole traps and atomic waveguides based on Bessel light beams,5.736409281271363e-06,0.0,5.0,0.0
hep-th/0306266,A Quantum Hall Fluid of Vortices,5.7357233596504905e-06,9.404961479219602e-06,17.0,2.0
cond-mat/0610433,Spins in few-electron quantum dots,5.734804889103562e-06,1.9103343487329173e-05,6.0,7.0
cond-mat/0610560,Semiclassical Approach to Chaotic Quantum Transport,5.733018202264224e-06,1.7993181049876492e-06,4.0,1.0
cond-mat/0204209,"Infrared conductivity of metallic (III,Mn)V ferromagnets",5.725334962096838e-06,0.0,4.0,1.0
cond-mat/9904361,"Percolation-type description of the metal-insulator transition in two
  dimensions",5.721986529646239e-06,0.0,9.0,4.0
cond-mat/0304385,"NRG study of the Kondo effect in the presence of itinerant-electron
  ferromagnetism",5.708250039235121e-06,5.970548265480216e-06,2.0,2.0
cond-mat/0510153,Transport in magnetically ordered Pt nanocontacts,5.7077713657032855e-06,0.0,1.0,1.0
cond-mat/0612293,Spin-orbit induced spin-qubit control in nanowires,5.707681273334445e-06,0.0,3.0,0.0
cond-mat/0205316,Josephson effect in S$_{\rm F}$XS$_{\rm F}$ junctions,5.700244205841559e-06,0.0,2.0,0.0
cond-mat/0503333,Deterministic Weak Localization in Periodic Structures,5.696484424552172e-06,0.0,2.0,0.0
cond-mat/0205186,"Possible realization of an ideal quantum computer in Josephson junction
  array",5.693120477629051e-06,8.037984365533529e-05,10.0,8.0
cond-mat/9907358,Keldysh action for disordered superconductors,5.691715108479653e-06,7.84680339584195e-06,7.0,2.0
cond-mat/9907497,"Quantum Decoherence and the ""P(E)-Theory""",5.682589715667776e-06,0.0004704673256776,1.0,5.0
cond-mat/0503445,Ab-initio methods for spin-transport at the nanoscale level,5.680783226351659e-06,0.0,4.0,3.0
cond-mat/0608720,Coherent transport in graphene nanoconstrictions,5.677069767674945e-06,0.0,7.0,0.0
cond-mat/0506446,Quantum state tomography with quantum shotnoise,5.673838909675694e-06,5.678412377627373e-07,2.0,2.0
cond-mat/0303349,On the theory of plateau-plateau transitions in Quantum Hall Effect,5.672174547159766e-06,0.0,4.0,0.0
hep-th/0112185,Noncommutative Field Theory and the Dynamics of Quantum Hall Fluids,5.660763572227476e-06,6.41219353347768e-05,31.0,9.0
cond-mat/9809228,Spectral Gaps of Quantum Hall Systems with Interactions,5.655144290770314e-06,0.0,1.0,1.0
cond-mat/0501466,"The Cyclotron Spin-Flip Mode as the Lowest-Energy Excitation of
  Unpolarized Integer Quantum Hall States",5.655144290770314e-06,0.0,1.0,1.0
cond-mat/0504208,"Efficient algorithm for current spectral density calculation in
  single-electron tunneling and hopping",5.655144290770314e-06,0.0,2.0,2.0
cond-mat/0509452,Mesoscopic Resistance Fluctuations in Cobalt Nanoparticles,5.655144290770314e-06,0.0,1.0,1.0
cond-mat/0411181,Spin dynamics and level structure of quantum-dot quantum wells,5.655144290770314e-06,0.0,1.0,1.0
cond-mat/0510410,"From ballistic transport to tunneling in electromigrated ferromagnetic
  breakjunctions",5.655144290770314e-06,0.0,1.0,1.0
cond-mat/0302445,A Numerical Study of Transport and Shot Noise at 2D Hopping,5.655144290770314e-06,0.0,2.0,2.0
cond-mat/0508740,Topological defects in flat nanomagnets: the magnetostatic limit,5.655144290770314e-06,0.0,2.0,2.0
cond-mat/0307534,"Coulomb blockade and quantum tunnelling in the low-conductivity phase of
  granular metals",5.655144290770314e-06,0.0,1.0,1.0
cond-mat/0411429,Faraday Rotation Spectroscopy of Quantum-Dot Quantum Wells,5.655144290770314e-06,0.0,1.0,1.0
cond-mat/0508741,Composite domain walls in flat nanomagnets: the magnetostatic limit,5.655144290770314e-06,0.0,2.0,2.0
cond-mat/0512287,Mesoscopic anisotropic magnetoconductance fluctuations in ferromagnets,5.655144290770314e-06,0.0,1.0,1.0
cond-mat/9811112,Insensitivity of Quantized Hall Conductance to Disorder and Interactions,5.655144290770314e-06,0.0,1.0,1.0
cond-mat/0402526,"Evolution of excitons via biexcitons to an electron-hole plasma without
  level crossing between band edge and exciton in a quantum wire",5.655144290770314e-06,0.0,1.0,1.0
cond-mat/0411707,"Zero-Momentum Cyclotron Spin-Flip Mode in a Spin-Unpolarized Quantum
  Hall System",5.655144290770314e-06,0.0,1.0,1.0
cond-mat/0506080,Adiabatic pumping through interacting quantum dots,5.655144290770314e-06,0.0,1.0,1.0
cond-mat/0403703,"Density of States and Conductivity of Granular Metal or Array of Quantum
  Dots",5.655144290770314e-06,0.0,1.0,1.0
cond-mat/0510094,Magnetoresistance of atomic-scale electromigrated nickel nanocontacts,5.655144290770314e-06,0.0,1.0,1.0
cond-mat/0412209,A Numerical Study of Coulomb Interaction Effects on 2D Hopping Transport,5.655144290770314e-06,0.0,2.0,2.0
cond-mat/0703720,"Friction of the surface plasmon by high-energy particle-hole pairs: Are
  memory effects important?",5.655144290770314e-06,0.0,1.0,1.0
cond-mat/0107241,Theory of Electron-Phonon Dynamics in Insulating Nanoparticles,5.655144290770314e-06,0.0,1.0,1.0
cond-mat/0703721,Sidebands in the light absorption of driven metallic nanoparticles,5.655144290770314e-06,0.0,1.0,1.0
cond-mat/0405217,"Analytic theory of correlation energy and spin polarization in the 2D
  electron gas",5.655144290770314e-06,0.0,1.0,0.0
cond-mat/0612651,"Effect of electron-electron interactions on the conductivity of clean
  graphene",5.649268857708518e-06,3.980365510320144e-06,4.0,2.0
cond-mat/0401182,Electron Dephasing in Mesoscopic Metal Wires,5.642904975591286e-06,0.0,3.0,4.0
chao-dyn/9808014,A Matrix Element for Chaotic Tunnelling Rates and Scarring Intensities,5.639721075225431e-06,0.0,5.0,2.0
cond-mat/0702376,"Fluctuation theorem for counting-statistics in electron transport
  through quantum junctions",5.6379773728032495e-06,0.0,5.0,2.0
cond-mat/0403191,"Spin susceptibility of two-dimensional electrons in narrow AlAs quantum
  wells",5.6343150927932325e-06,0.0,2.0,1.0
cond-mat/0003485,Resistance Jumps and Hysteresis in Ferromagnetic Wires,5.6325473821537255e-06,0.0,7.0,1.0
cond-mat/0511715,Coulomb drag between two spin incoherent Luttinger liquids,5.632399386413185e-06,1.0920343983440038e-05,4.0,1.0
cond-mat/0211430,"Nanoscale phase separation in $La_{0.7}Ca_{0.3}MnO_3$ films: evidence
  for the texture driven optical anisotropy",5.631976548029731e-06,0.0,1.0,0.0
cond-mat/0006506,Notes on Infinite Layer Quantum Hall Systems,5.627147074226992e-06,0.0,3.0,1.0
cond-mat/0510559,Landau-Zener interferometry with superconducting qubits,5.624722565387316e-06,0.0,3.0,5.0
cond-mat/9907098,"Visibility diagrams and experimental stripe structure in the quantum
  Hall effect",5.6170064233624885e-06,0.0,6.0,0.0
cond-mat/0401462,"Evidence of a first order phase transition between Wigner crystal and
  Bubble Phases of 2D electrons in higher Landau levels",5.611948068620922e-06,1.990182755160072e-06,3.0,1.0
cond-mat/0111007,"Excitons in quantum-ring structures in a magnetic field: Optical
  properties and persistent currents",5.610265049764747e-06,0.0,2.0,1.0
cond-mat/0111006,"Magnetoexcitons in quantum-ring structures: a novel magnetic
  interference effect",5.610265049764747e-06,0.0,2.0,1.0
cond-mat/0507336,Shot noise of photon-excited electron-hole pairs in open quantum dots,5.605342294757952e-06,0.0,3.0,0.0
cond-mat/0603337,"Nonequilibrium Steady States and Fano-Kondo Resonances in an AB Ring
  with a Quantum Dot",5.605123977916453e-06,1.0002896161196332e-05,3.0,3.0
cond-mat/0302154,Ghost Fano resonance in a double quantum dot molecule attached to leads,5.602699317989824e-06,0.0,2.0,0.0
cond-mat/0508282,"Ordered Dissipative Structures in Exciton Systems in Semiconductor
  Quantum Wells",5.594933260259464e-06,0.0,6.0,1.0
cond-mat/0108061,Effect of inelastic scattering on parametric pumping,5.593425571806935e-06,1.7852236355988107e-05,3.0,3.0
cond-mat/0008402,"Two-dimensional array of diffusive SNS junctions with high-transparent
  interfaces",5.576545225849642e-06,0.0,2.0,0.0
cond-mat/0205250,"Effect of Subband Landau Level Coupling to the Linearly Dispersing
  Collective Mode in a Quantum Hall Ferromagnet",5.572970409659303e-06,0.0,3.0,1.0
hep-th/0510271,Boundary RG Flow Associated with the AKNS Soliton Hierarchy,5.570764406492894e-06,0.0,6.0,1.0
cond-mat/0208318,"Charge and current fluctuations in a superconducting single electron
  transistor near a Cooper pair resonance",5.57042683651506e-06,1.8861179374442845e-05,6.0,1.0
quant-ph/0412122,Robust Charge-based Qubit Encoding,5.566207032342451e-06,7.0514813677305625e-06,3.0,2.0
cond-mat/0310323,"Spin quantum tunneling via entangled states in a dimer of exchange
  coupled single-molecule magnets",5.562046602531412e-06,0.0,3.0,0.0
cond-mat/0301612,"Spin swap gate in the presence of qubit inhomogeneity in a double
  quantum dot",5.560159439283686e-06,0.0,3.0,0.0
cond-mat/0507228,"Coulomb corrections to the extrinsic spin-Hall effect of a
  two-dimensional electron gas",5.556713660797509e-06,3.171761895179623e-06,9.0,1.0
quant-ph/0505018,"Performance of cavity-parametric amplifiers, employing Kerr
  nonlinearites, in the presence of two-photon loss",5.555439565396201e-06,0.0,4.0,12.0
cond-mat/0605230,"Influence of band structure effects on domain-wall resistance in diluted
  ferromagnetic semiconductors",5.554538494904111e-06,0.0,3.0,0.0
cond-mat/0502359,"Universal statistics of the local Green's function in quantum chaotic
  systems with absorption",5.551941802539383e-06,1.990182755160072e-06,3.0,2.0
cond-mat/0603730,"Solving spin quantum-master equations with matrix continued-fraction
  methods: application to superparamagnets",5.549403613431083e-06,0.0,6.0,0.0
cond-mat/9912423,"Two-species percolation and Scaling theory of the metal-insulator
  transition in two dimensions",5.545678842678149e-06,0.0,12.0,2.0
cond-mat/0005135,"Spin dynamics of Mn12-acetate in the thermally-activated tunneling
  regime: ac-susceptibility and magnetization relaxation",5.53759292393817e-06,0.0,5.0,2.0
cond-mat/9908256,Numerical results for two interacting particles in a random environment,5.535683823913975e-06,0.0,5.0,0.0
cond-mat/0610033,"Decay and fusion as two different mechanisms of stability loss for the
  (C_20)_2 cluster dimer",5.5355765335110034e-06,0.0,5.0,1.0
cond-mat/9709243,"Nonzero temperature transport near fractional quantum Hall critical
  points",5.532767964864875e-06,0.0,4.0,4.0
cond-mat/0404212,The Density Matrix Renormalization Group for finite Fermi systems,5.5315908929041375e-06,1.990182755160072e-06,5.0,1.0
cond-mat/9904245,Dynamical response of a weakly pinned two-dimensional Wigner crystal,5.527048320295241e-06,0.0,1.0,1.0
quant-ph/0411038,Read out of a Nuclear Spin Qubit,5.521329868637753e-06,0.0,3.0,1.0
cond-mat/0608512,Spin-spin coupling in electrostatically coupled quantum dots,5.51799981261865e-06,1.1941096530960432e-05,4.0,1.0
cond-mat/9902054,"Charge Relaxation Resistances and Charge Fluctuations in Mesoscopic
  Conductors",5.51295228403898e-06,0.0,5.0,1.0
cond-mat/0701096,Spin Hall Effect For Anyons,5.51194895140999e-06,0.0,6.0,0.0
cond-mat/0203487,"Thermally-Activated Magnetic Reversal Induced by a Spin-Polarized
  Current",5.50952320518162e-06,0.0,4.0,2.0
hep-th/0409115,"A matrix model for a quantum hall droplet with manifest particle-hole
  symmetry",5.508569516639812e-06,7.421108621247025e-06,28.0,15.0
cond-mat/0005542,A dual point description of mesoscopic superconductors,5.508073516737923e-06,3.7872880788493904e-08,6.0,4.0
cond-mat/0304269,Quasiparticles in quantum Hall effect: Smet's fractional charge,5.504686895782526e-06,6.635180193043025e-06,10.0,4.0
cond-mat/0402607,Electronic structure of d-wave superconducting quantum wires,5.502878378537422e-06,1.990182755160072e-06,3.0,1.0
cond-mat/0308342,"Vortex lattices in rapidly rotating Bose-Einstein condensates: modes and
  correlation functions",5.501452857076231e-06,4.034651073603519e-06,10.0,4.0
cond-mat/0602647,Gauge field for edge state in graphene,5.50006731970653e-06,0.0,5.0,1.0
cond-mat/0609756,Integral and fractional Quantum Hall Ising ferromagnets,5.496269871910976e-06,0.0,4.0,0.0
cond-mat/0307207,"Coherence and Coulomb blockade in single electron devices: a unified
  treatment of interaction effects",5.496150807370375e-06,0.0,5.0,0.0
cond-mat/0202453,"Spin and interaction effects in quantum dots: a Hartree-Fock-Koopmans
  approach",5.493949293809888e-06,3.367429141688183e-05,4.0,4.0
cond-mat/0511287,Universal features of electron-phonon interactions in atomic wires,5.491197430452261e-06,0.0,2.0,0.0
hep-th/9810105,"A Unified Conformal Field Theory Description of Paired Quantum Hall
  States",5.490341798646099e-06,4.0147261352992655e-06,4.0,16.0
cond-mat/9907453,Conductance distribution of disordered quasi one-dimensional wires,5.489130700592816e-06,0.0,2.0,0.0
cond-mat/9611078,Phase randomness in a one-dimensional disordered absorbing medium,5.48413264008019e-06,0.0,5.0,0.0
cond-mat/0703690,"Control of electron spin decoherence caused by electron-nuclear spin
  dynamics in a quantum dot",5.482093612352718e-06,0.0,2.0,0.0
cond-mat/9710195,Mesoscopic charge quantization,5.480801091657612e-06,0.0,2.0,5.0
cond-mat/0004206,"Weak anisotropy and disorder dependence of the in-plane
  magnetoresistance in high mobility (100) Si-inversion layers",5.477904229579709e-06,2.306175984271177e-05,7.0,11.0
cond-mat/0501385,"Charge dynamics effects in conductance through a large semi-open quantum
  dot",5.477710097690274e-06,0.0,2.0,0.0
cond-mat/0512362,"Enhancement of electron spin coherence by optical preparation of nuclear
  spins",5.47360889235836e-06,0.0,2.0,3.0
cond-mat/0603176,"Dissipation-driven quantum phase transitions in a Tomonaga-Luttinger
  liquid electrostatically coupled to a metallic gate",5.46815979263392e-06,0.0,3.0,0.0
cond-mat/0504661,Fermi liquid parameters in 2D with spin-orbit interaction,5.467619972044781e-06,1.990182755160072e-06,3.0,1.0
cond-mat/0007445,Microscopic theory for quantum mirages in quantum corrals,5.465943359513047e-06,0.0,3.0,2.0
