id,title,pagerank,betweenness,in_degree,out_degree
cond-mat/0412196,"Scale-free properties of weighted networks with connectivity-driven
  topology",6.816290419104273e-06,4.945932536310896e-07,6.0,2.0
cond-mat/0310080,"Generating droplets in two-dimensional Ising spin glasses by using
  matching algorithms",6.811636838771464e-06,1.1139082584851151e-08,4.0,1.0
cond-mat/0501655,"Evolving Model of Weighted Networks Inspired by Scientific Collaboration
  Networks",6.811379293103903e-06,7.547151825930167e-07,6.0,4.0
cond-mat/0204041,"On Renyi entropies characterizing the shape and the extension of the
  phase space representation of quantum wave functions in disordered systems",6.8073544518806e-06,0.0,2.0,4.0
cond-mat/0203416,Ferromagnetic ordering in graphs with arbitrary degree distribution,6.805696551654661e-06,1.3939447946682727e-05,7.0,5.0
quant-ph/0702169,Quantum wavefunction annealing of spin glasses,6.80552149568168e-06,0.0,5.0,0.0
quant-ph/0007088,Quantum Brain?,6.8036903982389775e-06,4.132151175863526e-06,5.0,7.0
cond-mat/0210473,"Dynamical mean-field approximation to coupled active rotator networks
  subject to white noises",6.801308779104164e-06,0.0,2.0,3.0
cond-mat/0508116,"Numerical Study of Spin Hall Transport in a Two Dimensional Hole Gas
  System",6.778857859554657e-06,0.0,13.0,1.0
cond-mat/0206297,Interaction effects on random Dirac fermions,6.773182414373742e-06,0.0,3.0,0.0
cond-mat/0212028,Number of loops of size h in growing scale-free networks,6.761470316129164e-06,2.22781651697023e-08,4.0,2.0
cond-mat/0206529,Glassy behavior of electrons near metal-insulator transitions,6.758229894341168e-06,1.9180007680645345e-06,3.0,2.0
cond-mat/0002128,Statistical Physics of Structural Glasses,6.756226771290926e-06,1.2701956409059962e-05,16.0,9.0
cond-mat/0011028,Quantum TAP equations,6.7441624924712566e-06,0.0009510005793869,4.0,3.0
cond-mat/9703188,"Sparse random matrix configurations for two or three interacting
  electrons in a random potential",6.743364173294224e-06,0.0,4.0,1.0
cond-mat/0603647,Diffusive Capture Process on Complex Networks,6.721557376417448e-06,0.0,1.0,0.0
cond-mat/0002299,Creep and depinning in disordered media,6.719839602203206e-06,0.0,2.0,6.0
cond-mat/9911467,Correlated random band matrices: localization-delocalization transitions,6.6643147216999095e-06,0.0,6.0,0.0
cond-mat/0404434,"Distributive routing & congestion control in wireless multihop ad hoc
  communication networks",6.643076752417287e-06,0.0,1.0,0.0
cond-mat/0601266,Non-equilibrium relaxation of an elastic string in random media,6.641814043472301e-06,0.0,2.0,0.0
cond-mat/0610035,"Classical Particle in a Box with Random Potential: exploiting rotational
  symmetry of replicated Hamiltonian",6.634700819285996e-06,5.6586887993929405e-06,5.0,3.0
cond-mat/0508092,Quantum-to-classical correspondence in open chaotic systems,6.626320833090974e-06,0.0,5.0,0.0
cond-mat/0012323,Extended Ensemble Monte Carlo,6.595994780816843e-06,2.786627159976929e-05,7.0,2.0
cond-mat/0111129,Ordering in Heisenberg Spin Glasses,6.57905754814589e-06,1.0437320382005527e-05,3.0,2.0
physics/0602144,Fast Community Identification by Hierarchical Growth,6.577946519599804e-06,0.0,6.0,0.0
cond-mat/0012161,The +/-J Spin Glass: Effects of Ground State Degeneracy,6.570878925712941e-06,0.0002655439665662,11.0,3.0
cond-mat/0206092,Ground state of the random-bond spin-1 Heisenberg chain,6.553395806000037e-06,0.0,5.0,1.0
cond-mat/0603118,Interacting Fermi Gases in Disordered One-Dimensional Lattices,6.544332589873494e-06,0.0,3.0,0.0
cond-mat/0009211,Adaptive learning by extremal dynamics and negative feedback,6.542580001780634e-06,0.0,3.0,0.0
cond-mat/0208451,"Wave function statistics and multifractality at the spin quantum Hall
  transition",6.541961032114513e-06,9.594452563991742e-05,5.0,1.0
cond-mat/0102011,Core percolation in random graphs: a critical phenomena analysis,6.528981543129276e-06,0.0,6.0,4.0
cond-mat/0411413,Low Temperature Specific Heat of some Quantum Mean Field glassy phases,6.523826212071901e-06,0.0,4.0,0.0
math/0311045,"A Phase Transition and Stochastic Domination in Pippenger's
  Probabilistic Failure Model for Boolean Networks with Unreliable Gates",6.523214867372587e-06,0.0,1.0,0.0
cond-mat/0512309,"Aging, memory and rejuvenation: some lessons from simple models",6.516993886291476e-06,0.0,2.0,1.0
cond-mat/0411227,Specific Heat of Quantum Elastic Systems Pinned by Disorder,6.514434138830092e-06,1.990182755160072e-06,4.0,1.0
cond-mat/0701193,"Random Matrices, the Ulam Problem, Directed Polymers & Growth Models,
  and Sequence Matching",6.503105193735524e-06,1.990182755160072e-06,8.0,1.0
cs/0312011,Constraint Optimization and Statistical Mechanics,6.499656301371134e-06,3.980365510320144e-06,10.0,2.0
cond-mat/0004080,SUE: A Special Purpose Computer for Spin Glass Models,6.491774659542026e-06,0.0,7.0,3.0
cond-mat/0012451,Correct extrapolation of overlap distribution in spin glasses,6.488919051374499e-06,8.077524786478107e-05,5.0,7.0
cond-mat/0010397,"Classical Correlation-Length Exponent in Non-Universal Quantum Phase
  Transition of Diluted Heisenberg Antiferromagnet",6.472681417369497e-06,0.0,3.0,1.0
cond-mat/9904285,"Numerical investigation of the thermodynamic limit for ground states in
  models with quenched disorder",6.471362061546445e-06,0.0,7.0,3.0
cond-mat/0408648,On the Consensus Threshold for the Opinion Dynamics of Krause-Hegselmann,6.468963704325147e-06,2.442504608694887e-06,6.0,3.0
cond-mat/0207366,"Scale-free Networks without Growth or Preferential Attachment: Good get
  Richer",6.4641731295403055e-06,1.7543548213414532e-05,5.0,6.0
cond-mat/9810144,Relaxation in graph coloring and satisfiability problems,6.461497782047221e-06,0.0,5.0,1.0
cond-mat/0305393,"On the existence of a finite-temperature transition in the
  two-dimensional gauge glass",6.455641387134068e-06,1.990182755160072e-06,10.0,2.0
cond-mat/0609234,"Statics and dynamics of elastic manifolds in media with long-range
  correlated disorder",6.422561660864006e-06,0.0,3.0,0.0
cond-mat/0008119,"Phase diagram of disordered fermion model on two-dimensional square
  lattice with $\pi$-flux",6.404920852226504e-06,0.0,9.0,0.0
math-ph/0505075,Kinetic Limit for Wave Propagation in a Random Medium,6.404117247139937e-06,1.791164479644065e-05,5.0,4.0
cond-mat/0402201,Imbibition in Disordered Media,6.399721080518857e-06,1.990182755160072e-06,8.0,1.0
cond-mat/9908216,Exact results and scaling properties of small-world networks,6.388877055148223e-06,0.0,16.0,5.0
cond-mat/0511133,Statistical networks emerging from link-node interactions,6.384854882521428e-06,0.0,5.0,0.0
cond-mat/9808192,Two interacting particles at the metal-insulator transition,6.384562682381137e-06,0.0,6.0,1.0
cond-mat/0409140,"Theory of enhanced performance emerging in a sparsely-connected
  competitive population",6.383985616231342e-06,0.0,2.0,2.0
cond-mat/0507231,Spanning Trees in Random Satisfiability Problems,6.382628202656923e-06,0.0,2.0,0.0
cond-mat/0306272,The three-dimensional randomly dilute Ising model: Monte Carlo results,6.378163926041384e-06,3.1175077858656846e-06,7.0,8.0
cond-mat/0311370,Stimulated and spontaneous relaxation in glassy systems,6.36916023988631e-06,5.098869224097421e-05,7.0,5.0
cond-mat/0304642,"Quenched Disorder Distributions in Three-Dimensional Diluted
  Ferromagnets",6.355189620570184e-06,3.95205367541698e-06,2.0,4.0
cond-mat/0501115,"Monte Carlo Study of Phase Transitions in the Bond-Diluted 3D 4-State
  Potts Model",6.355189620570184e-06,1.990182755160072e-06,2.0,1.0
hep-th/0612154,Exact classical solutions of nonlinear sigma models on supermanifolds,6.35292906717494e-06,0.0,8.0,0.0
cond-mat/0212232,A Farewell to Liouvillians,6.349739549102522e-06,0.0,1.0,1.0
cond-mat/0103616,Interfaces (and Regional Congruence?) in Spin Glasses,6.349401143652776e-06,2.217043421400696e-05,10.0,2.0
cond-mat/0109197,"Modified Thouless-Anderson-Palmer equations for the
  Sherrington-Kirkpatrick spin glass: Numerical solutions",6.341633849215337e-06,0.0,2.0,1.0
cond-mat/9904432,"Spin glass behavior upon diluting frustrated magnets and spin liquids: a
  Bethe-Peierls treatment",6.334643875732467e-06,0.0,2.0,0.0
cond-mat/0510064,Brownian Functionals in Physics and Computer Science,6.3342929101049e-06,1.182413662664242e-05,3.0,4.0
cond-mat/0312064,Effects of dissipation on disordered quantum spin models,6.315717916855541e-06,2.467843375072853e-06,3.0,3.0
cond-mat/0104129,"Molecular dynamics simulation study of the high frequency sound waves in
  the fragile glass former ortho-terphenyl",6.313927843528986e-06,1.990182755160072e-06,3.0,2.0
cond-mat/0301454,Slow dynamics under gravity: a nonlinear diffusion model,6.306680133298285e-06,0.0,2.0,0.0
cond-mat/0011200,"Griffiths effects and quantum critical points in dirty superconductors
  without spin-rotation invariance: One-dimensional examples",6.306194298499366e-06,8.140908927103689e-06,7.0,3.0
cond-mat/0411191,"Spin-glass chain in a magnetic field : influence of the disorder
  distribution on ground state properties and low-energy excitations",6.283886578676534e-06,0.0,2.0,0.0
cond-mat/0504513,"Functionals of the Brownian motion, localization and metric graphs",6.278266436646181e-06,2.923888695444692e-05,5.0,2.0
cond-mat/0412761,Hierarchical characterization of complex networks,6.2719207890784005e-06,2.593039376388184e-05,12.0,12.0
cond-mat/0308282,Thermodynamic Properties of the Dipolar Spin Ice Model,6.258540403936587e-06,3.980365510320144e-06,9.0,2.0
cond-mat/9809188,"Interaction induced delocalization of two particles: large system size
  calculations and dependence on interaction strength",6.247329967384408e-06,0.0,8.0,2.0
nlin/0612061,Unmixing in Random Flows,6.237295044101895e-06,0.0,2.0,0.0
cond-mat/0408487,"Microscopic Theory for the Quantum to Classical Crossover in Chaotic
  Transport",6.232546813432884e-06,1.632749821762122e-05,1.0,1.0
cond-mat/9710024,Coupled Minimal Models with and without Disorder,6.232509831190432e-06,0.0,8.0,3.0
physics/0404015,Stochastic analysis of different rough surfaces,6.2312493713254565e-06,0.0,2.0,1.0
physics/9912005,"Bayesian Field Theory: Nonparametric Approaches to Density Estimation,
  Regression, Classification, and Inverse Quantum Problems",6.21737073044464e-06,0.0,7.0,2.0
cond-mat/0108023,A Random Matrix Approach to Cross-Correlations in Financial Data,6.214884675239623e-06,0.0002471124075417,10.0,9.0
cond-mat/0408405,Kovacs effect in facilitated spin models of strong and fragile glasses,6.2085192168887055e-06,0.0,2.0,0.0
cond-mat/0304590,Local excitations in mean field spin glasses,6.208192973088168e-06,4.489050281695013e-06,3.0,1.0
cond-mat/0511655,The synchronizability of highly clustered scale-free networks,6.207020097367275e-06,7.178519888015186e-08,6.0,1.0
cond-mat/0508646,"Dopant-Induced Local Pairing Inhomogeneity in
  Bi$_2$Sr$_2$CaCu$_2$O$_{8+\delta}$",6.199587517895382e-06,6.884276470083671e-06,5.0,5.0
cond-mat/0609705,"Critical fluctuations and breakdown of Stokes-Einstein relation in the
  Mode-Coupling Theory of glasses",6.198389201835305e-06,1.8964213325543733e-05,5.0,1.0
cond-mat/0107447,"Lattice Dirac fermions in a non-Abelian random gauge potential: Many
  flavors, chiral symmetry restoration and localization",6.190893825107269e-06,7.117160928153608e-07,3.0,2.0
cond-mat/0011146,"Fokker-Planck equations and density of states in disordered quantum
  wires",6.185366649194022e-06,8.841176993057785e-06,6.0,4.0
cond-mat/0005244,"On the existence of a variational principle for deterministic cellular
  automaton models of highway traffic flow",6.1760624130200696e-06,0.0,7.0,1.0
cond-mat/0107582,Particle-hole symmetric localization in two dimensions,6.163115556590777e-06,1.1139082584851149e-07,2.0,3.0
cond-mat/0308240,Static response in disk packings,6.15612256880157e-06,2.985274132740108e-05,2.0,3.0
cond-mat/0510430,Boolean Dynamics of Kauffman Models with a Scale-Free Network,6.153997206709795e-06,2.364001681734049e-07,4.0,1.0
cond-mat/0602041,Interface free energies in p-spin glass models,6.14921109705185e-06,0.0,5.0,0.0
cond-mat/0412519,"When it comes to spintronics, there may be some room in the middle",6.136945548515699e-06,0.0,2.0,0.0
cond-mat/0507525,"An algorithm for counting circuits: application to real-world and random
  graphs",6.1349189407811575e-06,2.0709917360938104e-06,4.0,1.0
cond-mat/0702131,"Directed polymer in a random medium of dimension 1+1 and 1+3: weights
  statistics in the low-temperature phase",6.120521139366951e-06,0.0,4.0,1.0
cond-mat/9909285,Critical statistics in a power-law random banded matrix ensemble,6.119333032687596e-06,6.032432057618278e-06,4.0,3.0
cond-mat/9912328,Three-state neural network: from mutual information to the hamiltonian,6.119117400064861e-06,0.0,2.0,0.0
cond-mat/0203167,"Infinite-Order Percolation and Giant Fluctuations in a Protein
  Interaction Network",6.118953176034621e-06,4.9643178053153285e-06,3.0,8.0
cond-mat/0605673,"Self-consistent multi-mode lasing theory for complex or random lasing
  media",6.118278930390038e-06,0.0,4.0,1.0
cond-mat/0602349,Computing the number of metastable states in infinite-range models,6.10895604611903e-06,1.9818284432214337e-07,5.0,2.0
cond-mat/0611436,Rectification effects in coherent transport through single molecules,6.107026054511987e-06,0.0,1.0,1.0
cond-mat/0204398,"Universality of the Crossing Probability for the Potts Model for
  q=1,2,3,4",6.105765953846279e-06,0.0,5.0,0.0
cond-mat/9708222,Driven Dynamics of Periodic Elastic Media in Disorder,6.099146899280996e-06,0.0,3.0,1.0
cond-mat/0110219,"Monte Carlo Studies of the Ordering of the Three-Dimensional Isotropic
  Heisenberg Spin Glass in Magnetic Fields",6.095526101671075e-06,1.24275031371656e-05,4.0,1.0
cond-mat/0204168,"Exact solutions for the statistics of extrema of some random 1D
  landscapes, Application to the equilibrium and the dynamics of the toy model",6.095094127853285e-06,9.38407715006541e-07,6.0,10.0
cond-mat/0304636,Average distance in growing trees,6.087195923764641e-06,0.0,3.0,0.0
cond-mat/0008241,"Density of states for dirty d-wave superconductors: A unified and dual
  approach for different types of disorder",6.081428987514442e-06,8.79508682124874e-06,7.0,3.0
cond-mat/0301403,Ordering and Broken Symmetry in Short-Ranged Spin Glasses,6.073458001689584e-06,1.3894149010837668e-05,5.0,4.0
cond-mat/9901067,"Static and Dynamic Properties of a Viscous Silica Melt Molecular
  Dynamics Computer Simulations",6.063958736264456e-06,0.0,3.0,5.0
cond-mat/0410579,"Number and length of attractors in a critical Kauffman model with
  connectivity one",6.063552729854114e-06,0.0,3.0,3.0
math-ph/0312043,"Multiplying unitary random matrices - universality and spectral
  properties",6.059375798240314e-06,0.0,6.0,1.0
cond-mat/0501169,"Towards a Theory of Scale-Free Graphs: Definition, Properties, and
  Implications (Extended Version)",6.056313659559851e-06,1.0115762658074322e-05,4.0,4.0
cond-mat/0603622,"Non-Hermitean Random Matrix Theory: Summation of Planar Diagrams, the
  ""Single-Ring"" Theorem and the Disk-Annulus Phase Transition",6.054508004305906e-06,1.6457630040642576e-07,7.0,1.0
cond-mat/0505138,Defect energy of infinite-component vector spin glasses,6.052035426445219e-06,0.0,4.0,0.0
cond-mat/0011413,"Strong Coupling Fixed Points of Current Interactions and Disordered
  Fermions in 2D",6.041566523511071e-06,1.0720205810155248e-05,19.0,7.0
cond-mat/9810282,"Schwinger-Keldysh Approach to Disordered and Interacting Electron
  Systems: Derivation of Finkelstein's Renormalization Group Equations",6.0292146615176925e-06,9.030436650313698e-05,3.0,3.0
cond-mat/0508609,"Cavity approach for real variables on diluted graphs and application to
  synchronization in small-world lattices",6.026251986815238e-06,0.0,1.0,0.0
cond-mat/0104264,"State Hierarchy Induced by Correlated Spin Domains in short range spin
  glasses",6.0200720855008095e-06,3.383681986524951e-05,7.0,3.0
cond-mat/0107555,Damage spreading in small world Ising models,6.008024102919032e-06,0.0,3.0,1.0
cond-mat/0205244,Simple models of small world networks with directed links,6.006856045977727e-06,0.0,2.0,0.0
cond-mat/0005047,"On the Effects of Changing the Boundary Conditions on the Ground State
  of Ising Spin Glasses",6.004529268557675e-06,1.990182755160072e-06,7.0,8.0
cond-mat/0407734,"Heterogeneous dynamics of the three dimensional Coulomb glass out of
  equilibrium",5.9821016177041615e-06,0.0,3.0,2.0
cond-mat/9802111,XY models with disorder and symmetry-breaking fields in two dimensions,5.977978837095875e-06,0.0,4.0,2.0
cond-mat/9912111,Quasi-long-range order in nematics confined in random porous media,5.975188499174175e-06,0.0,2.0,0.0
cond-mat/0202295,Localization of thermal packets and metastable states in Sinai model,5.956002891648407e-06,1.4852110113134864e-08,4.0,2.0
cond-mat/0504418,"A mean field description of jamming in non-cohesive frictionless
  particulate systems",5.953524698755547e-06,0.0,7.0,0.0
cond-mat/0104547,Mean-field approximation for a limit order driven market model,5.952484806846285e-06,8.281536599084037e-06,8.0,4.0
cond-mat/0409449,Zero temperature phase diagram of finite connectivity spin glasses,5.949167943131317e-06,1.0251384442755505e-06,3.0,2.0
cond-mat/0407748,"Magnetism of One-Dimensional Ni monoatomic chain on Au(110)-(1x2)
  surface",5.941391913970334e-06,0.0,3.0,0.0
cond-mat/0603731,"Signature of the electron-electron interaction in the magnetic field
  dependence of nonlinear I-V characteristics in mesoscopic conductors",5.933154089214736e-06,4.302158008558098e-07,5.0,3.0
cond-mat/0511539,Geometric effects on critical behaviours of the Ising model,5.918156803376336e-06,0.0,2.0,0.0
cond-mat/0403172,"Parallel dynamics of disordered Ising spin systems on finitely connected
  random graphs",5.914293168394225e-06,1.990182755160072e-06,4.0,1.0
cond-mat/0206224,"On the Tail of the Overlap Probability Distribution in the
  Sherrington--Kirkpatrick Model",5.903513606094636e-06,7.231078264849342e-06,5.0,2.0
cond-mat/0003052,Vortex-glass phases in type-II superconductors,5.900874066479213e-06,0.0,4.0,3.0
cond-mat/0107566,Anomalous stress relaxation in random macromolecular networks,5.899222190970461e-06,0.0,3.0,0.0
cond-mat/0511375,"1/f noise in a dilute GaAs two-dimensional hole system in the insulating
  phase",5.898628635590931e-06,0.0,4.0,0.0
cond-mat/0012015,"Role of a parallel magnetic field in two dimensional disordered clusters
  containing a few correlated electrons",5.892156534480754e-06,3.934856812441045e-06,9.0,4.0
cond-mat/0302390,Melting transition of an Ising glass driven by magnetic field,5.880123532414176e-06,0.0,1.0,0.0
cond-mat/0601027,Hysteretic optimization for the Sherrington-Kirkpatrick spin glass,5.875015247321308e-06,8.664416899253921e-07,2.0,1.0
cond-mat/0407130,Extremal Optimization for Sherrington-Kirkpatrick Spin Glasses,5.875015247321308e-06,4.308673980722697e-06,2.0,4.0
cond-mat/0603018,Rigorous Inequalities between Length and Time Scales in Glassy Systems,5.873749826418227e-06,3.071072271781271e-05,3.0,4.0
cond-mat/0106357,Numerical results for the Anderson transition. Comment,5.871507119228095e-06,0.0,6.0,2.0
cond-mat/0605639,Hopping conductivity of a suspension of flexible wires in an insulator,5.866803729762933e-06,0.0,3.0,0.0
cond-mat/0306610,Systematic identification of statistically significant network measures,5.8624123852448e-06,5.977974320536784e-06,2.0,5.0
cond-mat/0403294,Electrical noise properties in aging materials,5.8540203399349545e-06,9.95091377580036e-06,7.0,1.0
cond-mat/0501197,Continuum Limit of the Integrable sl(2/1) 3-\bar{3} Superspin Chain,5.852367737882543e-06,2.644371971457701e-06,10.0,6.0
cond-mat/9904124,"Lennard-Jones binary mixture: a thermodynamical approach to glass
  transition",5.850886941707446e-06,8.246142403797689e-05,10.0,11.0
cond-mat/0607817,"Mosaic multi-state scenario vs. one-state description of supercooled
  liquids",5.850229654174903e-06,3.980365510320144e-06,4.0,1.0
cond-mat/0106005,"The critical exponent of the localization length at the Anderson
  transition in 3D disordered systems is larger than 1",5.840337303289136e-06,0.0,11.0,6.0
cond-mat/0108191,Modified TAP equations for the SK spin glass,5.835896996266983e-06,0.0,1.0,1.0
cond-mat/0504086,"Diagrammatic Analysis of the Unitary Group for Double Barrier Ballistic
  Cavities: Equivalence with Circuit Theory",5.823312980342088e-06,0.0,2.0,0.0
cond-mat/0610691,Mode statistics in random lasers,5.821996350622634e-06,0.0,1.0,0.0
cond-mat/0309278,Size dependence of the internal energy in Ising and vector spin glasses,5.815675110630771e-06,0.0,7.0,1.0
cond-mat/0507687,"Phononless thermally activated transport through a disordered array of
  quantum wires",5.813885026896663e-06,0.0,4.0,0.0
cond-mat/0012184,Disorder Driven Melting of the Vortex Line Lattice,5.805771545350872e-06,0.0,1.0,1.0
cond-mat/0212305,Disorder-induced rounding of certain quantum phase transitions,5.802574245024336e-06,0.0,2.0,0.0
cond-mat/0606635,Quantum chaos and fluctuations in isolated nuclear spin systems,5.801814807351457e-06,0.0,1.0,0.0
cond-mat/0401237,Message passing in random satisfiability problems,5.799665930342826e-06,3.980365510320144e-06,8.0,2.0
cond-mat/0406391,Theory of Networked Minority Games based on Strategy Pattern Dynamics,5.787410345656195e-06,0.0,5.0,1.0
cond-mat/9811252,The role of the energy gap in protein folding dynamics,5.785545697284649e-06,0.0,4.0,0.0
cond-mat/0310782,Evidence for a Vanishing Complexity of the Sherrington-Kirkpatrick model,5.774360039169462e-06,4.243038760050017e-05,9.0,5.0
cond-mat/0406590,"Models for the magnetic ac susceptibility of granular superferromagnetic
  CoFe/Al$_2$O$_3$",5.773321934807347e-06,0.0,1.0,0.0
cond-mat/0701211,"Disorder effects in the quantum Heisenberg model: An Extended Dynamical
  mean-field theory analysis",5.773321934807347e-06,0.0,1.0,0.0
cond-mat/9802104,"Application of a continous time cluster algorithm to the Two-dimensional
  Random Quantum Ising Ferromagnet",5.758322312258808e-06,3.980365510320144e-06,5.0,8.0
quant-ph/0508018,Disordered complex systems using cold gases and trapped ions,5.750949172491235e-06,1.438638221305426e-05,4.0,3.0
cond-mat/0212438,A single saddle model for the beta-relaxation in supercooled liquids,5.738273305179535e-06,2.98686543025223e-06,5.0,1.0
cond-mat/0011074,Fast Monte Carlo algorithm for supercooled soft spheres,5.737754896034603e-06,0.0,2.0,0.0
cond-mat/9905050,On the possibility of optimal investment,5.728641645988581e-06,0.0,6.0,0.0
cond-mat/9802092,A Study of Cross-Over Effects For The 2D Random Bond Potts Model,5.72402768850138e-06,0.0,7.0,19.0
cond-mat/9904361,"Percolation-type description of the metal-insulator transition in two
  dimensions",5.721986529646239e-06,0.0,9.0,4.0
cond-mat/9905388,Disordered d-wave superconductors with chiral symmetry,5.717320552026371e-06,4.146046060586393e-06,10.0,2.0
cond-mat/0203141,"Quantum Impurities in the Two-Dimensional Spin One-Half Heisenberg
  Antiferromagnet",5.71602702995523e-06,0.0,2.0,0.0
cond-mat/0605490,"Finite temperature Functional RG, droplets and decaying Burgers
  Turbulence",5.7067572179522e-06,2.9968535101504125e-06,9.0,7.0
cond-mat/0211417,Low-energy fixed points of random Heisenberg models,5.701106519650881e-06,0.0,4.0,0.0
cond-mat/9909210,"Energy-level statistics at the metal-insulator transition in anisotropic
  systems",5.69412257640501e-06,0.0,13.0,6.0
cond-mat/0012054,Onset Temperature of Slow Dynamics in Glass Forming Liquids,5.69174190855745e-06,1.9673457049187724e-06,6.0,2.0
cond-mat/0606797,"Nonlinear Diffusion Through Large Complex Networks Containing Regular
  Subgraphs",5.679326981876062e-06,0.0,3.0,0.0
cond-mat/9810119,Mean-Field Approximations to the Longest Common Subsequence Problem,5.678260575878476e-06,0.0,4.0,0.0
cond-mat/0503269,"Strong disorder renormalization group on fractal lattices: Heisenberg
  models and magnetoresistive effects in tight binding models",5.676434735517614e-06,0.0,1.0,1.0
cond-mat/0303349,On the theory of plateau-plateau transitions in Quantum Hall Effect,5.672174547159766e-06,0.0,4.0,0.0
cond-mat/0507157,"Quantum localization in bilayer Heisenberg antiferromagnets with site
  dilution",5.671000136016526e-06,0.0,2.0,0.0
cond-mat/0410355,"Anomalous heat conduction and anomalous diffusion in nonlinear lattices,
  single walled nanotubes, and billiard gas channels",5.668652143565432e-06,0.0,4.0,1.0
cond-mat/0506014,"Stability of thermodynamic and dynamical order in a system of globally
  coupled rotors",5.667450478064312e-06,0.0,4.0,0.0
cond-mat/0205021,Barkhausen Noise and Critical Scaling in the Demagnetization Curve,5.667235636323189e-06,0.0,3.0,2.0
cond-mat/0505021,The Memory Effect in Electron Glasses,5.655144290770314e-06,0.0,1.0,1.0
cond-mat/0412209,A Numerical Study of Coulomb Interaction Effects on 2D Hopping Transport,5.655144290770314e-06,0.0,2.0,2.0
cond-mat/0410406,"Finite Temperature Transitions in Large Magnetic Field in Dipolar Spin
  Ice",5.655144290770314e-06,0.0,1.0,1.0
cond-mat/0610469,"Interaction of two level systems in amorphous materials with arbitrary
  phonon fields",5.655144290770314e-06,0.0,1.0,1.0
cond-mat/0302445,A Numerical Study of Transport and Shot Noise at 2D Hopping,5.655144290770314e-06,0.0,2.0,2.0
cond-mat/0503160,"Neutron scattering studies of the spin ices Ho2Ti2O7 and Dy2Ti2O7 in
  applied magnetic field",5.655144290770314e-06,0.0,1.0,1.0
cond-mat/0603697,Floppy modes and non-affine deformations in random fiber networks,5.655144290770314e-06,0.0,1.0,1.0
cond-mat/0508703,"History dependence, memory and metastability in electron glasses",5.655144290770314e-06,0.0,1.0,1.0
cond-mat/0507085,Structure and Relaxation Dynamics of a Colloidal Gel,5.650405363854393e-06,1.0149020886148314e-05,4.0,2.0
