id,title,pagerank,betweenness,in_degree,out_degree
hep-th/9811212,The Microscopic Spectral Density of the QCD Dirac Operator,4.730112972813177e-06,0.0001717554384125,10.0,46.0
cond-mat/9812401,"Comment on ""Ising Spin Glasses in a Magnetic Field""",4.727496695485474e-06,0.0,3.0,2.0
q-bio/0701049,Random RNA under tension,4.720429924862225e-06,0.0,3.0,0.0
cond-mat/0005452,"Scaling of crossing probabilities for the q-state Potts model at
  criticality",4.7201580046065805e-06,1.990182755160072e-06,6.0,1.0
physics/9805029,Hierarchical noise in large systems of independent agents,4.717476312318796e-06,0.0,1.0,0.0
cond-mat/9906270,"How to evaluate ground-state landscapes of disordered systems
  thermodynamical correctly",4.712450765389955e-06,0.0,3.0,1.0
cond-mat/0302527,"Glass Transition in a Two-Dimensional Electron System in Silicon in a
  Parallel Magnetic Field",4.702379102631749e-06,1.990182755160072e-06,1.0,1.0
cond-mat/0211386,Aging Continuous Time Random Walks,4.701139521565866e-06,0.0,4.0,1.0
cond-mat/9911159,"Random solids and random solidification: What can be learned by
  exploring systems obeying permanent random constraints?",4.700911818086915e-06,0.0,3.0,0.0
cond-mat/0501668,"Non-linear susceptibility in glassy systems: a probe for cooperative
  dynamical length scales",4.695227257240531e-06,0.0,6.0,1.0
cond-mat/0412658,Self-avoiding walks on scale-free networks,4.689670497992088e-06,0.0,4.0,0.0
cond-mat/0204413,Discreteness and entropic fluctuations in GREM-like systems,4.689179358668541e-06,0.0001146344785427,4.0,2.0
math-ph/0608045,Spin Glass Computations and Ruelle's Probability Cascades,4.666859423183127e-06,0.0,5.0,1.0
cond-mat/0210223,Dephasing from interactions and spin disorder,4.666342048465971e-06,0.0,5.0,0.0
cond-mat/0103024,Minority Games and stylized facts,4.666263452018586e-06,1.3614434270373628e-07,13.0,1.0
cond-mat/0401351,"Electronic Localization Properties of a Double Strand of DNA: A Simple
  Model with Long-Range Correlated Hopping Disorder",4.662740240842264e-06,0.0,2.0,2.0
cond-mat/0110111,Cluster Growth in a Growing Tree Network,4.661762339337163e-06,1.990182755160072e-06,4.0,1.0
cond-mat/0004343,Dynamical response of a pinned two-dimensional Wigner crystal,4.661272429776293e-06,0.0,3.0,1.0
cond-mat/9906067,Boundary critical behaviour of two-dimensional random Potts models,4.652189275360982e-06,1.2087689019956395e-05,5.0,5.0
cond-mat/0001228,"Field distributions and effective-medium approximation for weakly
  nonlinear media",4.651340137579245e-06,0.0,3.0,0.0
cond-mat/0210428,Are waves all localized in two dimensional random media?,4.651340137579245e-06,0.0,3.0,0.0
cond-mat/9907084,"Self-organized criticality in a model of biological evolution with long
  range interactions",4.651340137579245e-06,0.0,3.0,1.0
physics/0505031,The Epidemics of Corruption,4.648162475791553e-06,4.09104909282992e-06,6.0,3.0
quant-ph/0202016,Neural Networks with c-NOT Gated Nodes,4.648085672191587e-06,0.0,3.0,1.0
cond-mat/0406649,Complexity in Mean-Field Spin-Glass Models: Ising $p$-spin,4.644454414252586e-06,0.0,5.0,1.0
cond-mat/0007113,Monte Carlo Simulations of Spin Glasses at Low Temperatures,4.626035749492272e-06,0.0001787981704359,5.0,20.0
cond-mat/0102160,Fluctuation effects in disordered Peierls systems,4.6243335514033895e-06,3.7689674281665456e-06,2.0,2.0
cond-mat/0401449,Landscapes and Fragilities,4.623134334191634e-06,0.0,4.0,4.0
cond-mat/0005380,An exact-diagonalization study of rare events in disordered conductors,4.6173774760091565e-06,0.0,2.0,0.0
cond-mat/0003122,Sub-aging in a Domain Growth Model,4.609490618718232e-06,1.990182755160072e-06,5.0,2.0
cond-mat/0105308,Theory of Microemulsion Glasses,4.604910211530504e-06,5.0435761718569e-06,1.0,2.0
cond-mat/0506521,"Energy statistics in disordered systems: The local REM conjecture and
  beyond",4.600481355050562e-06,0.0,4.0,0.0
cond-mat/0507471,Synchronization in Complex Networks: a Comment on two recent PRL papers,4.6004267538096966e-06,0.0,6.0,1.0
cond-mat/0010010,"Discrete energy landscapes and replica symmetry breaking at zero
  temperature",4.597840332052653e-06,0.0,4.0,2.0
cond-mat/0212363,On Ising and dimer models in two and three dimensions,4.596660081386083e-06,0.0001708005326048,4.0,4.0
cond-mat/0006132,Knowing a network by walking on it: emergence of scaling,4.594347331809969e-06,0.0,8.0,19.0
cond-mat/0305041,"Crossover from random-exchange to random-field critical behavior in
  Ising models",4.592473297055928e-06,5.510058948610165e-07,3.0,4.0
cond-mat/9902342,"Statistics of Coulomb Blockade Peak Spacings within the Hartree-Fock
  Approximation",4.580476185641609e-06,0.0,3.0,4.0
cond-mat/0510714,"Acoustic damping in Li$_2$O-2B$_2$O$_3$ glass observed by inelastic
  x-ray and optical Brillouin scattering",4.580159970007856e-06,0.0,3.0,1.0
cond-mat/9705096,Statics and Dynamics of Disordered Elastic Systems,4.559709922524477e-06,0.0,7.0,33.0
cond-mat/0609717,"Determinant Quantum Monte Carlo Study of the Screening of the One Body
  Potential near a Metal-Insulator Transition",4.554909346026627e-06,0.0,2.0,0.0
cond-mat/0605448,Random polymers and delocalization transitions,4.549222367131449e-06,1.4266628081441589e-06,4.0,3.0
cond-mat/0512167,The dynamic exponent of the Ising model on negatively curved surfaces,4.54605143317165e-06,0.0,1.0,2.0
cond-mat/0310389,Quantum-classical transitions in Lifshits tails with magnetic fields,4.544364411579962e-06,0.0,2.0,1.0
cond-mat/0106023,"The two-dimensional random-bond Ising model, free fermions and the
  network model",4.540567389384864e-06,6.156667015988871e-06,5.0,4.0
cond-mat/0003449,Metallic Spin Glass in Infinite Dimensions,4.536985275978071e-06,0.0,2.0,0.0
cond-mat/0109243,Antipersistent binary time series,4.535934941904233e-06,0.0,4.0,0.0
cond-mat/0002460,"The excess wing in the dielectric loss of glass-forming ethanol: A
  relaxation process",4.534059758234596e-06,0.0,3.0,3.0
cond-mat/9803088,Quantum Monte Carlo Study of Random Antiferromagnetic Heisenberg Chain,4.527116820765776e-06,0.0,2.0,3.0
cond-mat/0106530,"Fragility of the spin-glass-like collective state to a magnetic field in
  an interacting Fe-C nanoparticle system",4.527116820765776e-06,0.0,2.0,0.0
cond-mat/0108233,Cyclotron resonance in antidot arrays,4.527116820765776e-06,0.0,3.0,0.0
cond-mat/0009135,"Critical behavior of ferromagnetic spin models with aperiodic exchange
  interactions",4.527116820765776e-06,0.0,2.0,0.0
cond-mat/0304207,Investigation of a Protein Complex Network,4.527116820765776e-06,0.0,2.0,1.0
cond-mat/0102251,Interacting particles at a metal-insulator transition,4.526322470019998e-06,0.0,2.0,4.0
cond-mat/0009198,"Transport Properties and Density of States of Quantum Wires with
  Off-diagonal Disorder",4.525237009483222e-06,1.990182755160072e-06,1.0,2.0
cond-mat/0112020,"Quantum transport through mesoscopic disordered interfaces, junctions,
  and multilayers",4.522373394666947e-06,0.0,1.0,0.0
cond-mat/0008115,"Evidence for the double degeneracy of the ground-state in the 3D $\pm J$
  spin glass",4.520713465456047e-06,0.0,5.0,9.0
cond-mat/0512215,"Absence of zero-temperature transmission rate of a double-chain
  tight-binding model for DNA with random sequence of nucleotides in
  thermodynamic limit",4.520115041460564e-06,0.0,2.0,0.0
cond-mat/0112261,Strongly disordered spin ladders,4.518518973825055e-06,1.990182755160072e-06,5.0,1.0
cond-mat/9908034,Similarity of percolation thresholds on the hcp and fcc lattices,4.515025475212901e-06,0.0,1.0,0.0
cond-mat/0511177,"Quantum disorder and Griffiths singularities in bond-diluted
  two-dimensional Heisenberg antiferromagnets",4.515025475212901e-06,0.0,1.0,0.0
cond-mat/9711279,Critical Behaviour of Random Bond Potts Models: A Transfer Matrix Study,4.512112986261706e-06,0.0,2.0,9.0
cond-mat/9908480,"Exact solution of a modified El Farol's bar problem: Efficiency and the
  role of market impact",4.5104283324750405e-06,9.863629339152187e-05,3.0,27.0
cond-mat/0505453,"One-dimensional cluster growth and branching gels in colloidal systems
  with short-range depletion attraction and screened electrostatic repulsion",4.507433505410053e-06,3.038124847328491e-05,3.0,5.0
cond-mat/9803334,"Reflection coefficient and localization length of waves in
  one-dimensional random media",4.506955909658643e-06,1.990182755160072e-06,3.0,1.0
q-bio/0411019,A simple derivation of the Gompertz law for human mortality,4.504611069009671e-06,0.0,1.0,0.0
cond-mat/0610854,Localization of interacting fermions at high temperature,4.5022929763327535e-06,0.0,2.0,0.0
cond-mat/0502252,"Quantum Correction to Conductivity Close to Ferromagnetic Quantum
  Critical Point in Two Dimensions",4.500835502943323e-06,0.0,3.0,0.0
cond-mat/0406158,"Statistical Mechanics of Dilute Batch Minority Games with Random
  External Information",4.49112413815129e-06,0.0,7.0,2.0
cond-mat/0201030,2d random Dirac fermions: large N approach,4.486401025199277e-06,0.0,3.0,0.0
cond-mat/9807391,Density of states in the non-hermitian Lloyd model,4.481726819083363e-06,0.0,8.0,0.0
cond-mat/0406172,A super-Ohmic energy absorption in driven quantum chaotic systems,4.479127926427014e-06,0.0,2.0,0.0
cond-mat/0109136,Ground states of two-dimensional $\pm$J Edwards-Anderson spin glasses,4.475961922187627e-06,0.0,6.0,0.0
cond-mat/0607349,Theory of Structural Glasses and Supercooled Liquids,4.474212688447314e-06,0.0,3.0,5.0
cond-mat/0502605,"Finite-Size Scaling in the Energy-Entropy Plane for the 2D +- J Ising
  Spin Glass",4.466560042612233e-06,0.0,3.0,2.0
cond-mat/9711271,A numerical study of the Random Dimerized XX spin-1/2 chain,4.465742701834397e-06,0.0,3.0,0.0
cond-mat/0407503,Analysis of weighted networks,4.46415812226839e-06,2.256724825956606e-05,3.0,5.0
cond-mat/0611763,Ising Model Scaling Behaviour on z-Preserving Small-World Networks,4.461962530461261e-06,0.0,5.0,0.0
cond-mat/9906249,Capital flow in a two-component dynamical system,4.459220157990226e-06,0.0,12.0,2.0
cond-mat/0010371,Computer Science in Physics,4.457822704818995e-06,0.0,7.0,0.0
cond-mat/0402535,"Metal-insulator transition and glassy behavior in two-dimensional
  electron systems",4.454843416799474e-06,0.0,2.0,0.0
cond-mat/0001369,Dipolar Interactions and Origin of Spin Ice in Ising Pyrochlore Magnets,4.447213765174658e-06,0.0,2.0,0.0
cond-mat/0608555,Critical Fidelity,4.443377833452185e-06,0.0,2.0,0.0
cond-mat/0203004,Anomalous Quantum Diffusion at the Superfluid-Insulator Transition,4.439200053190975e-06,7.165209702336171e-05,3.0,2.0
cond-mat/0012213,"Intermediate liquid-solid regime near the quantum melting of a two
  dimensional Wigner molecule",4.436429442401061e-06,2.9803234293690627e-06,3.0,3.0
cond-mat/0511171,Semi-Poisson statistics in quantum chaos,4.435532521671518e-06,0.0,4.0,0.0
cond-mat/0609704,"Nonequilibrium structures and dynamic transitions in driven vortex
  lattices with disorder",4.434842184005817e-06,0.0,3.0,0.0
cond-mat/9803094,"Disorder-enhanced delocalization and local-moment quenching in a
  disordered antiferromagnet",4.433018954868417e-06,2.22781651697023e-08,2.0,2.0
cond-mat/0307752,Universality of the Lyapunov regime for the Loschmidt echo,4.430279520246971e-06,3.984078537848427e-06,4.0,9.0
cond-mat/0307443,"Anisotropy and universality: the Oslo model, the rice pile experiment
  and the quenched Edwards-Wilkinson equation",4.429648418783423e-06,9.338957696508356e-06,3.0,4.0
cond-mat/0104155,Statistical ensemble of scale-free random graphs,4.423100824305134e-06,3.980365510320144e-06,11.0,4.0
cond-mat/0703405,"Topology and Dynamics of Attractor Neural Networks: The Role of
  Loopiness",4.422872904755412e-06,0.0,2.0,0.0
cond-mat/9904414,"Gauge Invariance and the Critical Properties of Quantum Hall Plateaux
  Transitions",4.416890511095296e-06,2.680427640892613e-05,7.0,3.0
cond-mat/0607614,Ageing in disordered magnets and local scale-invariance,4.413408413633906e-06,1.990182755160072e-06,3.0,2.0
cond-mat/9707341,Zero Modes and Thermodynamics of Disordered Spin-1/2 Ladders,4.411096563814204e-06,0.0,8.0,4.0
cond-mat/0412650,"Spontaneous relaxation in generalized oscillator models with glassy
  dynamics",4.410382642360035e-06,0.0,4.0,0.0
math-ph/0505055,The Ghirlanda-Guerra Identities,4.407821217162313e-06,4.321650868200292e-06,2.0,4.0
cond-mat/0610706,"NMR Probing Spin Excitations in the Ring-Like Structure of a Two-Subband
  System",4.402893503952305e-06,0.0,2.0,0.0
cond-mat/0106325,Disorder induced cross-over effects at quantum critical points,4.396807341591407e-06,2.3956453612486537e-05,3.0,4.0
cond-mat/0312572,"Crossover effects in the random exchange spin-1/2 antiferromagnetic
  chain",4.393975199593941e-06,1.990182755160072e-06,3.0,1.0
cond-mat/0305073,Cluster model of glass transition in simple liquids,4.392553030018995e-06,0.0,3.0,0.0
cond-mat/0303210,Theory of the [111] magnetization plateau in spin ice,4.391563857013501e-06,1.779082881930031e-06,5.0,3.0
cond-mat/0406546,Aging and Memory Effects in Superparamagnets and Superspin Glasses,4.389256524993298e-06,1.990182755160072e-06,5.0,2.0
cond-mat/0009425,"Critical behavior of the thermoelectric transport properties in
  amorphous systems near the metal-insulator transition",4.387329771106658e-06,0.0,1.0,0.0
cond-mat/9809300,Disordered periodic systems at the upper critical dimension,4.384147183927571e-06,0.0,4.0,0.0
cond-mat/0406263,"Ground state clusters for short-range attractive and long-range
  repulsive potentials",4.382930095680508e-06,0.0,4.0,0.0
cond-mat/0204336,"Itineration of the Internet over Nonequilibrium Stationary States in
  Tsallis Statistics",4.375927655711967e-06,0.0001146530469427,5.0,2.0
cond-mat/9911226,"Activated processes and Inherent Structure dynamics of finite-size
  mean-field models for glasses",4.366497279960858e-06,0.0001362815175065,4.0,12.0
cond-mat/0307250,Near optimal configurations in mean field disordered systems,4.365966032582314e-06,0.0,4.0,0.0
cond-mat/0701256,"Long-range correlated random field and random anisotropy O(N) models: A
  functional renormalization group study",4.364398220632344e-06,0.0,1.0,0.0
cond-mat/0101070,"Numerical Study of the Localization-Delocalization Transition for
  Vibrations in Amorphous Silicon",4.361485731681149e-06,0.0,2.0,1.0
cond-mat/0108017,Financial Market Dynamics,4.361387580091172e-06,0.0,4.0,8.0
cond-mat/0412399,Emergence of weight-topology correlations in complex scale-free networks,4.350261010510934e-06,6.101824886583228e-06,5.0,6.0
cond-mat/9906078,An investigation of site-bond percolation on many lattices,4.348173415360582e-06,0.0,1.0,1.0
cond-mat/0111521,"Random Magnetism in $S=1/2$ Heisenberg Chains with Bond Alternation and
  Randomness on the Strong Bonds",4.340450834447055e-06,3.980365510320144e-06,1.0,3.0
cond-mat/9905017,"Intermediate Regime between the Fermi Glass and the Mott Insulator in
  one Dimension",4.339801513971384e-06,0.0,2.0,1.0
cond-mat/9706218,Non-Hermitean Localization and De-Localization,4.339637462212644e-06,0.0001364826723827,14.0,19.0
cond-mat/0006476,"Statistics of energy levels and zero temperature dynamics for
  deterministic spin models with glassy behaviour",4.338619724892374e-06,0.0,3.0,0.0
cond-mat/0501324,Thermal noise properties of two aging materials,4.338364390919941e-06,9.95091377580036e-06,5.0,2.0
cond-mat/9803067,Decoherence and the Thouless Crossover in One-Dimensional Conductors,4.337564785512166e-06,0.0,2.0,2.0
cond-mat/0511622,"Disorder-induced critical phenomena--new universality classes in
  Anderson localization",4.335836990172537e-06,7.975583130753422e-06,2.0,2.0
nlin/0110040,"Nonlinear Analysis of the Eckhaus Instability: Modulated Amplitude Waves
  and Phase Chaos with Non-zero Average Phase Gradient",4.335081793914062e-06,0.0,3.0,0.0
physics/0512011,A Review of Recent Studies of Geographical Scale-Free Networks,4.331412407345664e-06,7.690887835952622e-07,7.0,1.0
cond-mat/9810297,On loss of quantum coherence in an interacting Fermi gas,4.328693578248906e-06,0.0,5.0,6.0
cond-mat/9902231,"Universal scaling, beta function, and metal-insulator transitions",4.326403532216183e-06,0.0,4.0,2.0
cond-mat/0306509,Bug propagation and debugging in asymmetric software structures,4.320524592179016e-06,0.0,3.0,0.0
cond-mat/0011353,"Scaling approach to order-parameter fluctuations in disordered
  frustrated systems",4.3113494876271866e-06,0.0,7.0,0.0
cond-mat/0110238,The noncommutative replica approach,4.306194096278912e-06,1.4852110113134864e-08,10.0,5.0
cond-mat/9808053,Interaction effects and phase relaxation in disordered systems,4.305515993925067e-06,0.0,4.0,33.0
cond-mat/9811177,"Comment on ""Evidence for nontrivial ground-state structure of 3d +/- J
  spin glasses""",4.30117593889494e-06,0.0,4.0,0.0
cond-mat/0702199,"Two-dimensional spin-filtered chiral network model for the Z_2 quantum
  spin-Hall effect",4.294271632728661e-06,0.0,2.0,0.0
cond-mat/9908336,"Dynamics and statistics of simple models with infinite-range attractive
  interaction",4.287273966993423e-06,5.645020654608884e-05,6.0,9.0
cond-mat/0111158,"Weak quenched disorder and criticality: resummation of asymptotic(?)
  series",4.2832102639956605e-06,2.675630952606234e-06,3.0,4.0
cond-mat/0602212,"Universality in three-dimensional Ising spin glasses: A Monte Carlo
  study",4.279697113729223e-06,2.04089880284497e-05,3.0,7.0
cond-mat/0304579,Continuum percolation of wireless ad hoc communication networks,4.278937744858475e-06,0.0,3.0,0.0
cond-mat/9803342,"Network Model for a 2D Disordered Electron System with Spin-Orbit
  Scattering",4.271351258022924e-06,0.0,6.0,2.0
cond-mat/0309576,Parisi States in a Heisenberg Spin-Glass Model in Three Dimensions,4.271193346579789e-06,0.0,1.0,0.0
cond-mat/0210521,Sub-diffusion and localization in the one dimensional trap model,4.271062111276443e-06,3.987791565376711e-06,5.0,4.0
cond-mat/0005172,"The dynamics of the spherical p-spin model: from microscopic to
  asymptotics",4.264812796315341e-06,1.990182755160072e-06,4.0,2.0
cond-mat/0012144,"Localization Characteristics of Relativistic vs Nonrelativistic Fermions
  on a Lattice",4.263917507405499e-06,0.0,2.0,0.0
cond-mat/0504690,Finitely connected vector spin systems with random matrix interactions,4.26182427237557e-06,1.990182755160072e-06,3.0,1.0
cond-mat/0405563,Replica symmetry breaking in the `small world' spin glass,4.253022926945507e-06,9.95091377580036e-06,4.0,4.0
cond-mat/0401270,Internet's Critical Path Horizon,4.2524665599974e-06,0.0,6.0,0.0
cond-mat/0305612,Why social networks are different from other types of networks,4.249907502320099e-06,1.3012368879469022e-05,4.0,6.0
cond-mat/9910232,Off-Equilibrium Dynamics at Very Low Temperatures in 3d Spin Glasses,4.248960989671682e-06,5.287103131825307e-05,4.0,3.0
cond-mat/0104428,"Statistical mechanics methods and phase transitions in optimization
  problems",4.248939175027813e-06,0.0,7.0,4.0
math-ph/0408019,Addition of Free Unitary Random Matrices,4.248295649767041e-06,0.0,1.0,0.0
physics/0503199,Opinion dynamics and decision of vote in bipolar political systems,4.238654066716033e-06,1.9827567001035044e-06,4.0,1.0
cond-mat/0511072,"Delocalization transition of the selective interface model: distribution
  of pseudo-critical temperatures",4.235872465866094e-06,0.0,4.0,0.0
cond-mat/0512606,Trapped ion chain as a neural network,4.232823828677271e-06,1.4852110113134863e-09,3.0,1.0
cond-mat/0301486,"Magnetization enumerator of real-valued symmetric channels in Gallager
  error-correcting codes",4.22586231160466e-06,0.0,2.0,0.0
cond-mat/0312039,Glassy Dynamics and Aging in Disordered Systems,4.209301134281804e-06,0.0,5.0,0.0
cond-mat/0012313,Correlation effects in a simple model of small-world network,4.20772725939292e-06,0.0,7.0,1.0
cond-mat/0611313,"Statistical Neurodynamics for sequence processing neural networks with
  finite dilution",4.1999930719845695e-06,1.990182755160072e-06,2.0,1.0
cond-mat/9906186,"Ground State and Spin Glass Phase of the Large N Infinite Range Spin
  Glass Via Supersymmetry",4.199958298819334e-06,0.0,2.0,0.0
cond-mat/0408073,Spin glasses in the limit of an infinite number of spin components,4.199861651998353e-06,1.425658020248735e-07,3.0,1.0
cond-mat/9704155,"Revisiting the Theory of Finite Size Scaling in Disordered Systems: \nu
  Can Be Less Than 2/d",4.199458373837573e-06,0.0,3.0,3.0
cond-mat/0202135,"Critical Behavior and Lack of Self Averaging in the Dynamics of the
  Random Potts Model in Two Dimensions",4.198625384176371e-06,0.0,6.0,1.0
cond-mat/0412306,Voting and Catalytic Processes with Inhomogeneities,4.19078782517804e-06,2.2575207371964995e-08,3.0,1.0
cond-mat/0101146,Superballistic spreading of wave packets,4.189908929564321e-06,0.0,2.0,0.0
cond-mat/0107237,Self-organized branching process for a one-dimensional ricepile model,4.184187213649583e-06,0.0,3.0,0.0
cond-mat/0409245,"Double chains with base pairing: delocalization irrespective to DNA
  sequencing",4.183530822279433e-06,0.0,1.0,0.0
cond-mat/0307554,"Intermittency of glassy relaxation and the emergence of a
  non-equilibrium spontaneous measure in the aging regime",4.18238281024716e-06,1.990182755160072e-06,6.0,7.0
cond-mat/9903272,Melting of the Electron Glass,4.179095444565104e-06,0.0,5.0,2.0
cond-mat/0307184,The q-component static model : modeling social networks,4.1783749154557065e-06,1.3218378000690005e-06,3.0,2.0
cond-mat/0502134,"Energy transport along FPU-beta chains containing binary isotopic
  disorder: Zero temperature systems",4.17695262208147e-06,0.0,2.0,0.0
cond-mat/0104527,"Using Entropy-Based Methods to Study General Constrained Parameter
  Optimization Problems",4.172024798573043e-06,0.0,4.0,0.0
cond-mat/0308515,General duality for abelian-group-valued statistical-mechanics models,4.170535012898188e-06,1.336689910182138e-07,1.0,1.0
cond-mat/0303445,"Universal dependence of the fluctuation-dissipation ratio on the
  transition rates in trap models",4.1702556735068604e-06,5.287480688007349e-06,4.0,8.0
cond-mat/9912336,Jamming and Fluctuations in Granular Drag,4.164530281036357e-06,0.0,2.0,0.0
cond-mat/0102523,Stick-Slip Fluctuations in Granular Drag,4.164530281036357e-06,0.0,2.0,2.0
cond-mat/0609113,Glass Phenomenology from the Connection to Spin Glasses,4.156522208043753e-06,2.985274132740108e-06,3.0,3.0
cond-mat/0602517,"Spin-Hall effect in semiconductor heterostructures with cubic Rashba
  spin-orbit interaction",4.148192046014586e-06,6.480722480526911e-07,6.0,1.0
cond-mat/0603521,Local and cluster critical dynamics of the 3d random-site Ising model,4.146854844249496e-06,0.0,1.0,0.0
physics/0607272,"Beyond the average: detecting global singular nodes from local features
  in complex networks",4.145591568423238e-06,3.5273761518695305e-08,3.0,1.0
cond-mat/0007493,"On the Effects of a Bulk Perturbation on the Ground State of 3D Ising
  Spin Glasses",4.139437693863379e-06,6.504569515744942e-05,7.0,11.0
cond-mat/0312537,Self-organized critical network dynamics,4.137418616909712e-06,1.4852110113134863e-09,1.0,1.0
cond-mat/0005095,On nonlinear susceptibility in supercooled liquids,4.129645931296118e-06,1.7782909968309047e-06,5.0,1.0
cond-mat/0106331,Low field hysteresis in disordered ferromagnets,4.128278206266183e-06,0.0,2.0,2.0
cond-mat/0609132,"Comment to ""Packing Hyperspheres in High-Dimensional Euclidean Space""",4.114538931504376e-06,0.0,2.0,0.0
cond-mat/9910124,"On the universality of distribution of ranked cluster masses at critical
  percolation",4.113604228987466e-06,0.0,3.0,0.0
cond-mat/0507559,Mechanical Spectroscopy on Volcanic Glasses,4.112851992002675e-06,0.0,2.0,0.0
cond-mat/0606113,"Analytic determination of dynamical and mosaic length scales in a Kac
  glass model",4.110353438306911e-06,1.3462472173092044e-05,3.0,2.0
math-ph/0302013,Monotonicity and Thermodynamic Limit for Short Range Disordered Models,4.1016287241885015e-06,1.233949974576672e-05,2.0,5.0
quant-ph/0205020,Study of Optimization Problems by Quantum Annealing,4.100292487063275e-06,1.1941096530960432e-05,6.0,4.0
cs/0308010,On the probabilistic approach to the random satisfiability problem,4.097008383449108e-06,0.0,8.0,2.0
cond-mat/9612038,"Scaling and Crossover Functions for the Conductance in the Directed
  Network Model of Edge States",4.095442277202466e-06,0.0,3.0,3.0
cond-mat/9902036,"Effect of Local Magnetic Moments on the Metallic Behavior in Two
  Dimensions",4.09472774015017e-06,0.0,4.0,2.0
cond-mat/0007417,"Universal saturation of electron dephasing in three-dimensional
  disordered metals",4.091647093711683e-06,7.4260550565674335e-09,1.0,1.0
cond-mat/9804017,"Small Window Overlaps Are Effective Probes of Replica Symmetry Breaking
  in 3D Spin Glasses",4.091485917159071e-06,0.0,7.0,1.0
cond-mat/0502314,"Numerical study of the 6-vertex model with domain wall boundary
  conditions",4.087541985246875e-06,1.990182755160072e-06,6.0,1.0
cond-mat/0506301,Nonextensive aspects of small-world networks,4.085098475079258e-06,1.047073762976008e-05,3.0,6.0
cond-mat/0508723,Message passing algorithms for non-linear nodes and data compression,4.083176067329934e-06,3.996207761107488e-06,2.0,3.0
cond-mat/0206075,"Finite Size Scaling analysis of the avalanches in the 3d Gaussian Random
  Field Ising Model with metastable dynamics",4.082946664796544e-06,0.0,2.0,0.0
cond-mat/0403754,"Spanning avalanches in the three-dimensional Gaussian Random Field Ising
  Model with metastable dynamics: field dependence and geometrical properties",4.082946664796544e-06,0.0,2.0,3.0
cond-mat/0309488,Defining and identifying communities in networks,4.0823836317670185e-06,5.374981214119021e-06,7.0,9.0
cond-mat/0509386,Insulating state of granular superconductors in a strong-coupling regime,4.079392053477547e-06,0.0,2.0,2.0
