id,title,pagerank,betweenness,in_degree,out_degree
cond-mat/0412158,"What do we learn from the shape of the dynamical susceptibility of
  glass-formers?",9.921558501542904e-06,1.772342073289272e-05,7.0,6.0
cond-mat/0005270,"Numerical study of disorder effects on the three-dimensional Hubbard
  model",9.919845924026056e-06,0.0,4.0,0.0
cond-mat/0407031,Absence of an Almeida-Thouless line in Three-Dimensional Spin Glasses,9.904751445440712e-06,9.325886512203994e-06,8.0,4.0
cond-mat/0403346,"Complex Networks, Simple Vision",9.891142478657813e-06,4.0784337612261e-06,7.0,6.0
cond-mat/0404658,"Slowly evolving random graphs II: Adaptive geometry in
  finite-connectivity Hopfield models",9.865572355005802e-06,0.0,4.0,0.0
cond-mat/9904168,The Superconductor-Insulator Transition in 2D,9.855476295726592e-06,0.0,3.0,2.0
cond-mat/0602300,"Localization of electronic states in amorphous materials: recursive
  Green's function method and the metal-insulator transition at E<>0",9.758583565774622e-06,0.0,12.0,1.0
cond-mat/0403122,Anderson Localization in Euclidean Random Matrices,9.75588634903482e-06,1.990182755160072e-06,1.0,2.0
cond-mat/0606584,"On Irregular Interconnect Fabrics for Self-Assembled Nanoscale
  Electronics",9.74124413237002e-06,7.4260550565674335e-09,3.0,1.0
cond-mat/0212070,Energy exponents and corrections to scaling in Ising spin glasses,9.66376932569152e-06,3.864795069863314e-05,12.0,11.0
cond-mat/0603290,"Probing tails of energy distributions using importance-sampling in the
  disorder with a guiding function",9.619901125574329e-06,0.0,4.0,0.0
cond-mat/0606747,Bounds on the shear load of cohesionless granular matter,9.60068093542824e-06,0.0,4.0,0.0
cond-mat/9809268,Computer Simulations of Supercooled Liquids and Glasses,9.541648855989784e-06,0.0,13.0,2.0
cond-mat/0003032,Metal-insulator transition in 2D: resistance in the critical region,9.525048496405643e-06,0.0,11.0,11.0
cond-mat/0512022,Genetic attack on neural cryptography,9.518435951709912e-06,0.0,11.0,1.0
cond-mat/0208100,Local excitations of a spin glass in a magnetic field,9.484897406589704e-06,2.498867526534941e-06,6.0,5.0
cond-mat/9812430,"Effect of disorder on quantum phase transitions in anisotropic XY spin
  chains in a transverse field",9.47746643056682e-06,3.980365510320144e-06,11.0,1.0
cond-mat/0702610,The Phase Diagram of 1-in-3 Satisfiability Problem,9.436112852260498e-06,0.0,2.0,0.0
cond-mat/0403194,"Impact of network structure on the capacity of wireless multihop ad hoc
  communication",9.433680667003446e-06,1.990182755160072e-06,2.0,1.0
cond-mat/0510727,Surface criticality in random field magnets,9.409700616393403e-06,0.0,1.0,0.0
cond-mat/0311657,"Ground-state energy and frustration of the Sherrington-Kirkpatrick model
  and related models",9.39742744141324e-06,8.902002605675436e-06,6.0,2.0
cond-mat/0610857,Local fluctuations in the aging of a simple glass,9.396453296905387e-06,0.0,12.0,1.0
cond-mat/0603534,Damped Soft Phonons and Diffuse Scattering in 40PMN-60PT,9.379002847531143e-06,0.0,4.0,0.0
cond-mat/0004407,Random networks created by biological evolution,9.373335874308709e-06,0.0,13.0,5.0
cond-mat/9910181,Random Defect Lines in Conformal Minimal Models,9.372581646214263e-06,6.011058272096137e-06,10.0,3.0
cond-mat/0209350,"Off-equilibrium fluctuation-dissipation relations in the 3d Ising Spin
  Glass in a magnetic field",9.326545600975196e-06,0.0009704368747922,10.0,2.0
cond-mat/0012222,The Quantum Spherical p-Spin-Glass Model,9.308768347943691e-06,0.0,8.0,2.0
cond-mat/0406345,Rejuvenation and Memory in model Spin Glasses in 3 and 4 dimensions,9.305133690330678e-06,1.0647524872375124e-05,5.0,4.0
quant-ph/0607053,Error-Resistant Distributed Quantum Computation in Trapped Ion Chain,9.293926181374205e-06,2.1525016788268648e-06,18.0,2.0
cond-mat/0703017,"On the critical weight statistics of the Random Energy Model and of the
  Directed Polymer on the Cayley Tree",9.28431954934924e-06,0.0,2.0,0.0
cond-mat/0509042,Fluctuation-dissipation relations for complex networks,9.281779909090991e-06,0.0,5.0,0.0
cond-mat/0210489,Magnetic field chaos in the SK Model,9.279326675973226e-06,1.7021986169993555e-05,8.0,4.0
cond-mat/0106603,"Localization properties of two interacting particles in a quasi-periodic
  potential with a metal-insulator transition",9.276036862901568e-06,0.0,10.0,3.0
cond-mat/0508755,Glassy phases in layered Ising magnets with random interlayer exchange,9.259072109530628e-06,1.990182755160072e-06,5.0,1.0
cond-mat/0501730,Computer Simulations of Opinions,9.245590601984551e-06,4.717622868067108e-06,7.0,5.0
cond-mat/0612502,Network Structure Revealed by Short Cycles,9.212760192461452e-06,0.0,8.0,0.0
cond-mat/0611416,"Ensemble averaged coherent state path integral for disordered bosons
  with a repulsive interaction (Derivation of mean field equations)",9.17889524184956e-06,0.0,2.0,1.0
cond-mat/0308422,"On the thermodynamics of first-order phase transition smeared by frozen
  disorder",9.154717348692513e-06,5.10541285139011e-09,5.0,1.0
cond-mat/0508108,Time scale for the onset of Fickian diffusion in supercooled liquids,9.153072061909928e-06,4.856102926720945e-07,4.0,1.0
cond-mat/0107424,Mean-field glassy phase of the random field Ising model,9.138093868745989e-06,0.0,6.0,0.0
cond-mat/0305538,Crossover from entropic to thermal dynamics in glassy models,9.093668025555204e-06,3.7130275282837164e-09,6.0,1.0
cond-mat/0406575,Perturbation: the Catastrophe Causer in Scale-Free Networks,9.089172603405947e-06,5.68768307741642e-09,6.0,1.0
cond-mat/0107151,"Multiparticle ring exchange in the Wigner glass and its possible
  relevance to strongly interacting two-dimensional electron systems in the
  presence of disorder",9.080813686174569e-06,5.50137387645857e-06,6.0,1.0
cond-mat/0506209,Universality-class dependence of energy distributions in spin glasses,9.061808338308642e-06,5.670427080704227e-07,3.0,1.0
cond-mat/0403706,Memory effects in classical and quantum mean-field disordered models,9.058578779799338e-06,0.0,6.0,0.0
cond-mat/9701016,Numerical Simulations of Spin Glass Systems,9.049235151352964e-06,0.0,15.0,23.0
cond-mat/0207071,Ultrametricity Between States at Different Temperatures in Spin-Glasses,9.022035218847256e-06,4.5146860294659584e-08,7.0,1.0
cond-mat/0306029,Interaction-induced magnetoresistance in a two-dimensional electron gas,8.988047190669808e-06,7.960731020640288e-06,5.0,1.0
cond-mat/0303453,"A consequence of local equilibration and heterogeneity in glassy
  materials",8.924716269302972e-06,3.980365510320144e-06,6.0,3.0
cond-mat/0612505,"Minimal Model for Disorder-induced Missing Moment of Inertia in Solid
  $^4$He",8.924546195652706e-06,0.0,4.0,2.0
cond-mat/9710315,Absence of Localization in Certain Field Effect Transistors,8.909476441380857e-06,0.0,17.0,1.0
cond-mat/0108225,Glassy dynamics in granular compaction: sand on random graphs,8.868626102767886e-06,2.8331844026672897e-05,6.0,6.0
cond-mat/0612086,Non-linear susceptibilities of spherical models,8.859578263351007e-06,0.0,6.0,0.0
cond-mat/0601455,"Statistical Properties of Functionals of the Paths of a Particle
  Diffusing in a One-Dimensional Random Potential",8.840833597864095e-06,0.0,3.0,0.0
cond-mat/9905248,"Fluctuations, response and aging dynamics in a simple glass-forming
  liquid out of equilibrium",8.835728251238032e-06,1.9284165675500154e-05,8.0,6.0
cond-mat/0410146,Ageing and dynamical scaling in the critical Ising spin glass,8.827713180259535e-06,0.0,1.0,1.0
nlin/0702024,Advective collisions,8.827562513332386e-06,0.0,2.0,0.0
cond-mat/0206239,"Rigorous decimation-based construction of ground pure states for spin
  glass models on random lattices",8.819681119556779e-06,0.0001073190115678,4.0,11.0
cond-mat/0512296,Two Lectures on Iterative Coding and Statistical Mechanics,8.800533029472781e-06,0.0,3.0,0.0
cond-mat/0212486,"Neural Networks, Game Theory and Time Series Generation",8.755566468421563e-06,0.0,9.0,0.0
cond-mat/0203404,"Impurity-Semiconductor Band Hybridization Effects on the Critical
  Temperature of Diluted Magnetic Semiconductors",8.755172770524356e-06,3.5554219662128566e-05,7.0,4.0
cond-mat/0404018,Analytic solution of attractor neural networks on scale-free graphs,8.75401551564467e-06,1.9827567001035044e-06,6.0,1.0
nlin/0502055,"Sufficient Conditions for Fast Switching Synchronization in Time Varying
  Network Topologies",8.731977405795529e-06,0.0,8.0,0.0
cond-mat/0703369,"Comment on ``Spin-glass transition of the three-dimensional Heisenberg
  spin glass''",8.731895430494529e-06,0.0,1.0,1.0
q-bio/0502005,Cliques and duplication-divergence network growth,8.701130740940533e-06,0.0,8.0,0.0
cond-mat/0512678,"Transport properties of 2D-electron gas in a n-InGaAs/GaAs DQW in a
  vicinity of low magnetic-field-induced Hall insulator--quantum Hall liquid
  transition",8.690776677342933e-06,3.980365510320144e-06,4.0,1.0
cond-mat/0006045,"Inherent structures and non-equilibrium dynamics of 1D constrained
  kinetic models: a comparison study",8.68054414897009e-06,1.617282435116145e-06,5.0,4.0
physics/0009032,Information theory and learning: a physical approach,8.669252579238984e-06,0.0,18.0,2.0
cond-mat/0401018,Reinforcing the Resilience of Complex Networks,8.645517393398944e-06,0.0,10.0,0.0
cond-mat/0307592,Three dimensional resonating valence bond liquids and their excitations,8.642506871754924e-06,6.275044515091219e-05,9.0,4.0
cond-mat/0610821,"Numerical Calculation of the Functional renormalization group
  fixed-point functions at the depinning transition",8.616774379596407e-06,3.0015514453388466e-08,7.0,2.0
cond-mat/0302296,On network bipartivity,8.583841808708555e-06,2.9704220226269734e-08,7.0,1.0
cond-mat/0102285,"Self generated randomness, defect wandering and viscous flow in stripe
  glasses",8.580343539630216e-06,5.0732803920831695e-06,4.0,2.0
cond-mat/0012070,"Reply to the Comment on `Glassy Transition in a Disordered Model for the
  RNA Secondary Structure'",8.573993518761223e-06,0.0,4.0,0.0
gr-qc/0308089,Scale Free Small World Networks and the Structure of Quantum Space-Time,8.55196148310876e-06,2.1474592403739864e-06,10.0,3.0
cond-mat/0610661,"Density matrix renormalization on random graphs and the quantum
  spin-glass transition",8.546868788398191e-06,3.200485106291746e-06,2.0,2.0
cond-mat/0102257,Continuum time limit and stationary states of the Minority Game,8.520427614450385e-06,4.028634868187833e-06,20.0,8.0
cond-mat/0210708,"A survey of rigorous results on random Schroedinger operators for
  amorphous solids",8.514781206969677e-06,0.0,6.0,3.0
cond-mat/0311535,On large deviation properties of Erdos-Renyi random graphs,8.477911437960753e-06,0.0,3.0,2.0
cond-mat/0402036,Low-temperature behavior of two-dimensional Gaussian Ising spin glasses,8.445769729125666e-06,1.2290909663228916e-05,2.0,4.0
cond-mat/0210132,Managing catastrophic changes in a collective,8.419459361182768e-06,0.0,3.0,0.0
cond-mat/0102248,"Aging effects and dynamic scaling in the 3d Edwards-Anderson spin
  glasses: a comparison with experiments",8.406460222394825e-06,1.0300173077766616e-05,9.0,2.0
cond-mat/0403416,Approximating satisfiability transition by suppressing fluctuations,8.399113747662967e-06,3.980365510320144e-06,3.0,2.0
cond-mat/0107134,"Equilibrium Distribution of the Inherent States and their Dynamics in
  Glassy Systems and Granular Media",8.373849040611891e-06,2.611103266352136e-06,5.0,2.0
cond-mat/0107489,"The three-dimensional random field Ising magnet: interfaces, scaling,
  and the nature of states",8.363278240421772e-06,3.1265468565850304e-05,5.0,6.0
astro-ph/0407201,Eyes Wide Open - Optimising Cosmological Surveys in a Crowded Market,8.35419916099134e-06,3.5790969533790367e-06,19.0,5.0
cond-mat/0304576,Energetics of clusters in the two-dimensional Ising spin glass,8.348504250597983e-06,8.443424599317171e-06,18.0,2.0
cond-mat/0607411,"Probing the tails of the ground state energy distribution for the
  directed polymer in a random medium of dimension $d=1,2,3$ via a Monte-Carlo
  procedure in the disorder",8.336776826625297e-06,0.0,5.0,0.0
cond-mat/0508586,"Survey propagation at finite temperature: application to a Sourlas code
  as a toy model",8.320589546158597e-06,0.0,9.0,0.0
cond-mat/0312046,O(N) algorithms for disordered systems,8.320380508892744e-06,0.0,7.0,1.0
cond-mat/0303260,"Anomalous force diffusion in nearly-ordered packings of frictionless
  discs",8.320336959360071e-06,0.0,5.0,0.0
cond-mat/0003287,On the Energy Minima of the SK Model,8.216138022922414e-06,0.0010090026146345,13.0,2.0
cond-mat/0409323,Finite-size effects and intermittency in a simple aging system,8.171763819696603e-06,1.990182755160072e-06,9.0,1.0
cond-mat/0007372,"Glassiness and constrained dynamics of a short-range non-disordered spin
  model",8.139011536433895e-06,2.385750846263147e-06,7.0,3.0
cond-mat/0111397,Mesoscopic Coulomb Drag,8.134374558677189e-06,0.0,6.0,0.0
cond-mat/0012497,The waiting-time distribution of LIFFE bond futures,8.13237648989176e-06,2.22781651697023e-08,1.0,3.0
cond-mat/0503012,Temperature Cycles in the Heisenberg Spin Glass,8.130253469649888e-06,0.0,6.0,2.0
cond-mat/0701349,"Griffiths singularities and algebraic order in the exact solution of an
  Ising model on a fractal modular network",8.113292256613824e-06,0.0,5.0,0.0
cond-mat/0410676,"Aging dynamics across a dynamic Almeida-Thouless line in three
  dimensional short-range Issuing spin glass
  Cu$_{0.5}$Co$_{0.5}$Cl$_{2}$-FeCl$_{3}$ graphite bi-intercalation compound",8.106264430255082e-06,0.0,2.0,0.0
cond-mat/0505575,"Transitions in collective response in multi-agent models of competing
  populations driven by resource level",8.102639184851123e-06,0.0,4.0,0.0
cond-mat/0205226,"Universal Behavior of the Resistance Noise across the Metal-Insulator
  Transition in Silicon Inversion Layers",8.06555163531981e-06,8.84960432544885e-06,4.0,3.0
cond-mat/0603266,"Study of the phase transition in the 3d Ising spin glass from out of
  equilibrium numerical simulations",8.04849083646188e-06,0.0,3.0,0.0
physics/0504033,Strong correlations between text quality and complex networks features,8.041222072624561e-06,0.0,6.0,0.0
cond-mat/0209256,Vibrational Modes in LiBC: Theory Compared with Experiment,8.020748357218077e-06,9.95091377580036e-07,3.0,2.0
cond-mat/0504241,Cycles and clustering in bipartite networks,8.006261112824351e-06,2.0215478565172733e-06,6.0,3.0
cond-mat/0702396,"Ising model S=1, 3/2 and 2 on directed networks",8.005571004478953e-06,0.0,4.0,0.0
cond-mat/0201427,Spin Ice State in Frustrated Magnetic Pyrochlore Materials,7.966525096322919e-06,0.0,5.0,0.0
cond-mat/0501315,"2-loop Functional Renormalization for elastic manifolds pinned by
  disorder in N dimensions",7.944768209528558e-06,0.0,2.0,1.0
cond-mat/0304333,On the stochastic dynamics of disordered spin models,7.902232055195082e-06,6.068279734256335e-06,12.0,4.0
cond-mat/0501047,Influence of pore-scale disorder on viscous fingering during drainage,7.891905268412647e-06,0.0,1.0,0.0
quant-ph/0203010,Entangled Quantum Networks,7.883278302297784e-06,9.95091377580036e-06,4.0,3.0
cond-mat/0006360,Critical points in two-dimensional replica sigma models,7.778244612937169e-06,0.0001063463368264,18.0,8.0
cond-mat/0103428,Aging dynamics of quantum spin glasses of rotors,7.776490289691275e-06,0.0004725150155607,2.0,3.0
cond-mat/0305044,Aging dynamics of heterogeneous spin models,7.772293916587589e-06,4.950703371044955e-09,8.0,1.0
cond-mat/0111174,"Ising Spin Glasses : interaction distribution dependence of the critical
  exponents",7.749972863086799e-06,2.6049843048599776e-05,4.0,3.0
cond-mat/0005366,"Tricritical Points in the Sherrington-Kirkpatrick Model in the Presence
  of Discrete Random Fields",7.740413975381973e-06,0.0,4.0,0.0
cs/0609154,"Loop Calculus Helps to Improve Belief Propagation and Linear Programming
  Decodings of Low-Density-Parity-Check Codes",7.732841197175994e-06,7.960731020640288e-06,13.0,5.0
hep-th/0502125,Two-dimensional models,7.725478010757099e-06,0.0,2.0,1.0
cond-mat/0408264,"Epidemic spreading on undirected and directed scale-free networks with
  correlations",7.683053881664402e-06,0.0,2.0,0.0
cond-mat/0502035,Disorder driven phase transitions of the large q-state Potts model in 3d,7.662101773554484e-06,0.0,1.0,1.0
cond-mat/0602276,Condition numbers and scale free graphs,7.655517189312558e-06,0.0,2.0,0.0
cond-mat/0601332,Random walks and polymers in the presence of quenched disorder,7.653411137716187e-06,2.620537197685092e-06,11.0,1.0
cond-mat/0503486,Reduction of Two-Dimensional Dilute Ising Spin Glasses,7.631825409156674e-06,0.0,1.0,1.0
cond-mat/0005102,"Two-dimensional Granular Gas of Inelastic Spheres with Multiplicative
  Driving",7.623326747395854e-06,0.0,7.0,0.0
cond-mat/0105474,"Non-universal scaling in a model of information transmission and herd
  behavior",7.611640360747066e-06,3.980365510320144e-06,1.0,3.0
cond-mat/0202473,Overlap Among States at Different Temperatures in the SK Model,7.603539197973901e-06,0.0001024770890046,8.0,12.0
cond-mat/9907126,Statistics of energy levels and eigenfunctions in disordered systems,7.588997972052934e-06,0.0,8.0,11.0
cond-mat/0608312,On Cavity Approximations for Graphical Models,7.57653639577291e-06,0.0,2.0,0.0
cond-mat/0212065,Loschmidt Echo and Lyapunov Exponent in a Quantum Disordered System,7.5751237736749475e-06,2.1897579848053216e-05,5.0,1.0
cond-mat/0612499,What makes a crystal supersolid ?,7.573368755023422e-06,0.0,9.0,1.0
cond-mat/9902305,Mean-field theory of strongly disordered superconductors,7.566036308730596e-06,0.0,2.0,1.0
cond-mat/0207605,On the Aizenman exponent in critical percolation,7.548802038679981e-06,0.0,14.0,0.0
cond-mat/0506780,"Exact Enumeration of Ground States in the Sherrington-Kirkpatrick Spin
  Glass",7.535815829648906e-06,0.0,2.0,1.0
cond-mat/0312432,Recent Progress in Spin Glasses,7.513571888150276e-06,3.40154430167258e-05,10.0,10.0
cond-mat/0509055,Synchronization in Complex Networks: a Reply on a recent Comment,7.512455198155269e-06,0.0,4.0,0.0
cond-mat/0701527,Entanglement entropy of aperiodic quantum spin chains,7.509862129683683e-06,5.948270100310514e-06,1.0,4.0
cond-mat/0611735,Random matrix analysis of network Laplacians,7.508547499191271e-06,3.995217620433279e-06,1.0,2.0
cond-mat/0005541,"Chaotic, memory and cooling rate effects in spin glasses: Is the
  Edwards-Anderson model a good spin glass?",7.503205251944778e-06,2.993883856427667e-05,14.0,11.0
cond-mat/0203134,Multifractality at the spin quantum Hall transition,7.492000349200315e-06,1.3196365936641471e-05,6.0,2.0
cond-mat/0702601,"Replica Symmetry Breaking Condition Exposed by Random Matrix Calculation
  of Landscape Complexity",7.482099521709301e-06,0.0,4.0,0.0
cond-mat/0507561,"Low density spin-polarized transport in 2D semiconductor structures: The
  enigma of temperature dependent magnetoresistance of Si MOSFETs in an
  in-plane applied magnetic field",7.482022350138698e-06,0.0,7.0,0.0
cond-mat/0108208,"Vibrational properties of amorphous silicon from tight-binding O(N)
  calculation",7.476557220674645e-06,0.0,1.0,0.0
cond-mat/0507197,The partially asymmetric zero range process with quenched disorder,7.467662403102185e-06,2.1489043186797275e-06,2.0,1.0
cond-mat/0610518,"Particle displacements in the elastic deformation of amorphous
  materials: local fluctuations vs. non-affine field",7.462671345737005e-06,0.0,1.0,1.0
cond-mat/0511283,"Effect of degree correlations on the loop structure of scale-free
  networks",7.42207179893711e-06,8.080898093373835e-08,1.0,1.0
cond-mat/0107318,Renormalization group for network models of Quantum Hall transitions,7.3870578010220174e-06,1.8466452342754317e-05,11.0,3.0
cond-mat/0502546,"Heat conduction in one dimensional systems: Fourier law, chaos, and heat
  control",7.362833690974784e-06,0.0,2.0,0.0
cond-mat/0302371,"Single spin- and chiral-glass transition in vector spin glasses in
  three-dimensions",7.360411981347324e-06,1.0720599267889686e-05,9.0,11.0
cond-mat/0310087,"Aging in Spin Glasses in three, four and infinite dimensions",7.341734822710363e-06,0.0,2.0,0.0
cond-mat/0607615,Overlap Fluctuations from Random Overlap Structures,7.341431140449908e-06,3.2553552663758246e-06,5.0,2.0
cond-mat/0106176,Droplets in Disordered Metallic Quantum Critical Systems,7.335785297561334e-06,4.733505159287824e-06,2.0,2.0
cs/0607080,New Model of Internet Topology Using k-shell Decomposition,7.319313424148455e-06,1.990182755160072e-06,3.0,1.0
cond-mat/0405139,"Monte Carlo study of the ordering of the weakly anisotropic Heisenberg
  spin glass in magnetic fields",7.307770073433778e-06,0.0,2.0,0.0
cond-mat/9801083,"Dual theory of the superfluid-Bose glass transition in disordered
  Bose-Hubbard model in one and two dimensions",7.290790621869284e-06,0.0,2.0,1.0
cond-mat/0602524,"Field-induced quantum disordered phases in S=1/2 weakly-coupled dimer
  systems with site dilution",7.271463645806207e-06,5.970548265480216e-06,3.0,2.0
cond-mat/0406354,Biology helps to construct weighted scale free networks,7.245466922543078e-06,0.0,3.0,1.0
cond-mat/9611168,Glass phase of two-dimensional triangular elastic lattices with disorder,7.244790182655557e-06,0.0,7.0,3.0
cond-mat/9906320,Dephasing in Disordered Conductors due to Fluctuating Electric Fields,7.242578395866874e-06,0.0,5.0,0.0
cond-mat/0609254,"Positive-Overlap Transition and Critical Exponents in Mean Field Spin
  Glasses",7.233002946038282e-06,0.0,2.0,0.0
cond-mat/0307713,Ground-state energy fluctuations in the Sherrington-Kirkpatrick model,7.224049696672339e-06,1.3015998893783337e-05,4.0,12.0
physics/0608091,"Anomalous fluctuations in Minority Games and related multi-agent models
  of financial markets",7.1924219236361785e-06,0.0,4.0,0.0
cond-mat/0511529,"Why one needs a functional renormalization group to survive in a
  disordered world",7.184901766508563e-06,0.0,9.0,0.0
cond-mat/0006211,Critical Behavior of the Three-Dimensional Ising Spin Glass,7.176470822124939e-06,0.0003919505825347,6.0,15.0
cond-mat/0612627,Gaussian excitations model for glass-former dynamics and thermodynamics,7.143543907033281e-06,1.990182755160072e-06,3.0,1.0
cond-mat/0612041,"Stability properties and probability distribution of multi-overlaps in
  dilute spin glasses",7.124298914828693e-06,0.0,3.0,0.0
cond-mat/0307499,The signal-to-noise analysis of the Little-Hopfield model revisited,7.102454136209839e-06,7.960731020640288e-06,3.0,3.0
quant-ph/0702252,Convergence of Quantum Annealing with Real-Time Schrodinger Dynamics,7.101218764658724e-06,0.0,3.0,0.0
cond-mat/0407148,"Localization Properties of Electronic States in Polaron Model of
  poly(dG)-poly(dC) and poly(dA)-poly(dT) DNA polymers",7.095127502266564e-06,0.0,4.0,2.0
cond-mat/0302544,Connectivity Distribution of Spatial Networks,7.091575935056103e-06,1.991667966171385e-06,7.0,2.0
cond-mat/0410595,"The onset of jamming as the sudden emergence of an infinite $k$-core
  cluster",7.076016813040007e-06,0.0,6.0,11.0
cond-mat/9809357,"Phase diagram and validity of one-parameter scaling near the
  two-dimensional metal-insulator transition",7.073634241749689e-06,0.0,5.0,4.0
cond-mat/0606312,"Strong disorder fixed points in the two-dimensional random-bond Ising
  model",7.051599067475583e-06,0.0,5.0,0.0
cond-mat/0411374,Neural cryptography with queries,7.0288294445819184e-06,0.0,10.0,2.0
cond-mat/0702243,"Dissipation peak as an indicator of sample inhomogeneity in solid $^4$He
  oscillator experiments",7.028626210427464e-06,0.0,2.0,0.0
cond-mat/0610525,"How to measure Functional RG fixed-point functions for dynamics and at
  depinning",7.018631526478769e-06,9.740243600938636e-08,4.0,2.0
cond-mat/0202479,Colored minority games,7.010580562874252e-06,3.7130275282837164e-09,10.0,1.0
cond-mat/0501663,Clustering and Synchronization of Oscillator Networks,7.008483909968701e-06,2.1535559664045558e-08,6.0,2.0
cond-mat/0206316,"Temperature chaos in a replica symmetry broken spin glass model - A
  hierarchical model with temperature chaos -",7.007254935927375e-06,8.17702402780112e-06,5.0,3.0
cond-mat/0507490,Non-equilibrium relaxation of an elastic string in a random potential,6.99837563337327e-06,0.0,4.0,0.0
cond-mat/0410230,Strength distribution in gradient networks,6.997653781772332e-06,0.0,7.0,1.0
cond-mat/9702241,"Two interacting particles in a random potential: The random matrix model
  revisited",6.992961449917026e-06,0.0,2.0,5.0
cond-mat/0503437,Dynamics of disordered elastic systems,6.98011600643417e-06,0.0,6.0,0.0
cond-mat/0003282,Equilibrating Glassy Systems with Parallel Tempering,6.966931931368492e-06,0.0,2.0,2.0
cond-mat/0412007,"Exact calculation of the energy contributions to the T=0 random-field
  Ising model with metastable dynamics on the Bethe lattice",6.941111385955181e-06,0.0,3.0,0.0
cond-mat/0612303,"Response of Complex Systems to Complex Perturbations: the Complexity
  Matching Effect",6.894796304671696e-06,0.0,2.0,1.0
cond-mat/0605691,"Magnetic disorder and dynamical properties of a Bose-Einstein condensate
  in atomic waveguides",6.870197176383204e-06,0.0,5.0,0.0
cond-mat/0102384,Dynamics of the Time Horizon Minority Game,6.867813392766497e-06,1.325550827597284e-06,8.0,3.0
cond-mat/0511433,"Gel to glass transition in simulation of a valence-limited colloidal
  system",6.844887704323073e-06,1.990182755160072e-06,3.0,1.0
cond-mat/0404742,"Asymmetrically extremely dilute neural networks with non-trivial
  dynamics",6.831319948868569e-06,0.0,1.0,0.0
cond-mat/0104322,"The relaxation dynamics of a viscous silica melt: II The intermediate
  scattering functions",6.825864213075504e-06,0.0,2.0,1.0
cond-mat/0202044,"Elementary explanation of the inexistence of decoherence at zero
  temperature for systems with purely elastic scattering",6.819223288772889e-06,0.0,7.0,16.0
