id,title,pagerank,betweenness,in_degree,out_degree
cs/0702011,Dealing With Logical Omniscience: Expressiveness and Pragmatics,,,,
cs/0702027,"The Suspension Calculus and its Relationship to Other Explicit
  Treatments of Substitution in Lambda Calculi",,,,
cs/0702040,Polygraphs for termination of left-linear term rewriting systems,,,,
cs/0702069,Feasible reactivity in a synchronous pi-calculus,,,,
cs/0702089,"Mapping the Object-Role Modeling language ORM2 into Description Logic
  language DLRifd",,,,
cs/0702120,"On the decidability and complexity of Metric Temporal Logic over finite
  words",,,,
cs/0702169,Bistable Biorders: A Sequential Domain Theory,,,,
cs/0702171,How Overlap Determines the Macronuclear Genes in Ciliates,,,,
cs/0703007,Intensional properties of polygraphs,,,,
cs/0703018,A Coding Theoretic Study on MLL proof nets,,,,
cs/0703039,Transforming structures by set interpretations,,,,
cs/0703051,An ExpTime Procedure for Description Logic $\mathcal{ALCQI}$ (Draft),,,,
cs/0703064,Automatic Structures: Richness and Limitations,,,,
cs/0703079,"Automata with Nested Pebbles Capture First-Order Logic with Transitive
  Closure",,,,
cs/0703098,Polynomial time algorithm for 3-SAT. Examples of use,,,,
cs/0703146,A Polynomial Time Algorithm for SAT,,,,
cs/9808005,First-Order Conditional Logic Revisited,,,,
cs/9808006,Set-Theoretic Completeness for Epistemic and Conditional Logic,,,,
cs/9808007,Plausibility Measures and Default Reasoning,,,,
cs/9809003,Common knowledge revisited,,,,
cs/9809008,"Comparing the expressive power of the Synchronous and the Asynchronous
  pi-calculus",,,,
cs/9809013,Reasoning about Noisy Sensors and Effectors in the Situation Calculus,,,,
cs/9809014,Uniform Provability in Classical Logic,,,,
cs/9809015,"Correspondences between Classical, Intuitionistic and Uniform
  Provability",,,,
cs/9809120,"A Natural Deduction style proof system for propositional $\mu$-calculus
  and its formalization in inductive type theories",,,,
cs/9810008,Axiomatizing Flat Iteration,,,,
cs/9811012,"Deriving Abstract Semantics for Forward Analysis of Normal Logic
  Programs",,,,
cs/9811017,Formulas as Programs,,,,
cs/9812019,Symmetries and transitions of bounded Turing machines,,,,
cs/9901003,Fixpoint 3-valued semantics for autoepistemic logic,,,,
cs/9901012,Extremal problems in logic programming and stable model computation,,,,
cs/9901016,Representation Theory for Default Logic,,,,
cs/9902026,Probabilistic Inductive Inference:a Survey,,,,
cs/9903006,Designing SAT for HCP,,,,
cs/9903007,Some Remarks on the Geometry of Grammar,,,,
cs/9906007,MSO definable string transductions and two-way finite state transducers,,,,
cs/9906010,Predicate Logic with Definitions,,,,
cs/9906013,Combining Inclusion Polymorphism and Parametric Polymorphism,,,,
cs/9907014,"No information can be conveyed by certain events: The case of the clever
  widows of Fornicalia and the Stobon Oracle",,,,
cs/9907022,Weak length induction and slow growing depth boolean circuits,,,,
cs/9907027,"The Alma Project, or How First-Order Logic Can Help Us in Imperative
  Programming",,,,
cs/9909014,Reasoning About Common Knowledge with Infinitely Many Agents,,,,
cs/9909019,Knowledge in Multi-Agent Systems: Initial Configurations and Broadcast,,,,
cs/9910012,The Complexity of Temporal Logic over the Reals,,,,
cs/9910014,"Processor Verification Using Efficient Reductions of the Logic of
  Uninterpreted Functions to Propositional Logic",,,,
cs/9911014,The Complexity of Poor Man's Logic,,,,
math/0310175,"Defining Homomorphisms and Other Generalized Morphisms of Fuzzy
  Relations in Monoidal Fuzzy Logics by Means of BK-Products",,,,
math/0312422,"\Sigma\Pi-polycategories, additive linear logic, and process semantics",,,,
math/0502024,The maximum entropy state,,,,
math/0503453,Weakly complete axiomatization of exogenous quantum propositional logic,,,,
math/0505418,Internalising modified realisability in constructive type theory,,,,
math/0509248,"Deterministic modal Bayesian Logic: derive the Bayesian within the modal
  logic T",,,,
math/0512110,Computably Based Locally Compact Spaces,,,,
math/0602053,Towards a Definition of an Algorithm,,,,
math/0602493,The dimension of a variety,,,,
math/0608116,Conflict Free Rule for Combining Evidences,,,,
math/0612083,Termination orders for 3-dimensional rewriting,,,,
math/0612084,Termination orders for 3-polygraphs,,,,
math/0612088,Two polygraphic presentations of Petri nets,,,,
math/0612089,The three dimensions of proofs,,,,
math/0701801,"Deterministic modal Bayesian Logic: derive the Bayesian inference within
  the modal logic T",,,,
math/0701904,Noncomputable Spectral Sets,,,,
math/0702334,An Example of Pi^0_3-complete Infinitary Rational Relation,,,,
math/0703713,The logic of message passing,,,,
math/9411236,On finite rigid structures,,,,
math/9705225,Choiceless polynomial time,,,,
math/9807179,Polynomial time logic: Inability to express,,,,
