id,title,pagerank,betweenness,in_degree,out_degree
hep-th/0406154,Characters of the Positive Energy UIRs of D=4 Conformal Supersymmetry,8.552356830671533e-05,6.390478327083199e-05,122.0,6.0
math/0702746,A brief review of abelian categorifications,6.418038273245115e-05,0.0,21.0,0.0
math/0608248,"Rational R-matrices, centralizer algebras and tensor identities for e_6
  and e_7 exceptional families of Lie algebras",3.870021028921484e-05,0.0,7.0,0.0
hep-th/0606196,"Logarithmic extensions of minimal models: characters and modular
  transformations",3.663440109544448e-05,8.409073700616251e-07,33.0,1.0
math/0612798,Gaudin models with irregular singularities,3.512711688220464e-05,0.0,14.0,0.0
hep-th/0503040,"Infinite-dimensional representations of the rotation group and Dirac's
  monopole problem",3.346501018852585e-05,2.704794259531393e-07,23.0,1.0
math/0607527,On minimal affinizations of representations of quantum groups,3.071410530336129e-05,1.933967360044692e-06,6.0,1.0
math/0701557,Cluster structures for 2-Calabi-Yau categories and unipotent groups,3.03225781655286e-05,0.0004769961561282,16.0,5.0
math/0111055,Regularity of certain vertex operator algebras with two generators,2.680026842028459e-05,0.0,3.0,0.0
hep-th/0702152,"Invariant Differential Operators for Non-Compact Lie Groups: Parabolic
  Subalgebras",2.628704521895048e-05,0.0,11.0,0.0
math/0610594,Acyclic Calabi-Yau categories,2.5996355697033334e-05,0.0004750364612128,20.0,4.0
math/0403258,Representation theory for dilute lattice models,2.595977319238769e-05,5.8990523934204495e-08,3.0,1.0
hep-th/0402039,"Positive Energy Unitary Irreducible Representations of the Superalgebras
  osp(1|2n,R)",2.5177788667131384e-05,1.4247533122809636e-05,89.0,3.0
math/0610084,Fermionic forms and quiver varieties,2.3074619894328397e-05,0.0,14.0,0.0
math/0607155,Generalized cluster complexes via quiver representations,2.2799673663493306e-05,1.230872675452977e-07,9.0,3.0
math/0508003,Representations of shifted Yangians and finite W-algebras,2.1947696480957707e-05,2.350423412094981e-05,32.0,9.0
math/0501365,Mirkovic-Vilonen cycles and polytopes,2.10884159604408e-05,9.938728429430892e-06,15.0,3.0
hep-th/0512354,Invariant Differential Operators and Characters of the AdS_4 Algebra,2.0319963176639394e-05,1.2879005894716357e-06,26.0,2.0
math/0607736,Mutation in triangulated categories and rigid Cohen-Macaulay modules,2.025148323898837e-05,3.1366904805120765e-06,10.0,6.0
math/0402409,Martingales and character ratios,1.915065999247004e-05,0.0,5.0,1.0
math/0606631,Twisting Derived Equivalences,1.9103110025057092e-05,0.0,14.0,0.0
math/0703540,Cluster characters for triangulated 2-Calabi--Yau categories,1.843203254618236e-05,0.0,13.0,1.0
math-ph/0602046,Computation of Invariants of Lie Algebras by Means of Moving Frames,1.8351910097175394e-05,3.980365510320144e-06,8.0,2.0
math/0610512,A geometric description of the m-cluster categories of type D_n,1.8057700120567644e-05,7.631197814102649e-07,7.0,1.0
cs/0703059,Geometry and the complexity of matrix multiplication,1.8002094679962426e-05,0.0,6.0,0.0
math/0504600,Representations of rational Cherednik algebras,1.704940138130407e-05,2.7040827628867025e-06,16.0,2.0
math/0606380,Argument Shift Method and Gaudin Model,1.6442360677406093e-05,6.27765528374893e-07,9.0,3.0
quant-ph/0212101,p-Mechanics as a Physical Theory. An Introduction,1.6319663932805748e-05,2.504409541883486e-06,14.0,6.0
math/0503315,Combinatorics and Geometry of Higher Level Weyl Modules,1.6234353143845164e-05,0.0,18.0,6.0
math-ph/0409075,Markov processes on partitions,1.6226714939402497e-05,8.00281823967657e-06,28.0,2.0
math/0703338,The two-boundary Temperley-Lieb algebra,1.5793358267970198e-05,0.0,25.0,0.0
math/9905005,"Raising operators for the Whittaker wave functions of the Toda chain and
  intertwining operators",1.557915309010076e-05,0.0,19.0,0.0
math/0606506,"Kazhdan--Lusztig-dual quantum group for logarithmic extensions of
  Virasoro minimal models",1.5380290056911417e-05,8.795159696331325e-07,13.0,3.0
math/0607622,The supercuspidal representations of p-adic classical groups,1.5140027298816432e-05,0.0,4.0,1.0
math/0612733,"Towards a combinatorial representation theory for the rational Cherednik
  algebra of type G(r,p,n)",1.5027485182024128e-05,1.000752854149531e-06,4.0,2.0
math/0511489,"Harish-Chandra homomorphisms and symplectic reflection algebras for
  wreath-products",1.4761993082176534e-05,5.184113138037329e-06,15.0,2.0
hep-th/0205113,Finite-dimensional Lie algebras of order F,1.4753928311846932e-05,7.221157541003961e-06,30.0,9.0
math/0511548,Modular representations of Hecke algebras,1.4609986461575942e-05,7.4260550565674335e-09,6.0,2.0
math/0509077,"Rankin-Selberg without unfolding and bounds for spherical Fourier
  coefficients of Maass forms",1.444498849248415e-05,0.0,6.0,1.0
math/0506128,The Andrews-Stanley partition function and Al-Salam-Chihara polynomials,1.414176789928313e-05,1.1040962113742738e-05,5.0,2.0
math/0509276,"Weyl modules, Demazure modules, KR-modules, crystals, fusion products
  and limit constructions",1.3960008837321064e-05,1.2659117947225368e-05,16.0,13.0
hep-th/0612045,Z2 x Z2 graded superconformal algebra of parafermionic type,1.3691652715471856e-05,0.0,3.0,0.0
math/0607717,Centers of degenerate cyclotomic Hecke algebras and parabolic category O,1.3572315610201402e-05,2.439942489662597e-05,10.0,4.0
math/0702712,sl(2)-Trivial Deformations of Vect_{Pol}(R)-Modules of Symbols,1.3483599326819233e-05,0.0,8.0,0.0
math/0206298,The Deligne-Simpson problem -- a survey,1.3251041639074566e-05,0.0,9.0,2.0
math/0611391,Cartan matrices and presentations of Cunha and Elduque superalgebras,1.2898470260161513e-05,0.0,11.0,0.0
math/0408204,Minor summation formula and a proof of Stanley's open problem,1.282617681214381e-05,6.727501299228758e-06,6.0,4.0
math/0605136,Fomin-Zelevinsky mutation and tilting modules over Calabi-Yau algebras,1.2792531736054204e-05,0.0010126876711493,11.0,8.0
math/9806005,"Cross-projective representations of pairs of anticommutative algebras,
  alloys and finite-dimensional irreducible representations of some
  infinite-dimensional Lie algebras",1.2531507386004506e-05,0.0,3.0,0.0
math/0603231,Hochschild Cohomology and Graded Hecke Algebras,1.2484758565758575e-05,1.990182755160072e-06,6.0,1.0
math/0703568,"The product in the Hochschild cohomology ring of preprojective algebras
  of Dynkin quivers",1.2420439061849648e-05,0.0,4.0,0.0
math/0702797,The PBW filtration,1.2370921527119456e-05,0.0,3.0,0.0
hep-th/0402056,"On the Unitarity of D=9,10,11 Conformal Supersymmetry",1.2352258217317851e-05,3.4280443083163925e-06,20.0,2.0
math/0601184,"Sylvester-t' Hooft generators of sl(n) and sl(n|n), and relations
  between them",1.2165155444791077e-05,0.0,8.0,0.0
math/0606121,"A q-Analogue of the Centralizer Construction and Skew Representations of
  the Quantum Affine Algebra",1.2066620571743276e-05,0.0,14.0,0.0
math/0108005,"Matrix algebras converge to the sphere for quantum Gromov--Hausdorff
  distance",1.2064109247017616e-05,0.0001073349912812,34.0,17.0
math/0305419,Interpolation analogues of Schur Q-functions,1.2035872591342352e-05,5.940844045253946e-09,16.0,1.0
math/0608235,"Symmetric functions, parabolic category O and the Springer fiber",1.2032989983626109e-05,1.1628231027971145e-08,12.0,4.0
math/0502118,On the representation theory of braid groups,1.2029614474710089e-05,3.980365510320144e-06,4.0,3.0
math/0611617,Lectures on Hall algebras,1.1912658191027807e-05,0.0009436094030224,5.0,1.0
math/0611737,Del Pezzo surfaces and representation theory,1.1900107699557612e-05,0.0,3.0,0.0
hep-th/0602273,Algebraic approach to parafermionic conformal field theories,1.189245875653166e-05,3.9774311726823003e-08,12.0,1.0
math/0611899,Commuting differential operators with regular singularities,1.181264039819085e-05,0.0,1.0,1.0
math/0603660,Choosing roots of polynomials with symmetries smoothly,1.163268000218284e-05,0.0,6.0,0.0
math-ph/0606045,Invariants of Lie Algebras with Fixed Structure of Nilradicals,1.1611730167259728e-05,0.0,4.0,1.0
math/0512416,Erlangen Program at Large-1: Geometry of Invariants,1.1607504622489385e-05,2.8954104116237826e-06,11.0,3.0
math/0608264,A geometric model for cluster categories of type $D_n$,1.1572379504274986e-05,6.274954013918534e-09,19.0,1.0
math/0310284,"A functional model for the tensor product of level 1 highest and level
  -1 lowest modules for the quantum affine algebra U_q(sl_{2}^)",1.1571764819942836e-05,9.95091377580036e-07,5.0,1.0
hep-th/0412131,"Jordanian Quantum Deformations of D=4 Anti-de-Sitter and Poincare
  Superalgebras",1.1571092133741212e-05,4.656402424848528e-06,29.0,3.0
math/0703039,Cluster algebra structures and semicanonical bases for unipotent groups,1.1518415938904832e-05,0.0009480683320731,3.0,4.0
math/0605712,"Some Remarks Concerning Tilting Modules and Tilted Algebras. Origin.
  Relevance. Future. (An appendix to the Handbook of Tilting Theory)",1.1410643516981038e-05,0.0,20.0,0.0
math/0610873,Perfect Crystals for U_q(D_4^{(3)}),1.1324545126276217e-05,3.980365510320144e-06,8.0,2.0
math/0607173,Defining an m-cluster category,1.123047920132412e-05,5.0720181238835546e-08,4.0,3.0
math/0212112,Representations of Affine Quantum Function Algebras,1.1197658105060932e-05,0.0,5.0,0.0
math/0607091,Two dimensional current algebras and affine fusion product,1.1160723708208604e-05,9.896102417049504e-07,7.0,1.0
math/0702811,"Categorification of (induced) cell modules and the rough structure of
  generalized Verma modules",1.111051649922379e-05,7.4260550565674335e-09,10.0,1.0
math/0606082,"On refined enumerations of totally symmetric self-complementary plane
  partitions II",1.1049629095926294e-05,8.896543035437893e-07,9.0,1.0
math/0606579,Partitions of the wonderful group compactification,1.1048060694244964e-05,0.0,5.0,2.0
cond-mat/9912272,Exact Dynamics of the SU(K) Haldane-Shastry Model,1.0997032608046165e-05,0.0,7.0,0.0
math/0512043,An approach to non simply laced cluster algebras,1.0885725203458362e-05,0.0009469735261371,3.0,2.0
math/0612010,The cohomology of real De Concini-Procesi models of Coxeter type,1.078323537574098e-05,0.0,5.0,0.0
math/0508291,Stein's Method and Random Character Ratios,1.0684304170643132e-05,0.0,5.0,0.0
math/0509240,Special characters on star graphs and representations of $*$-algebras,1.0677845168923792e-05,0.0,3.0,1.0
math/0606523,"On category O for the rational Cherednik algebra of G(m,1,n): the almost
  semisimple case",1.064426420908895e-05,0.0,2.0,0.0
math/0601104,Canonical basic sets in type B,1.0591592772422086e-05,0.0,5.0,1.0
math-ph/0402064,Stochastic dynamics related to Plancherel measure on partitions,1.0522445808504838e-05,5.987946451612744e-06,11.0,5.0
math/0607170,"Cherednik, Hecke and quantum algebras as free Frobenius and Calabi-Yau
  extensions",1.0468309593802613e-05,4.537742799166441e-05,4.0,3.0
math/0611355,Moonshine for Rudvalis's sporadic group II,1.0453651780423673e-05,1.990182755160072e-06,3.0,1.0
math/0409333,Representation theory and random point processes,1.0445700269027795e-05,0.0,17.0,0.0
math/0311369,An introduction to harmonic analysis on the infinite symmetric group,1.037630735673718e-05,5.306732997069547e-07,24.0,4.0
math/0311210,"Rationality of the vertex operator algebra $V_L^+$ for a positive
  definite even lattice $L$",1.0354513196201289e-05,0.0,11.0,0.0
hep-th/0110020,Fractional Supersymmetry and F-fold Lie Superalgebras,1.0345543460539003e-05,1.6655017959510753e-06,25.0,3.0
math/0508398,"Two non-nilpotent linear transformations that satisfy the cubic
  $q$-Serre relations",1.0207082493801868e-05,3.029812484167034e-05,19.0,6.0
math/0610785,"Covers for self-dual supercuspidal representations of the Siegel Levi
  subgroup of classical p-adic groups",1.01947907405935e-05,0.0,1.0,1.0
math/0409262,"Almost-commuting variety, D-modules, and Cherednik Algebras",1.0178710722605327e-05,4.533332030734247e-06,6.0,9.0
math-ph/0512016,"On Graph-Theoretic Identifications of Adinkras, Supersymmetry
  Representations and Superfields",1.0159890490888112e-05,6.584241722492676e-06,16.0,5.0
math-ph/0111007,"Fredholm determinants, Jimbo-Miwa-Ueno tau-functions, and representation
  theory",1.0159585434371403e-05,2.482723058670678e-05,28.0,10.0
math/0509368,A category of modules for the full toroidal Lie algebra,1.0111548478774614e-05,0.0,3.0,1.0
math/0604379,Constructible Sheaves and the Fukaya Category,1.0056548067440466e-05,9.41805388483678e-07,10.0,1.0
math/0611534,Intertwining vertex operators and certain representations of sl(n)^,9.988640757868078e-06,0.0,9.0,0.0
math/0511706,Preprojective cluster variables of acyclic cluster algebras,9.946010515757628e-06,0.0009474559633828,11.0,2.0
math/0606725,Reidemeister numbers of saturated weakly branch groups,9.934606284275456e-06,0.0,8.0,1.0
math/0512311,Kazhdan-Lusztig combinatorics via sheaves on Bruhat graphs,9.91061265542074e-06,0.0,4.0,1.0
math/0611444,"On the Combinatorics of Crystal Graphs, II. The Crystal Commutator",9.770100341488492e-06,0.0,4.0,0.0
math/0507584,"The restricted Kirillov-Reshetikhin modules for the current and twisted
  current algebras",9.58347009696251e-06,0.0,7.0,3.0
math/0701823,Combinatorial invariants of algebraic Hamiltonian actions,9.574094755754784e-06,0.0,4.0,2.0
math/0612399,Microlocal branes are constructible sheaves,9.525879072041205e-06,4.704330974945032e-06,6.0,3.0
math/0702449,The bar derived category of a curved dg algebra,9.512763308600078e-06,0.0,3.0,0.0
math/0311405,"Virasoro Algebra, Dedekind $\eta$-function and Specialized Macdonald's
  Identities",9.499151418651794e-06,1.990182755160072e-06,3.0,1.0
math/0702081,"Logarithmic intertwining operators and W(2,2p-1)-algebras",9.449760945104078e-06,0.0,6.0,0.0
math/0609138,Partial flag varieties and preprojective algebras,9.359597266768029e-06,0.0,5.0,4.0
math/0606018,"Shellability and higher Cohen-Macaulay connectivity of generalized
  cluster complexes",9.186950733224505e-06,1.666623109914344e-05,11.0,4.0
math/0609006,Hochschild and cyclic homology of preprojective algebras of ADE quivers,9.085539724236715e-06,1.7054009179775916e-07,4.0,1.0
math/0502165,"Weyl, Fusion and Demazure modules for the current algebra of sl_{r+1}",9.080014635579184e-06,2.107114841693072e-05,17.0,11.0
math/0401409,"Instanton counting via affine Lie algebras I: Equivariant J-functions of
  (affine) flag manifolds and Whittaker vectors",9.06369729176724e-06,0.0,2.0,3.0
math/0509417,"Separating Functions, Spectral Graph Theory and Locally Scalar
  Representations in Hilbert Spaces",9.019898154865154e-06,0.0,1.0,1.0
math/0609082,Baxter Q-operator and Givental integral representation for C_n and D_n,9.007233127698471e-06,0.0,3.0,0.0
math/0505100,The algebra of Mirkovic-Vilonen cycles in type A,8.943626184942835e-06,0.0,5.0,1.0
math-ph/0601029,Gaussian transform of the Weil representation,8.896862062792245e-06,0.0,6.0,2.0
math/0603070,"A $\phi_{1,3}$-filtration of the Virasoro minimal series M(p,p') with
  1<p'/p< 2",8.86099300602907e-06,1.007998568511689e-06,7.0,2.0
math/0607038,"Parabolic Kazhdan-Lusztig polynomials, plethysm and gereralized
  Hall-Littlewood functions for classical types",8.818532402051467e-06,0.0,2.0,0.0
math/0610839,Alcove walks and nearby cycles on affine flag manifolds,8.73598595566217e-06,0.0,5.0,0.0
math/0404521,Cancellation in additively twisted sums on GL(n),8.727013478107884e-06,0.0,2.0,1.0
math/0505416,"Rational Cherednik algebras and diagonal coinvariants of G(m,p,n)",8.724354160938382e-06,3.550587465181828e-07,2.0,1.0
math/0612559,Computation of Weyl groups of G-varieties,8.706796009147175e-06,0.0,4.0,2.0
math/0604281,Kirillov--Reshetikhin modules associated to G_2,8.661165493005398e-06,3.00076855223065e-07,6.0,3.0
math/0604096,"A universal formula for representing Lie algebra generators as formal
  power series with coefficients in the Weyl algebra",8.648474959543259e-06,2.6521625202026543e-10,8.0,2.0
math-ph/0408061,Ramond sector of superconformal algebras via quantum reduction,8.640738953879415e-06,0.0,10.0,0.0
math/0612064,"Cyclotomic Birman--Wenzl--Murakami algebras, I: Freeness and realization
  as tangle algebras",8.545951837242617e-06,0.0,3.0,1.0
math/0612065,"Cyclotomic Birman--Wenzl--Murakami algebras, II: Admissibility Relations
  and Freeness",8.545951837242617e-06,0.0,3.0,1.0
math/0301183,"Character Formula for Infinite Dimensional Unitarizable Modules of the
  General Linear Superalgebra",8.536379087157052e-06,0.0,3.0,3.0
math/0701859,The hyperoctahedral quantum group,8.533651210383193e-06,2.0124609203297744e-06,4.0,2.0
math/0504143,Sur les representations de Krammer generiques,8.516242805367867e-06,8.955822398220324e-06,5.0,2.0
math/9905083,Algebraic aspects of increasing subsequences,8.446746496007995e-06,7.260389016105572e-06,7.0,27.0
math/0602112,Representations of toroidal extended affine Lie algebras,8.42575896894677e-06,0.0,3.0,1.0
math/0703543,Uniqueness property for spherical homogeneous spaces,8.396219769122828e-06,0.0,4.0,1.0
math/0512471,Cluster-tilted algebras are Gorenstein and stably Calabi-Yau,8.34232717391411e-06,0.0009499647274783,15.0,14.0
math/0610049,On symmetric invariants of centralisers in reductive Lie algebras,8.324570752839793e-06,5.970548265480216e-06,4.0,4.0
math/0604445,Noncommutative Counterparts of the Springer Resolution,8.28730839582594e-06,8.041491564832779e-06,19.0,6.0
math/0406380,"Mirror symmetry and Langlands duality in the non-Abelian Hodge theory of
  a curve",8.282832296620986e-06,0.0,12.0,1.0
math/0610799,A generalization of the Capelli identity,8.236771644506388e-06,0.0,4.0,0.0
math/0611055,Minimal length elements in some double cosets of Coxeter groups,8.192999385157623e-06,0.0,4.0,1.0
math/0601050,$\Out(F_n)$ and the spectral gap conjecture,8.07842363313878e-06,0.0,3.0,0.0
math/0403379,Toric degenerations of spherical varieties,8.069077162874557e-06,0.0,4.0,5.0
math/0109194,"Harmonic analysis on the infinite-dimensional unitary group and
  determinantal point processes",7.994469429877e-06,3.3062821267643874e-05,19.0,17.0
math/0604108,Seminormal forms and Gram determinants for cellular algebras,7.989874975663635e-06,0.0,4.0,0.0
hep-th/0602169,"Representations of the Lie Superalgebra gl(1|n) in a Gel'fand-Zetlin
  Basis and Wigner Quantum Oscillators",7.943771304868034e-06,0.0,1.0,0.0
math/0401173,"Moduli for decorated tuples of sheaves and representation spaces for
  quivers",7.912171925305452e-06,2.0058479088031416e-05,4.0,1.0
math/0610123,"Poisson geometry of the Grothendieck resolution of a complex semisimple
  group",7.837788840837154e-06,0.0,5.0,0.0
math/0011082,"Minuscule representations, invariant polynomials, and spectral covers",7.836331611924577e-06,1.990182755160072e-06,6.0,4.0
math/0309445,"Some continuous analogs of expansion in Jacobi polynomials and vector
  valued hypergeometric orthogonal bases",7.826285860409866e-06,3.980365510320144e-06,5.0,2.0
math/9802042,A generalization of Springer theory using nearby cycles,7.82324995062454e-06,0.0,2.0,1.0
math/0606499,Differential Calculi on Some Quantum Prehomogeneous Vector Spaces,7.82324995062454e-06,0.0,2.0,1.0
math/0403203,Representation rings of Lie superalgebras,7.784358941913151e-06,9.261008476452868e-07,9.0,3.0
math/0509469,Lie superalgebra structures in H*(g; g),7.750843815234427e-06,0.0,5.0,0.0
math-ph/0111008,Discrete gap probabilities and discrete Painleve equations,7.700010424684362e-06,3.186808188096894e-05,18.0,11.0
math/0605410,"Generalized graded Hecke algebra for complex reflection group of type
  G(r,1,n)",7.676442284729525e-06,2.4308798390832783e-06,1.0,2.0
math/0208156,"Spaces of coinvariants and fusion product II. Affine sl_2 character
  formulas in terms of Kostka polynomials",7.673407019917174e-06,3.00609422530568e-06,8.0,5.0
math/0211288,Yangians and their applications,7.639263078387617e-06,1.752075985641804e-05,7.0,7.0
math/0401437,"Fourier-Mukai transforms and semi-stable sheaves on nodal Weierstrass
  cubics",7.634850695940935e-06,1.1573490063146084e-07,14.0,3.0
math/0505619,Stabilization phenomena in Kac-Moody algebras and quiver varieties,7.622332506596909e-06,1.990182755160072e-06,2.0,1.0
math/0501112,"Gaussian fluctuations of characters of symmetric groups and of Young
  diagrams",7.618841975458628e-06,0.0,4.0,4.0
math/0611956,A cluster expansion formula ($A_n$ case),7.589113188011315e-06,0.0,7.0,0.0
math/0404307,Introduction to double Hecke algebras,7.568087701488865e-06,0.0,4.0,0.0
quant-ph/0609138,On the Impossibility of a Quantum Sieve Algorithm for Graph Isomorphism,7.522875854945386e-06,1.2291468952969955e-05,7.0,6.0
math/0107215,"Drinfeld-Sokolov reduction for quantum groups and deformations of
  W-algebras",7.514417398994658e-06,0.0,3.0,0.0
math/0606085,"Limits of BC-type orthogonal polynomials as the number of variables goes
  to infinity",7.451797421380246e-06,0.0,12.0,0.0
math/0605091,On Deformations and Contractions of Lie Algebras,7.431154332001428e-06,0.0,6.0,0.0
math/0405309,"LU factorizations, q=0 limits, and p-adic interpretations of some
  q-hypergeometric orthogonal polynomials",7.40119504379655e-06,0.0,9.0,4.0
math/0607251,"Crystal graphs of irreducible $U_v(\hat{sl}_e)$-modules of level two and
  Uglov bipartitions",7.379148427858157e-06,0.0,2.0,0.0
math/0608750,Invariants of quivers under the action of classical groups,7.266179153091092e-06,0.0,2.0,3.0
math/0406115,"Character sheaves on disconnected groups, VI",7.244232381118202e-06,0.0,2.0,0.0
math/0408120,Representation theory of 2-groups on finite dimensional 2-vector spaces,7.243396516303087e-06,2.218552852871616e-06,9.0,2.0
math/0602177,"Fusion products of Kirillov-Reshetikhin modules and fermionic
  multiplicity formulas",7.219713031775439e-06,0.0,5.0,4.0
math/0602068,"On refined enumerations of totally symmetric self-complementary plane
  partitions I",7.216481015700711e-06,1.1713853936143642e-06,12.0,2.0
math/0609279,On domino insertion and Kazhdan--Lusztig cells in type $B_n$,7.189122476006218e-06,0.0,3.0,3.0
math/0607231,Equivalence Classes in the Weyl groups of type $B_n$,7.189122476006218e-06,0.0,3.0,3.0
math/0505616,Dynkin diagram sequences and stabilization phenomena,7.159792106617818e-06,0.0,1.0,1.0
math/0312270,Harmonic analysis on the infinite symmetric group,7.149888784406031e-06,1.990182755160072e-06,12.0,4.0
math/0703744,Bitwisted Burnside-Frobenius theorem and Dehn conjugacy problem,7.1487258258477765e-06,0.0,2.0,0.0
math/0507252,Factorization of R-matrix and Baxter's Q-operator,7.141214222239379e-06,7.51446047390752e-09,16.0,2.0
math/0609449,Moonshine for Rudvalis's sporadic group I,7.128967226032365e-06,0.0,1.0,1.0
math/0502385,The poset of positive roots and its relatives,7.119373516457817e-06,0.0,3.0,0.0
math-ph/0210048,Z-measures on partitions and their scaling limits,7.1101662711390585e-06,2.822995788587297e-07,27.0,5.0
math/0507388,Representations of field automorphism groups,7.056031310086761e-06,0.0,5.0,0.0
math/0609732,Group orbits and regular partitions of Poisson manifolds,6.989213703785366e-06,0.0,2.0,3.0
math/0608114,Non-simply-laced Clusters of Finite Type via Frobenius Morphism,6.956934016761234e-06,8.953768192352736e-07,7.0,1.0
math/0611024,Elementary invariants for centralizers of nilpotent matrices,6.937864431107847e-06,7.960731020640288e-06,6.0,1.0
math/0211076,Riemann-Roch Theorem and Index Theorem in Non-commutative Geometry,6.931362311632945e-06,0.0,9.0,0.0
math/0612652,Garside and locally Garside categories,6.916293452882349e-06,3.987791565376711e-06,4.0,2.0
math/0702090,Dual graded graphs for Kac-Moody algebras,6.907808832379271e-06,0.0,3.0,0.0
math/0701051,"Asymptotics of characters of symmetric groups related to Stanley
  character formula",6.903630368136916e-06,0.0,5.0,0.0
math/0609770,BRST Reduction of the chiral Hecke Algebra,6.882429332520778e-06,0.0,10.0,0.0
math/0612858,Affine Geometric Crystal of type $G^{(1)}_2$,6.880332410306642e-06,0.0,2.0,0.0
math/0703296,On fibers of algebraic invariant moment maps,6.863075374206549e-06,0.0,3.0,2.0
math/0612561,Proof of the Knop conjecture,6.845587085657801e-06,0.0,1.0,2.0
math/0607454,Saturation and Irredundancy for Spin(8),6.809503546785552e-06,0.0,5.0,0.0
math/0606179,Twisted Burnside-Frobenius theory for discrete groups,6.795124394016869e-06,0.0,7.0,2.0
math/0603398,Regge and Okamoto symmetries,6.777422607334441e-06,0.0,5.0,0.0
math/0311468,"On a representation of the idele class group related to primes and zeros
  of L-functions",6.7164780103030375e-06,0.0,1.0,3.0
astro-ph/0602076,Elements of dodecahedral cosmology,6.697051969647276e-06,0.0,7.0,0.0
math/0312227,A Statement of the Fundamental Lemma,6.689494568430987e-06,0.0,6.0,0.0
math/0306403,"On the Cohomology of Locally Symmetric Spaces and of their
  Compactifications",6.674793096083258e-06,0.0,7.0,0.0
math/0309201,"Ramanujan's ""Lost Notebook"" and the Virasoro Algebra",6.674620144681049e-06,0.0,1.0,1.0
math/0606711,On Mirkovi\'c-Vilonen cycles and crystals combinatorics,6.646176122466856e-06,0.0,1.0,0.0
math/0207301,"Cohomology of convex cocompact groups and invariant distributions on
  limit sets",6.643812038937588e-06,0.0,5.0,1.0
hep-th/0209144,Lie algebras of order F and extensions of the Poincar\'e algebra,6.623154711227175e-06,0.0,6.0,0.0
math/0512206,Branching rules for Hecke Algebras of Type $D_{n}$,6.6174560180715e-06,0.0,3.0,0.0
math/0506159,Vector partition function and representation theory,6.604068167355491e-06,1.98832624139593e-06,4.0,1.0
math/0203256,"p-Modular TQFT's, Milnor torsion and the Casson-Lescop invariant",6.602430464078121e-06,4.114034501338358e-06,6.0,1.0
math/0503496,"Derived categories of irreducible projective curves of arithmetic genus
  one",6.596032244432333e-06,9.243611423650846e-07,11.0,3.0
