id,title,pagerank,betweenness,in_degree,out_degree
math/9810014,"Point processes and the infinite symmetric group. Part V: Analysis of
  the matrix Whittaker kernel",3.1860504545325613e-06,2.356892046733178e-07,6.0,9.0
math/0201176,"Formulae relating the Bernstein and Iwahori-Matsumoto presentations of
  an affine Hecke algebra",3.1767571998964616e-06,0.0,1.0,0.0
math/0003100,Quantum Strata of Coadjoint Orbits,3.1644402208787145e-06,0.0,5.0,2.0
math/0201075,Richardson Varieties and Equivariant K-Theory,3.1569575412271506e-06,0.0,2.0,0.0
math/0103025,Tensor product varieties and crystals. ADE case,3.1542220239804827e-06,0.0,2.0,3.0
math-ph/0201048,"Coupling coefficients of SO(n) and integrals over triplets of Jacobi and
  Gegenbauer polynomials",3.145931679443331e-06,0.0,1.0,2.0
math/9803092,Quantum Double-Torus,3.142375920968913e-06,0.0,1.0,0.0
math/0606044,On the tensor product of two basic representations of $U_v(\hat{sl}_e)$,3.131028080310917e-06,1.0396477079194407e-07,3.0,3.0
math/0405089,A link invariant from the symplectic geometry of nilpotent slices,3.117224734769341e-06,3.622324034464452e-06,7.0,12.0
math/0502225,Iterated Loop Algebras,3.103777601410486e-06,0.0,1.0,1.0
math/0601028,On maximal proper subgroups of field automorphism groups,3.0994875333560767e-06,0.0,3.0,1.0
math/9903176,Random Matrices and Random Permutations,3.0971624900471783e-06,0.0003673860053575,10.0,30.0
math/0402263,Random Metric Spaces and Universality,3.091631210673364e-06,0.0,2.0,0.0
math/0512287,Koszulity and the Hilbert series of preprojective algebras,3.0889715504138945e-06,5.9310310439291965e-06,2.0,2.0
math/0311241,Some deformations of U[sl(2)] and their representations,3.088461576460132e-06,0.0,3.0,1.0
math/0202193,Invariant operators on supermanifolds and Standard Models,3.085541638150926e-06,1.0775941912083495e-05,6.0,9.0
math/0409218,A weight multiplicity formula for Demazure modules,3.083365260433425e-06,0.0,3.0,0.0
math/0505317,An explicit form for Kerov's character polynomials,3.069533492740095e-06,1.3931279286120504e-05,1.0,6.0
math/0209133,"Dual canonical bases, quantum shuffles and q-characters",3.0694621445482894e-06,5.970548265480216e-06,2.0,1.0
math/0308135,Lie theory and the Chern-Weil homomorphism,3.0638284396616904e-06,5.970548265480216e-06,4.0,3.0
hep-th/9807234,Singular dimensions of the N=2 superconformal algebras. I,3.056954285063904e-06,1.990182755160072e-06,3.0,5.0
math/0605379,An extended Freudenthal Magic Square in characteristic 3,3.0540404477154944e-06,2.122567801944391e-07,3.0,4.0
math/0511163,"Betti numbers of holomorphic symplectic quotients via arithmetic Fourier
  transform",3.0485878768133367e-06,4.138485706643069e-06,4.0,5.0
math/0504538,"Geometric lifting of the canonical basis and semitoric degenerations of
  Richardson varieties",3.0473693706268627e-06,0.0,1.0,0.0
math/0506104,Factorisation of Lie Resolvents,3.0472482127272877e-06,0.0,2.0,0.0
math/0411257,Minimal metrics on nilmanifolds,3.0472482127272877e-06,0.0,2.0,1.0
math/0603690,Equivariant deformations of the affine multicone over a flag variety,3.0472482127272877e-06,0.0,2.0,0.0
math/0511697,q-Schur algebras and quantum Frobenius,3.0472482127272877e-06,0.0,2.0,0.0
math/0102039,"Quasi-exceptional sets and equivariant coherent sheaves on the nilpotent
  cone",3.0429770493204038e-06,0.0,5.0,3.0
math/0405043,"A Unified and Complete Construction of All Finite Dimensional
  Irreducible Representations of gl(2|2)",3.0361565242520665e-06,1.990182755160072e-06,3.0,1.0
math/0202301,Baby Verma modules for rational Cherednik algebras,3.0321628677032263e-06,0.0,2.0,3.0
math/0309207,Affine Weyl groups in K-theory and representation theory,3.031461081399892e-06,0.0,2.0,9.0
math/0104114,"Gluing of abelian categories and differential operators on the basic
  affine space",3.0299496640727984e-06,0.0,1.0,1.0
math/0508077,Uniqueness in the Kashiwara-Vergne conjecture,3.0299496640727984e-06,0.0,1.0,1.0
math/0009231,"t-analogue of the q-characters of finite dimensional representations of
  quantum affine algebras",3.025101135216147e-06,8.901112434737709e-05,5.0,5.0
math/0309385,Optimal SL(2)-homomorphisms,3.0244053110178157e-06,0.0,4.0,3.0
math/0005122,"Induced Representations of the Two Parametric Quantum Deformation
  U$_{pq}$[gl(2/2)]",3.020519262298035e-06,0.0,4.0,5.0
math/9905189,"Z-Measures on partitions, Robinson-Schensted-Knuth correspondence, and
  beta=2 random matrix ensembles",3.0182683959020056e-06,3.3937845977776096e-05,14.0,24.0
math/0508257,Stability conditions and Kleinian singularities,3.014141858060574e-06,5.294085817133406e-07,8.0,12.0
math/0402345,Monstrous Moonshine: The first twenty-five years,3.013479674981643e-06,3.0265433004257244e-06,3.0,1.0
math/0112251,L-modules and micro-support,3.001809991938506e-06,0.0,2.0,6.0
math/0605179,"Two-parameter Quantum Groups of Exceptional Type E-Series and Convex PBW
  Type Basis",3.001081869700707e-06,0.0,3.0,1.0
math/0007165,G-actions on graphs,2.9996560647510477e-06,0.0,3.0,0.0
math-ph/0010051,"su(N) tensor product multiplicities and virtual Berenstein-Zelevinsky
  triangles",2.988722917524851e-06,0.0,3.0,7.0
hep-th/9905150,Highest weight representations of the N=1 Ramond algebra,2.9859612357151613e-06,1.975616262549113e-06,2.0,2.0
math/0509525,"The analogs of the Riemann tensor for exceptional structures on
  supermanifolds",2.967886764800132e-06,0.0,3.0,0.0
math/0504267,"Crystal graphs of higher level q-deformed Fock spaces, Lusztig a-values
  and Ariki-Koike algebras",2.959534664540457e-06,2.079295415838881e-07,2.0,4.0
math/0412283,On the centralizer of the sum of commuting nilpotent elements,2.958282812836827e-06,0.0,2.0,1.0
math/0303146,Formulas for the dimensions of some affine Deligne-Lusztig Varieties,2.956861821267805e-06,0.0,3.0,0.0
math/0512654,Some new simple modular Lie superalgebras,2.949539286973292e-06,4.781790545650017e-06,1.0,3.0
math/0605693,"Centralizers of generic elements of Newton strata in the adjoint
  quotients of reductive groups",2.94881126164197e-06,0.0,1.0,0.0
math/0203106,Motivic Haar measure on reductive groups,2.9466295408530955e-06,9.462819350990206e-07,4.0,1.0
math/0503396,Factorization of the R-matrix.I,2.942445853994466e-06,9.234215322210647e-08,7.0,3.0
math/0203004,Vertex algebras and the class algebras of wreath products,2.937146102804262e-06,9.671610217892984e-06,4.0,5.0
math/0209151,Nilpotent orbits over ground fields of good characteristic,2.932144905477012e-06,0.0,3.0,4.0
math/0410039,Construction of equivariant vector bundles,2.923024895913817e-06,0.0,1.0,0.0
math/0503019,"Calculs explicites dans une alg\`{e}bre de Lie semi-simple effectu\'{e}s
  avec GAP4",2.923024895913817e-06,0.0,1.0,0.0
math/0502279,A homotopy aspect of representation theory,2.923024895913817e-06,0.0,1.0,0.0
math/0505268,Classification of multiplicity free symplectic representations,2.91697922313738e-06,0.0,1.0,1.0
math/0611403,The generating hypothesis for the stable module category of a $p$-group,2.91697922313738e-06,0.0,1.0,1.0
math/0403307,Quivers and the cohomology of homogeneous vector bundles,2.91697922313738e-06,0.0,1.0,1.0
math/0504148,"Cyclic homology of $H$-unital (pro-) algebras, Lie algebra homology of
  matrices, and a paper of Hanlon's",2.91697922313738e-06,0.0,1.0,1.0
math/0507198,On associated variety for Lie superalgebras,2.91697922313738e-06,0.0,1.0,1.0
math/0609699,Ghosts in modular representation theory,2.91697922313738e-06,0.0,1.0,0.0
math/0401296,A universal dimension formula for complex simple Lie algebras,2.91697922313738e-06,0.0,1.0,1.0
math/0505653,Twisted symplectic reflection algebras,2.913227610179713e-06,8.893448427335545e-06,6.0,3.0
math/0207274,Stable reductive varieties II: Projective case,2.912196206452803e-06,0.0,2.0,4.0
math/0409256,"Finite dimensional representations of double affine Hecke algebra of
  rank 1",2.911054625859556e-06,0.0,3.0,1.0
math/0307082,"Positivity and canonical bases in rank 2 cluster algebras of finite and
  affine types",2.9094709027617333e-06,0.0,6.0,5.0
math/0701612,"Derived equivalence classification for cluster-tilted algebras of type
  $A_n$",2.9078405881069656e-06,0.0,4.0,0.0
math/9909034,"Weight bases of Gelfand-Tsetlin type for representations of classical
  Lie algebras",2.902694056266672e-06,0.0,2.0,1.0
math/0611357,Abstract Young Pairs for Signed Permutation Groups,2.897062285469715e-06,0.0,2.0,0.0
math/0411363,Paley-Wiener spaces for real reductive Lie groups,2.8823378698908707e-06,0.0,2.0,0.0
math/9909118,"Realization of level one representations of $U_q(\hat{\mathfrak g})$ at
  a root of unity",2.880980385672061e-06,0.0,1.0,0.0
math/0609370,Special biserial coalgebras and representations of quantum SL(2),2.87768715912649e-06,0.0,1.0,0.0
math/0009183,"Irreducibility criterion for tensor products of Yangian evaluation
  modules",2.8771462224375405e-06,0.0,3.0,4.0
math/0104165,Adapted algebras for the Berenstein-Zelevinsky conjecture,2.876630506993645e-06,0.0,3.0,4.0
math/0510110,Geometric Waldspurger periods,2.8728502300995147e-06,0.0,2.0,0.0
math-ph/9905002,"Quasi-Spin Graded-Fermion Formalism and $gl(m|n)\downarrow osp(m|n)$
  Branching Rules",2.8609556160718624e-06,0.0,1.0,1.0
math/0407515,A Construction of Metabelian Groups,2.855213185875573e-06,0.0,2.0,0.0
math/9912012,"Tensor product multiplicities, canonical bases and totally positive
  varieties",2.855213185875573e-06,0.0,3.0,12.0
math/0501267,"JMMO Fock space and Geck-Rouquier classification of simple modules for
  Hecke algebras",2.855213185875573e-06,0.0,2.0,0.0
math/9909104,"Random words, quantum statistics, central limits, random matrices",2.8469552279025178e-06,8.668327852812233e-06,13.0,11.0
math/0012220,"Matrix balls, radial analysis of Berezin kernels, and hypergeometric
  determinants",2.845031740927148e-06,0.0,6.0,6.0
math/0606155,A twisted Burnside theorem for countable groups and Reidemeister numbers,2.8448948657450828e-06,0.0,1.0,5.0
math/9911180,On the Decomposition of Clifford Algebras of Arbitrary Bilinear Form,2.8445562634070007e-06,0.0,4.0,8.0
math/0606212,Canonical bases of higher-level q-deformed Fock spaces,2.844477427236234e-06,0.0,2.0,1.0
math/0510359,Clusters and seeds in acyclic cluster algebras,2.8441427504649723e-06,3.89065819885841e-06,9.0,8.0
math-ph/0411079,"Some results on the eigenfunctions of the quantum trigonometric
  Calogero-Sutherland model related to the Lie algebra E6",2.837718517927932e-06,0.0,4.0,0.0
math/0701260,Vertex tensor category structure on a category of Kazhdan--Lusztig,2.8324691674898384e-06,2.1472987781652016e-05,2.0,1.0
math/0610447,A realization of quantum groups via product valued quivers,2.831162402317752e-06,0.0,4.0,0.0
math/0101165,"Vertex operator superalgebra structure for degenerate minimal models:
  Neveu-Schwarz algebra",2.8247586174241464e-06,0.0,3.0,0.0
math/0310425,Fusion rules for the vertex operator algebras M(1)^+ and V_L^+,2.821625468219483e-06,0.0,3.0,0.0
math/0605569,"N-complexes as functors, amplitude cohomology and fusion rules",2.820736832090624e-06,0.0,2.0,0.0
math/0506467,Cyclotomic Nazarov-Wenzl algebras,2.813805413604416e-06,0.0,2.0,1.0
math/0512651,Semi-invariants of mixed representations of quivers,2.8122315166685897e-06,0.0,1.0,1.0
math/0609520,Moduli spaces of orthogonal bundles over an algebraic curve,2.8122315166685897e-06,0.0,1.0,1.0
math/0210161,Finite growth representations of infinite Lie conformal algebras,2.8108046467036023e-06,0.0,3.0,1.0
math/0602514,Graded level zero integrable representations of affine Lie algebras,2.805118427366484e-06,0.0,2.0,1.0
math/0106222,Superanalogs of the Calogero operators and Jack polynomials,2.7968082649139464e-06,0.0,3.0,1.0
math/0403003,"Cohomology of tilting modules over quantum groups and $t$-structures on
  derived categories of coherent sheaves",2.7919884189337524e-06,1.249116948936693e-07,6.0,2.0
math/9809122,Littlewood-Richardson coefficients and Kazhdan-Lusztig polynomials,2.785497975058984e-06,0.0,7.0,12.0
math/0612213,Cluster-Cyclic Quivers with three Vertices and the Markov Equation,2.7801384983084275e-06,0.0,2.0,1.0
math/0210323,Standard modules for tabular algebras,2.77239764133326e-06,0.0,1.0,0.0
math/0611323,Spherical varieties and Langlands duality,2.769561548353564e-06,1.990182755160072e-06,5.0,1.0
math/0212371,About rational-trigonometric deformation,2.759877757770993e-06,0.0,2.0,0.0
math/0509200,"On the Combinatorics of Crystal Graphs, I. Lusztig's Involution",2.7597879103901067e-06,0.0,2.0,1.0
math/0107103,"Representations of the fundamental group of a surface in PU(p,q) and
  holomorphic triples",2.7596921656880744e-06,0.0,2.0,1.0
math/0511481,On the R-matrix realization of Yangians and their representations,2.759477489040785e-06,0.0,1.0,0.0
math/0209346,Poisson geometry and the Kashiwara-Vergne conjecture,2.759195672449716e-06,0.0,2.0,1.0
math/0211289,Gelfand-Tsetlin bases for classical Lie algebras,2.759195672449716e-06,0.0,2.0,3.0
math/0208107,Geometric Proofs of Horn and Saturation Conjectures,2.7584602810147936e-06,0.0,3.0,6.0
math/0506511,Moduli Spaces for Principal Bundles in Arbitrary Characteristic,2.757988664698385e-06,1.990182755160072e-06,2.0,1.0
math/0110248,The Tensor Product of Representations of U_q(sl_2) Via Quivers,2.7513933269090025e-06,1.990182755160072e-06,2.0,1.0
math/0107063,"The Plancherel decomposition for a reductive symmetric space I.
  Spherical functions",2.7504625511549888e-06,0.0,2.0,2.0
math/0510445,From tilted to cluster-tilted algebras of Dynkin type,2.750260982909241e-06,4.550864568348475e-06,5.0,4.0
math/9805100,"Ring structure, uniform expressions and intersection homology",2.747437991287778e-06,0.0,4.0,2.0
math/0201248,Local Systems on Nilpotent Orbits and Weighted Dynkin Diagrams,2.74245642232104e-06,0.0,2.0,0.0
math/0203082,"An order-reversing duality map for conjugacy classes in Lusztig's
  canonical quotient",2.74245642232104e-06,0.0,2.0,0.0
math-ph/9906011,Permutation Weights for Affine Lie Algebras,2.741566128302988e-06,1.9920392689242136e-06,2.0,1.0
math/0509562,Invariant bilinear differential operators,2.7374447325780757e-06,3.767188805183535e-06,2.0,4.0
math/0609349,"On the multiplicities of the irreducible highest weight modules over
  Kac-Moody algebras",2.7324608981451864e-06,0.0,3.0,0.0
math/0702137,"Bilinear forms on $\mathfrak{sl}_2$-modules and a hypergeometric
  identity",2.7289034430357475e-06,0.0,1.0,0.0
math/0602417,"Lakshmibai-Seshadri paths of level-zero weight shape and one-dimensional
  sums associated to level-zero fundamental representations",2.7150304201538005e-06,0.0,2.0,0.0
math/0312243,Metric Lie algebras and quadratic extensions,2.704582946725624e-06,6.84860752286985e-06,3.0,3.0
math/0601734,On Mukai flops for Scorza varieties,2.7027813795874865e-06,1.990182755160072e-06,2.0,3.0
math/0501156,"Finite dimensional representations of symplectic reflection algebras
  associated to wreath products II",2.7026616838763327e-06,1.246972046069731e-06,4.0,4.0
math/0302204,Nilpotent commuting varieties of reductive Lie algebras,2.700834972668998e-06,0.0,2.0,2.0
math/0507504,On Orbital variety closures in sl_n. III Geometric properties,2.697084014042981e-06,0.0,2.0,1.0
math/0511610,Weighted locally gentle quivers and Cartan matrices,2.697084014042981e-06,0.0,1.0,0.0
math/0511623,Shapovalov determinants of Q-type Lie superalgebras,2.697084014042981e-06,0.0,1.0,0.0
math/0201103,"Dixmier Algebras for Classical Complex Nilpotent Orbits via
  Kraft-Procesi Models I",2.697084014042981e-06,0.0,2.0,0.0
math/0603672,Maximal n-orthogonal modules for selfinjective algebras,2.6950989560893555e-06,0.0,3.0,2.0
math/0506555,"Crystal bases and simple modules for Hecke algebras of type G(p,p,n)",2.6950687897841683e-06,0.0,2.0,2.0
math/0309247,"Perverse sheaves, Koszul IC-modules, and the quiver for the category O",2.689692617520429e-06,0.0,4.0,2.0
math/0403529,Motivic nature of character values of depth-zero representations,2.675910858143319e-06,0.0,4.0,0.0
math/0006221,On finitization of the Gordon identities,2.674181251316045e-06,0.0,3.0,2.0
math/0608175,"Sequences of reflection functors and the preprojective component of a
  valued quiver",2.6738905120250686e-06,0.0,2.0,1.0
hep-th/9810059,Free-Field Resolutions of the Unitary N=2 Super-Virasoro Representations,2.6670538260456257e-06,7.945622013037208e-06,6.0,8.0
math/0405236,A regularity result for a locus of Brill type,2.6639048199791843e-06,0.0,1.0,0.0
math/0110318,Asymptotic representation theory and Riemann-Hilbert problem,2.6632656982453938e-06,0.0,8.0,1.0
math/0311388,On the ideals of secant varieties of Segre varieties,2.6631781590238582e-06,0.0,2.0,2.0
math/0603475,"Quadratic duals, Koszul dual functors, and applications",2.66256759427185e-06,0.0,4.0,4.0
math/0505688,Nilpotent metric Lie algebras of small dimension,2.6617000598741657e-06,0.0,2.0,0.0
math/0611074,On the quiver Grassmannian in the acyclic case,2.6608352425234085e-06,0.0009439717884512,5.0,2.0
math/0408249,On the structure of pseudo-Riemannian symmetric spaces,2.65914239157171e-06,9.011070000876856e-06,2.0,5.0
math/0206087,The connectedness of some varieties and the Deligne-Simpson problem,2.655681235077153e-06,0.0,4.0,2.0
math/0412432,"Tensor product structure of affine Demazure modules and limit
  constructions",2.654231116153579e-06,1.990182755160072e-06,3.0,9.0
math/0310128,Isomorphisme de Duflo et la cohomologie tangentielle,2.6351969778253457e-06,0.0,1.0,0.0
math/0401347,Tensor categories (after P. Deligne),2.6342641277089068e-06,0.0,1.0,0.0
math/0501504,"Equidimensionality of convolution morphisms and applications to
  saturation problems",2.6284293171741966e-06,0.0,4.0,0.0
math/0504216,Relative Kazhdan--Lusztig cells,2.6238794061273608e-06,0.0,2.0,4.0
nlin/0405040,"New Integrable Hierarchies from Vertex Operator Representations of
  Polynomial Lie Algebras",2.621770386752702e-06,0.0,1.0,0.0
math/0102220,On tensor categories attached to cells in affine Weyl groups II,2.617043775885506e-06,0.0,4.0,2.0
math/0204302,"Elliptic Central Characters and Blocks of Finite Dimensional
  Representations of Quantum Affine Algebras",2.6151694023109303e-06,0.0,2.0,2.0
math/0306393,Double affine Hecke algebras of rank 1 and affine cubic surfaces,2.601234892820597e-06,2.0615895342173323e-08,4.0,2.0
math/0309132,Affine pavings for affine Springer fibers for split elements in PGL(3),2.5948454955250407e-06,0.0,2.0,0.0
math/0406047,Exponents for B-stable ideals,2.5948454955250407e-06,0.0,2.0,0.0
math/0403222,Quiver varieties and Lusztig's algebra,2.586917397848992e-06,3.244474077483424e-05,3.0,12.0
math/0505673,Stable spherical varieties and their moduli,2.583548223239553e-06,0.0,3.0,2.0
math/0204305,"Gromov-Witten theory, Hurwitz theory, and completed cycles",2.573910259910056e-06,1.859044103301596e-05,4.0,34.0
math/0108185,Dunkl operators for complex reflection groups,2.5710534749703146e-06,0.0,2.0,8.0
math/0512020,Standard monomials for wonderful group compactifications,2.5660353914125506e-06,0.0,1.0,0.0
math/0307390,"Representations of rational Cherednik algebras of rank 1 in positive
  characteristic",2.5537986239858453e-06,0.0,4.0,2.0
math/0602255,"Geometric Langlands correspondence for D-modules in prime
  characteristic: the GL(n) case",2.543227696952896e-06,9.071536735069984e-06,4.0,4.0
math/9909183,"Application of a ""Jacobi identity"" for vertex operator algebras to zeta
  values and differential operators",2.5431562672415373e-06,0.0,2.0,0.0
math/0512176,The combinatorics of Coxeter categories,2.5427058008364057e-06,0.0,2.0,1.0
math/0506087,Closures of Steinberg fibers in twisted wonderful compactifications,2.535700708140893e-06,0.0,4.0,1.0
math/0703681,"Frobenius-Schur Indicators for Subgroups and the Drinfel'd Double of
  Weyl Groups",2.5356976698495262e-06,0.0,2.0,0.0
math/0105210,Finite dimensional comodules over the Hopf algebra of rooted trees,2.5350418812148733e-06,2.287796823998541e-08,8.0,1.0
math-ph/0011002,"Unitary Irreducible Representations of a Lie Algebra for Matrix Chain
  Models",2.5225364952994413e-06,0.0,7.0,0.0
math/0102159,"The Riemannian geometry of orbit spaces. The metric, geodesics, and
  integrable systems",2.519151888885073e-06,0.0,2.0,3.0
math/9810140,On the projective geometry of homogeneous spaces,2.515685857326737e-06,2.5473817846560957e-05,3.0,6.0
math/0207127,Induced and simple modules of double affine Hecke algebras,2.512727571129308e-06,9.91923913099252e-06,4.0,6.0
math/0611392,"Cartan matrices and presentations of the exceptional simple Elduque Lie
  superalgebra",2.512320490346682e-06,0.0,2.0,0.0
math/0508408,"Cluster X-varieties, amalgamation and Poisson-Lie groups",2.5053443034087623e-06,3.128844530500412e-07,4.0,5.0
math/0111304,"The Plancherel decomposition for a reductive symmetric space II.
  Representation theory",2.496384990125525e-06,0.0,1.0,2.0
math/0609003,Tensor product decompositions and open orbits in multiple flag varieties,2.495545303430724e-06,0.0,2.0,0.0
math/0202182,"Enveloping algebra U(gl(3)) and orthogonal polynomials in several
  discrete indeterminates",2.4950653001258034e-06,0.0,2.0,1.0
math/0508186,Structure of the tensor product semigroup,2.49461834615543e-06,0.0,3.0,1.0
math/0312336,Representations of Quantum Affinizations and Fusion Product,2.4933570639931465e-06,0.0,2.0,1.0
math/9907127,Infinite wedge and random partitions,2.487993420196947e-06,3.154776632047128e-05,11.0,35.0
math/9810015,"Point processes and the infinite symmetric group. Part VI: Summary of
  results",2.484131604167208e-06,2.762785954388713e-05,7.0,23.0
math/0304030,Mod p classification of Shimura F-crystals,2.4808540183758142e-06,0.0,1.0,2.0
math/0503238,"Colored-Descent Representations of Complex Reflection Groups G(r,p,n)",2.4713636486304903e-06,0.0,1.0,1.0
math/0502478,The index of representations associated with stabilisers,2.4711431321721443e-06,0.0,1.0,0.0
math/0312521,"Sur la compatibilite entre les correspondances de Langlands locale et
  globale pour U(3). (On the compatibility between local and global Langlands
  correspondances for U(3))",2.4711431321721443e-06,0.0,1.0,0.0
math/0412265,Monodromy of the Hitchin Map over Hyperelliptic Curves,2.4711431321721443e-06,0.0,1.0,0.0
math/9803031,"Geometry of Quantum Homogeneous Supervector Bundles and Representation
  Theory of Quantum General Linear Supergroup",2.4711431321721443e-06,0.0,1.0,0.0
math/0410242,On compression of Bruhat-Tits buildings,2.4711431321721443e-06,0.0,1.0,0.0
math/0411554,Conjugacy in Permutation Representations of the Symmetric Group,2.4711431321721443e-06,0.0,1.0,0.0
math/0507125,The Brauer group of modified supergroup algebras,2.4711431321721443e-06,0.0,1.0,1.0
math/0511227,"Derived equivalence classification of symmetric algebras of domestic
  type",2.4711431321721443e-06,0.0,1.0,1.0
math-ph/0009010,Berezin quantization of the Schrodinger algebra,2.4711431321721443e-06,0.0,1.0,0.0
math/0407108,Finite Hochschild cohomology without finite global dimension,2.4711431321721443e-06,0.0,1.0,0.0
math/0208051,A Poisson structure on compact symmetric spaces,2.4711431321721443e-06,0.0,1.0,1.0
math/0611950,Spin Hecke algebras of finite and affine types,2.4711431321721443e-06,0.0,1.0,0.0
math/0701644,Category $\mathcal O$ for the Virasoro algebra: Cohomology and Koszulity,2.4711431321721443e-06,0.0,1.0,0.0
math/0701763,A note on affine quotients and equivariant double fibrations,2.4711431321721443e-06,0.0,1.0,0.0
math/0612545,"An analogue of the Cartan decomposition for p-adic reductive symmetric
  spaces",2.4711431321721443e-06,0.0,1.0,0.0
math/0702480,"New models for the action of Hecke operators in spaces of Maass wave
  forms",2.4711431321721443e-06,0.0,1.0,0.0
math/0701048,"Convergent noncommutative power series algebras and their finite
  dimensional representations",2.4711431321721443e-06,0.0,1.0,0.0
math/0701351,Group algebras of Kleinian type and groups of units,2.4711431321721443e-06,0.0,1.0,0.0
math/0609846,Cramped subgroups and generalized Harish-Chandra modules,2.4711431321721443e-06,0.0,1.0,0.0
math/0612219,Noncrossing partitions and representations of quivers,2.4711431321721443e-06,0.0,1.0,1.0
math/9905133,"Spectral estimations for Laplace operator for the discrete Heisenberg
  group",2.4711431321721443e-06,0.0,1.0,0.0
math/0406211,"The bar automorphism in quantum groups and geometry of quiver
  representations",2.4711431321721443e-06,0.0,1.0,0.0
math/0304189,Elliptic U(2) quantum group and elliptic hypergeometric series,2.4711431321721443e-06,0.0,1.0,6.0
math/0409055,"An extension of Rais' theorem and seaweed subalgebras of simple Lie
  algebras",2.4711431321721443e-06,0.0,1.0,0.0
math/9812078,"Partial resolutions of Hilbert type, Dynkin diagrams, and generalized
  Kummer varieties",2.4711431321721443e-06,0.0,1.0,2.0
math/0312214,"Skew category, Galois covering and smash product of a $k$-category",2.4711431321721443e-06,0.0,1.0,5.0
math/0510216,Notes on Coxeter Transformations and the McKay correspondence,2.4711431321721443e-06,0.0,1.0,1.0
math/9912128,Total positivity: tests and parametrizations,2.4711431321721443e-06,0.0,2.0,1.0
math/0309095,Young Wall Realization of Crystal Bases for Classical Lie Algebras,2.4711431321721443e-06,0.0,1.0,0.0
math/0608284,"Domains of holomorphy for irreducible unitary representations of simple
  Lie groups",2.4711431321721443e-06,0.0,1.0,0.0
math/0310011,BMW algebras of simply laced type,2.4711431321721443e-06,0.0,1.0,1.0
math/0511079,Fourier transforms related to a root system of rank 1,2.4711431321721443e-06,0.0,1.0,1.0
math/0608149,$H^*$-algebras and quantization of para-Hermitian spaces,2.4711431321721443e-06,0.0,1.0,0.0
math/0610029,"Cylindrical Combinatorics and Representations of Cherednik Algebras of
  type A",2.4711431321721443e-06,0.0,1.0,0.0
math/0603409,Varieties for Modules of Quantum Elementary Abelian Groups,2.4711431321721443e-06,0.0,1.0,1.0
