id,title,pagerank,betweenness,in_degree,out_degree
hep-th/0301033,"Basic Twist Quantization of osp(1|2) and kappa-- Deformation of D=1
  Superconformal Mechanics",4.253028691671723e-06,4.147517630248305e-06,6.0,5.0
math/0607451,Blocks of cyclotomic Hecke algebras,4.236402573222e-06,1.6351240086418886e-06,2.0,3.0
math/0607690,"Framed Rank r Torsion-free Sheaves on CP^2 and Representations of the
  Affine Lie Algebra \hat{gl(r)}",4.223420327429379e-06,1.990182755160072e-06,4.0,1.0
math/0606130,On the unramified spectrum of spherical varieties over p-adic fields,4.217775651293076e-06,0.0,2.0,0.0
math/0605680,Thin coverings of modules,4.210716650691079e-06,0.0,3.0,0.0
math/0502147,A Combinatorial Model for Crystals of Kac-Moody Algebras,4.200121724387936e-06,0.0,2.0,3.0
math/0612639,Continuous representations of groupoids,4.199458373837573e-06,0.0,3.0,0.0
math/0210366,Dunkl operators: Theory and applications,4.199458373837573e-06,0.0,3.0,0.0
math/0609430,"Restrictions of the Complementary Series of the Universal Covering of
  the Symplectic Group",4.199458373837573e-06,0.0,3.0,0.0
math/0102191,Tessellations of homogeneous spaces of classical groups of real rank two,4.199458373837573e-06,0.0,3.0,0.0
math/0406049,"Some remarks on another proof of geometrical Paley-Wiener theorems for
  the Dunkl transform",4.187705344406421e-06,0.0,3.0,0.0
math/0507399,On the Finite-Dimensional Irreducible Representations of PSL2(Z),4.168953560777068e-06,0.0,2.0,0.0
math/0301330,Askey-Wilson functions and quantum groups,4.157283384277122e-06,0.0,2.0,3.0
math/0302342,"Laguerre functions and representations of su(1,1)",4.149368520445399e-06,0.0,3.0,3.0
math/0306254,Chern classes and Lie-Rinehart algebras,4.14418112976081e-06,5.970548265480216e-06,3.0,2.0
math/0610669,Is the Luna stratification intrinsic?,4.138457338761509e-06,0.0,2.0,0.0
math/0404187,"Monomials of q and q,t-characters for non simply-laced quantum
  affinizations",4.1275355655611805e-06,0.0,2.0,0.0
math/0306111,Regions in the dominant chamber and nilpotent orbits,4.1271853247691e-06,0.0,2.0,0.0
math/0307052,On the Hodge-Newton decomposition for split groups,4.12036658780285e-06,0.0,4.0,0.0
math/0309186,The Bloch-Okounkov correlation functions at higher levels,4.117206093167623e-06,0.0,1.0,0.0
math-ph/0302061,Special Weights and Roots for Finite Lie Algebras,4.113671498507673e-06,0.0,2.0,0.0
math/0601117,Small resolutions of minuscule Schubert varieties,4.1093321625896605e-06,0.0,4.0,5.0
math/9806140,"Infinite dimensional geometry of $M_1=Diff_+(S^1)/PSL(2,R)$ and
  $q_R$--conformal symmetries",4.108306421450398e-06,0.0,2.0,1.0
math/0402140,Normalizers of ad-nilpotent ideals,4.09221595339974e-06,0.0,2.0,1.0
math/0504399,Averages over classical compact Lie groups and Weyl characters,4.089307811357881e-06,0.0,2.0,0.0
math/0205324,"Spaces of coinvariants and fusion product I. From equivalence theorem to
  Kostka polynomials",4.087241943058507e-06,7.966699003092724e-06,9.0,5.0
hep-th/0104240,"Fusion multiplicities as polytope volumes: N-point and higher-genus
  su(2) fusion",4.084380240591782e-06,2.540446009256847e-06,4.0,3.0
math/0403416,Dynamical differential equations compatible with rational qKZ equations,4.078373781013743e-06,0.0,2.0,1.0
math/0312030,Lifting mappings over invariants of finite groups,4.075235057024103e-06,0.0,3.0,3.0
math/0212001,Multi-dimensional Weyl Modules and Symmetric Functions,4.068980731597389e-06,7.5049570847050684e-06,6.0,7.0
math/0506171,Invariant functions on symplectic representations,4.063143711471229e-06,0.0,1.0,2.0
math/0401405,Resolutions of homogeneous bundles on P^2,4.063143711471229e-06,0.0,1.0,2.0
math/0402157,The sextonions and $E_{7\frac 12}$,4.063143711471229e-06,0.0,1.0,2.0
math/0610423,Groups which do not admit ghosts,4.063143711471229e-06,0.0,1.0,2.0
quant-ph/0302112,"A subexponential-time quantum algorithm for the dihedral hidden subgroup
  problem",4.060520791837712e-06,0.0,12.0,23.0
math-ph/0603012,Off-shell supersymmetry and filtered Clifford supermodules,4.057763191530921e-06,1.4574834174313648e-06,5.0,5.0
math/0703401,Tight representations of semilattices and inverse semigroups,4.057098038694793e-06,0.0,1.0,0.0
math/0110077,Frobenius-Schur functions,4.037864075546937e-06,1.791164479644065e-05,4.0,8.0
math/0601343,"Alcove walks, Hecke algebras, spherical functions, crystals and column
  strict tableaux",4.036189262235711e-06,0.0,4.0,1.0
math/0602259,Cluster algebras IV: Coefficients,4.013889513760613e-06,7.154938638170288e-05,7.0,8.0
math/0005005,The Derived Picard Group is a Locally Algebraic Group,4.010830335901636e-06,0.0,4.0,0.0
math/0610552,Tensor envelopes of regular categories,4.007423346985859e-06,0.0,3.0,0.0
math/9808034,On the Structure of Lie Group C*-Algebras and Compact Quantum Groups,4.007423346985859e-06,0.0,3.0,0.0
math/0509400,"Structures of G(2) type and nonintegrable distributions in
  characteristic p",4.006053337732336e-06,1.7794728805024725e-05,6.0,5.0
math/0609726,"Actions of the face monoid associated to a Kac-Moody group on its
  building",3.998282797825446e-06,0.0,2.0,0.0
math/0403437,"Norms of geodesic restrictions for eigenfunctions on hyperbolic surfaces
  and representation theory",3.989418745580976e-06,0.0,3.0,1.0
math/0405503,Galois module structure of Milnor K-theory in characteristic p,3.98435861544654e-06,0.0,1.0,3.0
math/0509063,The $F$-triangle of the generalised cluster complex,3.98351631355901e-06,0.0,3.0,0.0
math/0607758,Bimodules and g-rationality of vertex operator algebras,3.983191162089067e-06,0.0,2.0,0.0
math/0501446,"On the Computation of Clebsch-Gordan Coefficients and the Dilation
  Effect",3.9734447121048935e-06,3.978508996556002e-06,5.0,1.0
math/0506018,From triangulated categories to cluster algebras,3.960103013898323e-06,9.460509863937006e-05,10.0,20.0
math/0505518,Root systems and generalized associahedra,3.957563036644239e-06,3.057065322388521e-05,4.0,12.0
math/0109193,"The problem of harmonic analysis on the infinite-dimensional unitary
  group",3.955712505995193e-06,6.600068921331218e-07,14.0,8.0
math/0108131,"Computing the Frobenius-Schur indicator for abelian extensions of Hopf
  algebras",3.952804440583965e-06,0.0,5.0,0.0
math/0611861,Cat\'{e}gories de foncteurs en grassmanniennes et filtration de Krull,3.951011740210633e-06,0.0,2.0,0.0
math/0304193,The use of geometric and quantum group techniques for wild quivers,3.9456389158304665e-06,0.0,3.0,1.0
math/9802054,"Poisson structure on moduli of flat connections on Riemann surfaces and
  $r$-matrix",3.930605971448052e-06,0.0,2.0,28.0
math/0304188,Eisenstein integrals and induction of relations,3.927914570218655e-06,0.0,3.0,0.0
math-ph/0408053,The Structure of the Ladder Insertion-Elimination Lie algebra,3.926400917617281e-06,3.917906822745317e-07,7.0,2.0
math/0606237,"$q$-Inverting pairs of linear transformations and the $q$-tetrahedron
  algebra",3.900891851510637e-06,1.1881688090507892e-08,15.0,3.0
math/0610012,Deformation of Outer Representations of Galois Group II,3.889822344235479e-06,0.0,2.0,0.0
math/0609693,Quantification pour les paires symetriques et diagrammes de Kontsevich,3.88877811469293e-06,9.389177012177936e-09,4.0,1.0
math/0105155,The Octonions,3.877731000353603e-06,0.0001205733352751,5.0,37.0
math/0007121,Theory of Finite Pseudoalgebras,3.865117286789155e-06,5.970548265480216e-06,7.0,2.0
math/0610448,Generalized Kac-Moody Lie Algebras And Product Quivers,3.8613299686195e-06,0.0,3.0,0.0
math/0202184,Indecomposable representations of Lie superalgebras,3.853795325504487e-06,0.0,3.0,4.0
math-ph/0410049,Ultracoherence and Canonical Transformations,3.8525092825469965e-06,0.0,3.0,3.0
math/0202018,"Action of overalgebra in Plancherel decomposition and shift operators in
  imaginary direction",3.847453722699276e-06,0.0,4.0,0.0
math/0611517,"Vertex operator algebras associated to modified regular representations
  of affine Lie algebras",3.8460111917553846e-06,0.0,4.0,0.0
math/0201135,Elliptic genus and vertex operator algebras,3.833115969187927e-06,1.980281348417982e-08,4.0,1.0
math/0511726,Elliptic curves and birational representation of Weyl groups,3.83171613660717e-06,0.0,2.0,1.0
math/0305437,Schubert varieties and the fusion products,3.8275837686394844e-06,1.995274907198861e-06,6.0,2.0
math/0606222,Quantum dimensions and their non-Archimedean degenerations,3.826048164020265e-06,0.0,3.0,0.0
math/0402222,"Lifting smooth curves over invariants for representations of compact Lie
  groups. II",3.8237089214844825e-06,0.0,4.0,2.0
math/0304010,"Kerov's central limit theorem for the Plancherel measure on Young
  diagrams",3.818379531896379e-06,1.5921462041280577e-05,4.0,2.0
math/0702277,Combinatorial Formulae for Nested Bethe Vectors,3.811079851824469e-06,0.0,2.0,1.0
hep-th/9805179,"Resolutions and Characters of Irreducible Representations of the N=2
  Superconformal Algebra",3.8062786908386218e-06,1.19418878858664e-05,8.0,13.0
math/0409411,Quiver varieties and Demazure modules,3.805743824538357e-06,0.0,4.0,0.0
math-ph/9909009,Universality of correlations of levels with discrete statistics,3.7870301603922314e-06,0.0,15.0,1.0
math/0612398,"Isometric group actions on Banach spaces and representations vanishing
  at infinity",3.784821671342791e-06,0.0,1.0,0.0
math/0011114,"Symplectic reflection algebras, Calogero-Moser space, and deformed
  Harish-Chandra homomorphism",3.7811801593004206e-06,2.388463940031453e-05,7.0,35.0
math/0203260,Representation theory and projective geometry,3.777211867804691e-06,4.3422606471970685e-05,5.0,6.0
math/0610644,The Character of the Weil Representation,3.773980547862988e-06,0.0,2.0,0.0
math/0506405,Auslander algebras and initial seeds for cluster algebras,3.772006675341978e-06,1.9949911671864724e-06,5.0,7.0
math/0507488,On the Wronskian combinants of binary forms,3.767934875086551e-06,0.0,2.0,0.0
math/0508123,A geometric decomposition of Harish-Chandra modules,3.7589767133589184e-06,0.0,2.0,0.0
math/0403234,Geometric Crystals on Unipotent Groups and Generalized Young Tableaux,3.7584765598058175e-06,0.0,2.0,0.0
math/0404439,Paley-Wiener theorems for the Dunkl transform,3.758417733575704e-06,1.990182755160072e-05,2.0,6.0
math/0104105,Irreducible representations of Upq[gl(2/2)],3.747835992213766e-06,7.960731020640288e-06,6.0,4.0
math/0505165,Quantization of minimal resolutions of Kleinian singularities,3.742807412471055e-06,0.0,3.0,2.0
math/0503324,Rigid modules over preprojective algebras,3.7416638425775456e-06,6.99657460919076e-06,10.0,5.0
math/0205046,"Computation of Cohomology of Lie Algebra of Hamiltonian Vector Fields by
  Splitting Cochain Complex into Minimal Subcomplexes",3.732405385655268e-06,0.0,2.0,0.0
math/0308101,A polynomiality property for Littlewood-Richardson coefficients,3.732339176354288e-06,0.0,2.0,0.0
math/9902146,Yangian of the Queer Lie Superalgebra,3.725070858339796e-06,0.0,2.0,2.0
math/0109140,Difference L operators related to q-characters,3.715247166192509e-06,3.2182786654240945e-08,4.0,1.0
math/0310441,On the Deligne-Simpson problem and its weak version,3.696527284397995e-06,0.0,5.0,0.0
math/0609240,Lefschetz decompositions and Categorical resolutions of singularities,3.696398471451571e-06,1.4733120059560566e-07,6.0,3.0
math/0511632,"Representations of the Quantum Algebra su_q(1,1) and Discrete
  q-Ultraspherical Polynomials",3.6856780749299194e-06,0.0,3.0,1.0
math/0301257,The combinatorial quantum cohomology ring of $G/B$,3.683200824320974e-06,0.0,3.0,3.0
math/0612099,"Reflection functors and representations for continuous wreath-product
  symplectic reflection algebras",3.676681030592632e-06,0.0,4.0,0.0
math/0411428,Sextonions and the magic square,3.661596380187423e-06,0.0,5.0,0.0
math/0504543,"Noncommutative Deformations of Type A Kleinian Singularities and Hilbert
  Schemes",3.633266862045615e-06,4.538258584642183e-06,3.0,3.0
math/0512563,Quantum double of ${\rm U}_q((\ksl_2)^{\leq 0})$,3.62335329328243e-06,0.0,2.0,0.0
math/0404510,Left cells and constructible representations,3.62335329328243e-06,0.0,2.0,0.0
math/0308176,Crystal bases and monomials for $U_q(G_2)$-modules,3.62335329328243e-06,0.0,2.0,1.0
math/0507559,Systems of submodules and a remark by M.C.R. Butler,3.62335329328243e-06,0.0,2.0,0.0
math/0605621,Representation theory of Mantaci-Reutenauer algebras,3.62335329328243e-06,0.0,2.0,0.0
math/0606268,"On the sum of the index of a parabolic subalgebra and of its nilpotent
  radical",3.62335329328243e-06,0.0,2.0,0.0
math/0702864,Schur-Weyl dualities for symmetric inverse semigroups,3.62335329328243e-06,0.0,3.0,0.0
math-ph/9908014,"Representation of the quantum algebra $SU_q(2)$ in the basis with
  diagonal $""J_x""$ generator",3.62335329328243e-06,0.0,2.0,0.0
math/0610112,Poincare-Birkhoff-Witt Deformations of Calabi-Yau Algebras,3.6181763721898537e-06,0.0,5.0,2.0
math/0608500,"Kostant's generating functions, Ebeling's theorem and McKay's
  observation relating the Poincare series",3.6053486918775466e-06,0.0,2.0,0.0
math/0409329,"Intersections of Schubert varieties and highest weight vectors in tensor
  products of sl_{N+1}-representations",3.6005903618090062e-06,5.970548265480216e-06,3.0,3.0
math/0606724,A C*-analogue of Kazhdan's property (T),3.596442773074684e-06,0.0,1.0,0.0
math-ph/9812014,Summing over the Weyl Groups of E_7 and E_8,3.594652035791368e-06,7.963158769408782e-06,2.0,4.0
math/0703297,"The log-concavity conjecture for the Duistermaat-Heckman measure
  revisited",3.5891707673166538e-06,0.0,1.0,0.0
math/0703333,"Generation of mutually unbiased bases as powers of a unitary matrix in
  2-power dimensions",3.586302588248816e-06,0.0,2.0,0.0
math/0606504,Incidence Hilbert schemes and infinite dimensional Lie algebras,3.5834036575191383e-06,0.0,2.0,0.0
math/9908039,The projective geometry of Freudenthal's magic square,3.578316104143297e-06,0.0,2.0,2.0
math/0303065,ad-nilpotent ideals of a Borel subalgebra III,3.576230843727076e-06,0.0,2.0,1.0
math/0607399,"Convergence rates of random walk on irreducible representations of
  finite groups",3.573846242604402e-06,0.0,2.0,1.0
math/9810013,"Point Processes and the Infinite Symmetric Group. Part IV: Matrix
  Whittaker kernel",3.5624931242921063e-06,0.0001437313702211,9.0,10.0
math/0510207,The Moduli Space of Three Dimensional Lie Algebras,3.560823194439908e-06,0.0,4.0,1.0
math/0511155,Matrix Factorizations and Representations of Quivers II: type ADE case,3.560155384090224e-06,2.378670872785096e-06,10.0,5.0
math/0511552,Proof of the modular branching rule for cyclotomic Hecke algebras,3.558963220697691e-06,1.990182755160072e-06,2.0,1.0
math/0512137,Tame concealed algebras and cluster quivers of minimal infinite type,3.558615426866601e-06,0.0,7.0,4.0
math/0104127,Twisted vertex representations and spin characters,3.556840312199264e-06,0.0,3.0,2.0
math/0512111,Mullineux involution and twisted affine Lie algebras,3.548701656976629e-06,0.0,2.0,0.0
math/0311278,Schubert varieties and the fusion products. The general case,3.5130888940598865e-06,0.0,5.0,1.0
math/0503410,Factorization of the R-matrix.II,3.5092898257851943e-06,0.0,10.0,0.0
math/0504213,Lusztig's $a$-function in type $B_n$ in the asymptotic case,3.5087666658959697e-06,0.0,3.0,4.0
math/0302251,Continuous Hahn functions as Clebsch-Gordan coefficients,3.5040503898578538e-06,0.0,2.0,3.0
math/9902060,A weight basis for representations of even orthogonal Lie algebras,3.5015444226741347e-06,0.0,1.0,3.0
math/0609115,"The value ring of geometric motivic integration and the Iwahori Hecke
  algebra of SL_2",3.500183238704697e-06,0.0,2.0,1.0
math/0602206,Representations of the twisted quantized enveloping algebra of type C_n,3.4998773353161366e-06,0.0,1.0,0.0
math/0310352,Tame-wild dichotomy for derived categories,3.49912997646896e-06,0.0,2.0,1.0
math/0010290,Spherical harmonic polynomials for higher bundles,3.49912997646896e-06,0.0,2.0,0.0
math/0608655,Symmetric product as moduli space of linear representations,3.49912997646896e-06,0.0,2.0,0.0
math/0604535,Graded Lie algebras and intersection cohomology,3.49912997646896e-06,0.0,2.0,0.0
math/0610449,Notes on affine canonical and monomial bases,3.49912997646896e-06,0.0,2.0,0.0
math-ph/0604035,A family of tridiagonal pairs and related symmetric functions,3.498691847526419e-06,0.0,6.0,1.0
math/0609501,On Hom-algebra structures,3.4942283857866885e-06,0.0,1.0,0.0
math/9907036,"Representation Theory and Numerical AF-invariants: The representations
  and centralizers of certain states on O_d",3.493345650031712e-06,0.0,2.0,1.0
math/0511382,Equivalences between cluster categories,3.491508291043165e-06,0.0009466365573732,4.0,5.0
math/0509272,"Complexe canonique de deuxi\`{e}me esp\`{e}ce, vari\'{e}t\'{e}
  commutante et bic\^{o}ne nilpotent d'une alg\`{e}bre de Lie r\'{e}ductive",3.4903414378081924e-06,0.0,2.0,0.0
math/0607571,Universal deformation rings and dihedral defect groups,3.4870386309160864e-06,0.0,1.0,0.0
math/0511524,"Classification of Quasifinite Modules over Lie Algebras of Matrix
  Differential Operators on the Circle",3.4870386309160864e-06,0.0,1.0,0.0
math/0606272,Yangians and Mickelsson Algebras II,3.4870386309160864e-06,0.0,1.0,0.0
math/0606265,Yangians and Mickelsson Algebras I,3.4870386309160864e-06,0.0,1.0,0.0
math/0502115,Monodromie algebrique des groupes d'Artin diedraux,3.4711477978623e-06,2.985274132740108e-06,2.0,2.0
math/0202148,Imaginary vectors in the dual canonical basis of $U_q(n)$,3.468810021732402e-06,0.0,5.0,4.0
math/0506056,Representation Theory of W-Algebras,3.462945707271834e-06,6.245509904453402e-06,1.0,5.0
math/0610069,Galois orders,3.462945707271834e-06,1.990182755160072e-06,1.0,1.0
math/0503058,Homological realization of the restricted Kostka polynomials,3.46143107662102e-06,0.0,4.0,0.0
math/0312478,"Fusion products, cohomology of GL(N) flag manifolds and Kostka
  polynomials",3.459437043288065e-06,6.843812866085734e-09,4.0,3.0
math/0011161,Symmetric Functions and Representations of Quantum Affine Algebras,3.4556909805325102e-06,1.4852110113134864e-08,4.0,2.0
math/0305141,Purity of equivalued affine Springer fibers,3.4481585505855954e-06,4.261368606133283e-06,4.0,5.0
math/0605695,On intersection indices of subvarieties in reductive groups,3.4476460829037417e-06,0.0,1.0,0.0
math/0604251,Cofrobenius Coalgebra,3.4433537724866293e-06,0.0,2.0,2.0
math-ph/0006013,"Optimally defined Racah-Casimir operators for su(n) and their
  eigenvalues for various classes of representations",3.4429054758462543e-06,1.9938957826883555e-06,3.0,5.0
math/9808098,Interactive games and representation theory. II. A second quantization,3.440043016639392e-06,0.0,3.0,11.0
math/0509252,"q-Schur algebras and complex reflection groups, I",3.439946349357537e-06,3.7130275282837166e-08,2.0,4.0
math/0201026,Adapted algebras and standard monomials,3.439212992138258e-06,0.0,4.0,1.0
math/0608657,"On parameterizations of rational orbits of some forms of prehomogeneous
  vector spaces",3.431318266430716e-06,0.0,3.0,0.0
math/0512102,"Symmetric Self-Adjunctions: A Justification of Brauer's Representation
  of Brauer's Algebras",3.429474335843057e-06,0.0,3.0,1.0
math/0702645,"Cohomology of the Lie Superalgebra of Contact Vector Fields on
  $\mathbb{R}^{1|1} $ and Deformations of the Superspace of Symbols",3.421824160577561e-06,0.0,4.0,0.0
math/0401387,"Representations of trigonometric Cherednik algebras of rank 1 in
  positive characteristic",3.4208119948137844e-06,0.0,3.0,0.0
math/0610971,"Towers of recollement and bases for diagram algebras: planar diagrams
  and a little beyond",3.4178337409318537e-06,0.0,5.0,1.0
math/0511737,Coxeter orbits and modular representations,3.4098274318272243e-06,0.0,2.0,0.0
math/0309131,On the Frobenius-Schur indicators for quasi-Hopf algebras,3.4092407235706405e-06,0.0,4.0,0.0
math/0509198,Cluster-tilted algebras of finite representation type,3.408560152609639e-06,7.169382186601014e-08,10.0,4.0
math/0208209,Extension-orthogonal components of nilpotent varieties,3.405233764914112e-06,0.0,3.0,0.0
math/0612043,Embedded factor patterns for Deodhar elements in Kazhdan-Lusztig theory,3.404844922429264e-06,0.0,2.0,0.0
math/0502586,"Modular representations on some Riemann-Roch spaces of modular curves
  X(N)",3.393308275689979e-06,0.0,2.0,1.0
math/9907140,Dual pairs and infinite dimensional Lie algebras,3.385932264255597e-06,0.0,4.0,0.0
math/0304172,"Beta-function of Bruhat--Tits buildings and deformation of $l_2$ on the
  space of lattices",3.377935472880877e-06,0.0,3.0,0.0
math/0202180,Casimir operators for Lie superalgebras,3.377520249617309e-06,0.0,4.0,2.0
math/0612292,Labelling the character tables of symmetric and alternating groups,3.3749066596554898e-06,0.0,1.0,0.0
math-ph/0703080,Eigenfunction Expansions of Functions Describing Systems with Symmetries,3.3749066596554898e-06,0.0,1.0,0.0
math/0612541,Regular orbit closures in module varieties,3.3749066596554898e-06,0.0,1.0,0.0
math/0309454,"The homomorphisms between scalar generalized Verma modules associated to
  maximal parabolic subalgebras",3.3749066596554898e-06,0.0,1.0,0.0
math/0507056,"Polyhedral Realizations of Crystal Bases for Quantum Algebras of Finite
  Types",3.3749066596554898e-06,0.0,1.0,0.0
math/0502501,A Poset Connected to Artin Monoids of Simply Laced Type,3.3749066596554898e-06,0.0,1.0,0.0
math/0611109,"Deformation spaces of one-dimensional formal modules and their
  cohomology",3.3749066596554898e-06,0.0,1.0,0.0
math/0403487,"Representations of reductive groups over finite rings and extended
  Deligne-Lusztig varieties",3.3749066596554898e-06,0.0,1.0,0.0
math/0209055,Cells in quantum affine sl_n,3.349618927135484e-06,0.0,3.0,1.0
math/0612640,Integral group ring of the Mathieu simple group M23,3.3312794850547613e-06,0.0,3.0,2.0
math/0612638,Integral group ring of the Mathieu simple group M12,3.3312794850547613e-06,0.0,3.0,2.0
math/0004128,Toda equations for Hurwitz numbers,3.3311310347760985e-06,2.9002034482033485e-06,7.0,5.0
math/0307343,The Generalized Segal-Bargmann transform and Special Functions,3.3153943098381222e-06,0.0,3.0,1.0
math/0507047,"Irreducibly acting subgroups of $Gl(n,\rr)$",3.3104016039337887e-06,1.214176921445874e-07,3.0,1.0
math/0403250,"Finite dimensional representations of symplectic reflection algebras
  associated to wreath products",3.300354194360201e-06,4.267400373835473e-07,5.0,5.0
math/0307053,Card shuffling and the decomposition of tensor products,3.297497792813357e-06,0.0,2.0,0.0
math/0110274,Sampling theorems for the Heisenberg groups,3.2903346293957183e-06,0.0,3.0,0.0
math/0303194,On some representations of the rational Cherednik algeba,3.2813376285486787e-06,1.5925776784732414e-05,6.0,4.0
math/0208249,Spectrum as the Support of Functional Calculus,3.274614040513025e-06,3.172682822918487e-07,5.0,2.0
math-ph/0301029,Realizations of Real Low-Dimensional Lie Algebras,3.2722403041149304e-06,4.015094187527869e-06,3.0,4.0
math/0504269,"Drinfeld coproduct, quantum fusion tensor category and applications",3.2664869898731056e-06,3.906751929072235e-06,3.0,1.0
math/9911201,"On the Casimir Elements of q-Algebras U'_q(so_n) and Their Eigenvalues
  in Representations",3.2664079235942997e-06,0.0,3.0,1.0
math/0002087,"A categorification of the Temperley-Lieb algebra and Schur quotients of
  U(sl(2)) via projective and Zuckerman functors",3.2645184828464224e-06,0.0,1.0,7.0
math/0608555,Subconvexity bounds for triple L-functions and representation theory,3.257267374433886e-06,0.0,2.0,1.0
math/9909101,"A Reducing of the Invariant Semidefinite Subspace Problem for Krein
  Noncontraction to such a Problem for Krein Isometry",3.255793443484808e-06,0.0,1.0,0.0
math/0104035,"Index hypergeometric transform and imitation of analysis of Berezin
  kernels on hyperbolic spaces",3.2540653993640758e-06,0.0,5.0,2.0
math/0608773,"The quantum Knizhnik-Zamolodchikov equation and non-symmetric Macdonald
  polynomials",3.248287972903419e-06,0.0,1.0,1.0
math/0503528,Properties of legendrian subvarieties of projective space,3.245456675980303e-06,3.86979980170014e-08,4.0,1.0
math/0606161,Twisted Burnside theorem for type II_1 groups: an example,3.2448102041180463e-06,0.0,2.0,4.0
math/9908004,"On the classification of simple modules for cyclotomic Hecke algebras of
  type G(m,1,n) and Kleshchev multipartitions",3.2442902870115976e-06,1.4852110113134864e-08,5.0,1.0
math/9908005,Lectures on cyclotomic Hecke algebras,3.2442902870115976e-06,2.22781651697023e-08,5.0,2.0
math/0609647,On Galois coverings and tilting modules,3.2439370357106485e-06,0.0,3.0,0.0
math/0405138,From p-adic to real Grassmannians via the quantum,3.241141770876093e-06,0.0,2.0,1.0
math/0603356,Derived equivalences and finite dimensional algebras,3.2367781827990027e-06,0.0,6.0,1.0
math/0401147,Invariant multidimensional matrices,3.2242794050749323e-06,0.0,1.0,0.0
math/0202101,"Induced Representations of Quantum Kinematical Algebras and Quantum
  Mechanics",3.220626479761588e-06,0.0,4.0,1.0
math/0609847,The work of Andrei Okounkov,3.2166082697012464e-06,0.0,4.0,0.0
hep-th/0506072,Tensor products of psl(2|2) representations,3.2147452136347126e-06,2.348539111093748e-07,14.0,4.0
math/0212270,Series of nilpotent orbits,3.21420891780372e-06,0.0,4.0,0.0
math/0602546,Galois module structure of Milnor K-theory mod p^s in characteristic p,3.2137619564578854e-06,0.0,2.0,1.0
math/0610493,"On the coadjoint representation of $\mathbb Z_2$-contractions of
  reductive Lie algebras",3.202695654115719e-06,0.0,2.0,1.0
math/0505379,A conjecture for q-decomposition matrices of cyclotomic v-Schur algebras,3.1946732159231825e-06,1.4852110113134864e-08,3.0,3.0
math/9907134,"Level-One Highest Weight Representations of $U_q[\hat{gl(1|1)}]$ and
  Associated Vertex Operators",3.1928547647215524e-06,1.990182755160072e-06,3.0,3.0
