id,title,pagerank,betweenness,in_degree,out_degree
math/0612845,A combinatorial proof of a Weyl type formula for hook Schur polynomials,6.594238015689026e-06,0.0,2.0,0.0
math/0511384,"Applications of BGP-reflection functors: isomorphisms of cluster
  algebras",6.53042043970892e-06,0.0009486405484816,7.0,3.0
math/0601550,McKay correspondence over non algebraically closed fields,6.504540403684989e-06,0.0,5.0,1.0
math/0606682,"Simple Lie superalgebras and nonintegrable distributions in
  characteristic p",6.464018665181944e-06,3.178940474990269e-06,7.0,2.0
math/0608698,The Quiver of the Semigroup Algebra of a Left Regular Band,6.445021149456035e-06,0.0,1.0,1.0
math/0003231,Connected components of real double Bruhat cells,6.440064720667887e-06,0.0,3.0,0.0
math/0608276,A combinatorial rule for (co)minuscule Schubert calculus,6.434304110749595e-06,0.0,4.0,5.0
math/0312452,"On the Cachazo-Douglas-Seiberg-Witten conjecture for simple Lie
  algebras, II",6.400606454498276e-06,0.0,5.0,0.0
math/0608145,On multiplicity-free skew characters and the Schubert Calculus,6.372295753300662e-06,0.0,1.0,1.0
math/0609819,The small quantum group and the Springer resolution,6.34336772981383e-06,0.0,7.0,0.0
math/0605626,The centralizer of a nilpotent section,6.338766187495358e-06,0.0,4.0,0.0
math/0607577,Construction of G-Hilbert schemes,6.293816714956508e-06,0.0,4.0,1.0
math/0702340,Smooth Projective Symmetric Varieties with Picard Number equal to one,6.274603050728663e-06,0.0,2.0,1.0
math/0601023,Algebraic Hamiltonian actions,6.2715208561448285e-06,0.0,3.0,2.0
math/0502035,"Reflection functors and symplectic reflection algebras for wreath
  products",6.237684540690523e-06,4.049731923826915e-08,10.0,4.0
math/0311493,Cluster algebras: Notes for the CDM-03 conference,6.189425388331203e-06,2.143514727996857e-05,15.0,8.0
math/0210256,"The generalized triangle inequalities in symmetric spaces and buildings
  with applications to algebra",6.184020412583943e-06,2.5870519303316797e-05,2.0,10.0
math/0612174,Finite-Dimensional Representations of Hyper Loop Algebras,6.175324394507004e-06,0.0,5.0,0.0
math/0310098,Thompson's conjecture for real semi-simple Lie groups,6.153368909429176e-06,6.86296864480049e-05,4.0,2.0
math/0606412,"Hochschild and cyclic homology of central extensions of preprojective
  algebras of ADE quivers",6.124264804562859e-06,0.0,4.0,1.0
math/0309251,Category O over a deformation of the symplectic oscillator algebra,6.114743593233446e-06,0.0,1.0,2.0
math/0302294,A geometric Littlewood-Richardson rule,6.08899211306445e-06,0.0,4.0,8.0
math/0510187,Projective unitary representations of smooth Deligne cohomology groups,6.080111667247158e-06,0.0,4.0,1.0
math/0703288,Zassenhaus conjecture for $A_{6}$,6.079941090797531e-06,0.0,5.0,0.0
math/0701045,Category O and sl(k) link invariants,6.074143342213919e-06,0.0,6.0,1.0
math/0703153,"Calogero-Moser space, reduced rational Cherednik algebras, and two-sided
  cells",6.067243684777289e-06,1.4852110113134864e-08,3.0,4.0
math/0312474,"Cherednik algebras and Hilbert schemes in characteristic p (with an
  appendix by Pavel Etingof)",6.053315663797871e-06,2.1765967119207194e-06,10.0,8.0
math/0002165,"Degenerate affine Hecke algebras and centralizer construction for the
  symmetric groups",6.023764081581857e-06,0.0,4.0,0.0
math/0202181,The Howe duality and Lie superalgebras,6.012542929063747e-06,0.0,7.0,3.0
math/0506115,Iwahori-Hecke Algebras of SL_2 over 2-dimensional Local Fields,6.011322022280661e-06,0.0,2.0,0.0
math/0702298,"Notes on two-parameter quantum groups, (I)",5.987458297252676e-06,0.0,4.0,0.0
math/0506539,"A two-parametric deformation of U[sl(2)], its representations and
  complex ""spin""",5.986566444737082e-06,0.0,4.0,1.0
math/0501548,Homological algebra for Schwartz algebras of reductive p-adic groups,5.986038792873094e-06,0.0,4.0,3.0
math/0405176,Quantized symplectic oscillator algebras of rank one,5.9846195316294e-06,1.990182755160072e-06,3.0,1.0
math/0309372,"Identities between q-hypergeometric and hypergeometric integrals of
  different dimensions",5.983783864408512e-06,2.985274132740108e-06,3.0,2.0
math/0703472,Einstein solvmanifolds are standard,5.97105701329057e-06,0.0,2.0,1.0
math/0311512,Vector valued spherical functions and Macdonald-Koornwinder polynomials,5.962538503207798e-06,0.0,4.0,1.0
math/0208215,"A Convexity property for the SO(2,C)-double coset decomposition of
  SL(2,C) and applications to spherical functions",5.927773615503002e-06,0.0,4.0,0.0
math/0504101,"Lifting smooth curves over invariants for representations of compact Lie
  groups, III",5.88336443511138e-06,0.0,5.0,1.0
math/0309016,"Filtrations and completions of certain positive level modules of affine
  algebras",5.864610839831283e-06,0.0,2.0,0.0
math/0503029,Configurations in abelian categories. II. Ringel-Hall algebras,5.844319727172033e-06,3.373339823214603e-08,9.0,8.0
math/0506147,Nakajima monomials and crystals for special linear Lie algebras,5.844046154605155e-06,0.0,2.0,3.0
math/0702583,"The argument shift method and maximal commutative subalgebras of Poisson
  algebras",5.837629356439407e-06,0.0,3.0,0.0
math/0411252,"Relation between two geometrically defined bases in representations of
  $GL_n$",5.815345098094435e-06,0.0,2.0,1.0
math/0612101,The classification problem for pseudo-Riemannian symmetric spaces,5.812362962296095e-06,0.0,2.0,0.0
math/0501192,Continuous Hecke algebras,5.761892306487823e-06,2.0964613555700306e-06,5.0,2.0
math/0508421,"A Computational Solution to a Question by Beauville on the Invariants of
  the Binary Quintic",5.735320599853928e-06,0.0,3.0,0.0
math/0611532,Extended canonical algebras and Fuchsian singularities,5.7308481117742414e-06,1.990182755160072e-06,2.0,1.0
math/0605100,"From triangulated categories to abelian categories--cluster tilting in a
  general framework",5.724526117078026e-06,9.282568820709291e-09,2.0,5.0
math/0411105,On two geometric constructions of U(sl_n) and its representations,5.714266510496676e-06,0.0,1.0,1.0
math/0406253,On unitary representations of groups of isometries,5.6851476722624685e-06,0.0,4.0,0.0
math/0608712,Fine Hochschild invariants of derived categories for symmetric algebras,5.679326981876062e-06,0.0,3.0,0.0
math/0602638,The center of quantum symmetric pair coideal subalgebras,5.655144290770314e-06,0.0,1.0,1.0
math/0508162,Bases for certain cohomology representations of the symmetric group,5.655144290770314e-06,0.0,1.0,1.0
math/0608301,On the evaluation of some Selberg-like integrals,5.655144290770314e-06,0.0,1.0,1.0
math/0505370,On the Ext groups between Weyl modules for GL_n,5.655144290770314e-06,0.0,1.0,1.0
math/0607478,An exotic Springer correspondence for symplectic groups,5.655144290770314e-06,0.0,1.0,1.0
math/0601155,An exotic Deligne-Langlands correspondence for symplectic groups,5.655144290770314e-06,0.0,1.0,1.0
math/0607130,Twisted loop groups and their affine flag varieties,5.655144290770314e-06,0.0,1.0,1.0
math/0312006,"The symmetric group representation on cohomology of the regular elements
  of a maximal torus of the special linear group",5.655144290770314e-06,0.0,1.0,1.0
math/0401105,A simple proof of Bernstein-Lunts equivalence,5.655144290770314e-06,0.0,1.0,1.0
math/0405238,"Finite good filtration dimension for modules over an algebra with good
  filtration",5.655144290770314e-06,0.0,1.0,1.0
math/0403361,A reductive group with finitely generated cohomology algebras,5.655144290770314e-06,0.0,1.0,1.0
math/0401106,Equivariant analogues of Zuckerman functors,5.655144290770314e-06,0.0,1.0,1.0
math/0505371,A homological interpretation of Jantzen's sum formula,5.655144290770314e-06,0.0,1.0,1.0
math/0608167,On a class of multiplicity-free nilpotent K_C-orbits,5.655144290770314e-06,0.0,1.0,1.0
math/0411110,"Brill-Gordan Loci, Transvectants and an Analogue of the Foulkes
  Conjecture",5.634924526589387e-06,1.1941096530960432e-05,3.0,3.0
hep-th/0504234,Representation theory of sl(2|1),5.632746705529306e-06,1.6150165570191876e-07,16.0,3.0
math/0609363,Cohomology and Support Varieties for Lie Superalgebras,5.6313145570452535e-06,0.0,2.0,0.0
math/0609764,"Total positivity, Grassmannians, and networks",5.513987695259037e-06,6.011210677206626e-06,6.0,4.0
math/0703107,Quiver varieties and Frenkel-Kac construction,5.486532865422557e-06,0.0,1.0,0.0
cs/9809119,"Droems: experimental mathematics, informatics and infinite dimensional
  geometry",5.469945661302049e-06,0.0,8.0,4.0
math/0703150,"Quiver varieties, category O for rational Cherednik algebras, and Hecke
  algebras",5.469210685694588e-06,5.940844045253947e-08,4.0,3.0
math/0407414,"Cluster algebras: notes for 2004 IMCC (Chonju, Korea, August 2004)",5.452476525149232e-06,2.97041331679394e-05,15.0,5.0
math/0501109,"Poisson structures on affine spaces and flag varieties. I. Matrix affine
  Poisson space",5.441294754452351e-06,0.0,2.0,4.0
math/0304173,"Quantum Groups, the loop Grassmannian, and the Springer resolution",5.436477328064559e-06,2.6050294252166354e-06,9.0,2.0
math/0411420,"Notes on Stein-Sahi representations and some problems of non $L^2$
  harmonic analysis",5.436149187558247e-06,0.0,4.0,0.0
math/0007006,A class of T-stable (P1 x ... x P1)'s in G/B,5.435249081675914e-06,0.0,2.0,1.0
math/0511689,"Repr\'esentations cohomologiques isol\'ees, applications cohomologiques",5.430880348249121e-06,0.0,3.0,0.0
math/0412150,Geometric Bessel models for GSp_4 and multiplicity one,5.414180777971969e-06,0.0,2.0,0.0
math/0202208,Uhlenbeck spaces for $A^2$ and affine Lie algebra $\hat{sl}_n$,5.397306984030689e-06,1.990182755160072e-06,4.0,1.0
math/0311428,"Horn's Problem, Vinnikov Curves and the Hive Cone",5.391253029496631e-06,3.877880163436794e-05,4.0,2.0
math/0612572,Pascal arrays: counting Catalan sets,5.382174995082971e-06,0.0,6.0,0.0
math/0608234,"Parabolic category O, perverse sheaves on Grassmannians, Springer fibres
  and Khovanov homology",5.3657579905975815e-06,1.6787332678132394e-05,3.0,10.0
math/0701648,Lax operator algebras,5.36368988922189e-06,0.0,4.0,0.0
math/0607260,Courbes elliptiques sur la variete spinorielle,5.346849529281955e-06,0.0,2.0,0.0
math/0407367,On Bethe vectors in the sl_{N+1} Gaudin model,5.329620674132362e-06,0.0,6.0,1.0
math/0003108,A Survey of Noncommutative Chern Characters,5.327270386780987e-06,0.0,7.0,0.0
math/0211354,Two character formulas for $\hat{sl_2}$ spaces of coinvariants,5.302046810129974e-06,6.168369609566764e-06,8.0,2.0
math/0304380,"Short antichains in root systems, semi-Catalan arrangements, and
  B-stable subspaces",5.300076304869005e-06,0.0,5.0,2.0
math/0612429,"Partial augmentations and Brauer character values of torsion units in
  group rings",5.221429495811374e-06,3.995217620433279e-06,4.0,5.0
math/0610071,Fibers of characters in Harish-Chandra categories,5.208421956459475e-06,0.0,1.0,0.0
math/0210463,Abelian ideals in a Borel subalgebra of a complex simple Lie algebra,5.202534404790843e-06,0.0,3.0,2.0
math/0504253,"On a generic Verma module at the critical level over affine Lie
  superalgebras",5.195348759909423e-06,0.0,2.0,0.0
math/0608612,"Preprojective representations of valued quivers and reduced words in the
  Weyl group of a Kac-Moody algebra",5.184129200172126e-06,0.0,4.0,0.0
math/0004039,"Intertwining operator superalgebras and vertex tensor categories for
  superconformal algebras, II",5.183010070534542e-06,1.96790458999037e-06,4.0,2.0
math/0407239,Positivity in equivariant quantum Schubert Calculus,5.183007931128372e-06,0.0,6.0,2.0
math/0605233,"Character formulas for the operad of two compatible brackets and for the
  bihamiltonian operad",5.167386680189e-06,0.0,4.0,0.0
math/0703291,Separation cutoffs for random walk on irreducible representations,5.156909096561352e-06,0.0,2.0,0.0
math/0611535,A Chebycheff recursion formula for Coxeter polynomials,5.138055766279636e-06,0.0,1.0,0.0
math/0411331,Chern classes of reductive groups and an adjunction formula,5.128507879521577e-06,0.0,2.0,2.0
math/0509528,"Orthogonal polynomials of discrete variable and Lie algebras of complex
  size matrices",5.117609149085249e-06,0.0,3.0,1.0
math/0411101,"Framed quiver moduli, cohomology, and quantum groups",5.116871452168377e-06,0.0,2.0,1.0
math/0409593,Categorification of the braid groups,5.115136768183448e-06,0.0,2.0,7.0
math/0603524,Geometric realizations of Wakimoto modules at the critical level,5.106809905442725e-06,0.0,6.0,1.0
math/0304020,"Affine Krichever-Novikov algebras, their representations and
  applications",5.087572944054396e-06,4.1008421748879316e-08,5.0,2.0
math/9801136,Quasifinite representations of classical Lie subalgebras of W_{1+infty},5.070452446817819e-06,0.0,5.0,0.0
math/0611540,Principal subspaces of higher-level standard sl(3)^-modules,5.070048649115575e-06,0.0,8.0,1.0
math/0508382,Local geometric Langlands correspondence and affine Kac-Moody algebras,5.056794288236791e-06,5.011734128454298e-06,7.0,11.0
math/0604054,Laurent expansions in cluster algebras via quiver representations,5.0548575498594646e-06,4.032399826171057e-06,8.0,2.0
math/0410293,"Rational Cherednik algebras and Hilbert schemes II: representations and
  sheaves",5.036432804351298e-06,3.9194139934922146e-08,3.0,5.0
hep-th/9905063,Determinant Formula for the Topological N=2 Superconformal Algebra,5.035679139727929e-06,2.2400964399376583e-05,10.0,4.0
math/9904127,The Charge Quantum Numbers of Gauge Invariant Quasi-free Endomorphisms,5.031806460041623e-06,0.0,1.0,0.0
math/0206237,Twisted K-theory and loop groups,5.027945849365673e-06,4.808771866985096e-06,13.0,10.0
quant-ph/0612089,"On the impossibility of a quantum sieve algorithm for graph isomorphism:
  unconditional results",4.986426272360601e-06,3.503724220095187e-07,4.0,3.0
math/0509700,Dual canonical bases and Kazhdan-Lusztig polynomials,4.97852203594997e-06,7.172597994030682e-09,3.0,2.0
math/0505500,Three-dimensional Anosov flag manifolds,4.967425670671966e-06,0.0,4.0,0.0
math/0409570,Degenerations for derived categories,4.966907238954575e-06,0.0,1.0,0.0
math/0106057,ad-Nilpotent ideals of a Borel subalgebra II,4.966907238954575e-06,0.0,1.0,2.0
math/9911058,"$U_q[\hat{sl(2|1)}]$ Vertex Operators, Screen Currents and Correlation
  Functions at Arbitrary Level",4.948183845759878e-06,0.0,3.0,0.0
math-ph/0306056,"A Method for Weight Multiplicity Computation Based on Berezin
  Quantization",4.942159845520089e-06,0.0,4.0,0.0
math/0501272,"Subrepresentations in the Polynomial Representation of the Double Affine
  Hecke Algebra of type $GL_n$ at $t^{k+1}q^{r-1}=1$",4.9390373964001945e-06,0.0,5.0,0.0
math/0605451,Demazure structure inside Kirillov-Reshetikhin crystals,4.92846586578466e-06,0.0,4.0,1.0
math/0403048,"Character sheaves on disconnected groups, V",4.911186874469205e-06,0.0,4.0,1.0
math/0101015,Quantized Algebras of Functions on Affine Hecke Algebras,4.90507244156189e-06,0.0,3.0,1.0
math/0509075,Poisson structures on affine spaces and flag varieties. II. General case,4.899689528521081e-06,0.0,2.0,5.0
math/0610540,"Upper bound on the characters of the symmetric groups for balanced Young
  diagrams and a generalized Frobenius formula",4.897340509806431e-06,0.0,4.0,2.0
math-ph/0006026,"Compilation of relations for the antisymmetric tensors defined by the
  Lie algebra cocycles of $su(n)$",4.896776542926542e-06,1.979186481326309e-06,11.0,2.0
math/0506348,On compactifications of the Steinberg zero-fiber,4.894820720626032e-06,0.0,4.0,0.0
math/0610819,Counterexamples to Okounkov's Log-Concavity Conjecture,4.887892070703837e-06,0.0,4.0,0.0
math/0609833,"Logarithmic tensor product theory for generalized modules for a
  conformal vertex algebra, Part I",4.883773173662569e-06,2.4837821125147995e-05,3.0,4.0
math/0703371,B-orbits of nilpotent order 2 and link patterns,4.881929071148736e-06,0.0,4.0,0.0
math-ph/0305043,Random partitions and the Gamma kernel,4.865514328901941e-06,3.4453663964918718e-06,17.0,8.0
math/0307227,A vector partition function for the multiplicities of sl_k(C),4.862430717870804e-06,3.980365510320144e-06,3.0,2.0
math/0106079,"Combinatorics and invariant differential operators on multiplicity free
  spaces",4.837857736334099e-06,0.0,2.0,1.0
math/0411647,"Asymptotics of characters of symmetric groups, genus expansion and free
  probability",4.837481124801807e-06,0.0,3.0,2.0
math/0206036,"Howe Duality and Combinatorial Character Formula for Orthosymplectic Lie
  superalgebras",4.8281436580568725e-06,0.0,3.0,1.0
math/0606377,Periodicity of Y-systems and flat connections,4.826262841456079e-06,2.22781651697023e-08,4.0,1.0
math/9807142,"Infinite dimensional geometry of $M_1=Diff_+(S^1)/PSL(2,R)$ and
  $q_R$-conformal symmetries. II. Geometric quantization and hidden symmetries
  of Verma modules over Virasoro algebra",4.805881577412675e-06,0.0,2.0,0.0
math/0401245,"Duality for Knizhnik-Zamolodchikov and Dynamical Equations, and
  Hypergeometric Integrals",4.803078015490474e-06,0.0,3.0,6.0
math/0601537,Cluster-tilted algebras as trivial extensions,4.790060678946121e-06,0.0009466208316095,6.0,7.0
math/0501218,"Nonintersecting Paths, Noncolliding Diffusion Processes and
  Representation Theory",4.783284478547076e-06,0.0,5.0,0.0
math/0111005,Cherednik algebras and differential operators on quasi-invariants,4.776207368272054e-06,7.034871919648848e-05,8.0,18.0
math/0607679,Rationality of vertex operator algebras,4.771217299854308e-06,0.0,4.0,0.0
math/0307122,"LS-Galleries, the path model and MV-cycles",4.77087406634764e-06,1.2185346369469797e-08,2.0,3.0
math/9909082,"A classification of the principal nilpotent pairs in simple Lie algebras
  and related problems",4.767389838870325e-06,0.0,3.0,0.0
math/0401077,"A Littlewood-Richardson rule for evaluation representations of quantum
  affine sl(n)",4.740966357083738e-06,0.0,1.0,0.0
math/0103144,Regularity of invariant distributions,4.7393482595704855e-06,0.0,2.0,3.0
math/0302171,Orbites coadjointes et vari\'et\'es caract\'eristiques,4.7195712980078185e-06,2.5876341166929696e-06,10.0,2.0
math/0403277,Singular polynomials for the symmetric groups,4.716430779979648e-06,2.5872375817080932e-05,3.0,2.0
math/0503435,Extraspecial 2-groups and images of braid group representations,4.716063731483266e-06,1.2279217783813824e-07,3.0,4.0
math/0403524,Twisted representation rings and Dirac induction,4.701612163537926e-06,1.7830397530192956e-06,5.0,2.0
math/0412077,Cluster mutation via quiver representations,4.700934166175292e-06,4.167418406912488e-06,10.0,21.0
math/0608183,"Projective toric varieties as fine moduli spaces of quiver
  representations",4.691180243045955e-06,5.348302257429213e-08,2.0,2.0
math/0311353,Good orbital integrals,4.686211170374481e-06,1.7183384605833671e-06,7.0,2.0
math/0312158,Deformation of Weyl Modules and Generalized Parking Functions,4.678444595389851e-06,4.124323907196551e-07,9.0,1.0
math/0204025,"The representation theory of the Ariki-Koike and cyclotomic q-Schur
  algebras",4.674316967281031e-06,0.0,6.0,1.0
math/0303213,"Central Invariants and Frobenius-Schur Indicators for Semisimple
  Quasi-Hopf Algebras",4.671703184405738e-06,1.419243222172063e-07,4.0,3.0
math/0510562,Finite Simple Groups as Expanders,4.659266951852776e-06,0.0,4.0,0.0
math/0609769,"A motivated introduction to character sheaves and the orbit method for
  unipotent groups in positive characteristic",4.651340137579245e-06,0.0,3.0,1.0
math/0107052,"Parameterizing Hecke algebra modules: Bernstein-Zelevinsky
  multisegments, Kleshchev multipartitions, and crystal graphs",4.647891986441586e-06,0.0,1.0,0.0
math/0501057,Geometric representation theory for unitary groups of operator algebras,4.636336303075177e-06,0.0,3.0,0.0
math/0506499,On the Kashiwara-Vergne conjecture,4.636225955638153e-06,0.0,2.0,2.0
math/0508440,Some remarks on quantized Lie superalgebras of classical type,4.625401703115303e-06,0.0,5.0,0.0
math-ph/0206044,6j-symbols for symmetric representations of SO(n) as the double series,4.620254345190977e-06,3.980365510320144e-06,3.0,2.0
math/0509472,How to realize Lie algebras by vector fields,4.6198795431741614e-06,4.302512885801556e-06,4.0,4.0
math/9908008,"Vertex Operators of $U_q[\hat{gl(N|N)}]$ and Highest Weight
  Representations of $U_q[\hat{gl(2|2)}]$",4.6196579456792326e-06,1.990182755160072e-06,5.0,2.0
math/0212369,A non radical based approach to study of associative algebras,4.60993236530809e-06,0.0,3.0,0.0
math/0503563,Affine embeddings of homogeneous spaces,4.5882885240249376e-06,0.0,2.0,0.0
math/0201073,Perverse sheaves on affine flags and Langlands dual group,4.572652128962204e-06,4.166486322897171e-05,5.0,10.0
math/0510251,From triangulated categories to cluster algebras II,4.5637792842914565e-06,0.000946571164766,10.0,14.0
math/0405383,Representations of the rational Cherednik algebras of dihedral type,4.548104872903389e-06,1.3551524047073268e-06,8.0,3.0
math/0305195,"Finite-dimensional representations of U_q[gl(2/1)] in a basis of
  U_q[gl(2)\oplus gl(1)]",4.54255141624943e-06,0.0,6.0,0.0
math/9805001,Approximate representations and Virasoro algebra,4.542503782677871e-06,0.0,4.0,2.0
math/0501494,Singular Polynomials and Modules for the Symmetric Groups,4.538193217953484e-06,2.1892010306760792e-05,1.0,2.0
math/0605217,Schur-Weyl duality for higher levels,4.515161670839859e-06,1.4906582038324178e-05,3.0,5.0
math/0407516,Rational Cherednik algebras and Hilbert schemes,4.509953342802213e-06,1.6032305075753934e-05,5.0,7.0
math/0504395,Deformed Harish-Chandra homomorphism for the cyclic quiver,4.499428996580454e-06,2.4087752556283365e-06,4.0,1.0
math/0210450,"Path Model for a Level Zero Extremal Weight Module over a Quantum Affine
  Algebra",4.489883999246117e-06,0.0,3.0,1.0
math/0009192,"ADE-bundles over rational surfaces, configuration of lines and rulings",4.469378921145011e-06,1.593441003471254e-05,1.0,3.0
math/0609405,"An algorithm for computing the canonical bases of higher-level
  q-deformed Fock spaces",4.469144005060815e-06,0.0,2.0,0.0
math/0406073,"A geometric construction of crystal graphs using quiver varieties:
  Extension to the non-simply laced case",4.448921219904863e-06,0.0,3.0,0.0
math/0402188,Structures and Representations of Generalized Path Algebras,4.441168092398221e-06,1.990182755160072e-06,2.0,1.0
math/0210428,Abelian ideals of a Borel subalgebra and long positive roots,4.441168092398221e-06,0.0,2.0,4.0
math/0207078,"Travaux de Frenkel, Gaitsgory et Vilonen sur la correspondance de
  Drinfeld-Langlands",4.439860713062182e-06,0.0,3.0,2.0
math/9908012,"Eigenvalues, invariant factors, highest weights, and Schubert calculus",4.4342009489937885e-06,8.016338796889964e-06,8.0,7.0
math/0208138,Finite dimensional representations of rational Cherednik algebras,4.433846199448133e-06,2.016276831500687e-05,10.0,6.0
math/9904098,On a Conjecture of Kac-Wakimoto,4.427871027202408e-06,7.213308556347265e-06,10.0,3.0
math/0503220,New examples of indefinite hyper-Kaehler symmetric spaces,4.413083258648293e-06,1.7831965735233972e-06,4.0,1.0
math/0307176,Simple singularities and integrable hierarchies,4.386462775950856e-06,1.3093824590481992e-08,5.0,2.0
math/0701189,Cabling Burau Representation,4.3802847097823846e-06,0.0,1.0,0.0
math/0502119,L'algebre de Lie des transpositions,4.3802847097823846e-06,0.0,1.0,1.0
math-ph/9809024,"Highest weight irreducible representations of the Lie superalgebra
  $gl(1/\infty)$",4.3784974436951225e-06,0.0,7.0,0.0
math/0602089,Quantization of branching coefficients for classical Lie groups,4.376356312780318e-06,1.990182755160072e-06,1.0,1.0
math/0310361,Whittaker and Bessel functors for GSp_4,4.368948430054917e-06,0.0,4.0,1.0
math/0605005,"Rational semistandard tableaux and character formula for the Lie
  superalgebra $\hat{\frak{gl}}_{\infty|\infty}$",4.3687517815191786e-06,0.0,2.0,1.0
math/0311347,Ideals of Heisenberg type and minimax elements of affine Weyl groups,4.341551635609961e-06,0.0,3.0,2.0
math-ph/0610059,"Differential operators on supercircle: conformally equivariant
  quantization and symbol calculus",4.320027961179198e-06,1.990182755160072e-06,4.0,1.0
math/0605103,TQFT with corners and tilting functors in the Kac-Moody case,4.3096168834483936e-06,0.0,5.0,7.0
math/0601511,"Geometric and Combinatorial Realizations of Crystals of Enveloping
  Algebras",4.306206673710396e-06,0.0,3.0,1.0
math/0403072,Composition Kostka functions,4.301483685627278e-06,1.990182755160072e-06,5.0,1.0
math/0612206,"Current algebras, highest weight categories and quivers",4.300508524099575e-06,0.0,2.0,0.0
math/0110006,Resolutions of p-Modular TQFT's and Representations of Symmetric Groups,4.296793717769526e-06,1.336689910182138e-07,2.0,3.0
math/0612478,The finite Rat-splitting for coalgebras,4.295824559865384e-06,0.0,2.0,0.0
math/0601655,Harmonic Analysis on Homogeneous Spaces,4.295439461555972e-06,0.0,6.0,0.0
math/0502500,The degree of the discriminant of irreducible representations,4.292556062076476e-06,0.0,1.0,0.0
math/0608152,Givental Integral Representation for Classical Groups,4.279142721752606e-06,4.754227643935103e-07,5.0,1.0
math/0309334,Poisson structures on complex flag manifolds associated with real forms,4.278670187138834e-06,0.0,1.0,0.0
math/0601700,"Representations of residually finite groups by isometries of the Urysohn
  space",4.277930499610127e-06,0.0,3.0,2.0
math/0607589,Some homological properties of the category $\mathcal{O}$,4.275572254689585e-06,0.0,5.0,1.0
math/0407055,Correspondance locale de Langlands et monodromie des espaces de Drinfeld,4.267562788740003e-06,0.0,2.0,0.0
hep-th/0107222,"Minimal representations, spherical vectors, and exceptional theta series
  I",4.265200421702256e-06,3.190594897015731e-06,20.0,14.0
math/0603588,Representations of vertex operator algebras,4.259788068091749e-06,1.947182011830243e-06,5.0,2.0
math/9812106,Bosonic formula for level-restricted paths,4.256206864352921e-06,0.0,6.0,5.0
