id,title,pagerank,betweenness,in_degree,out_degree
math/0305322,A Generalisation of an Ostrowski Inequality in Inner Product Spaces,1.3189329710618589e-06,0.0,0.0,1.0
math/0507299,Some Remarks on CMV Matrices and Dressing Orbits,1.3189329710618589e-06,0.0,0.0,2.0
math/9501219,Lectures on the affine Hecke algebras and Macdonald conjectures,1.3189329710618589e-06,0.0,0.0,2.0
math/0411247,Geometric Aspects of the Moduli Space of Riemann Surfaces,1.3189329710618589e-06,0.0,0.0,2.0
math/0505555,Multiple operator integrals and higher operator derivatives,1.3189329710618589e-06,0.0,0.0,2.0
math/0402031,A Christoffel-Darboux formula for multiple orthogonal polynomials,1.3189329710618589e-06,0.0,0.0,1.0
math/0109174,The causal structure of microlocalized Einstein metrics,1.3189329710618589e-06,0.0,0.0,3.0
math/0406261,"Analytic representation of functions and a new quasi-analyticity
  threshold",1.3189329710618589e-06,0.0,0.0,1.0
math/0412051,Convergence of Markov processes near saddle fixed points,1.3189329710618589e-06,0.0,0.0,1.0
math/0701458,"Optimal control of a large dam, taking into account the water costs",1.3189329710618589e-06,0.0,0.0,1.0
math/0302261,"A generalized mean value inequality for subharmonic functions and
  applications",1.3189329710618589e-06,0.0,0.0,1.0
math/9907110,Small eigenvalues of large Hankel matrices:The indeterminate case,1.3189329710618589e-06,0.0,0.0,1.0
math/0602283,Symmetric Joins and Weighted Barycenters,1.3189329710618589e-06,0.0,0.0,1.0
math/0612265,"Mappings and spaces, 2",1.3189329710618589e-06,0.0,0.0,1.0
math/0612400,"Two Variable Orthogonal Polynomials on the Bi-circle and Structured
  Matrices",1.3189329710618589e-06,0.0,0.0,1.0
math/9904176,\Lambda(p)-sets and the limit order of operator ideals,1.3189329710618589e-06,0.0,0.0,1.0
math/0603351,"Distributions with dynamic test functions and multiplication by
  discontinuous functions",1.3189329710618589e-06,0.0,0.0,1.0
math/0007014,Lusternik--Schnirelmann theory on general spaces,1.3189329710618589e-06,0.0,0.0,1.0
math/9904066,"Packing, tiling, orthogonality and completeness",1.3189329710618589e-06,0.0,0.0,1.0
math/0211171,Some topics pertaining to algebras of linear operators,1.3189329710618589e-06,0.0,0.0,1.0
math/0604472,"A certain class of Laplace transforms with applications to reaction and
  reaction-diffusion equations",1.3189329710618589e-06,0.0,0.0,1.0
math/0605522,The Littlewood-Gowers problem,1.3189329710618589e-06,0.0,0.0,1.0
math/0608109,"Lattice points on circles, squares in arithmetic progressions and
  sumsets of squares",1.3189329710618589e-06,0.0,0.0,1.0
math/0101051,Multiple Equilibria for an SIRS Epidemiological System,1.3189329710618589e-06,0.0,0.0,1.0
math/0512306,"Convolutions and mean square estimates of certain number-theoretic error
  terms",1.3189329710618589e-06,0.0,0.0,1.0
math/0607122,A new multivariable 6-psi-6 summation formula,1.3189329710618589e-06,0.0,0.0,1.0
math-ph/0505063,"Lectures on chainlet geometry - new topological methods in geometric
  measure theory",1.3189329710618589e-06,0.0,0.0,2.0
math-ph/0501001,Ravello lecture notes on geometric calculus -- Part I,1.3189329710618589e-06,0.0,0.0,2.0
math/9307207,The q-harmonic oscillator and the Al-Salam and Carlitz polynomials,1.3189329710618589e-06,0.0,0.0,1.0
math/9411229,On a general q-Fourier transformation with nonsymmetric kernels,1.3189329710618589e-06,0.0,0.0,1.0
math/0207122,Symmetric Functions and B_N-invariant Spherical Harmonics,1.3189329710618589e-06,0.0,0.0,1.0
math/0611936,Fuglede's conjecture fails in dimension 4,1.3189329710618589e-06,0.0,0.0,1.0
math/0612016,On Fuglede's conjecture and the existence of universal spectra,1.3189329710618589e-06,0.0,0.0,1.0
math/9902034,Normal forms of real hyepersurfaces with nondegenerate Levi form,1.3189329710618589e-06,0.0,0.0,1.0
math/9902035,Umbilic points and Real hyperquadrics,1.3189329710618589e-06,0.0,0.0,1.0
math/0001033,Askey-Wilson polynomials: an affine Hecke algebraic approach,1.3189329710618589e-06,0.0,0.0,8.0
math/9902036,Analytic continuation of a biholomorphic mapping,1.3189329710618589e-06,0.0,0.0,1.0
math/9506216,Addition formulas for q-special functions,1.3189329710618589e-06,0.0,0.0,1.0
math/0102080,"On the valuation of arithmetic-average Asian options: the Geman-Yor
  Laplace transform revisited",1.3189329710618589e-06,0.0,0.0,1.0
math/0311195,On a combinatorial problem of Asmus Schmidt,1.3189329710618589e-06,0.0,0.0,1.0
math/0405050,"Another proofs of the geometrical forms of Paley-Wiener theorems for the
  Dunkl transform and inversion formulas for the Dunkl interwining operator and
  for its dual",1.3189329710618589e-06,0.0,0.0,1.0
math/0503423,Potential theoretic approach to rendezvous numbers,1.3189329710618589e-06,0.0,0.0,2.0
math/0102145,The Sidon constant of sets with three elements,1.3189329710618589e-06,0.0,0.0,2.0
math/0407344,Low-pass filters and representations of the Baumslag Solitar group,1.3189329710618589e-06,0.0,0.0,2.0
math/0204248,"Riemann--Hilbert analysis for Laguerre polynomials with large negative
  parameter",1.3189329710618589e-06,0.0,0.0,1.0
math/0112269,"Critical points of functions, sl_2 representations, and Fuchsian
  differential equations with only univalued solutions",1.3189329710618589e-06,0.0,0.0,7.0
math/0502406,"Littlewood-Paley decompositions and Besov spaces on Lie groups of
  polynomial growth",1.3189329710618589e-06,0.0,0.0,2.0
nlin/0206009,Computing Riemann Theta Functions,1.3189329710618589e-06,0.0,0.0,2.0
math-ph/0001037,Abel ODEs: Equivalence and Integrable Classes,1.3189329710618589e-06,0.0,0.0,3.0
math/9307206,The q-harmonic oscillator and an analog of the Charlier polynomials,1.3189329710618589e-06,0.0,0.0,2.0
math/0311181,Recent progress on the restriction conjecture,1.3189329710618589e-06,0.0,0.0,1.0
math/0411120,The $L^p$ Dirichlet Problem for Elliptic Systems on Lipschitz Domains,1.3189329710618589e-06,0.0,0.0,2.0
math/0307187,Coherent states for the Legendre oscillator,1.3189329710618589e-06,0.0,0.0,5.0
math/0607668,An application of a local version of Chang's theorem,1.3189329710618589e-06,0.0,0.0,2.0
math/0010162,"A new A_n extension of Ramanujan's 1-psi-1 summation with applications
  to multilateral A_n series",1.3189329710618589e-06,0.0,0.0,2.0
math/0402354,Ramanujan's Approximation to the nth Partial Sum of the Harmonic Series,1.3189329710618589e-06,0.0,0.0,2.0
math/0306233,The best bounds of harmonic sequence,1.3189329710618589e-06,0.0,0.0,2.0
math/0311510,Counting Integral Lam\'e Equations by Means of Dessins d'Enfants,1.3189329710618589e-06,0.0,0.0,2.0
math/0407391,"The image of the heat kernel transform on Riemannian symmetric spaces of
  the noncompact type",1.3189329710618589e-06,0.0,0.0,2.0
math/0504030,"Necessary conditions for vector-valued operator inequalities in harmonic
  analysis",1.3189329710618589e-06,0.0,0.0,1.0
math/0002226,Orthogonal Polynomials and Generalized Oscillator Algebras,1.3189329710618589e-06,0.0,0.0,7.0
math/9906097,"A new bound on partial sum-sets and difference-sets, and applications to
  the Kakeya conjecture",1.3189329710618589e-06,0.0,0.0,2.0
math/0205094,Differential properties of matrix orthogonal polynomials,1.3189329710618589e-06,0.0,0.0,1.0
math/0104260,"Integral Transform and Segal-Bargmann Representation Associated to
  q-Charlier Polynomials",1.3189329710618589e-06,0.0,0.0,1.0
math/9512225,Some remarks on the construction of quantum symmetric spaces,1.3189329710618589e-06,0.0,0.0,3.0
math/9903203,On Calder\'on's conjecture,1.3189329710618589e-06,0.0,0.0,2.0
math/0111037,"Asymptotics of the Fourier and Laplace transforms in weighted spaces of
  analytic functions",1.3189329710618589e-06,0.0,0.0,1.0
math/0306008,"An Infinite Product for e^gamma via Hypergeometric Formulas for Euler's
  Constant, gamma",1.3189329710618589e-06,0.0,0.0,2.0
math/0205088,Poincare Inequalities in Punctured Domains,1.3189329710618589e-06,0.0,0.0,3.0
math/0407499,"An Improved Energy-Area Inequality for Harmonic Maps Using Image
  Curvature",1.3189329710618589e-06,0.0,0.0,1.0
math/0005095,A generalization of Kummer's identity,1.3189329710618589e-06,0.0,0.0,2.0
math/0403030,Distributions and Analytic Continuation of Dirichlet Series,1.3189329710618589e-06,0.0,0.0,2.0
math/0508632,"Global well-posedness of the Benjamin-Ono equation in low-regularity
  spaces",1.3189329710618589e-06,0.0,0.0,3.0
math/9910039,Multi-linear operators given by singular multipliers,1.3189329710618589e-06,0.0,0.0,2.0
math/0502347,"Spectral Convergence of the Discrete Laplacian on Models of a Metrized
  Graph",1.3189329710618589e-06,0.0,0.0,3.0
math/0311261,Canonical structure and symmetries of the Schlesinger equations,1.3189329710618589e-06,0.0,0.0,3.0
math/0607555,"Meromorphic Solutions of Linear Differential Systems, Painleve type
  functions",1.3189329710618589e-06,0.0,0.0,1.0
math/0504540,"The Hermite-Krichever ansatz for Fuchsian equations with applications to
  the sixth Painlev\'e equation and to finite-gap potentials",1.3189329710618589e-06,0.0,0.0,2.0
math/0609426,Sum-product estimates in finite fields,1.3189329710618589e-06,0.0,0.0,1.0
math/0411598,Dissipative Boundary Conditions for Ordinary Differential Operators,1.3189329710618589e-06,0.0,0.0,1.0
math/0610624,Jacobi decomposition of weighted Triebel-Lizorkin and Besov spaces,1.3189329710618589e-06,0.0,0.0,1.0
math/0406238,"Inverse spectral problems for Sturm-Liouville operators with singular
  potentials, IV. Potentials in the Sobolev space scale",1.3189329710618589e-06,0.0,0.0,1.0
math/0611145,Localized polynomial frames on the ball,1.3189329710618589e-06,0.0,0.0,1.0
math/0407252,"Eigenvalue asymptotics for Sturm--Liouville operators with singular
  potentials",1.3189329710618589e-06,0.0,0.0,1.0
math/0407447,"Second order difference equations and discrete orthogonal polynomials of
  two variables",1.3189329710618589e-06,0.0,0.0,1.0
math/0612489,Two variable deformations of the Chebyshev measure,1.3189329710618589e-06,0.0,0.0,1.0
math/0703546,Quantum Hilbert matrices and orthogonal polynomials,1.3189329710618589e-06,0.0,0.0,1.0
math/0702626,Oseledets regularity functions for Anosov flows,1.3189329710618589e-06,0.0,0.0,1.0
math/0401310,New bounds on the Hermite polynomials,1.3189329710618589e-06,0.0,0.0,1.0
math/0310348,Hankel Operators in Several Complex Variables and Product $BMO\zProd$,1.3189329710618589e-06,0.0,0.0,1.0
math/0212164,L^p bounds for a maximal dyadic sum operator,1.3189329710618589e-06,0.0,0.0,1.0
math/9501224,How many zeros of a random polynomial are real?,1.3189329710618589e-06,0.0,0.0,1.0
math/9207221,Convolution polynomials,1.3189329710618589e-06,0.0,0.0,1.0
math/9307224,Generalized Hermite polynomials and the Bose-like oscillator calculus,1.3189329710618589e-06,0.0,0.0,1.0
math/0304240,"On the p-Logarithmic and Alpha-Power Divergence Measures in Information
  Theory",1.3189329710618589e-06,0.0,0.0,1.0
math/0401243,The heat kernel transform for the Heisenberg group,1.3189329710618589e-06,0.0,0.0,1.0
math/0504451,"A Fourier restriction theorem for hypersurfaces which are graphs of
  certain real polynomials",1.3189329710618589e-06,0.0,0.0,1.0
math/0601628,"Differential equations driven by H\""{o}lder continuous functions of
  order greater than 1/2",1.3189329710618589e-06,0.0,0.0,1.0
math/0012072,"On the valuation of arithmetic-average Asian options: Laguerre series
  and Theta integrals",1.3189329710618589e-06,0.0,0.0,1.0
math/0505124,Empirically determined Apery-like formulae for zeta(4n+3),1.3189329710618589e-06,0.0,0.0,1.0
math/0202083,Asymptotic analysis for the Dunkl kernel,1.3189329710618589e-06,0.0,0.0,1.0
math/0505093,"Searching symbolically for Apery-like formulae for values of the Riemann
  zeta function",1.3189329710618589e-06,0.0,0.0,1.0
math/9911153,Sharp L^2 bounds for oscillatory integral operators with C^\infty phases,1.3189329710618589e-06,0.0,0.0,1.0
math/0609187,Kakeya Sets in Cantor directions,1.3189329710618589e-06,0.0,0.0,1.0
math/0609196,Hyperbolic Schwarz map for the hypergeometric differential equation,1.3189329710618589e-06,0.0,0.0,1.0
math-ph/0211022,"Asymptotics of the partition function for random matrices via
  Riemann-Hilbert techniques, and applications to graphical enumeration",1.3189329710618589e-06,0.0,0.0,1.0
math/9409230,On Jacobi and continuous Hahn polynomials,1.3189329710618589e-06,0.0,0.0,1.0
math/0002008,"Generalized Riemann - Liouville fractional derivatives for multifractal
  sets",1.3189329710618589e-06,0.0,0.0,8.0
math/0310238,Computation of the entropy of polynomials orthogonal on an interval,1.3189329710618589e-06,0.0,0.0,1.0
math/9807089,Orthonormal Compactly Supported Wavelets with Optimal Sobolev Regularity,1.3189329710618589e-06,0.0,0.0,1.0
math-ph/0307055,Random matrices with external source and multiple orthogonal polynomials,1.3189329710618589e-06,0.0,0.0,4.0
math/0310062,Multiple Polylogarithms: A Brief Survey,1.3189329710618589e-06,0.0,0.0,7.0
q-alg/9504012,On the diagonalization of difference Calogero-Sutherland systems,1.3189329710618589e-06,0.0,0.0,5.0
math/0305252,Spheres and Minima,1.3189329710618589e-06,0.0,0.0,2.0
math/0407265,Degenerate Gauss hypergeometric functions,1.3189329710618589e-06,0.0,0.0,2.0
math/0004053,The Askey-Wilson function transform,1.3189329710618589e-06,0.0,0.0,1.0
math/0510581,Maximal multilinear operators,1.3189329710618589e-06,0.0,0.0,2.0
math/0510341,Some remarks on the Wu-Sprung potential. Preliminary report,1.3189329710618589e-06,0.0,0.0,2.0
math/9804082,On a Functional Differential Equation of Determinantal Type,1.3189329710618589e-06,0.0,0.0,2.0
math/0212254,"Moduli of continuity and average decay of Fourier transforms: two-sided
  estimates",1.3189329710618589e-06,0.0,0.0,1.0
math-ph/0008033,"Integrability, Random Matrices and Painlev\'e Transcendents",1.3189329710618589e-06,0.0,0.0,3.0
math/0011046,Orthogonal polynomials associated with root systems,1.3189329710618589e-06,0.0,0.0,2.0
math/0509575,"Evolutionary Trees and the Ising Model on the Bethe Lattice: a Proof of
  Steel's Conjecture",1.3189329710618589e-06,0.0,0.0,1.0
math/0601074,"Blow-up in finite time for the dyadic model of the Navier-Stokes
  equations",1.3189329710618589e-06,0.0,0.0,1.0
math/0309286,"Nonlinear potentials and two weight trace inequalities for general
  dyadic and radial kernels",1.3189329710618589e-06,0.0,0.0,1.0
math/0603138,"Asymptotic isoperimetry on groups and uniform embeddings into Banach
  spaces",1.3189329710618589e-06,0.0,0.0,6.0
math/0002111,"Prediction Properties of Aitken's Iterated Delta^2 Process, of Wynn's
  Epsilon Algorithm, and of Brezinski's Iterated Theta Algorithm",1.3189329710618589e-06,0.0,0.0,3.0
math/9503225,Quantum symmetric spaces and related q-orthogonal polynomials,1.3189329710618589e-06,0.0,0.0,4.0
math/0106048,Decrease of bounded holomorphic functions along discrete sets,1.3189329710618589e-06,0.0,0.0,3.0
math/0309130,"There are Significantly More Nonnegative Polynomials than Sums of
  Squares",1.3189329710618589e-06,0.0,0.0,4.0
math/0303205,Theta hypergeometric integrals,1.3189329710618589e-06,0.0,0.0,5.0
math/9902121,Study of a Class of Regularizations of 1/|x| using Gaussian Integrals,1.3189329710618589e-06,0.0,0.0,1.0
math/0605047,"Maximal inequalities and Riesz transform estimates on $L^p$ spaces for
  Schr\""odinger operators with nonnegative potentials",1.3189329710618589e-06,0.0,0.0,1.0
math/0501042,Asymptotic analysis of the Krawtchouk polynomials by the WKB method,1.3189329710618589e-06,0.0,0.0,1.0
math/0503735,Spherical transform and Jacobi polynomials on root systems of type BC,1.3189329710618589e-06,0.0,0.0,1.0
math/0304155,Probabilistic aspects of Al-Salam-Chihara polynomials,1.3189329710618589e-06,0.0,0.0,1.0
math/0206089,Heat kernel expansions on the integers,1.3189329710618589e-06,0.0,0.0,3.0
math/0308074,Multiple Gamma Function and Its Application to Computation of Series,1.3189329710618589e-06,0.0,0.0,2.0
math/0110241,"Geometric and Physical Interpretation of Fractional Integration and
  Fractional Differentiation",1.3189329710618589e-06,0.0,0.0,4.0
math/0404293,"Some remarks on a proof of geometrical Paley-Wiener theorems for the
  Dunkl transform",1.3189329710618589e-06,0.0,0.0,1.0
math/9312210,"Solutions to the associated q-Askey-Wilson polynomial recurrence
  relation",1.3189329710618589e-06,0.0,0.0,1.0
math/9411226,"Contiguous relations, basic hypergeometric functions, and orthogonal
  polynomials : III. associated continuous dual q-Hahn polynomials",1.3189329710618589e-06,0.0,0.0,1.0
math/0402175,"Iterated function systems, representations, and Hilbert space",1.3189329710618589e-06,0.0,0.0,1.0
math/0412314,A representation formula related to Schrodinger operators,1.3189329710618589e-06,0.0,0.0,2.0
math/9809088,"Asymptotic formulas for determinants of a sum of finite Toeplitz and
  Hankel matrices",1.3189329710618589e-06,0.0,0.0,1.0
nlin/0003039,A system of four ODEs: the singularity analysis,1.3189329710618589e-06,0.0,0.0,1.0
math/0605524,Boolean functions with small spectral norm,1.3189329710618589e-06,0.0,0.0,1.0
math/0703084,"Inequalities and monotonicity of ratios for generalized hypergeometric
  function",1.3189329710618589e-06,0.0,0.0,1.0
math-ph/0001004,Solving second order equations by extending the PS method,1.3189329710618589e-06,0.0,0.0,1.0
nlin/0410043,"Semiclassical orthogonal polynomials, matrix models and isomonodromic
  tau functions",1.3189329710618589e-06,0.0,0.0,8.0
math/0405246,"Minimal representations of unitary operators and orthogonal polynomials
  on the unit circle",1.3189329710618589e-06,0.0,0.0,3.0
math/0411607,Multi-parameter paraproducts,1.3189329710618589e-06,0.0,0.0,4.0
math/0211291,Turan Extremum Problem for Periodic Function with Small Support,1.3189329710618589e-06,0.0,0.0,2.0
math/0101168,"On the sums Sum((4k+1)^(-n),k,-inf,+inf)",1.3189329710618589e-06,0.0,0.0,2.0
math/0102032,"Analytic continuation of the generalized hypergeometric series near unit
  argument with emphasis on the zero-balanced series",1.3189329710618589e-06,0.0,0.0,3.0
hep-th/9310083,"Representations of affine Lie algebras, parabolic differential
  equations, and Lame functions",1.3189329710618589e-06,0.0,0.0,4.0
math/0508577,A remark on Littlewood-Paley theory for the distorted Fourier transform,1.3189329710618589e-06,0.0,0.0,2.0
math/0408369,Short proofs of the elliptic beta integrals,1.3189329710618589e-06,0.0,0.0,3.0
math/0008017,Cancellation of factorials,1.3189329710618589e-06,0.0,0.0,2.0
math/9805023,"q-Laguerre polynomials and big q-Bessel functions and their
  orthogonality relations",1.3189329710618589e-06,0.0,0.0,3.0
math/0111150,On uniformization of Burnside's curve $y^2=x^5-x$,1.3189329710618589e-06,0.0,0.0,2.0
math/9912001,A converse extrapolation theorem for translation invariant operators,1.3189329710618589e-06,0.0,0.0,1.0
math/9912098,Sharp Lorentz space estimates for rough operators,1.3189329710618589e-06,0.0,0.0,1.0
math/0508013,"A comparative analysis of Bernstein type estimates for the derivative of
  multivariate polynomials",1.3189329710618589e-06,0.0,0.0,1.0
math/0601371,On functions of Jacobi and Weierstrass (I),1.3189329710618589e-06,0.0,0.0,1.0
math-ph/0204006,"Universality for eigenvalue correlations from the modified Jacobi
  unitary ensemble",1.3189329710618589e-06,0.0,0.0,1.0
math/0302142,Jacobi Polynomials from Compatibility Conditions,1.3189329710618589e-06,0.0,0.0,1.0
math/0508039,"Discrete orthogonal polynomials and difference equations of several
  variables",1.3189329710618589e-06,0.0,0.0,1.0
math/0603093,CMV matrices: Five years after,1.3189329710618589e-06,0.0,0.0,1.0
math/0603640,"Weighted norm inequalities, off-diagonal estimates and elliptic
  operators. Part I: General operator theory and weights",1.3189329710618589e-06,0.0,0.0,1.0
math/0505065,"The Brascamp-Lieb inequalities: finiteness, structure, and extremals",1.3189329710618589e-06,0.0,0.0,1.0
math/0604312,Irrationality of $\zeta_q(1)$ and $\zeta_q(2)$,1.3189329710618589e-06,0.0,0.0,1.0
math/0504245,"Difference analogue of the Lemma on the Logarithmic Derivative with
  applications to difference equations",1.3189329710618589e-06,0.0,0.0,1.0
math/0606133,Parameter-based Fisher's information of orthogonal polynomials,1.3189329710618589e-06,0.0,0.0,1.0
math/0503075,Slowing down and reflection of waves in truncated periodic media,1.3189329710618589e-06,0.0,0.0,1.0
math/0606743,One Parameter Generalizations of the Fibonacci and Lucas Numbers,1.3189329710618589e-06,0.0,0.0,1.0
math/0301094,"Linearization coefficients for orthogonal polynomials using stochastic
  processes",1.3189329710618589e-06,0.0,0.0,3.0
math/0410542,"Near Optimal Signal Recovery From Random Projections: Universal Encoding
  Strategies?",1.3189329710618589e-06,0.0,0.0,5.0
math/0606360,Multivariate Polya-Schur classification problems in the Weyl algebra,1.3189329710618589e-06,0.0,0.0,5.0
math-ph/0003005,Discrete phase integral method for five-term recursion relations,1.3189329710618589e-06,0.0,0.0,6.0
math/0407428,"Metrized graphs, electrical networks, and Fourier analysis",1.3189329710618589e-06,0.0,0.0,3.0
math/9811068,"Trace formula in noncommutative geometry and the zeros of the Riemann
  zeta function",1.3189329710618589e-06,0.0,0.0,11.0
cond-mat/0310735,Multiplicity of periodic solutions in bistable equations,,,,
cs/0310043,"Value-at-Risk and Expected Shortfall for Quadratic portfolio of
  securities with mixture of elliptic Distributed Risk Factors",,,,
cs/0502014,On the asymptotic behavior of some Algorithms,,,,
cs/0510051,Numerical resolution of some BVP using Bernstein polynomials,,,,
cs/0604084,"A Recursive Method for Determining the One-Dimensional Submodules of
  Laurent-Ore Modules",,,,
cs/0703121,Differential Equations for Algebraic Functions,,,,
funct-an/9612008,Some Topics in Fourier Analysis and Approximation Theory,,,,
funct-an/9707004,Normalization Integrals of Orthogonal Heun Functions,,,,
hep-th/9310091,"On a q-Deformation of the Discrete Painlev\'e I Equation and
  q-Orthogonal Polynomials",,,,
hep-th/9312012,New relations for two-dimensional Hermite polynomials,,,,
hep-th/9405010,"Asymptotics for the Fredholm Determinant of the Sine Kernel on a Union
  of Intervals",,,,
math-ph/0008012,Compactness of the embedding operators for rough domains,,,,
math-ph/0008026,"Model selection for inverse problems: Best choice of basis function and
  model order selection",,,,
math-ph/0011021,A Laguerre Polynomial Orthogonality and the Hydrogen Atom,,,,
math-ph/0107011,"General Decomposition of Radial Functions on R^n and Applications to
  N-Body Quantum Systems",,,,
math-ph/0203058,Zeros of polynomials orthogonal on several intervals,,,,
math-ph/0301010,"Analytical solution of linear ordinary differential equations by
  differential transfer matrix method",,,,
math-ph/0303041,The prolate spheroidal phenomena and bispectrality,,,,
math-ph/0304027,"On the expansion of the Kummer function in terms of incomplete Gamma
  functions",,,,
math-ph/0307065,Generalised definitions of certain functions and their uses,,,,
math-ph/0312024,From exact-WKB towards singular quantum perturbation theory,,,,
math-ph/0406046,On Generalized Fractional Kinetic Equations,,,,
math-ph/0406047,Unified Fractional Kinetic Equation and a Fractional Diffusion Equation,,,,
math-ph/0406049,"Astrophysical Thermonuclear Functions for Boltzmann-Gibbs Statistics and
  Tsallis Statistics",,,,
math-ph/0409005,"Virtual turning points and bifurcation of Stokes curves for higher order
  ordinary differential equations",,,,
math-ph/0409065,Higher-Order Szego Theorems With Two Singular Points,,,,
math-ph/0411083,Precise coupling terms in adiabatic quantum evolution: The generic case,,,,
math-ph/0412047,"Lax pairs for the Ablowitz-Ladik system via orthogonal polynomials on
  the unit circle",,,,
math-ph/0412083,A class of identities relating Whittaker and Bessel functions,,,,
math-ph/0503063,"On Separation of Minimal Riesz Energy Points on Spheres in Euclidean
  Spaces",,,,
math-ph/0506037,"A semi-algorithm to find elementary first order invariants of rational
  second order ordinary differential equations",,,,
math-ph/0506040,Large Parameter Behavior of Equilibrium Measures,,,,
math-ph/0603011,"A New Form of the Spherical Expansion of Zonal Functions and Fourier
  Transforms of SO(d)-Finite Functions",,,,
math-ph/0605035,"Determining Liouvillian First Integrals for Dynamical Systems in the
  Plane",,,,
math-ph/0612073,Mass-sign duality of cubic oscillators,,,,
math-ph/0703073,A new integral representation for the Riemann Zeta function,,,,
math-ph/9909033,Infinities in Physics and Transfinite numbers in Mathematics,,,,
math-ph/9911034,Inequalities for the derivatives,,,,
math/0002067,Fuglede's conjecture for a union of two intervals,,,,
math/0002152,"BMO, H^1, and Calderon-Zygmund operators for non doubling measures",,,,
math/0002221,"A proof of the weak (1,1) inequality for singular integrals with non
  doubling measures based on a Calderon-Zygmund decomposition",,,,
math/0003014,Fourier Tauberian Theorems and Applications,,,,
math/0003148,"Second-order linear differential equations with two irregular singular
  points of rank three: the characteristic exponent",,,,
math/0003175,On zeros of polynomials orthogonal over a convex domain,,,,
math/0004001,An asymptotic expansion for a ratio of products of gamma functions,,,,
math/0004016,On the valuation of Paris options: foundational results,,,,
math/0004060,The dimensions of Hausdorff and Mendes France. A comparative study,,,,
math/0004069,A notion of rectifiability modeled on Carnot groups,,,,
math/0005008,On the Asymptotics of Takeuchi Numbers,,,,
math/0005013,Functions of Baire class one,,,,
math/0005027,Disjointly strictly singular inclusions of symmetric spaces,,,,
