id,title,pagerank,betweenness,in_degree,out_degree
math/0507014,"The Maslov dequantization, idempotent and tropical mathematics: A brief
  introduction",4.652961767491447e-05,1.990182755160072e-06,55.0,1.0
hep-th/0703017,Expansions of algebras and superalgebras and some applications,3.9762147100728194e-05,1.297900243134945e-07,32.0,1.0
math/0609041,"Comparison of some notions of C^k-maps in multi-variable non-archimedian
  analysis",1.6626769282820493e-05,0.0,5.0,1.0
math/0506475,"Foundations of real analysis and computability theory in
  non-Aristotelian finitary logic",1.4713054021283687e-05,5.970548265480216e-06,5.0,1.0
math/0603599,"A Comment on ""On Some Contradictory Computations in Multi-dimensional
  Mathematics""",1.3590475737133266e-05,2.8784803885932812e-08,5.0,1.0
math/0312189,"Nonstandard Analysis Applied to Special and General Relativity - The
  Theory of Infinitesimal Light-Clocks",1.358386103678638e-05,0.0,8.0,3.0
math/0501038,"The Maslov dequantization, idempotent and tropical mathematics: a very
  brief introduction",1.2871646679377646e-05,4.841367552205469e-06,25.0,2.0
math/0605430,Analytical and differential - algebraic properties of Gamma function,1.171851400767436e-05,3.980365510320144e-06,3.0,1.0
math/0112296,Separations inside a cube,1.097946813721729e-05,0.0,17.0,0.0
math/0703515,Improvement on a Central Theory of PDEs,1.066420036241358e-05,0.0,7.0,0.0
math/0509130,"Deformations and Inversion Formulas For Formal Automorphisms in
  Noncommutative Variables",1.0318737958268202e-05,4.028936099283981e-07,11.0,4.0
math/0212296,Non-Archimedean stochastic processes on non-Archimedean manifolds,9.64884211965478e-06,0.0,6.0,1.0
math-ph/0508068,"Lam\'e equation, quantum top and elliptic Bernoulli polynomials",9.221854445625878e-06,5.241214824023057e-06,5.0,1.0
math/0202269,An Extension to Fermat's Factorisation and a simple primality test,9.087592082995425e-06,0.0,2.0,1.0
math/0605120,The GGU-model and Generation of the Developmental Paradigms,8.092525333353698e-06,0.0,8.0,3.0
math/0609765,Crisis in the geometry development and its social consequences,7.583098240092869e-06,0.0,5.0,0.0
math/0603573,"General Logic-Systems that Determine Significant Collections of
  Consequence Operators",7.343941948640635e-06,0.0,6.0,0.0
math/9911147,Tactical games & behavioral self-organization,6.9337107014970414e-06,0.0,8.0,3.0
math/0001032,"Tactics, dialectics, representation theory",6.634883943817482e-06,0.0,6.0,1.0
math/0109114,A Computational Algorithm for /pi(N),6.55890781825366e-06,0.0,1.0,1.0
math/0504025,Geometric algebra and particle dynamics,6.466864348372653e-06,0.0,3.0,5.0
math/0611445,"Junction Conditions, Resolution of Singularities and Nonlinear Equations
  of Physics",6.40575603304941e-06,0.0,3.0,0.0
math/0607387,"Erlangen Program at Large-0: Starting with the group SL(2,R)",6.206501923109838e-06,0.0,3.0,2.0
math/0511218,"Finite order differentiability properties, fixed points and implicit
  functions over valued fields",5.775019740460008e-06,1.1941096530960432e-05,4.0,5.0
math/0503334,The $k$-orbit theory and polycirculant conjecture,5.74310824339668e-06,0.0,4.0,0.0
math/0312432,"Nonstandard Analysis Applied to Advanced Undergraduate Mathematics -
  Infinitesimal Modeling",5.640269235459436e-06,0.0,4.0,5.0
math/0508188,Geometric triangulations and discrete Laplacians on manifolds,5.56322807563326e-06,0.0,7.0,1.0
hep-th/0107266,"On SUSY-QM, fractal strings and steps towards a proof of the Riemann
  hypothesis",5.285628829587732e-06,6.773030286765413e-06,5.0,5.0
math/0606702,"Combinatorial Speculations and the Combinatorial Conjecture for
  Mathematics",5.164339324857438e-06,0.0,7.0,0.0
math/0611486,How to Define Global Lie Group Actions on Functions,4.8303593020260746e-06,0.0,1.0,0.0
math/0601047,Several Applications of Bezout Matrices,4.775563454392716e-06,0.0,3.0,1.0
math-ph/0508066,Elliptic Faulhaber polynomials and Lam\'e densities of states,4.748655462186104e-06,0.0,4.0,2.0
math/9903082,The Theory of Ultralogics Part II,4.375237755426473e-06,0.0,2.0,9.0
math/0502016,The notion of dimension in geometry and algebra,4.265956839386594e-06,2.5706805099748283e-06,10.0,2.0
math/0412354,Differentially Transcendental Functions,4.226032979787758e-06,0.0,1.0,2.0
math/0512559,General Logic-Systems and Consequence Operators,4.217972532549365e-06,0.0,3.0,3.0
math/0611662,"""Non-strict"" l'Hospital-Type Rules for Monotonicity: Intervals of
  Constancy",4.132978839879297e-06,0.0,4.0,0.0
hep-th/0303162,Massive Feynman diagrams and inverse binomial sums,3.872739830725615e-06,8.898696010752362e-06,8.0,24.0
math/0511451,"Expression of a Tensor Commutation Matrix in Terms of the Generalized
  Gell-Mann Matrices",3.805363860438904e-06,0.0,3.0,1.0
math/0703547,Comments on a recent item by Yu I Manin,3.662959199933061e-06,0.0,2.0,1.0
math/0005275,"New mathematical methods for psychophysical filtering of experimental
  data and their processing",3.644036855033209e-06,0.0,2.0,3.0
math/0312360,Beyond Uncountable,3.62335329328243e-06,0.0,2.0,0.0
math/0507109,"Mathematical computability questions for some classes of linear and
  non-linear differential equations originated from Hilbert's tenth problem",3.498026145358259e-06,0.0,3.0,1.0
math/0404102,"Identical and Nonidentical Relations. Nondegenerate and Degenerate
  Transformations. (Properties of skew-symmetric differential forms)",3.4374595853665712e-06,0.0,4.0,0.0
hep-th/0208221,Final steps towards a proof of the Riemann hypothesis,3.3623056100833957e-06,0.0,3.0,1.0
math/0609847,The work of Andrei Okounkov,3.2166082697012464e-06,0.0,4.0,0.0
math-ph/0109006,On recent strategies proposed for proving the Riemann hypothesis,3.159053738212133e-06,7.4260550565674335e-09,3.0,5.0
math/0106132,"Stochastic processes on non-Archimedean spaces. III. Stochastic
  processes on totally disconnected topological groups",3.1234081109029617e-06,0.0,3.0,2.0
math/0612543,Negative dimension in general and asymptotic topology,3.0534563793997423e-06,0.0,1.0,0.0
math/0502490,The $k$-orbit theory and Fein-Kantor-Schacher Theorem,3.0058404404561305e-06,0.0,3.0,1.0
math/0610902,Oblique Matching Pursuit,2.923024895913817e-06,0.0,1.0,0.0
math/0608141,Redundancies : An Omission in Probability Theory ?,2.855213185875573e-06,0.0,2.0,1.0
math/0104070,"Stochastic processes on non-Archimedean spaces. II. Stochastic
  antiderivational equations",2.753292487717489e-06,0.0,3.0,3.0
math/0508053,Tensor Permutation Matrices in Finite Dimensions,2.7373006378771747e-06,0.0,2.0,2.0
math/0403521,Stochastic arbitrage return and its implications for option pricing,2.734110668784602e-06,0.0,2.0,0.0
math/0510302,On surfaces with $p_g=q=1$ and non-ruled bicanonical involution,2.726959420544478e-06,0.0,1.0,1.0
math/0601016,Ivan Bernoulli Series Universalissima,2.7266361099285818e-06,0.0,3.0,0.0
math/0104069,"Stochastic processes on non-Archimedean spaces. I. Stochastic processes
  on Banach spaces",2.7261209365076626e-06,0.0,3.0,4.0
math/0703400,A generalization of Stokes theorem on combinatorial manifolds,2.697084014042981e-06,0.0,1.0,0.0
math/0604342,From Incompleteness Towards Completeness,2.6631781590238582e-06,0.0,2.0,0.0
math/0611730,"Spreading of infectious diseases on complex networks with non-symmetric
  transmission probabilities",2.642324062390966e-06,0.0,1.0,0.0
math/0510230,Automorphisms of the semigroup of all endomorphisms of free algebras,2.571561301892516e-06,0.0,3.0,0.0
math/0610279,New Method for Solving Large Classes of Nonlinear Systems of PDEs,2.5323920617452204e-06,0.0,4.0,1.0
math/0608450,Solving General Equations by Order Completion,2.5323920617452204e-06,0.0,4.0,1.0
math/0609234,Extending Mappings between Posets,2.5323920617452204e-06,0.0,4.0,1.0
physics/0203072,Vector- and tensor-valued descriptors for spatial patterns,2.4891212211691163e-06,1.990182755160072e-06,1.0,1.0
math-ph/0212019,Fractional operators and special functions. II. Legendre functions,2.4711431321721443e-06,0.0,1.0,0.0
math/0111291,On power sets,2.4711431321721443e-06,0.0,1.0,0.0
math-ph/0408015,A hyper-geometric approach to the BMV-conjecture,2.4711431321721443e-06,0.0,1.0,0.0
math-ph/0702062,"Dirichlet integral dual-access collocation-kernel space analytic
  interpolation for unit disks: DIDACKS I",2.4711431321721443e-06,0.0,1.0,2.0
math/0701111,"Counting all equilateral triangles in {0,1,2,...,n}^3",2.4711431321721443e-06,0.0,1.0,0.0
math/0609503,The structure of tame minimal dynamical systems,2.4711431321721443e-06,0.0,1.0,0.0
math-ph/0207032,"The structure of general solutions and integrability conditions for
  rational first-order ODE's",2.4711431321721443e-06,0.0,1.0,2.0
math/0310351,Nonstandard Analysis - A Simplified Approach,2.432993557848162e-06,0.0,1.0,2.0
math/0503261,New crisis in geometry?,2.416504666821159e-06,0.0,3.0,1.0
math/0312160,Deformation principle as a foundation of physical geometry,2.370696238255488e-06,0.0,3.0,2.0
math-ph/0211069,The rational generalized integrating factors for first-order ODEs,2.3469198153586743e-06,0.0,1.0,1.0
math/0508471,Solving Problems in Scalar Algebras of Reduced Powers,2.303095572179999e-06,0.0,1.0,2.0
math/0210413,Deformation principle and problem of parallelism in geometry and physics,2.290989143692043e-06,0.0,2.0,3.0
math/0505179,"Composition and exponential of compactly supported generalized integral
  kernel operators",2.27910810532043e-06,0.0,2.0,0.0
math/0211071,Scale calculus and the Schrodinger equation,2.244404819677782e-06,0.0,1.0,0.0
math/0410377,Non-differentiable variational principles,2.244404819677782e-06,0.0,1.0,0.0
math/0607082,Which are the Maximal Ideals ?,2.1741011702521514e-06,0.0,3.0,1.0
math/0511575,"Euclidean geometry as algorithm for construction of generalized
  geometries",2.147655629228759e-06,0.0,2.0,1.0
math/0405507,Complete proper minimal surfaces in convex bodies of $R^3$,2.1114152158958983e-06,0.0,1.0,0.0
math/0603664,On a Proof of the Goldbach Conjecture and the Twin Prime Conjecture,1.963720148540796e-06,0.0,1.0,0.0
math/0610094,"Constructive updating/downdating of oblique projectors: a generalization
  of the Gram-Schmidt process",1.8950380516170012e-06,0.0,1.0,1.0
math/0104025,On the Goedel's formula,1.8950380516170012e-06,0.0,1.0,0.0
math/0505192,Refinement of Inequalities among Means,1.8950380516170012e-06,0.0,1.0,0.0
math/0508645,New directions in enumerative chess problems,1.8950380516170012e-06,0.0,1.0,0.0
math/0510479,On Multi-Vector Spaces,1.8950380516170012e-06,0.0,1.0,0.0
math/0307090,Does Church-Kleene ordinal $\omega_1^{CK}$ exist?,1.8950380516170012e-06,0.0,1.0,0.0
math/0510478,On Algebraic Multi-Ring Spaces,1.8950380516170012e-06,0.0,1.0,0.0
math/0401279,Backward Optimized Orthogonal Matching Pursuit,1.8950380516170012e-06,0.0,1.0,0.0
math-ph/0204040,Majorana transformation for differential equations,1.8950380516170012e-06,0.0,1.0,1.0
math/0601709,Logic for Everyone,1.8678218206850973e-06,0.0,1.0,1.0
math/0102031,Riemann hypothesis and super-conformal invariance,1.8649635025908884e-06,0.0,1.0,5.0
math/0212224,Multivector Functionals,1.820857769315738e-06,0.0,3.0,7.0
math/0509032,Automorphic equivalence of one-sorted algebras,1.803421194485659e-06,0.0,1.0,1.0
math/0212223,Multivector Functions of a Multivector Variable,1.7933756968289977e-06,0.0,2.0,8.0
math/0402288,The second part of on duality triads' paper,1.7757435652394217e-06,0.0,3.0,5.0
nlin/0512015,A Predictive Theory of Games,1.744402721345843e-06,0.0,1.0,0.0
math/0408202,On the nature of finite groups,1.703003024765287e-06,0.0,1.0,2.0
math/0307165,Standard-model symmetry in complexified spacetime algebra,1.703003024765287e-06,0.0,1.0,1.0
math/0204167,Prime number logarithmic geometry on the plane,1.703003024765287e-06,0.0,1.0,0.0
math/0509233,Towards commutator theory for relations. II,1.703003024765287e-06,0.0,1.0,1.0
math/0511313,Towards commutator theory for relations. III,1.703003024765287e-06,0.0,1.0,1.0
math/0505126,Generalized Integral Operators and Applications,1.703003024765287e-06,0.0,1.0,0.0
math/0503175,Bernoulli numbers and solitons,1.703003024765287e-06,0.0,1.0,1.0
math-ph/0211064,Obtaining Bounds on The Sum of Divergent Series in Physics,1.6466411304896744e-06,0.0,1.0,0.0
math/0401039,"Invariant and evolutionary properties of the skew-symmetric differential
  forms",1.6436993272071737e-06,0.0,2.0,4.0
cond-mat/0601573,Amorphous packings of hard spheres in large space dimension,1.60698551133943e-06,0.0,1.0,1.0
math/0610307,Pseudo-Manifold Geometries with Applications,1.60698551133943e-06,0.0,1.0,0.0
math/0612760,Geometrical Theory on Combinatorial Manifolds,1.60698551133943e-06,0.0,1.0,1.0
math/0506386,Parallel bundles in planar map geometries,1.60698551133943e-06,0.0,1.0,0.0
math/0701238,Lectures on Linear Algebra over Division Ring,1.5726506406963732e-06,0.0,2.0,1.0
math/0612111,Biring of Matrices,1.5726506406963732e-06,0.0,2.0,2.0
math/0607410,Hyperdeterminantal calculations of Selberg's and Aomoto's integrals,1.5291821355397728e-06,0.0,1.0,0.0
math/0607624,Introducing bisemistructures,1.5109679979135728e-06,0.0,1.0,0.0
math/0212222,Multivector Functions of a Real Variable,1.4629592412006444e-06,0.0,1.0,4.0
math/0608503,"Manifolds, Structures Categorically",1.4300132099457716e-06,0.0,1.0,0.0
math/0603275,Quantum Knots and Riemann Hypothesis,1.4257499616715735e-06,1.991667966171385e-06,2.0,2.0
math/0702213,"The velocity translation in the game of ""Life""",1.3587375286113452e-06,0.0,1.0,0.0
math/0501249,"A matrix-based proof of the quaternion representation theorem for
  four-dimensional rotations",1.3189329710618589e-06,0.0,0.0,1.0
math/0312401,Bernoulli-Taylor formula for psi-umbral difference calculus,1.3189329710618589e-06,0.0,0.0,4.0
math/0607279,Hyperdeterminants on semilattices,1.3189329710618589e-06,0.0,0.0,1.0
math/0308153,"Mathematics and Logic as Information Compression by Multiple Alignment,
  Unification and Search",1.3189329710618589e-06,0.0,0.0,2.0
math/0005050,A Possible Origin of Logic,1.3189329710618589e-06,0.0,0.0,2.0
math/0411408,On automorphisms of categories of universal algebras,1.3189329710618589e-06,0.0,0.0,3.0
math/0506232,A new view of combinatorial maps by Smarandache's notion,1.3189329710618589e-06,0.0,0.0,4.0
math/0303300,"Differential Calculus, Manifolds and Lie Groups over Arbitrary Infinite
  Fields",1.3189329710618589e-06,0.0,0.0,9.0
math/0106170,"Quasi-invariant and pseudo-differentiable measures on a non-Archimedean
  Banach space. II. Measures with values in non-Archimedean fields",1.3189329710618589e-06,0.0,0.0,7.0
math/0101021,"Correspondence principle for idempotent calculus and some computer
  applications",1.3189329710618589e-06,0.0,0.0,9.0
math/0402260,On duality triads,1.3189329710618589e-06,0.0,0.0,4.0
math/0303320,Implicit Functions from Topological Vector Spaces to Banach Spaces,1.3189329710618589e-06,0.0,0.0,9.0
math/9903081,The Theory of Ultralogics Part I,1.3189329710618589e-06,0.0,0.0,14.0
math/0507039,Towards commutator theory for relations,1.3189329710618589e-06,0.0,0.0,3.0
math/0402103,An exposition of results of Fricke,1.3189329710618589e-06,0.0,0.0,7.0
math/0601121,Incidence structures and Stone-Priestley duality,1.3189329710618589e-06,0.0,0.0,2.0
math/0204209,On the polycirculant conjecture,1.3189329710618589e-06,0.0,0.0,3.0
math/0003001,Experimental detection of interactive phenomena and their analysis,1.3189329710618589e-06,0.0,0.0,4.0
math/0510427,On Algebraic Multi-Group Spaces,1.3189329710618589e-06,0.0,0.0,2.0
math/0305222,On Reidys and Stadler's metrics for RNA secondary structures,1.3189329710618589e-06,0.0,0.0,2.0
math/0601288,Riesz basis of exponentials for a union of cubes in R^{d},1.3189329710618589e-06,0.0,0.0,1.0
math-ph/0001037,Abel ODEs: Equivalence and Integrable Classes,1.3189329710618589e-06,0.0,0.0,3.0
math/0002059,"An Abel ordinary differential equation class generalizing known
  integrable classes",1.3189329710618589e-06,0.0,0.0,3.0
math/0306007,Is mathematics consistent?,1.3189329710618589e-06,0.0,0.0,2.0
math/0106169,"Quasi-invariant and pseudo-differentiable measures on a non-Archimedean
  Banach space.I. Real-valued measures",1.3189329710618589e-06,0.0,0.0,4.0
math-ph/0007023,"First order ODEs, Symmetries and Linear Transformations",1.3189329710618589e-06,0.0,0.0,1.0
math-ph/0311024,"Minimal Riesz Energy Point Configurations for Rectifiable d-Dimensional
  Manifolds",1.3189329710618589e-06,0.0,0.0,1.0
math/0312485,Algebraic geometry in First Order Logic,1.3189329710618589e-06,0.0,0.0,1.0
math/0606713,Beyond Undecidable,1.3189329710618589e-06,0.0,0.0,1.0
math/0207258,"On the Root Ambiguity in the Complete Solution to the Most General Fifth
  Degree Polynomial",1.3189329710618589e-06,0.0,0.0,1.0
math/0509246,Mathematical conceptualism,1.3189329710618589e-06,0.0,0.0,1.0
math/0005026,On the Complete Solution to the Most General Fifth Degree Polynomial,1.3189329710618589e-06,0.0,0.0,1.0
math/0509244,Predicativity beyond Gamma_0,1.3189329710618589e-06,0.0,0.0,1.0
math/0108119,The cardinality of the set of real numbers,1.3189329710618589e-06,0.0,0.0,1.0
math/0103014,Triplets and Symmetries of Arithmetic mod p^k,1.3189329710618589e-06,0.0,0.0,1.0
physics/0612124,"Mesoscopic structure conditions the emergence of cooperation on social
  networks",1.3189329710618589e-06,0.0,0.0,1.0
math/0408013,An Introduction to Some Spaces of Interval Functions,1.3189329710618589e-06,0.0,0.0,1.0
math-ph/0212018,Fractional operators and special functions. I. Bessel functions,1.3189329710618589e-06,0.0,0.0,1.0
math-ph/0210027,Equivalent forms of the Bessis-Moussa-Villani conjecture,1.3189329710618589e-06,0.0,0.0,1.0
math-ph/0202040,"The introduction to the operator method for solving differential
  equations.First-order DE",1.3189329710618589e-06,0.0,0.0,1.0
math-ph/0002025,Integrating factors for second order ODEs,1.3189329710618589e-06,0.0,0.0,1.0
math/0610859,"Broccoli Reduces The Risk of Splenetic Fever! The use of induction and
  falsifiability in statistics and model selection",1.3189329710618589e-06,0.0,0.0,1.0
math/0503291,"Relative invariants, difference equations, and the Picard-Vessiot theory",1.3189329710618589e-06,0.0,0.0,1.0
math/0412245,M-hyperquasivarieties,1.3189329710618589e-06,0.0,0.0,1.0
math/0006230,"Orthogonal matrices with rational components in composing tests for High
  School students",1.3189329710618589e-06,0.0,0.0,3.0
math/0306038,"Observations concerning G\""odel's 1931",1.3189329710618589e-06,0.0,0.0,1.0
math/0609697,"A Characterization of the Convexity of Cyclic Polygons in Terms of the
  Central Angles",1.3189329710618589e-06,0.0,0.0,1.0
math/0609698,Convexity of Sub-polygons of Convex Polygons,1.3189329710618589e-06,0.0,0.0,2.0
math/0010065,"Introductory Calculus from the Viewpoint of Non-Standard Analysis -
  Derivative of Sine and Cosine",1.3189329710618589e-06,0.0,0.0,1.0
math/0412391,Basis Manifold,1.3189329710618589e-06,0.0,0.0,1.0
math/0312309,The Collatz 3n+1 Conjecture is Unprovable,1.3189329710618589e-06,0.0,0.0,1.0
math/0202309,"The Banach-Tarski paradox or what mathematics and religion have in
  common",1.3189329710618589e-06,0.0,0.0,1.0
math/0111262,A Strategy for Proving Riemann Hypothesis,1.3189329710618589e-06,0.0,0.0,1.0
cs/0410018,Utilitarian resource assignment,,,,
math-ph/0204047,Multiply Warped Products with Non-Smooth Metrics,,,,
math-ph/0404032,A method to construct refracting profiles,,,,
math-ph/0512055,"p-Adic analysis in the Lizorkin type spaces: fractional operators,
  pseudo-differential equations and Tauberian theorems",,,,
math-ph/0610071,Nonlinear Integral-Equation Formulation of Orthogonal Polynomials,,,,
math-ph/0612009,Inverse problem and Bertrand's theorem,,,,
math-ph/0612049,"$p$-Adic multidimensional wavelets and their application to $p$-adic
  pseudo-differential operators",,,,
math/0002134,Random triangle problem: geometrical approach,,,,
math/0003112,Matrix exponentials,,,,
math/0003122,Four multiplicative cohomology theorems,,,,
math/0005141,A lemma on the minimal surfaces,,,,
math/0005188,On the dynamic flows,,,,
math/0005189,On the quantum model of gravitational electrodynamics,,,,
math/0005191,Goldbach's Rule,,,,
math/0005213,On the generation of linear groups by combinatoric groups,,,,
math/0005214,On the rigid algebraic structure of Euclidean spaces,,,,
math/0005215,On some mathematical construction of many-dimensional cosmos,,,,
math/0005216,On the interior structure of exterior algebra,,,,
math/0007098,Density preserving functions,,,,
math/0008023,Nonlocal Mathematics,,,,
math/0009005,Why a Conjecture of Poincare Doesn't Work,,,,
math/0010027,On Partitions of Goldbach's Conjecture,,,,
math/0103091,"Additive structure of Z(.) mod m_k (squarefree) and Goldbach's
  Conjecture",,,,
math/0104153,Symmetric Logic Synthesis with Phase Assignment,,,,
math/0105004,"Generalized Steiner's Problem and its Solution with the Concepts in
  Field Thoery",,,,
math/0105009,Le cryptosysteme non-commutatif,,,,
math/0105022,Intrinsic palindromic numbers,,,,
math/0105029,"A new Binary Number Code and a Multiplier, based on 3 as semi-primitive
  root of 1 mod 2^k",,,,
math/0106069,The Origin of a Metric,,,,
math/0108190,The Essence of Intuitive Set Theory,,,,
math/0108201,"White Hole, Black Whole, and The Book",,,,
math/0108217,Testing the Existence of a Supporting Plane,,,,
math/0110335,Introductory Topics in Distributions over Binary Test Functions,,,,
math/0110336,Introductory Topics in Binary Set Functions,,,,
math/0112117,An algebraic approach to representations of the permutation group,,,,
math/0112147,Can our number system be improved?,,,,
math/0202132,Infinite and natural numbers,,,,
math/0203245,A Generator System of Invariant differential forms,,,,
math/0203274,"Diff\'erentielles non commutatives et th\'eorie de Galois
  diff\'erentielle ou aux diff\'erences",,,,
math/0204196,Oscillating Population Models,,,,
math/0204245,Seven Lectures on the Universal Algebraic Geometry,,,,
math/0205070,"Une caracterisation des fonctions holomorphes injectives en analyse
  ultrametriqe",,,,
math/0205183,"On the real zeroes of the Hurwitz zeta-function and Bernoulli
  polynomials",,,,
math/0205220,Heuristic algorithm for solving of the graph isomorphism problem,,,,
math/0206280,"A methodological exhibition of the theory of the identification of
  Lineal Dynamic systems",,,,
math/0207061,A Simple Proof of the Four-Color Theorem,,,,
math/0208009,The Mathematical Universe in a Nutshell,,,,
math/0208131,On a Linear Property of Bilinearly Defined Sets in $\mathbb{R}^n$,,,,
math/0208158,On some sequences of functions and their applications in Physics,,,,
math/0208210,"Obtaining a New Representation for the Golden Ratio by Solving a
  Biquadratic Equation",,,,
math/0209232,On Goldbach's Conjecture,,,,
math/0210187,Automorphisms of the category of free Lie algebras,,,,
math/0210194,Algebras with the same (algebraic) geometry,,,,
math/0210285,Restricted linear properties of scalar product in T-geometry,,,,
math/0210334,Proof of the Poincare' conjecture,,,,
math/0211161,Geometrical Equivalents of Goldbach Conjecture and Fermat Like Theorem,,,,
math/0211225,On a stellar structure for a stellar manifold,,,,
math/0211261,A multidimensional Law of Sines,,,,
math/0211301,A proof of the non existence of Frey curves without using TSW theorem,,,,
math/0212251,Lattice Option Pricing By Multidimensional Interpolation,,,,
math/0301316,Modelling the Zero Point Field,,,,
math/0303241,A Theorem on Prime Numbers,,,,
math/0303284,The prisoners may be in two minds,,,,
math/0303379,Uncertainty of the Shapley Value,,,,
math/0304081,Logic and probability,,,,
math/0306411,"Less than $2^/omega$ many translates of a compact nullset may cover the
  real line",,,,
math/0307395,Functional Equation of the Rate of Inflation,,,,
math/0308121,Radii of regular polytopes,,,,
math/0308144,Oversampling and transmission of hidden information,,,,
math/0309268,On the Blackman's Association Problem,,,,
math/0309401,"Partial Ordering of Hyper-powersets and Matrix Representation of Belief
  Functions within DSmT",,,,
math/0309416,"Variations of thin piezoelectric shallow shells: Two-dimensional
  approximation",,,,
math/0309431,On the Generation of Hyper-powersets for the DSmT,,,,
math/0309474,The diophantine equation x^3/3+y^3+z^3-2xyz=0,,,,
math/0310412,Claims On Primorial Primes,,,,
math/0311401,New Trigonometric form of The Hamilton's Quaternions,,,,
math/0311475,Topologically Fragmental Space and the Proof of Hadwiger's Conjecture,,,,
math/0312420,"Algebraic Logic, Varieties of Algebras and Algebraic Varieties",,,,
math/0312427,"Geometrical equivalence, geometrical similarity and geometrical
  compatibility of algebras",,,,
math/0312428,An Algebraic Approach to Knowledge Bases Informational Equivalence,,,,
math/0401043,A prime prime primer,,,,
math/0401082,"On trigonometric-like decompositions of functions with respect to the
  cyclic group of order n",,,,
math/0401099,Elementary evaluation of $\int_0^\infty{sin^p t/t^q} dt$,,,,
math/0402342,Coxeter groups of stellar manifolds,,,,
math/0402410,Signal Transmission in Passive Media,,,,
math/0402426,"A.K.Kwasniewski, W.Bajguz Generalized Clifford Algebras and the Last
  Fermat Theorem",,,,
math/0403011,Higher Order Recurrences for Analytical Functions of Tchebysheff Type,,,,
math/0403057,"The complete dimension theory of partially ordered systems with
  equivalence and orthogonality",,,,
math/0403169,Countability of the Real Numbers,,,,
math/0403288,Remarks on Cantor's diagonalization proof of 1891,,,,
math/0403378,On the Constructive Inverse Problem in Differential Galois Theory,,,,
math/0403394,Some remarks on autoequivalences of categories,,,,
math/0403555,Left Invariant Contact Structures on Lie Groups,,,,
