id,title,pagerank,betweenness,in_degree,out_degree
hep-ph/0611013,Ionic Binding in a Susy Background,1.491456713626023e-05,0.0,6.0,0.0
nucl-th/0502039,Naive Dimensional Analysis for Three-Body Forces Without Pions,1.4630625923931e-05,5.029806370512393e-05,5.0,8.0
quant-ph/0209119,A Renormalisation Approach to Effective Interactions in Hilbert Space,1.0349110012197376e-05,1.3251297716090763e-06,4.0,3.0
hep-th/0505005,"New Directions in Non-Relativistic and Relativistic Rotational and
  Multipole Kinematics for N-Body and Continuous Systems",9.66362106309618e-06,4.2547158944789535e-09,13.0,4.0
physics/0512085,Large-N droplets in two dimensions,8.64232686948462e-06,9.890762611574046e-09,10.0,2.0
nucl-th/0511039,How To Classify 3-Body Forces -- And Why,7.998803084004859e-06,0.0,5.0,0.0
cond-mat/9905407,The Dynamics of Structural Transitions in Sodium Chloride Clusters,7.792391649233983e-06,0.0,5.0,0.0
physics/9910016,Binding Energies and Scattering Observables in the 4^He_3 Atomic System,7.20062767979354e-06,1.1941096530960432e-05,9.0,7.0
cond-mat/9808265,The double-funnel energy landscape of the 38-atom Lennard-Jones cluster,6.974654439285102e-06,0.0,7.0,2.0
physics/0512035,Scattering length for helium atom-diatom collision,6.808404884296969e-06,0.0,2.0,0.0
quant-ph/0503046,"Effect of phase relaxation on quantum superpositions in complex
  collisions",6.345725781886271e-06,2.985274132740108e-06,2.0,3.0
physics/0610214,"Ultracold atom-molecule collisions and bound states in magnetic fields:
  tuning zero-energy Feshbach resonances in He-NH (3Sigma-)",5.729162451675133e-06,0.0,3.0,0.0
cond-mat/0411144,"Characterizing the network topology of the energy landscapes of atomic
  clusters",5.536177120501641e-06,6.028505387227953e-07,8.0,1.0
physics/9901016,How harmonic is dipole resonance of metal clusters?,5.209308199805078e-06,0.0,2.0,1.0
physics/0511238,"Explicit Representations for the T-Matrix on Unphysical Energy Sheets
  and Resonances in Two- and Three-Body Systems",4.785928664261176e-06,0.0,4.0,1.0
hep-th/0011014,"Dynamical Body Frames, Orientation-Shape Variables and Canonical Spin
  Bases for the Non-Relativistic N-Body Problem",4.768204611872719e-06,0.0,5.0,11.0
cond-mat/9903305,"Evolution of the Potential Energy Surface with Size for Lennard-Jones
  Clusters",4.708638468522879e-06,0.0,1.0,3.0
physics/0304048,The ^3He^4He_2$ trimer within the hard-core Faddeev approach,4.539766417224396e-06,0.0,5.0,0.0
physics/0505131,"Long range intermolecular forces in triatomic systems: connecting the
  atom-diatom and atom-atom-atom representations",4.4362403791882124e-06,0.0,1.0,1.0
physics/0408019,Scattering length of the helium atom - helium dimer collision,4.425140402869522e-06,0.0,6.0,1.0
physics/9810005,Scattering and resonances in the ^4He three-atomic system,4.409413469492901e-06,0.0,6.0,2.0
cond-mat/0312202,Correlations in noisy Landau-Zener transitions,4.283288964980243e-06,0.0,1.0,1.0
physics/0203019,Scissors modes in triaxial metal clusters,4.278670187138834e-06,0.0,1.0,0.0
physics/0208080,Linking Ultracold Polar Molecules,4.18009309532364e-06,0.0,2.0,1.0
cond-mat/0210095,Two-body correlations in N-body boson systems,4.076591341755463e-06,0.0,1.0,0.0
nucl-th/9811046,The Three-Boson System with Short-Range Interactions,4.021959119276198e-06,1.5787161563096706e-05,22.0,39.0
cond-mat/0501510,"Factorization in Break-up and Recombination Processes for Atoms with a
  Large Scattering Length",3.813329961767304e-06,0.0,2.0,0.0
cond-mat/0210448,"Comment on: ``Nonextensivity: from low-dimensional maps to Hamiltonian
  systems'' by Tsallis et al",3.805822199063416e-06,0.0,5.0,2.0
cond-mat/0108310,"Saddle Points and Dynamics of Lennard-Jones Clusters, Solids and
  Supercooled Liquids",3.8019590689851e-06,6.809453792245518e-05,4.0,3.0
physics/9612012,Three-Body Configuration Space Calculations with Hard Core Potentials,3.791047263525046e-06,0.0,4.0,6.0
cond-mat/0612123,Efimov Physics in Cold Atoms,3.70729045688924e-06,3.219956634914e-07,5.0,2.0
cond-mat/0306387,"Fragmentation of multiply charged simple metal clusters in liquid-drop
  stabilized jellium model",3.62335329328243e-06,0.0,2.0,0.0
physics/0110057,Electric multipole plasmons in deformed sodium clusters,3.62335329328243e-06,0.0,2.0,1.0
cond-mat/0108375,Mechanism of Magnetism in Stacked Nanographite,3.49912997646896e-06,0.0,2.0,0.0
physics/0703177,"On the occurrence of Balmer spectra in expanding microplasmas from laser
  irradiated liquid hydrogen",3.49912997646896e-06,0.0,2.0,0.0
physics/0308090,"Binding Energies and Scattering Observables in the ^3He^4He_2 Atomic
  System",3.387556256114109e-06,0.0,4.0,0.0
cond-mat/9802034,Classical Many-particle Clusters in Two Dimensions,3.307094949617245e-06,0.0,2.0,4.0
cond-mat/9806020,Thermodynamics and the Global Optimization of Lennard-Jones clusters,3.1307257482540787e-06,0.0,2.0,2.0
cond-mat/9801152,Structural Transitions and Global Minima of Sodium Chloride Clusters,3.1307257482540787e-06,0.0,2.0,2.0
cond-mat/9711213,"Interaction-Driven Equilibrium and Statistical Laws in Small Systems.
  The Cerium Atom",3.095079115793552e-06,0.0,1.0,2.0
physics/0506215,Laser-cluster interaction: x-ray production by short laser pulses,3.0472482127272877e-06,0.0,2.0,0.0
cond-mat/0108179,Effective action and density functional theory,2.9375139116691645e-06,0.0,3.0,5.0
physics/0202049,"Toroidal configuration of the orbit of the electron of the hydrogen atom
  under strong external magnetic fields",2.923429915274331e-06,0.0,2.0,0.0
cond-mat/0112018,Entropic effects on the structure of Lennard-Jones clusters,2.759195672449716e-06,0.0,2.0,0.0
physics/0109068,"The $^4$He tetramer ground state in the Faddeev-Yakubovsky differential
  equations formalism",2.7274069794651544e-06,0.0,2.0,0.0
cond-mat/0007338,Physical perspectives on the global optimization of atomic clusters,2.697084014042981e-06,0.0,2.0,0.0
physics/0308004,Low-energy quadrupole modes in deformed clusters,2.689899798187394e-06,0.0,1.0,0.0
physics/0606102,"Exploration of electronic quadrupole states in atomic clusters by
  two-photon processes",2.689899798187394e-06,0.0,1.0,0.0
physics/0009035,"Binding Energies and Scattering Observables in the 4Helium3 Atomic
  System",2.531587501299412e-06,0.0,2.0,0.0
physics/0301036,Temperature-induced pair correlations in clusters and nuclei,2.49094608549746e-06,0.0,2.0,0.0
physics/9810006,"Structure of T- and S-matrices in unphysical sheets and resonances in
  three-body systems",2.485970682320325e-06,0.0,4.0,1.0
physics/0310166,Small rare gas clusters in XUV laser pulses,2.4711431321721443e-06,0.0,2.0,0.0
cond-mat/0212281,Making sense of nanocrystal lattice fringes,2.4711431321721443e-06,0.0,1.0,0.0
physics/0103003,Quantum fluid-dynamics from density functional theory,2.4711431321721443e-06,0.0,1.0,0.0
physics/0403060,"Silicon clusters produced by femtosecond laser ablation: Non-thermal
  emission and gas-phase condensation",2.4711431321721443e-06,0.0,1.0,0.0
physics/0301064,Localized helium excitations in 4He_N-benzene clusters,2.4711431321721443e-06,0.0,1.0,0.0
physics/0301039,"Two Avenues to Self-Interaction Correction within Kohn-Sham Theory:
  Unitary Invariance is the Shortcut",2.4711431321721443e-06,0.0,1.0,0.0
physics/0211027,"Evolution of electronic and ionic structure of Mg-clusters with the
  growth cluster size",2.4711431321721443e-06,0.0,1.0,0.0
cond-mat/0107191,Crystallographic Method for Exact Describing Quasicrystal Structures,2.4711431321721443e-06,0.0,1.0,0.0
cond-mat/9807011,Pair-correlations and magnetic susceptibility of small Al-grains,2.4711431321721443e-06,0.0,1.0,2.0
physics/0511034,"Finite size effects in the dynamics and thermodynamics of 2D Coulomb
  clusters",2.4711431321721443e-06,0.0,1.0,0.0
physics/0302078,Negative heat capacity of sodium clusters,2.4711431321721443e-06,0.0,1.0,0.0
physics/0410027,Low-energy excitations of a linearly Jahn-Teller coupled orbital quintet,2.4711431321721443e-06,0.0,1.0,0.0
physics/0508157,"Exact exchange optimized effective potential and self-compression of
  stabilized jellium clusters",2.4711431321721443e-06,0.0,1.0,0.0
physics/9706040,"Time-Dependent Local Density Approximation for Collective Excitations of
  Atomic Clusters",2.4711431321721443e-06,0.0,1.0,0.0
physics/0404096,"Weakly nonlinear vertical dust grain oscillations in dusty plasma
  crystals in the presence of a magnetic field",2.4711431321721443e-06,0.0,1.0,0.0
physics/0109029,Positronium scattering by atoms and molecules at low energies,2.4711431321721443e-06,0.0,1.0,0.0
nucl-th/9811028,Fermionic and Bosonic Bubbles and Foam,2.4711431321721443e-06,0.0,1.0,5.0
cond-mat/0604255,The Three-Boson System at Next-To-Next-To-Leading Order,2.4148940719193816e-06,4.261583185923341e-06,2.0,7.0
physics/0506159,"First principles electron transport: finite-element implementation for
  nanostructures",2.3642110433836806e-06,7.4260550565674335e-09,1.0,1.0
physics/0209025,Scaling limit of virtual states of triatomic systems,2.3486555497258798e-06,0.0,1.0,0.0
physics/0206058,Ultra-low energy elastic scattering in a system of three He atoms,2.27910810532043e-06,0.0,2.0,0.0
nucl-th/0012047,"Comment on ""Negative heat ..."" by Moretto et al",2.2377003330492736e-06,0.0,2.0,0.0
cond-mat/0012333,Polytetrahedral Clusters,2.120978933487838e-06,0.0,1.0,0.0
physics/0303031,Scaling predictions for radii of weakly bound triatomic molecules,2.120978933487838e-06,0.0,1.0,1.0
cond-mat/0205040,"Internal Space Renormalization Group Methods for Atomic and Condensed
  Matter Physics",2.0815089879057336e-06,5.786595415615415e-06,4.0,1.0
cond-mat/0505450,A New Thermodynamics from Nuclei to Stars III,2.0731277190413432e-06,0.0,3.0,1.0
cond-mat/0201430,"The network topology of a potential energy landscape: A static
  scale-free network",2.070794094528149e-06,3.980365510320144e-06,3.0,2.0
quant-ph/0401154,Optimal Database Search: Waves and Catalysis,2.028086997545696e-06,0.0,6.0,4.0
cond-mat/9707100,"Fragmentation Phase Transition in Atomic Clusters IV -- Liquid-gas
  transition in finite metal clusters and in the bulk --",1.9919356963017617e-06,0.0,2.0,14.0
cond-mat/0107028,Quantized vortices in mixed 3He-4He drops,1.921564093680211e-06,0.0,2.0,0.0
physics/0403016,"Small rare gas clusters in laser fields: ionisation and absorption at
  long and short laser wavelengths",1.8950380516170012e-06,0.0,1.0,0.0
cond-mat/0412052,Energetics of metal slabs and clusters: the rectangle-box model,1.8950380516170012e-06,0.0,1.0,0.0
cond-mat/0012349,Mechanism of Magnetism in Stacked Nanographite: Theoretical Study,1.8950380516170012e-06,0.0,1.0,1.0
physics/0603006,A versatile electrostatic trap,1.8950380516170012e-06,0.0,1.0,0.0
cond-mat/0205374,The favoured cluster structures of model glass formers,1.8950380516170012e-06,0.0,1.0,4.0
cond-mat/0011018,Global Optimization and the Energy Landscapes of Dzugutov Clusters,1.8950380516170012e-06,0.0,1.0,2.0
cond-mat/0505363,"Hyperpolarizabilities for the one-dimensional infinite single-electron
  periodic systems: I. Analytical solutions under dipole-dipole correlations",1.8950380516170012e-06,0.0,1.0,0.0
cond-mat/0505364,"Hyperpolarizabilities for the one-dimensional infinite single-electron
  periodic systems: II. Dipole-dipole versus current-current correlations",1.8950380516170012e-06,0.0,1.0,0.0
physics/0005053,"An orbital-free molecular dynamics study of melting in K_20, K_55, K_92,
  K_142, Rb_55 and Cs_55 clusters",1.8950380516170012e-06,0.0,1.0,0.0
physics/0005045,Melting behavior of large disordered sodium clusters,1.8950380516170012e-06,0.0,1.0,0.0
cond-mat/0012088,"An SU(4) Model of High-Temperature Superconductivity and
  Antiferromagnetism",1.887874440082504e-06,0.0,1.0,0.0
cond-mat/9911257,"Phase Transitions in ""Small"" systems",1.839660382020978e-06,0.0,3.0,6.0
physics/0505029,The spectra of mixed $^3$He-$^4$He droplets,1.7383727857482604e-06,0.0,1.0,0.0
nucl-th/9809025,Renormalization of the Three-Body System with Short-Range Interactions,1.730304267979745e-06,1.026459181926634e-05,4.0,56.0
nucl-th/9902011,Shell correction energy for bubble nuclei,1.7301277087805848e-06,0.0,1.0,2.0
cond-mat/0207432,The structure of small lead clusters,1.719955952274848e-06,0.0,1.0,0.0
cond-mat/0301374,A model metal potential exhibiting polytetrahedral clusters,1.719955952274848e-06,0.0,1.0,0.0
quant-ph/0412112,Renormalization of the singular attractive $1/r^4$ potential,1.7071420539591506e-06,0.0,1.0,0.0
physics/0611171,On search for nuclear Schiff moment in liquid xenon,1.703003024765287e-06,0.0,1.0,0.0
physics/0410025,Triatomic Molecular Systems and Three-body forces: The Ar_3 case,1.703003024765287e-06,0.0,1.0,0.0
physics/0606120,A note about the ground state of the hydrogen molecule,1.703003024765287e-06,0.0,1.0,0.0
physics/0507031,Differential Form of the Skornyakov--Ter-Martirosyan Equations,1.703003024765287e-06,0.0,1.0,0.0
cond-mat/0002364,"Formation and control of electron molecules in artificial atoms:
  Impurity and magnetic-field effects",1.703003024765287e-06,0.0,1.0,1.0
physics/0412174,"Single-Particle Green Function Approach and Correlated Atomic or
  Molecular Orbitals",1.703003024765287e-06,0.0,1.0,1.0
physics/0109037,"Semiclassical analysis of the lowest-order multipole deformations of
  simple metal clusters",1.703003024765287e-06,0.0,1.0,0.0
physics/0303100,"Impact of Interatomic Electronic Decay Processes on Xe 4d Hole Decay in
  the Xenon Fluorides",1.6990994447933085e-06,0.0,1.0,4.0
cond-mat/9707016,"Statistical Theory of Finite Fermi-Systems Based on the Structure of
  Chaotic Eigenstates",1.6754723489017648e-06,0.0,1.0,7.0
cond-mat/0608250,Quantum fluids of self-assembled chains of polar molecules,1.66195931361303e-06,0.0,1.0,1.0
cond-mat/0701760,Chiral Gauge Theory for Graphene,1.60698551133943e-06,0.0,1.0,0.0
physics/0701215,"Electrostatic interaction energies of homogeneous cubic charge
  distributions",1.60698551133943e-06,0.0,1.0,0.0
physics/0512061,Electronic excitations in atomic clusters: beyond dipole plasmon,1.5980531366768588e-06,0.0,1.0,1.0
physics/0212084,"Orbital magnetism in axially deformed sodium clusters: From scissors
  mode to dia-para magnetic anisotropy",1.5980531366768588e-06,0.0,1.0,1.0
physics/9808027,"On the mechanism of formation of the Efimov states in the helium ^4He
  trimer",1.4835344226490424e-06,0.0,1.0,7.0
physics/0407112,"Optimizing the photoassociation of cold atoms by use of chirped laser
  pulses",1.4629592412006444e-06,0.0,1.0,0.0
cond-mat/0107007,"Short-Range Correlations in He-4 Liquid and Small He-4 Droplets
  described by the Unitary Correlation Operator Method",1.3189329710618589e-06,0.0,0.0,1.0
physics/0310123,Small rare gas clusters in soft X-ray pulses,1.3189329710618589e-06,0.0,0.0,2.0
physics/0403134,"Ab initio determination of the lifetime of the $6^2P_{3/2}$ state f or
  $^{207}Pb^+$ by relativistic many-body theory",1.3189329710618589e-06,0.0,0.0,1.0
physics/0501053,"Wave-Function Reconstruction for the Determination of the Scattering
  Length of Sr",1.3189329710618589e-06,0.0,0.0,2.0
physics/9904017,A Variety of Giant Resonances in Metal Clusters,1.3189329710618589e-06,0.0,0.0,1.0
nucl-th/0406056,Partial energies fluctuations and negative heat capacities,1.3189329710618589e-06,0.0,0.0,3.0
cond-mat/0010043,Mechanism of magnetism in stacked nanographite: Theoretical study,1.3189329710618589e-06,0.0,0.0,2.0
physics/0204025,"Bound State Calculations for Three Atoms Without Explicit Partial Wave
  Decomposition",1.3189329710618589e-06,0.0,0.0,3.0
physics/9811023,Prismane C_8: A New Form of Carbon?,1.3189329710618589e-06,0.0,0.0,4.0
physics/9807002,Super Shell Structure of the Magnetic Susceptibility,1.3189329710618589e-06,0.0,0.0,1.0
physics/0404028,"Photoassociation of cold atoms with chirped laser pulses: time-dependent
  calculations and analysis of the adiabatic transfer within a two-state model",1.3189329710618589e-06,0.0,0.0,8.0
cond-mat/0001066,The effect of compression on the global optimization of atomic clusters,1.3189329710618589e-06,0.0,0.0,2.0
physics/9806020,The structure of the atomic helium trimers: Halos and Efimov states,1.3189329710618589e-06,0.0,0.0,7.0
physics/9808015,"Application of the time-dependent local-density approximation to
  conjugated molecules",1.3189329710618589e-06,0.0,0.0,2.0
physics/9901008,Cluster ionization via two-plasmon excitation,1.3189329710618589e-06,0.0,0.0,1.0
physics/9903049,"Orbital Magnetic Dipole Mode in Deformed Clusters: A Fully Microscopic
  Analysis",1.3189329710618589e-06,0.0,0.0,1.0
cond-mat/0505307,"Breaking of the overall permutation symmetry in nonlinear optical
  susceptibilities of one-dimensional periodic dimerized Huckel model",1.3189329710618589e-06,0.0,0.0,2.0
physics/9911042,"Melting in large sodium clusters: An orbital-free molecular dynamics
  study",1.3189329710618589e-06,0.0,0.0,2.0
cond-mat/0012370,Fractional Electrons in Liquid Helium?,1.3189329710618589e-06,0.0,0.0,6.0
physics/0104058,Metastability of the Three-Dimensional Carbon Cluster Prismane C$_8$,1.3189329710618589e-06,0.0,0.0,4.0
cond-mat/9801008,"Anomalous diffusion as a signature of collapsing phase in two
  dimensional self-gravitating systems",1.3189329710618589e-06,0.0,0.0,3.0
cond-mat/0012498,"Quantization of Thermodynamics, Supersecondary Quantization, and a New
  Variational Principle",1.3189329710618589e-06,0.0,0.0,1.0
astro-ph/0010138,"Aromatic Hydrocarbons, Diamonds, and Fullerenes in Interstellar Space:
  Puzzles to be Solved by Laboratory and Theoretical Astrochemistry",1.3189329710618589e-06,0.0,0.0,1.0
physics/0010025,"Photoabsorption spectra in the continuum of molecules and atomic
  clusters",1.3189329710618589e-06,0.0,0.0,1.0
nucl-th/0308072,Radii of weakly bound three-body systems: halo nuclei and molecules,1.3189329710618589e-06,0.0,0.0,1.0
physics/0307058,Xenon Clusters in Intense VUV Laser Fields,1.3189329710618589e-06,0.0,0.0,2.0
cond-mat/9904019,Exact Quantum Solutions of Extraordinary N-body Problems,1.3189329710618589e-06,0.0,0.0,1.0
cond-mat/0511231,"Statistical Mechanics of Dynamical Systems With Topological Phase
  Transitions",1.3189329710618589e-06,0.0,0.0,1.0
nucl-th/0102018,Casimir Interaction among Objects Immersed in a Fermionic Environment,1.3189329710618589e-06,0.0,0.0,1.0
physics/0611085,A Low-Noise High-Density Alkali Metal Scalar Magnetometer,1.3189329710618589e-06,0.0,0.0,1.0
cond-mat/0108499,Mechanism of magnetism in stacked nanographite with open shell electrons,1.3189329710618589e-06,0.0,0.0,1.0
physics/0303029,"Binding energy of the ^3He^4He_2 trimer within the hard-core Faddeev
  approach",1.3189329710618589e-06,0.0,0.0,1.0
physics/0106027,"I-V characteristics and differential conductance fluctuations of Au
  nanowires",1.3189329710618589e-06,0.0,0.0,1.0
physics/9909037,Carbon clusters near the crossover to fullerene stability,1.3189329710618589e-06,0.0,0.0,1.0
physics/9909006,"Density-functional Study of Small Molecules within the
  Krieger-Li-Iafrate Approximation",1.3189329710618589e-06,0.0,0.0,1.0
cond-mat/0212160,"Quantum size correction to the work function and the centroid of excess
  charge in positively ionized simple metal clusters",1.3189329710618589e-06,0.0,0.0,1.0
physics/9905053,"Alternative sets of hyperspherical harmonics: Satisfying cusp conditions
  through frame transformations",1.3189329710618589e-06,0.0,0.0,1.0
physics/0306058,Variational RPA for the Mie resonance in jellium,1.3189329710618589e-06,0.0,0.0,1.0
cond-mat/0305600,"Stabilized jellium model and structural relaxation effects on the
  fragmentation energies of ionized silver clusters",1.3189329710618589e-06,0.0,0.0,1.0
physics/0310073,"Ionization of clusters in intense laser pulses through collective
  electron dynamics",1.3189329710618589e-06,0.0,0.0,1.0
nucl-th/9802083,New collective mode due to collisional coupling,1.3189329710618589e-06,0.0,0.0,1.0
physics/0306102,"Dynamics in a cluster under the influence of intense femtosecond hard
  x-ray pulses",1.3189329710618589e-06,0.0,0.0,1.0
physics/0101069,Structure and Magnetism of Neutral and Anionic Palladium Clusters,1.3189329710618589e-06,0.0,0.0,1.0
physics/0105050,Energetic photoionization of neutral and ionic metal clusters,1.3189329710618589e-06,0.0,0.0,1.0
cond-mat/0509334,Melting of aluminium clusters,1.3189329710618589e-06,0.0,0.0,1.0
physics/0311116,Cluster emission under femtosecond laser ablation of silicon,1.3189329710618589e-06,0.0,0.0,1.0
cond-mat/0212426,"Simple iterative construction of the optimized effective potential for
  orbital functionals, including exact exchange",1.3189329710618589e-06,0.0,0.0,1.0
physics/0406094,Fission of charged alanine dipeptides,1.3189329710618589e-06,0.0,0.0,2.0
physics/0207068,Melting of sodium clusters,1.3189329710618589e-06,0.0,0.0,1.0
physics/0406093,"Conformational properties of neutral and charged alanine and glycine
  chains",1.3189329710618589e-06,0.0,0.0,2.0
physics/0508115,"Self-consistent iterative solution of the exchange-only OEP equations
  for simple metal clusters in jellium model",1.3189329710618589e-06,0.0,0.0,1.0
physics/0207085,"On the applicability of jellium model to the description of alkali
  clusters",1.3189329710618589e-06,0.0,0.0,1.0
physics/0412066,"Bond-order correlation energies for small Si-containing molecules
  compared with ab initio results from low-order Moller-Plesset perturbation
  theory",1.3189329710618589e-06,0.0,0.0,1.0
physics/0612161,"Theory of Small Para-Hydrogen Clusters: Magic Numbers and Superfluid
  Sizes",1.3189329710618589e-06,0.0,0.0,1.0
physics/9904037,High-quality variational wave functions for small 4He clusters,1.3189329710618589e-06,0.0,0.0,1.0
nucl-th/0502069,"Multifragmentation, Clustering, and Coalescence in Nuclear Collisions",1.3189329710618589e-06,0.0,0.0,2.0
astro-ph/0609186,"Formation and destruction of polycyclic aromatic hydrocarbon clusters in
  the interstellar medium",,,,
astro-ph/9807185,"Chaotic scattering on surfaces and collisional damping of collective
  modes",,,,
cond-mat/0001361,"Numerical Solution of the Two-Dimensional Gross-Pitaevskii Equation for
  Trapped Interacting Atoms",,,,
cond-mat/0003152,Hydrodynamic approach to TDDFT; response properties of metal clusters,,,,
cond-mat/0003164,Classical mechanics technique for quantum linear response,,,,
cond-mat/0003272,"Impurity Scattering in Carbon Nanotubes with Superconducting Pair
  Correlations",,,,
cond-mat/0010030,Twist Mode in Spherical Alkali Metal Clusters,,,,
cond-mat/0010141,Volume change of bulk metals and metal clusters due to spin-polarization,,,,
cond-mat/0010462,New type of antiferromagnetic state in stacked nanographite,,,,
cond-mat/0011466,Entropic effects on the Size Evolution of Cluster Structure,,,,
cond-mat/0012202,Multiply charged metal cluster anions,,,,
cond-mat/0106637,Modelling the structure of clusters of C_60 molecules,,,,
cond-mat/0109075,"Optical excitations in diphenylacetylene based dendrimers studied by a
  coupled exciton model with off-diagonal disorder",,,,
cond-mat/0109076,"Propagation of Cooper pairs in carbon nanotubes with superconducting
  correlations",,,,
cond-mat/0112023,Selected aspects of physics of fermionic bubbles,,,,
cond-mat/0203125,"Deformed Harmonic Oscillators for Metal Clusters: Analytic Properties
  and Supershells",,,,
cond-mat/0204213,"Thermal quenching of electronic shells and channel competition in
  cluster fission",,,,
cond-mat/0207566,Surface-reconstructed Icosahedral Structures for Lead Clusters,,,,
cond-mat/0208323,Novel electronic wave interference patterns in nanographene sheets,,,,
cond-mat/0212167,Alkali-metal ion in rare gas clusters: global minima,,,,
cond-mat/0302111,"Taming the rugged energy landscape: Techniques for the production,
  reordering, and stabilization of selected cluster inherent structures",,,,
cond-mat/0303396,"Optimized Effective Potential made simple: Orbital functionals, orbital
  shifts, and the exact Kohn-Sham exchange potential",,,,
cond-mat/0306225,Identifying structural patterns in `disordered' metal clusters,,,,
cond-mat/0306301,"Electronic structure and rebonding in the onion-like As@Ni12@As20
  cluster",,,,
cond-mat/0309085,"Comment on ``Strontium clusters: Many-body potential, energetics, and
  structural transitions'' [J. Chem. Phys. 115, 3640 (2001)]",,,,
cond-mat/0312238,"Modified Statistical Treatment of Kinetic Energy in the Thomas-Fermi
  Model",,,,
cond-mat/0312291,Triatomic continuum resonances for large negative scattering lengths,,,,
cond-mat/0312335,"Nanoscale Quantum Solvation of para-H$_2$ around the Linear OCS Molecule
  inside $^4$He Droplets",,,,
cond-mat/0404092,Phosphorus cluster production by laser ablation,,,,
cond-mat/0405234,"Lead clusters: different potentials, different structures",,,,
cond-mat/0406251,Production of Gas Phase Zinc Oxide Nanoclusters by Pulsed Laser Ablation,,,,
cond-mat/0502074,"SU(4) Model of High-Temperature Superconductivity: Manifestation of
  Dynamical Symmetry in Cuprates",,,,
cond-mat/0504726,Mapping the magic numbers in binary Lennard-Jones clusters,,,,
cond-mat/0506329,"Geometric magic numbers of sodium clusters: Interpretation of the
  melting behaviour",,,,
cond-mat/0510205,Electron-phonon coupling as an order-one problem,,,,
cond-mat/0603312,Lattice fringe signatures of epitaxy on nanotubes,,,,
cond-mat/0604250,"The structure of binary Lennard-Jones clusters: The effects of atomic
  size ratio",,,,
cond-mat/0606093,Unlayered graphenes in red-giant starsmoke,,,,
cond-mat/0609165,"Molecular dynamics simulations of palladium cluster growth on flat and
  rough graphite surfaces",,,,
cond-mat/9604113,Electronic Structures in C60-Polymers (review),,,,
cond-mat/9705028,"Stabilized Spin-Polarized Jellium Model and Odd-Even Alternations in
  Jellium Metal Clusters",,,,
