id,title,pagerank,betweenness,in_degree,out_degree
cond-mat/9707328,Van der Waals Energies in Density Functional Theory,,,,
cond-mat/9709201,"Structural Consequences of the Range of the Interatomic Potential: a
  Menagerie of Clusters",,,,
cond-mat/9709341,Rough droplet model for spherical metal clusters,,,,
cond-mat/9710034,The onset of a liquid-vapour transition in metallic nanoparticles,,,,
cond-mat/9711038,"Global Minima for Transition Metal Clusters Described by Sutton-Chen
  Potentials",,,,
cond-mat/9802143,"Long-range excitons in conjugated polymers with ring torsions:
  poly(para-phenylene) and polyaniline",,,,
cond-mat/9802144,"Coulomb interaction effects on nonlinear optical response in C60, C70,
  and higher fullerenes",,,,
cond-mat/9803344,"Global Optimization by Basin-Hopping and the Lowest Energy Structures of
  Lennard-Jones Clusters Containing up to 110 Atoms",,,,
cond-mat/9806021,"Microscopic description of the surface dipole plasmon in large Na_N
  clusters (950 < N < 12050)",,,,
cond-mat/9806089,"Molecular dynamics in shape space and femtosecond vibrational
  spectroscopy of metal clusters",,,,
cond-mat/9806167,d-electron induced icosahedral growth in strontium clusters,,,,
cond-mat/9808289,"Formation of Clusters of Interstitial Carbon Atoms in Graphite due to
  Deformation Interaction and their Spatial Arrangement",,,,
cond-mat/9811126,Coupling between electron-spin and ferromagnetic clusters,,,,
cond-mat/9901174,Molecular Chirality and Chiral Parameters,,,,
cond-mat/9909384,"Finite-size effects and the stabilized spin-polarized jellium model for
  metal clusters",,,,
hep-ex/0411057,"Marked influence of the nature of chemical bond on CP-violating
  signature in molecular ions $\mathrm{HBr}^{+}$ and $\mathrm{HI}^{+}$",,,,
nlin/0606041,"Clusters die hard: Time-correlated excitation in the Hamiltonian Mean
  Field model",,,,
nucl-th/0003011,SU(3) Symmetry and Scissors Mode Vibrations in Nuclei,,,,
nucl-th/0011009,Squeezing mode in nuclear collisions,,,,
nucl-th/0311073,Gross shell structure at high spin in heavy nuclei,,,,
nucl-th/9904073,Tri-axial Octupole Deformations and Shell Structure,,,,
physics/0001024,"Scattering of positronium by H, He, Ne, and Ar",,,,
physics/0001032,"Decay channels and appearance sizes of doubly anionic gold and silver
  clusters",,,,
physics/0002051,"Thermal expansion in small metal clusters and its impact on the electric
  polarizability",,,,
physics/0003042,"Electron correlation in C_(4N+2) carbon rings: aromatic vs. dimerized
  structures",,,,
physics/0003076,Nonlinear Modes of Liquid Drops as Solitary Waves,,,,
physics/0003077,"Patterns on liquid surfaces: cnoidal waves, compactons and scaling",,,,
physics/0004020,"CTMC calculations of electron capture and ionization in collisions of
  multiply charged ions with elliptical Rydberg atoms",,,,
physics/0004041,"Structures and Stabilities of CaO and MgO Clusters and Cluster Ions: An
  alternative interpretation of the experimental mass spectra",,,,
physics/0004066,"A transferable nonorthogonal tight-binding model of germanium:
  application to small clusters",,,,
physics/0007018,Ionic and electronic structure of sodium clusters up to N=59,,,,
physics/0008235,Emergence of Bulk CsCl Structure in (CsCl)nCs+ Cluster Ions,,,,
physics/0009011,"Orientational melting of two-shell carbon nanoparticles: molecular
  dynamics study",,,,
physics/0010066,"Optimization of ground and excited state wavefunctions and van der Waals
  clusters",,,,
physics/0011063,"Thermodynamics of Na_8 and Na_{20} clusters studied with ab-initio
  electronic structure methods",,,,
physics/0011068,Fast and stable method for simulating quantum electron dynamics,,,,
physics/0011069,"Finite element approach for simulating quantum electron dynamics in a
  magnetic field",,,,
physics/0011070,"Time dependent energy absorption of atomic clusters from an intense
  laser pulse",,,,
physics/0012037,"Differential and partial cross sections of elastic and inelastic
  positronium-helium-atom scattering",,,,
physics/0012039,Positronium atom scattering by H_2 in a coupled-channel framework,,,,
physics/0012040,"Differential cross sections for elastic and inelastic
  positronium-hydrogen-atom scattering",,,,
physics/0101043,"Quantum Evolution Supergenerator of Superparamagnetic System in Discrete
  Orientation Model",,,,
physics/0101092,"An Ab Initio Study of the Structures and Relative Stabilities of Doubly
  Charged [(NaCl)m(Na)2]2+ Cluster Ions",,,,
physics/0102037,"Equilibrium sizes of jellium metal clusters in the stabilized
  spin-polarized jellium model",,,,
physics/0102069,Trial function optimization for excited states of van der Waals clusters,,,,
physics/0103017,Resonant radiation pressure on neutral particles in a waveguide,,,,
physics/0103032,"Spurious oscillations from local self-interaction correction in high
  energy photoionization calculations for metal clusters",,,,
physics/0103035,"S-, P- and D-wave resonances in positronium-sodium and
  positronium-potassium scattering",,,,
physics/0104037,Resonances in positronium-rubidium and positronium-cesium scattering,,,,
physics/0104071,"Adsorption of CO on a Platinum (111) surface - a study within a
  four-component relativistic density functional approach",,,,
physics/0105001,S-matrix poles and the second virial coefficient,,,,
physics/0105014,"Two-step Liquid Drop Model for Binary, Metal-rich Clusters",,,,
physics/0105033,Visualization of Coulomb Correlations in Finite Metallic Systems,,,,
physics/0105041,"Analytical Expressions for a Hyperspherical Adiabatic Basis Three
  Particles in 2 Dimensions",,,,
physics/0105061,"Relaxation dynamics in the presence of unequally spaced attractors along
  the reaction coordinate",,,,
physics/0105073,"On the proximity relation between two surface-melted clusters involved
  in inter-cluster mass-transfer",,,,
physics/0105078,"Photoabsorption Spectra of Na_n+ clusters: Thermal Line-Broadening
  Mechanisms",,,,
physics/0105098,"Unified description of magic numbers of metal clusters in terms of the
  3-dimensional q-deformed harmonic oscillator",,,,
physics/0106030,Charge-Induced Fragmentation of Sodium Clusters,,,,
physics/0106044,"C$_{60}$ in intense femtosecond laser pulses: nonlinear dipole response
  and ionization",,,,
physics/0106092,Multipole response of doped $^3$He drops,,,,
physics/0107013,"Magic number behavior for heat capacities of medium sized classical
  Lennard-Jones clusters",,,,
physics/0107056,"Variational description of the Helium trimer using correlated
  hyperspherycal harmonic basis functions",,,,
physics/0108071,Collectivity in the optical response of small metal clusters,,,,
physics/0109004,Importance Sampling in Rigid Body Diffusion Monte Carlo,,,,
physics/0109028,Statics and dynamics of phase segregation in multicomponent fermion gas,,,,
physics/0110072,Can optical spectroscopy directly elucidate the ground state of C20?,,,,
physics/0112011,Comparative study of metal cluster fission in Hartree-Fock and LDA,,,,
physics/0112012,New Approach to Nonlinear Dynamics of Fullerenes and Fullerites,,,,
physics/0112015,"Efficient method for simulating quantum electron dynamics under the time
  dependent Kohn-Sham equation",,,,
physics/0112022,"Fragmentation of positively charged metal clusters in stabilized jellium
  model with self-compression",,,,
physics/0112038,Structure and properties of small sodium clusters,,,,
physics/0112052,"A useful form of the recurrence relation between relativistic atomic
  matrix elements of radial powers",,,,
physics/0112053,"Density functional study of Au$_n$ (n=2-20) clusters: lowest-energy
  structures and electronic properties",,,,
physics/0112054,Mass spectrometric and first principles study of Al$_n$C$^-$ clusters,,,,
physics/0112058,Ground state and excitation dynamics in Ag doped helium clusters,,,,
physics/0112072,Polarizabilities of germanium clusters,,,,
physics/0112075,"Novel structures of Co-Cu bimetallic clusters and their magnetic
  properties",,,,
physics/0201008,"Origin of anomalously long interatomic distances in suspended gold
  chains",,,,
physics/0201031,Orbiting Resonances and Bound States in Molecular Scattering,,,,
physics/0201052,"Analytical Potential Energy Function for the Ground State X^{1} Sigma^+
  of LaCl",,,,
physics/0202032,Global Optimization by Adiabatic Switching,,,,
physics/0202050,Laser Spinning of Nanotubes: A path to fast-rotating microdevices,,,,
physics/0202066,Formalism for Multiphoton Plasmon Excitation in Jellium Clusters,,,,
physics/0203054,"Parallel J-W Monte Carlo Simulations of Thermal Phase Changes in
  Finite-size Systems",,,,
physics/0203055,"Charge Dependence of Temperature-Driven Phase Transitions of Molecular
  Nanoclusters: Molecular Dynamics Simulation",,,,
physics/0203078,Chirality in Bare and Passivated Gold Nanoclusters,,,,
physics/0205024,"Formation of an Icosahedral Structure during the Freezing of Gold
  Nanoclusters: Surface-Induced Mechanism",,,,
physics/0206023,"Structure and spectroscopy of doped helium clusters using quantum Monte
  Carlo techniques",,,,
physics/0206070,Electron release of rare gas atom clusters under an intense laser pulse,,,,
physics/0206079,Ionization of clusters in strong X-ray laser pulses,,,,
physics/0207007,A new vibrational level of the H$_2^+$ molecular ion,,,,
physics/0207011,Enhanced ionization in small rare gas clusters,,,,
physics/0207052,"Fringe Structure in the Phase-Space Dynamics of Atomic Stabilization in
  An Intense Field",,,,
physics/0207082,"Revisiting the Complexity of Finding Globally Minimum Energy
  Configurations in Atomic Clusters",,,,
physics/0207084,Cluster growing process and a sequence of magic numbers,,,,
physics/0207116,"Work functions, ionization potentials, and in-between: Scaling relations
  based on the image charge model",,,,
physics/0207121,Wetting to Non-wetting Transition in Sodium-Coated C_60,,,,
physics/0209031,Observation of Mammalian Similarity Through Allometric Scaling Laws,,,,
physics/0209046,Global Optimization on an Evolving Energy Landscape,,,,
physics/0209055,"Optimization of molecular clusters configurations using a Genetic
  Algorithm",,,,
physics/0209106,"The Determination of Microscopic Surface Tension of Liquids with a
  Curved Interphase Boundary by Means of Positron Spectroscopy",,,,
physics/0210042,"Asymmetric emission of high energy electrons in the two-dimensional
  hydrodynamic expansion of large xenon clusters irradiated by intense laser
  fields",,,,
physics/0212062,"Theoretical study of finite temperature spectroscopy in van der Waals
  clusters. I. Probing phase changes in CaAr_n",,,,
physics/0212063,"Theoretical study of finite temperature spectroscopy in van der Waals
  clusters. II Time-dependent absorption spectra",,,,
physics/0212064,"Theoretical study of the finite temperature spectroscopy in van der
  Waals clusters. III Solvated Chromophore as an effective diatomics",,,,
physics/0301038,Statistical evaporation of rotating clusters,,,,
physics/0301081,Optics of Nanostructured Fractal Silver Colloids,,,,
physics/0302073,"Study of interaction of high-power Ar$^+$ laser beam with Ag$^+$-doped
  glass",,,,
physics/0303068,Coulombic Energy Transfer and Triple Ionization in Clusters,,,,
physics/0303079,"Anisotropic ""charge-flipping"" acceleration of highly charged ions from
  $(N_2)_n$ clusters in strong optical fields",,,,
physics/0303080,Explosions of water clusters in intense laser fields,,,,
physics/0303088,"Linking Vibrational Dynamics to Local Electronic Structure: Local
  Analysis of Dynamics of the relaxed Si$_{87}$ Cluster",,,,
physics/0304029,Optimal representations of quantum states by gaussians in phase space,,,,
physics/0304057,"Dynamical ionization ignition of clusters in intense and short laser
  pulses",,,,
physics/0304073,Microcanonical Thermodynamic Properties of Helium Nanodroplets,,,,
physics/0304081,Efimov states in asymmetric systems,,,,
physics/0305103,"Ab initio density functional investigation of B_24 cluster: Rings,
  Tubes, Planes, and Cages",,,,
physics/0305127,Entanglement of two coupled molecules,,,,
physics/0306027,Structure and energetics of Ni clusters with up to 150 atoms,,,,
physics/0306154,"From ab initio quantum chemistry to molecular dynamics: The delicate
  case of hydrogen bonding in ammonia",,,,
physics/0306185,"Fusion process of Lennard-Jones clusters: global minima and magic
  numbers formation",,,,
physics/0308083,"Dual kinetic balance approach to basis set expansions for the Dirac
  equation",,,,
physics/0308088,"Coulomb three-body systems and charge transfer collisions in a
  configuration-space approach",,,,
physics/0309024,"Optical Manipulation of Long-range Interactions at the 3s+3p Asymptote
  of Na$_2$",,,,
physics/0309074,"OCS in small para-hydrogen clusters: energetics and structure with N=1-8
  complexed hydrogen molecules",,,,
physics/0309081,"Comparison of Rotational Energies and Rigidity of OCS-paraH_2 and
  OCS-4He complexes",,,,
physics/0309101,"Evolution in the structural and bonding properties of Aluminum-Lithium
  clusters",,,,
physics/0309103,Microscopic study of the He2-SF6 trimers,,,,
physics/0309105,"Lowest Open Channels, Bound States, and Narrow Resonances of
  Dipositronium",,,,
physics/0310018,Close-Packing of Clusters: Application to Al_100,,,,
physics/0310144,"Structure and stability of copper clusters : A tight-binding molecular
  dynamics study",,,,
physics/0311085,Structure and energetics of helium adsorption on nanosurfaces,,,,
physics/0311088,Optical response of small magnesium clusters,,,,
physics/0311097,Rules for Minimal Atomic Multipole Expansion of Molecular Fields,,,,
physics/0311109,Rearrangement of cluster structure during fission processes,,,,
physics/0312049,On the premelting features in sodium clusters,,,,
physics/0312098,Can Small Free Methane Clusters Exhibit Phase-like Transitions?,,,,
physics/0312110,Why do gallium clusters have a higher melting point than the bulk?,,,,
physics/0401096,Sodium atoms and clusters on graphite: a density functional study,,,,
physics/0401107,"Calculation of electron density of periodic systems using non-orthogonal
  localised orbitals",,,,
physics/0401108,"Comparison of localization procedures for applications in crystal
  embedding",,,,
physics/0402005,Momentum transfer to small particles by aloof electron beams,,,,
physics/0402061,Relativistic recursion relations for transition matrix elements,,,,
physics/0402086,"Broken-Symmetry Unrestricted Hybrid Density Functional Calculations on
  Nickel Dimer and Nickel Hydride",,,,
physics/0402102,"Molecular structures and vibrations of neutral and anionic CuOx (x =
  1-3,6) clusters",,,,
physics/0402103,Are hemispherical caps of boron-nitride nanotubes possible?,,,,
physics/0402104,"Stability of As$_n$ [n=4, 8, 20, 28, 32, 36, 60] Cage Structures",,,,
physics/0403048,Composition-induced structural transitions in mixed rare-gas clusters,,,,
physics/0403071,Variational Estimates using a Discrete Variable Representation,,,,
physics/0403101,"Taming the rugged landscape: production, reordering, and stabilization
  of selected cluster inherent structures in the X_(13-n)Y_n system",,,,
physics/0404069,Scanning tunneling microscopy and spectroscopy studies of graphite edges,,,,
physics/0404143,"Stretched chemical bonds in Si6H6: A transition from ring currents to
  localized pi-electrons?",,,,
physics/0404144,"Equilibrium geometries of low-lying isomers of some Li clusters, within
  Hartree-Fock theory plus bond order or MP2 correlation corrections",,,,
physics/0404145,"Theoretical Study of Quantum Scattering Processes for Diatomic Hydrogen
  $(^{2}S)$ and Oxygen $(^{3}P)$ Complex",,,,
physics/0405004,Infrared electron modes in light deformed clusters,,,,
physics/0406107,"Free Energy Approach to the Formation of an Icosahedral Structure during
  the Freezing of Gold Nanoclusters",,,,
physics/0407031,"Electronic structure, vibrational stability, infra-red, and Raman
  spectra of B24N24 cages",,,,
physics/0407039,Polarization forces in water deduced from single molecule data,,,,
physics/0407086,Electron--phonon coupling and anharmonic effects in metal clusters,,,,
physics/0407088,Discovery of dumbbell-shaped Cs*He_n exciplexes in solid He 4,,,,
physics/0407106,"Global minima of Al_N, Au_N and Pt_N, N=2-80, clusters described by
  Voter-Chen version of embedded-atom potentials",,,,
physics/0407119,Stacked clusters of polycyclic aromatic hydrocarbon molecules,,,,
physics/0407122,UV spectra of benzene isotopomers and dimers in helium nanodroplets,,,,
physics/0408087,"Calculation of van der Walls coefficients of alkali metal clusters by
  hydrodynamic approach to time-dependent density-functional theory",,,,
physics/0408098,On the observed irregular melting temperatures of free sodium clusters,,,,
physics/0408127,Minimal mass-size of a stable 3He cluster,,,,
physics/0409126,"Surface plasma resonance in small rare gas clusters by mixing IR and VUV
  laser pulses",,,,
physics/0410010,"Structural and energetic properties of nickel clusters: $2 \le N \le
  150$",,,,
physics/0410014,"A joint theoretical and experimental study of phenylene-acetylene
  molecular wires",,,,
physics/0410049,Kinetic approach to the cluster liquid-gas transition,,,,
physics/0410071,$e^+ + H$ direct annihilation above the positronium formation threshold,,,,
physics/0411104,"Importance of electronic self-consistency in the TDDFT based treatment
  of nonadiabatic molecular dynamics",,,,
physics/0411106,Mechanical Resonance of embedded cluster,,,,
physics/0411239,Photoionization of the fullerene ion C60+,,,,
physics/0412023,"Melting and evaporation transitions in small Al clusters: canonical
  Monte-Carlo simulations",,,,
physics/0412077,"Novel Features in 2D and 3D Neutral, Cationic, and Anionic Gold Clusters
  Au_{5 \leq n \leq 8}^Z (Z = 0, \pm)",,,,
physics/0501023,"Accurate interaction energies from perturbation theory based on
  Kohn-Sham model",,,,
physics/0501069,Modeling Na clusters in Ar matrices,,,,
physics/0501094,"Theoretical infra-red, Raman, and Optical spectra of the B36N36 cage",,,,
physics/0501125,Geometrical and statistical factors in fission of small metal clusters,,,,
physics/0502015,Stability of Small Neutral and Charged Strontium Clusters,,,,
physics/0502022,Predicting atomic dopant solvation in helium clusters: the MgHe$_n$ case,,,,
physics/0503009,"Large Magnetic Moments of Arsenic-Doped Mn Clusters and their Relevance
  to Mn-Doped III-V Semiconductor Ferromagnetism",,,,
physics/0503082,"On the crystal structure of lithium peroxide, Li2O2",,,,
physics/0503092,"Electronic structure of clusters (LiBC)_n: n=1, 2, 4",,,,
physics/0503100,Analysis of band-gap formation in squashed arm-chair CNT,,,,
physics/0504090,"The planar-to-tubular structural transition in boron clusters from
  optical absorption",,,,
physics/0505012,"Study of coupled states for the (4s^{2})^{1}S + (4s4p)^{3}P asymptote of
  Ca_{2}",,,,
physics/0505109,"Path integral virial estimator based on the scaling of fluctuation
  coordinates: Application to quantum clusters with fourth-order propagators",,,,
physics/0505185,Electron dynamics in strong laser pulse illumination,,,,
physics/0506047,"Neutral and ionic dopants in helium clusters: interaction forces for the
  $Li_2(a^3\Sigma_u^+)-He$ and $Li_2^+(X^2\Sigma_g^+)-He$",,,,
physics/0506048,"Microsolvation of Li$^+$ in small He Clusters. Li$^+$He$_n$ species from
  Classical and Quantum Calculations",,,,
physics/0506121,"Optical absorption by magnesia-supported gold clusters and
  nanocatalysts: effects from the support, cluster and adsorbants",,,,
physics/0507052,Equilibrium spherically curved 2D Lennard-Jones systems,,,,
physics/0508085,"A simple and surprisingly accurate approach to the chemical bond
  obtained from dimensional scaling",,,,
physics/0509141,"Determination of the lowest energy structure of Ag$_8$ from
  first-principles calculations",,,,
physics/0509162,"Configuration interaction study of single and double dipole plasmon
  excitations in Na_8",,,,
physics/0510095,"Stability criterions of an oscillating tip-cantilever system in dynamic
  force microscopy",,,,
physics/0510096,"Stability of an oscillating tip in Non-Contact Atomic Force Microscopy:
  theoretical and numerical investigations",,,,
physics/0511027,T-shaped dimer of coronene,,,,
physics/0511069,"Two-Photon Excitation of Low-Lying Electronic Quadrupole States in
  Atomic Clusters",,,,
physics/0511187,"Observation of individual molecules trapped on a nanostructured
  insulator",,,,
physics/0511190,"Isotopic replacement in ionic systems: the 4He2+ + 3He -> 3He4He+ + 4He
  reaction",,,,
physics/0512059,"Polyatomic Molecules Formed with a Rydberg Atom in an Ultracold
  Environment",,,,
physics/0512060,"Practicable factorized TDLDA for arbitrary density- and
  current-dependent functionals",,,,
physics/0512249,Nonlinear resonance absorption in laser-cluster interaction,,,,
physics/0601209,Vibrational spectrum of the H5+ molecule using quantum Monte Carlo,,,,
physics/0602021,A Density Functional Study of Bare and Hydrogenated Platinum Clusters,,,,
physics/0602068,Compact in-place gate valve for molecular beam experiments,,,,
physics/0602178,Diffusion-limited-aggregation on a directed small world network,,,,
physics/0604090,Spectroscopy and dynamics in helium nanodroplets,,,,
physics/0604128,Implicit Density Functional Theory,,,,
physics/0604143,Wave packet dynamics of potassium dimers attached to helium nanodroplets,,,,
physics/0605160,Unexpected Magnetism of Small Silver Clusters,,,,
physics/0605202,Rotational Energy Transfer in H2+H2,,,,
physics/0606032,"Structure, electronic properties and magnetic transition in manganese
  clusters",,,,
physics/0607184,Magnetism and Magnetic Isomers in Free Chromium Clusters,,,,
physics/0607185,"Collisionless energy absorption in the short-pulse intense laser-cluster
  interaction",,,,
physics/0608305,"Characterization of doping levels in heteronuclear, gas-phase, van der
  Waals clusters and their energy absorption from an intense optical field",,,,
physics/0609052,"Spectroscopy of free radicals and radical containing entrance-channel
  complexes in superfluid helium nano-droplets",,,,
physics/0610015,Matrix formalism of synchrobetatron coupling,,,,
physics/0610041,"A high-resolution infrared spectroscopic investigation of the halogen
  atom-HCN entrance channel complexes solvated in superfluid helium droplets",,,,
physics/0610055,"Magnetic structure of free cobalt clusters studied with Stern-Gerlach
  deflection experiments",,,,
physics/0610060,Is the Fermi field contact and isotropic?,,,,
physics/0610079,"Ab initio potential energy surfaces, bound states and electronic
  spectrum of the Ar-SH complex",,,,
physics/0610245,"Lattice Parameters Modification of Para-Dichlorbenzol Nanodimension
  Films",,,,
physics/0610246,"Examination of the Allocations of Building Molecules in the Single
  Crystal of the Para-Dichlorbenzol with the P-Dibromobenzene Solid Solution by
  the Method of the Raman Effect of Light Depending on Requirements of
  Selection",,,,
physics/0612009,"Complex Dynamics of Correlated Electrons in Molecular Double Ionization
  by an Ultrashort Intense Laser Pulse",,,,
physics/0612061,"Tracing ultrafast interatomic electronic decay processes in real time
  and space",,,,
physics/0612093,"Two-photon double ionization of helium in the region of photon energies
  42-50 eV",,,,
physics/0612123,Multichannel Formalism for Positron-Hydrogen Scattering and Annihilation,,,,
physics/0701028,Systematics of spin-polarized small Na clusters,,,,
physics/0701292,Dynamics and Infrared Spectroscopy of the Protonated Water Dimer,,,,
physics/0701343,"Noncontact atomic force microscopy simulator with phase-locked-loop
  controlled frequency detection and excitation",,,,
physics/0702238,"Structure and static response of small silver clusters to an external
  electric field",,,,
physics/0703267,"High activity of He droplets following ionization of systems inside
  those droplets",,,,
physics/9706021,Theoretical Study of Small (NaI)n Clusters,,,,
physics/9706030,Structural and Electronic Properties of Small Neutral (MgO)n Clusters,,,,
physics/9709032,Structure and Bonding in Small Neutral Alkali-Halide Clusters,,,,
physics/9710026,Hydrolysis of ferric ion in water and conformational equilibrium,,,,
physics/9711005,Influence of Dynamics on Magic Numbers for Silicon Clusters,,,,
physics/9712008,"Charge Transfer in Cluster-Atom Collisions Studied with Non-Adiabatic
  Quantum Molecular Dynamics",,,,
physics/9712012,Excitation and relaxation in atom-cluster collisions,,,,
physics/9801002,Nonradiative Electronic Deexcitation Time Scales in Metal Clusters,,,,
physics/9802017,Oscillator strengths with pseudopotentials,,,,
physics/9802020,"An ab initio path integral Monte Carlo simulation method for molecules
  and clusters: application to Li_4 and Li_5^+",,,,
physics/9806022,Ionic structure and photoabsorption in medium sized sodium clusters,,,,
physics/9806024,"Non-adiabatic molecular Hamiltonian: Canonical transformation coupling
  electronic and vibrational motions",,,,
physics/9806025,"Ab initio calculations of structures and stabilities of (NaI)_nNa+ and
  (CsI)_nCs+ cluster ions",,,,
physics/9806035,Construction of Simulation Wavefunctions for Aqueous Species: D3O+,,,,
physics/9808036,"Structures and Stabilities of Doubly-charged (MgO)nMg2+ (n=1-29) Cluster
  Ions",,,,
physics/9809006,The rovibrational kinetic energy for complexes of rigid molecules,,,,
physics/9809013,"Coulomb and spin-orbit interaction matrix elements in d^2d'
  configuration",,,,
