id,title,pagerank,betweenness,in_degree,out_degree
physics/9809019,"Orbital-Free Molecular Dynamics Simulations of Melting in Na8 and Na20:
  Melting in Steps",,,,
physics/9810001,Intensity of Two-Photon Absorption Transitions for Ni2+ in MgO,,,,
physics/9810030,"Guided random walk calculation of energies and $<\sq {r^2} >$ values of
  the $^1\Sigma_g$ state of H_2 in a magnetic field",,,,
physics/9810031,Rearrangements of Water Dimer and Hexamer,,,,
physics/9810032,Rearrangements and Tunneling Splittings in Small Water Clusters,,,,
physics/9810047,Two-Photon Spectroscopy of Transition-Metal Ions in Cubical Symmetry,,,,
physics/9810048,"Multi-Photon Laser Spectroscopy of Transition Ions in Crystals: Recent
  Progress in the Use of Symmetry Considerations",,,,
physics/9810055,Symmetry Adaptation Techniques in n-Photon Absorption Spectroscopy,,,,
physics/9811032,Symmetry Adaptation in Two-Photon Spectroscopy,,,,
physics/9811033,"Two-Photon Laser Spectroscopy of Transition Ions in Crystals: Inter-
  Configurational Transitions",,,,
physics/9811035,"Symmetry Adaptation and Two-Photon Spectroscopy of Ions in Molecular or
  Solid-State Finite Symmetry",,,,
physics/9811036,Sum Rules for Multi-Photon Spectroscopy of Ions in Finite Symmetry,,,,
physics/9902019,The ground-state spectroscopic constants of Be_2 revisited,,,,
physics/9902025,"Dissociative Autoionization in (1+2)-photon Above Threshold Excitation
  of H2 Molecules",,,,
physics/9902047,Noncollinear magnetic ordering in small Chromium Clusters,,,,
physics/9903001,"Implications of non-feasible transformations among icosahedral $h$
  orbitals",,,,
physics/9903041,Optical response of small silver clusters,,,,
physics/9903048,Underthreshold resonances in three-particle molecular systems,,,,
physics/9904052,Incoherent Energy Transfer within Light-harvesting Complexes,,,,
physics/9905016,"Parametric Resonance in the Drift Motion of an Ionic Bubble in near
  critical Ar Gas",,,,
physics/9905052,Geometry and symmetries of multi-particle systems,,,,
physics/9906005,"Electronic entropy, shell structure, and size-evolutionary patterns of
  metal clusters",,,,
physics/9906026,"Comment on ""Density functional theory study of some structural and
  energetic properties of small lithium clusters"" [J. Chem. Phys. 105, 9933
  (1996)]",,,,
physics/9907022,Quantum Monte Carlo study of the H- impurity in small helium clusters,,,,
physics/9907050,"The dynamical Green's function and an exact optical potential for
  electron-molecule scattering including nuclear dynamics",,,,
physics/9908034,Tight-binding molecular dynamic study of silver clusters,,,,
physics/9909022,"Dissociation, fragmentation and fission of simple metal clusters",,,,
physics/9909058,"Photoelectron spectra of aluminum cluster anions: Temperature effects
  and ab initio simulations",,,,
physics/9910048,"Wild cables and survivability of macroscopic molecular structures in hot
  tokamak plasmas",,,,
physics/9911049,Symmetry in Order-Disorder Changes of Molecular Clusters,,,,
physics/9911052,"Electron exchange model potential: Application to positronium-helium
  scattering",,,,
physics/9911053,Low-energy quenching of positronium by helium,,,,
physics/9911054,Positronium-hydrogen-atom scattering in a five-state model,,,,
physics/9911058,"Semiempirical charge distribution of clusters in the ion sputtering of
  metal",,,,
physics/9912045,Static Electric Dipole Polarizabilities of Na Clusters,,,,
quant-ph/0002086,"Pressure dependence of the Mg $3s4s^3S_1 \to 3s3p^3P_{0,1,2}$ transition
  in superfluid $^4$He",,,,
quant-ph/0102057,"Interference of resonances and the double-pole of the S-matrix in a
  double well system",,,,
quant-ph/0402065,"Collective excitations in circular atomic configurations, and
  single-photon traps",,,,
quant-ph/0505021,"Inter-dimensional Degeneracies in van der Waals Clusters and Quantum
  Monte Carlo Computation of Rovibrational States",,,,
quant-ph/0609008,"Precise Control of Molecular Dynamics with a Femtosecond Frequency Comb
  - A Weak Field Route to Strong Field Coherent Control",,,,
quant-ph/9711007,"Symmetries in nuclear, atomic and molecular spectroscopy",,,,
quant-ph/9712014,"On a Generalized Oscillator: Invariance Algebra and Interbasis
  Expansions",,,,
quant-ph/9911096,"The Van der Waals interaction of the hydrogen molecule - an exact local
  energy density functional",,,,
