id,title,pagerank,betweenness,in_degree,out_degree
physics/0405024,Kinetic Derivation of the Hydrodynamic Equations for Capillary Fluids,,,,
physics/0405042,Relativistic Doppler effect: universal spectra and zeptosecond pulses,,,,
physics/0405052,"A guiding-center Fokker-Planck collision operator for nonuniform
  magnetic fields",,,,
physics/0405083,Radiation Pressure Dominate Regime of Relativistic Ion Acceleration,,,,
physics/0405114,"Stimulated Raman backscattering of laser radiation in deep plasma
  channels",,,,
physics/0405116,Electron trapping by electric field reversal and Fermi mechanism,,,,
physics/0405138,"One-point statistics and intermittency of induced electric field in the
  solar wind",,,,
physics/0405140,Monte Carlo results for the hydrogen Hugoniot,,,,
physics/0405149,Table-top synchrotron,,,,
physics/0406047,"Two-dimensional PIC-MCC simulations of capacitively coupled
  radio-frequency discharge in methane",,,,
physics/0406063,"Three species collisionless reconnection: Effect of O+ on magnetotail
  reconnection",,,,
physics/0406125,"Space-frequency model of amplified spontaneous emission and
  super-radiance in free electron laser operating in the linear and non-linear
  regimes",,,,
physics/0406132,"Two-fluid magnetic island dynamics in slab geometry: I - Isolated
  islands",,,,
physics/0406133,"Two-fluid magnetic island dynamics in slab geometry: II - Islands
  interacting with resistive walls or static external resonant magnetic
  perturbations",,,,
physics/0406141,Exact solution of the Zeeman effect in single-electron systems,,,,
physics/0406146,"Analytical Solutions for the Nonlinear Longitudinal Drift Compression
  (Expansion) of Intense Charged Particle Beams",,,,
physics/0407011,"Canonical Lie-transform method in Hamiltonian gyrokinetics: a new
  approach",,,,
physics/0407015,Relativistic kinetic theory of magnetoplasmas,,,,
physics/0407034,Linear Waves in Imperfect Relativistic MHD Fluid,,,,
physics/0407047,Fast and slow nonlinear tearing mode reconnection,,,,
physics/0407052,"Force measurements in positive unipolar wire-to-plane corona discharges
  in air",,,,
physics/0407079,"Relationship between Horizontal Flow Velocity and Cell Lifetime for
  Supergranulation",,,,
physics/0407155,"Weibel instability on weakly relativistic produced plasma by circular
  polarization microwave electric field",,,,
physics/0408014,"Absence of saturation for finite injected currents in axially symmetric
  cavity diode",,,,
physics/0408029,Larmor radius effects on impurity transport in turbulent plasmas,,,,
physics/0408036,"Low-Frequency Instability of Linearly and
  Circularly-Polarized-Microwave-Field Produced Plasmas",,,,
physics/0408057,Prompt Beta Spectroscopy as a Diagnostic for Mix in Ignited NIF Capsules,,,,
physics/0408082,"Escape patterns due to ergodic magnetic limiters in tokamaks with
  reversed magnetic shear",,,,
physics/0408128,Short waves and cyclotron losses in the relativistic gyrokinetic theory,,,,
physics/0409026,"Arbitrary amplitude inertial Alfven waves in homogeneous magnetized
  electron-positron-ion plasmas",,,,
physics/0409028,"Photoluminescence and Terahertz Emission from Femtosecond Laser-Induced
  Plasma Channels",,,,
physics/0409036,Contactless inductive flow tomography,,,,
physics/0409056,"On the probability distribution function of small scale interplanetary
  magnetic field fluctuations",,,,
physics/0409074,Self-organization in turbulence as a route to order in plasma and fluids,,,,
physics/0409091,Criticality in a Vlasov-Poisson system - a fermionic universality class,,,,
physics/0409093,Topological soliton in magnetohydrodynamics,,,,
physics/0409119,Variational formulations of exact and reduced Vlasov-Maxwell equations,,,,
physics/0409138,Laser wakefield acceleration by petawatt ultra-short laser pulses,,,,
physics/0409145,"Kinematic dynamo action in a sphere: Effects of periodic time-dependent
  flows on solutions with axial dipole symmetry",,,,
physics/0410042,Dusty plasma liquids,,,,
physics/0410052,Ionization fronts in negative corona discharges,,,,
physics/0410072,"Theoretical and numerical investigation of the shock formation of dust
  ion acoustic waves",,,,
physics/0410073,Wavelet analysis of magnetic turbulence in the Earth's plasma sheet,,,,
physics/0410075,Nonlinear whitlerons,,,,
physics/0410091,Kinetic fluctuations in the inhomogeneous plasma,,,,
physics/0410092,Impurity transport in plasma edge turbulence,,,,
physics/0410093,Theory of solitary waves in complex plasma lattices,,,,
physics/0410094,Lagrangean formulation of ion- and dust-ion-acoustic waves,,,,
physics/0410095,Intrinsic localized modes in dust lattices,,,,
physics/0410100,"Modulated envelope localized wavepackets associated with electrostatic
  plasma waves",,,,
physics/0410101,"Developement of real time diagnostics and feedback algorithms for JET in
  view of the next step",,,,
physics/0410106,Analytical theory of Doppler reflectometry in slab plasma model,,,,
physics/0410107,Spatial and Wavenumber Resolution of Doppler Reflectometry,,,,
physics/0410112,"Plasma heating due to X-B mode conversion in a cylindrical ECR plasma
  system",,,,
physics/0410118,"Stabilization of burn conditions in an ITER FEAT like tokamak with
  uncertainities in the helium ash confinement time",,,,
physics/0410120,Selective production of metallic carbon nanotubes,,,,
physics/0410131,"Nonlinear dynamics of electromagnetic pulses in cold relativistic
  plasmas",,,,
physics/0410143,Phase-Space Holes in an Electron-Beam-Plasma,,,,
physics/0410152,"Analysis of the Drift Instability Growth Rates in Non-Ideal
  inhomogeneous Dusty Plasmas",,,,
physics/0410153,Intermittent transport in edge plasmas,,,,
physics/0410156,"Stability of off-axis motion for intense particle beams in periodically
  focusing channels",,,,
physics/0410160,The case of the trapped singularities,,,,
physics/0410164,"Plasma production by helicon waves with single mode number in low
  magnetic fields",,,,
physics/0410166,"Polarization reversal of electron cyclotron wave due to radial boundary
  condition",,,,
physics/0410167,"Fluctuation-phase relation between positive and negative ions on
  pair-plasma electrostatic waves",,,,
physics/0410173,"Accelerated electron populations formed by Langmuir wave-caviton
  interactions",,,,
physics/0410175,"Reconstruction of Zeff profiles at TEXTOR through Bayasian source
  separation",,,,
physics/0410178,"Nonlinear saturation of magnetic curvature driven Rayleigh Taylor
  instability in three dimensions",,,,
physics/0410182,"Propagation of finite amplitude electrostatic disturbances in an
  inhomogeneous magnetized plasma",,,,
physics/0410183,"Electrostatic ion-cyclotron instabilities modified by the parallel and
  perpendicular plasma flow velocity shears",,,,
physics/0410187,"Measurement of electron sheath thickness and collection region of
  electric probe using laser photodetachment signals",,,,
physics/0410188,"Impact of dissipative effects on the macroscopic evolution of a Vlasov
  system",,,,
physics/0410190,"Threshold of parametric decay instability accompanying electron
  Bernstein wave heating in spherical tokamaks",,,,
physics/0410191,Three-dimensional PIC simulation of electron plasmas,,,,
physics/0410193,Stochastic acceleration in strong random fields,,,,
physics/0410201,"Particle-in-cell simulations of high energy electron production by
  intense laser pulses in underdense plasmas",,,,
physics/0410203,"Disperson relation of finite amplitude Alfven wave in a relativistic
  electron- positron plasma",,,,
physics/0410204,Longitudinal oscillations in a nonextensive relativistic plasma,,,,
physics/0410206,Multi-scale magnetic field intermittence in the plasma sheet,,,,
physics/0410207,"Potential of a moving test charge in a dusty plasma in the presence of
  grain size distribution and grain charging dynamics",,,,
physics/0410210,"Multi-ion-species effects on magnetosonic waves and energy transfer in
  thermal equilibrium plasmas",,,,
physics/0410213,"A comparative analysis of the EEDF obtained by regularization methods
  and by a least-squares fitting",,,,
physics/0410215,Electron cyclotron current drive efficiency in an axisymmetric tokamak,,,,
physics/0410218,Dynamics of relativistic solitons,,,,
physics/0410223,"Anti-ExB flow field associated with a vortex formation in a partially
  ionized plasma",,,,
physics/0410227,"A study of magnetically-supported dc discharge in cylindrical and
  inverted cyclindrical configuration",,,,
physics/0410230,"Generation of quasi static magnetic field in the relativisitic
  laser-plasma interactions",,,,
physics/0410234,"Effects of laser wavelength and density scalelength on absorption of
  ultrashort intense lasers on solid-density targets",,,,
physics/0410240,Coherent structures in an electron beam,,,,
physics/0410241,Extension and its characteristics of ECRH plasma in the LHD,,,,
physics/0410242,Electron dynamics at the initial stage of floating-sheath formation,,,,
physics/0410251,Modified Zakharov equations for plasmas with a quantum correction,,,,
physics/0410276,"Nonlocal Nonlinear Electrostatic Gyrofluid Equations: A four-moment
  model",,,,
physics/0411001,"Study of charge-charge coupling effects on dipole emitter relaxation
  within a classical electron-ion plasma description",,,,
physics/0411053,Ion resonance instability in the Eltrap electron plasma,,,,
physics/0411055,"Scaling and singularity characteristics of solar wind and magnetospheric
  fluctuations",,,,
physics/0411058,Wave-kinetic description of nonlinear photons,,,,
physics/0411068,Study on high pressure plasma produced by ArF laser,,,,
physics/0411069,Development behavior of liquid plasma produced by YAG laser,,,,
physics/0411075,"Search for optimal 2D and 3D wave launching configurations for the
  largest acceleration of charged particles in a magnetized plasma, Resonant
  Moments Method",,,,
physics/0411086,ELM triggering conditions for the integrated modeling of H-mode plasmas,,,,
physics/0411089,"On the jets, kinks, and spheromaks formed by a planar magnetized coaxial
  gun",,,,
physics/0411112,"Modulated dust-acoustic wave packets in a plasma with non-isothermal
  electrons and ions",,,,
physics/0411116,"The magnetized dusty plasma discharge : negative and positive space
  charge modes",,,,
physics/0411132,Multitoroidal configurations as equilibrium flow eigenstates,,,,
physics/0411133,"Modulation of harmonic emission spectra from intense laser-plasma
  interaction",,,,
physics/0411144,"A new parallel strategy for two-dimensional incompressible flow
  simulations using pseudo-spectral methods",,,,
physics/0411152,Marginal Confinement in Tokamaks by Inductive Electric Field,,,,
physics/0411153,"Formation mechanism of the atmospheric ball lightning using the triple
  Beltrami equation",,,,
physics/0411173,Power loss in open cavity diodes and a modified Child Langmuir Law,,,,
physics/0411175,"Generalization of Child-Langmuir Law for Non-Zero Injection Velocities
  in a Planar Diode",,,,
physics/0411177,"The effects of induced scattering of Alfven waves for the solar wind
  acceleratio",,,,
physics/0411180,Transonic instabilities in accretion disks,,,,
physics/0411230,Magnetic turbulence in the plasma sheet,,,,
physics/0411235,On linear coupling of acoustic and cyclotron waves in plasma flows,,,,
physics/0412014,"The scaling properties of dissipation in incompressible isotropic
  three-dimensional magnetohydrodynamic turbulence",,,,
physics/0412033,Free-energy model for fluid helium at high density,,,,
physics/0412046,Nonlinear Evolution of q=1 Triple Tearing Modes in a Tokamak Plasma,,,,
physics/0412047,Whistleron Gas in Magnetized Plasmas,,,,
physics/0412053,Sympathetic cooling of $^4$He$^+$ ions in a radiofrequency trap,,,,
physics/0412054,Ellipsoidal Coulomb Crystals in a Linear Radiofrequency Trap,,,,
physics/0412086,"Oscillations in DC driven ""barrier"" discharges: numerical solutions,
  stability analysis and phase diagram",,,,
physics/0412091,Spectral line shapes in low frequency turbulent tokamak plasmas,,,,
physics/0412121,"Theory of the propagation of coupled waves in arbitrarily-inhomogeneous
  stratified media",,,,
physics/0412130,Shear Flow Generation and Energetics in Electromagnetic Turbulence,,,,
physics/0412147,Effective field theory of the classical two-dimensional plasma,,,,
physics/0412173,"Electron Bernstein waves in spherical tokamak plasmas with ""magnetic
  wells""",,,,
physics/0501034,Stochastic Ion Heating by a Lower Hybrid Wave: II,,,,
physics/0501035,"Velocity-Space Diffusion in a Perpendicularly Propagating Electrostatic
  Wave",,,,
physics/0501039,"Anomalous diffusion, clustering, and pinch of impurities in plasma edge
  turbulence",,,,
physics/0501047,"Temporal Evolution of Lower Hybrid Waves in the Presence of
  Ponderomotive Density Fluctuations",,,,
physics/0501058,Efficiency of Current Drive by Fast Waves,,,,
physics/0501059,Current in Wave Driven Plasmas,,,,
physics/0501062,Quantum theory of SASE FEL,,,,
physics/0501066,Fokker-Planck and Quasilinear Codes,,,,
physics/0501067,Differential Form of the Collision Integral for a Relativistic Plasma,,,,
physics/0501136,"Perturbative approach to the nonlinear saturation of the tearing mode
  for any current gradient",,,,
physics/0502001,A catastrophe model for fast magnetic reconnection onset,,,,
physics/0502030,Dynamical Alignment in Three Species Tokamak Edge Turbulence,,,,
physics/0502044,Phase distortion mechanisms in linear beam vacuum devices,,,,
physics/0502125,"Investigation of transfer coefficients for many-component dense systems
  of neutral and charged hard spheres",,,,
physics/0503021,Quantum Magnetohydrodynamics,,,,
physics/0503029,Dust acoustic wave in a strongly magnetized pair-dust plasma,,,,
physics/0503043,"A Computational Fluid Model for Investigation of Plasma Waves and
  Instabilities",,,,
physics/0503068,Fast growing double tearing modes in a tokamak plasma,,,,
physics/0503077,On existence of resistive magnetohydrodynamic equilibria,,,,
physics/0503103,"Measurement of the electric fluctuation spectrum of magnetohydrodynamic
  turbulence",,,,
physics/0503182,On some recent results about inertial manifolds and kinematic dynamos,,,,
physics/0503209,"Invariant imbedding theory of mode conversion in inhomogeneous plasmas:
  I. Exact calculation of the mode conversion coefficient in cold, unmagnetized
  plasmas",,,,
physics/0504021,Dynamic positive column in long-gap barrier discharges,,,,
physics/0504104,"Investigation of fluorescence radiation following radiative
  recombination of ions and electrons",,,,
physics/0504115,"General expression for the dielectronic recombination cross section of
  polarized ions with polarized electrons",,,,
physics/0504152,Microfield distributions in strongly coupled two-component plasmas,,,,
physics/0504169,"Investigation of the complex dynamics and regime control in Pierce diode
  with the delay feedback",,,,
physics/0504209,"Intermittent turbulence and turbulent structures in a linear magnetized
  plasma",,,,
physics/0505011,Subsonic ion-acoustic solitons,,,,
physics/0505101,"Two-fluid tokamak equilibria with reversed magnetic shear and sheared
  flow",,,,
physics/0505140,A Femtosecond Neutron Source,,,,
physics/0505150,Plasma dynamics and a significant error of macroscopic averaging,,,,
physics/0506031,"Nanostructures and enhanced absorption in intense laser interaction with
  matter: effect of laser prepulses",,,,
physics/0506059,Energy-conserving Finite-beta Electromagnetic Drift-fluid Equations,,,,
physics/0506073,Variational principle for linear stability of moving magnetized plasma,,,,
physics/0506088,"Cancellation exponent and multifractal structure in two-dimensional
  magnetohydrodynamics: direct numerical simulations and Lagrangian averaged
  modeling",,,,
physics/0506135,Revisiting the anomalous rf field penetration into a warm plasma,,,,
physics/0506140,Axisymmetric equilibria with anisotropic resistivity and toroidal flow,,,,
physics/0506221,"Dynamic and Stagnating Plasma Flow Leading to Magnetic Flux Tube
  Collimation",,,,
physics/0506226,Generation and Propagation of Nonlinear Waves in Travelling Wave Tubes,,,,
physics/0507076,Self-consistent Monte-Carlo simulation of the positive column in Argon,,,,
physics/0507100,"Theory of the Laser Wake-Field Accelerator Revisited: Wake Overtaking,
  Localized Spectrum and Ponderomotive Acceleration",,,,
physics/0507119,Classical and quantum kinetics of the Zakharov system,,,,
physics/0507206,"X-point collapse and saturation in the nonlinear tearing mode
  reconnection",,,,
physics/0508006,"Differential Geometric and Topological methods with MHD and plasma
  physics",,,,
physics/0508106,Vlasov Simulations of Trapping and Inhomogeneity in Raman Scattering,,,,
physics/0508125,"Observation of Three-dimensional Long-range Order in Smaller Ion Coulomb
  Crystals in an rf Trap",,,,
physics/0508173,"Inertial Range Scaling, Karman-Howarth Theorem and Intermittency for
  Forced and Decaying Lagrangian Averaged MHD in 2D",,,,
physics/0508212,Structural properties of screened Coulomb balls,,,,
physics/0509019,Spectral energy dynamics in magnetohydrodynamic turbulence,,,,
physics/0509091,A Landau fluid model for warm collisionless plasmas,,,,
physics/0509096,"Enabling pulse compression and proton acceleration in a modular ICF
  driver for nuclear and particle physics applications",,,,
physics/0509125,Electron and ion transport in dense rare gases,,,,
physics/0509175,"Coherent instabilities of intense high-energy ""white"" charged-particle
  beams in the presence of nonlocal effects within the context of the Madelung
  fluid description",,,,
physics/0509180,"Laboratory observation of a nonlinear interaction between shear
  Alfv\'{e}n waves",,,,
physics/0509186,Kinetic electrostatic structures in current-carrying pair plasmas,,,,
physics/0509190,Rigorous theory of nuclear fusion rates in a plasma,,,,
physics/0509191,Highly charged ions in a weakly coupled plasma: an exact solution,,,,
physics/0509238,Covariant kinetic theory of nonlinear plasma waves interaction,,,,
physics/0510006,Equation of state for partially ionized carbon at high temperatures,,,,
physics/0510057,MHD dynamo generation via Riemannian soliton theory,,,,
physics/0510109,Levy-Student Distributions for Halos in Accelerator Beams,,,,
physics/0510131,Nontrapping arrest of Langmuir wave damping near the threshold amplitude,,,,
physics/0510139,Is a Plasma Diamagnetic?,,,,
physics/0510140,On the Solvability of Magnetic Differential Equations,,,,
physics/0510189,"Laser Ion Acceleration Scaling Laws Seen in Muti-Parametric PIC
  Simulations",,,,
physics/0510265,"Measurements of the magnetic field induced by a turbulent flow of liquid
  metal",,,,
physics/0511029,Observation of a Turbulence-Induced Large Scale Magnetic Field,,,,
physics/0511070,"Focusing of laser-generated ion beams by a plasma cylinder: similarity
  theory and the thick lens formula",,,,
physics/0511083,Incoherent interaction of light with electron-acoustic waves,,,,
physics/0511111,"Nonlinear Interactions of Gravitational Wave with Matter in
  Magnetic-type Maxwell-Vlasov Description",,,,
physics/0511117,Cerenkov Emission by Neutral Particles in Gravitoelectro-magnetic Fields,,,,
physics/0511124,Early nonlinear regime of MHD internal modes: the resistive case,,,,
physics/0511126,"Nonlinear evolution of the m=1 internal kink mode in the presence of
  magnetohydrodynamic turbulence",,,,
physics/0511134,A numerical simulation of the backward Raman amplifying in plasma,,,,
physics/0511149,"Ambivalent effects of added layers on steady kinematic dynamos in
  cylindrical geometry: application to the VKS experiment",,,,
physics/0511195,"Nonlinear evolution of the plasma beatwave: Compressing the laser
  beatnotes via electromagnetic cascading",,,,
physics/0511196,"Single-Cycle High-Intensity Electromagnetic Pulse Generation in the
  Interaction of a Plasma Wakefield with Nonlinear Coherent Structures",,,,
physics/0512003,"The effects of the pre-pulse on capillary discharge extreme ultraviolet
  laser",,,,
physics/0512024,The role of magnetic flux and wall current drain on anomalous diffusion,,,,
physics/0512041,Self-sustained oscillations in a Large Magneto-Optical Trap,,,,
physics/0512060,"Practicable factorized TDLDA for arbitrary density- and
  current-dependent functionals",,,,
physics/0512067,"Titanium plasma source for capillary discharge extreme ultraviolet
  lasers",,,,
physics/0512079,"EHD ponderomotive forces and aerodynamic flow control using plasma
  actuators",,,,
physics/0512103,"Meteor generated plasma columns in E-region ionosphere: fields and
  diffusion",,,,
physics/0512191,"Fluid simulation studies of the dynamical behaviour of one dimensional
  relativistic electromagnetic solitons",,,,
physics/0512231,Very High Mach Number Electrostatic Shocks in Collisionless Plasmas,,,,
physics/0512247,Virtual Reality Visualization by CAVE with VFIVE and VTK,,,,
physics/0512271,How much laser power can propagate through fusion plasma?,,,,
physics/0601041,"Path integral Monte Carlo calculations of helium and hydrogen-helium
  plasma thermodynamics and of the deuterium shock Hugoniot",,,,
physics/0601065,Dynamics of broadband dispersive Alfven waves,,,,
physics/0601082,"Viscosity and mutual diffusion in strongly asymmetric binary ionic
  mixtures",,,,
physics/0601180,"Spectral line shape modeling and ion temperature fluctuations in tokamak
  edge plasmas",,,,
physics/0601193,Parametric instabilities in magnetized multicomponent plasmas,,,,
physics/0601197,Geomagnetic storm dependence on the solar flare class,,,,
physics/0601200,"A global simulation for laser driven MeV electrons in $50\mu m$-diameter
  fast ignition targets",,,,
physics/0601211,MovieMaker: A Parallel Movie-Making Software for Large Scale Simulations,,,,
physics/0601220,Darwin-Vlasov Simulations of magnetized Plasmas,,,,
physics/0602004,A Parallel Mesh-Adaptive Framework for Hyperbolic Conservation Laws,,,,
physics/0602006,Solar arcades as possible minimum dissipative relaxed states,,,,
physics/0602010,Large-amplitude Electron Oscillations in a Plasma Slab,,,,
physics/0602089,The three-wave coupling coefficients for a cold magnetized plasma,,,,
physics/0602090,Nonlinear interaction between three kinetic Alfv\'{e}n waves,,,,
physics/0602127,"Controlling chaos in spatially extended beam-plasma system by the
  continuous delayed feedback",,,,
physics/0602147,Magnetohydrodynamic activity inside a sphere,,,,
physics/0602155,"Invariant imbedding theory of mode conversion in inhomogeneous plasmas.
  II. Mode conversion in cold, magnetized plasmas with perpendicular
  inhomogeneity",,,,
physics/0602168,Early out-of-equilibrium beam-plasma evolution,,,,
physics/0603048,Stabilisation of BGK modes by relativistic effects,,,,
physics/0603086,The clustering of polarity reversals of the geomagnetic field,,,,
physics/0603134,"Determination of the Carrier-Envelope Phase of Few-Cycle Laser Pulses
  with Terahertz-Emission Spectroscopy",,,,
physics/0603204,"Rigorous approach to the nonlinear saturation of the tearing mode in
  cylindrical and slab geometry",,,,
physics/0603208,"Comparison of time splitting and backsubstitution methods for
  integrating Vlasov's equation with magnetic fields",,,,
physics/0603209,"Aspects of Electron Acoustic Wave Physics in Laser Backscatter from
  Plasmas",,,,
physics/0603223,Relativistic quantum plasma dispersion functions,,,,
physics/0603227,Dispersion in a relativistic degenerate electron gas,,,,
physics/0603234,"Relation between space charge limited current and power loss in open
  drift tubes",,,,
physics/0603239,The moving boundary problem in the presence of a dipole magnetic field,,,,
physics/0603250,"Highly Charged Ions in a Dilute Plasma: An Exact Asymptotic Solution
  Involving Strong Coupling",,,,
physics/0604001,A Model for Spontaneous Onset of Fast Magnetic Reconnection,,,,
physics/0604055,"Oblique electromagnetic instabilities for an ultra relativistic electron
  beam passing through a plasma",,,,
physics/0604122,Nonlinear interactions between kinetic Alfv\'{e}n and ion-sound waves,,,,
physics/0604136,"Controlled Shock Shells and Intracluster Fusion Reactions in the
  Explosion of Large Clusters",,,,
physics/0604138,Kinetics of the collisionless expansion of spherical nanoplasmas,,,,
physics/0604210,3D Lattice-Boltzmann Model for Magnetic Reconnection,,,,
physics/0604223,New parametrization for differences between plasma kinetic codes,,,,
physics/0605048,"Influence of equation of state on interpretation of electrical
  conductivity measurements in strongly coupled tungsten plasma",,,,
physics/0605081,"Field-induced phases of an orientable charged particle in a dilute
  background of point charges",,,,
physics/0605128,"Instability and dynamics of two nonlinearly coupled laser beams in a
  plasma",,,,
physics/0605169,Nonlinear interaction between three inertial Alfv\'{e}n waves,,,,
physics/0605174,"A Proposed Experiment to Study Relaxation Formation of a Spherical
  Tokamak with a Plasma Center Column",,,,
physics/0605178,"Transverse Dynamics and Energy Tuning of Fast Electrons Generated in
  Sub-Relativistic Intensity Laser Pulse Interaction with Plasmas",,,,
physics/0605217,Torus instability,,,,
physics/0605249,"Three-dimensional fast electron transport for ignition-scale inertial
  fusion capsules",,,,
physics/0606033,"Collisionless energy absorption in nanoplasma layer in regular and
  stochastic regimes",,,,
physics/0606047,"Collisionless magnetic field reconnection from first principles: What it
  can and cannot do",,,,
