id,title,pagerank,betweenness,in_degree,out_degree
math/0505600,"Asymptotic results with generalized estimating equations for
  longitudinal data",,,,
math/0505602,Analysis of binary spatial data by quasi-likelihood estimating equations,,,,
math/0505603,Default priors for Gaussian processes,,,,
math/0505604,"Likelihood approach for marginal proportional hazards regression in the
  presence of dependent censoring",,,,
math/0505605,"Posterior propriety and admissibility of hyperpriors in normal
  hierarchical models",,,,
math/0505606,"Functionals of Dirichlet processes, the Cifarelli-Regazzini identity and
  Beta-Gamma processes",,,,
math/0505631,"Multiprocess parallel antithetic coupling for backward and forward
  Markov Chain Monte Carlo",,,,
math/0505632,Confidence sets for nonparametric wavelet regression,,,,
math/0505633,Spike and slab variable selection: Frequentist and Bayesian strategies,,,,
math/0505638,Generalized functional linear models,,,,
math/0505639,Extremal quantile regression,,,,
math/0505640,Data-driven rate-optimal specification testing in regression models,,,,
math/0505641,"Optimal and efficient crossover designs for comparing test treatments
  with a control treatment",,,,
math/0505642,A general theory of minimum aberration and its applications,,,,
math/0506027,"Modelling multivariate volatilies via conditionally uncorrelated
  components",,,,
math/0506028,"Assessing prediction error of nonparametric regression and
  classification under Bregman divergence",,,,
math/0506029,"Dynamic Integration of Time- and State-domain Methods for Volatility
  Estimation",,,,
math/0506080,Two new Markov order estimators,,,,
math/0506081,"The Dantzig selector: Statistical estimation when $p$ is much larger
  than $n$",,,,
math/0506125,"A Fast Algorithm for Computing Expected Loan Portfolio Tranche Loss in
  the Gaussian Factor Model",,,,
math/0506163,Monotone invariants and embeddings of statistical manifolds,,,,
math/0506296,Invariant Bayesian estimation on manifolds,,,,
math/0506300,"Local central limit theorems, the high-order correlations of rejective
  sampling and logistic likelihood asymptotics",,,,
math/0506342,Rodeo: Sparse Nonparametric Regression in High Dimensions,,,,
math/0506378,"Fast Computation of the Expected Loss of a Loan Portfolio Tranche in the
  Gaussian Factor Model: Using Hermite Expansions for Higher Accuracy",,,,
math/0506607,Independent Component Analysis by Wavelets,,,,
math/0507080,"Equi-energy sampler with applications in statistical inference and
  statistical mechanics",,,,
math/0507082,"Fast Computation Of the Economic Capital, the Value at Risk and the
  Greeks of a Loan Portfolio in the Gaussian Factor Model",,,,
math/0507084,Central limit theorems for a class of irreducible multicolor urn models,,,,
math/0507089,"Addendum to the discussion of ""Breakdown and groups""",,,,
math/0507267,Stationarity of Switching VAR and Other Related Models,,,,
math/0507367,Le Cam spacings theorem in dimension two,,,,
math/0507415,Optimal testing of equivalence hypotheses,,,,
math/0507416,Nonparametric checks for single-index models,,,,
math/0507417,On Optimality of Stepdown and Stepup Multiple Test Procedures,,,,
math/0507419,Testing for monotone increasing hazard rate,,,,
math/0507420,Generalizations of the Familywise Error Rate,,,,
math/0507421,Hierarchical testing designs for pattern recognition,,,,
math/0507422,"Square Root Penalty: Adaptation to the Margin in Classification and in
  Edge Estimation",,,,
math/0507423,"Large sample theory of intrinsic and extrinsic sample means on
  manifolds--II",,,,
math/0507425,Bandwidth selection for smooth backfitting in additive models,,,,
math/0507426,Nonparametric regression penalizing deviations from additivity,,,,
math/0507427,"Estimation of a function under shape restrictions. Applications to
  reliability",,,,
math/0507428,Optimal smoothing in nonparametric mixed-effect models,,,,
math/0507431,Uniform in bandwidth consistency of kernel-type function estimators,,,,
math/0507432,"Approximating conditional distribution functions using dimension
  reduction",,,,
math/0507434,"Nonanticipating estimation applied to sequential analysis and
  changepoint detection",,,,
math/0507510,"LAD Regression and Nonparametric Methods for Detecting Outliers and
  Leverage Points",,,,
math/0507529,"The Geometry of Statistical Models for Two-Way Contingency Tables with
  Fixed Odds Ratios",,,,
math/0508060,The Short-Cut Metropolis Method,,,,
math/0508073,CLT in Functional Linear Regression Models,,,,
math/0508089,Position play in carom billiards as a Markov process,,,,
math/0508219,"Marginal asymptotics for the ""large p, small n"" paradigm: with
  applications to microarray data",,,,
math/0508275,Local Rademacher complexities,,,,
math/0508276,Boosting with early stopping: Convergence and consistency,,,,
math/0508277,Contour regression: A general approach to dimension reduction,,,,
math/0508278,Variable selection using MM algorithms,,,,
math/0508279,Statistical analysis on high-dimensional spheres and shape spaces,,,,
math/0508280,Directions and projective shapes,,,,
math/0508281,Empirical Bayes selection of wavelet thresholds,,,,
math/0508282,A new class of generalized Bayes minimax ridge regression estimators,,,,
math/0508284,"Efficiency improvements in inference on stationary and nonstationary
  fractional time series",,,,
math/0508286,Exact local Whittle estimation of fractional integration,,,,
math/0508313,"On the Bahadur representation of sample quantiles for dependent
  sequences",,,,
math/0508314,Ignorability for categorical data,,,,
math/0508317,"Semiparametric estimation for stationary processes whose spectra have an
  unknown pole",,,,
math/0508437,"Computing all roots of the likelihood equations of seemingly unrelated
  regressions",,,,
math/0508497,Breakdown and groups,,,,
math/0508499,"Discussion of ""Breakdown and groups"" by P. L. Davies and U. Gather",,,,
math/0508500,"Discussion of ""Breakdown and groups"" by P. L. Davies and U. Gather",,,,
math/0508501,"Discussion of ""Breakdown and groups"" by P. L. Davies and U. Gather",,,,
math/0508502,"Discussion of ""Breakdown and groups"" by P. L. Davies and U. Gather",,,,
math/0508503,"Discussion of ""Breakdown and groups"" by P. L. Davies and U. Gather",,,,
math/0508504,"Discussion of ""Breakdown and groups"" by P. L. Davies and U. Gather",,,,
math/0508505,"Rejoinder to ""Breakdown and groups"" by P. L. Davies and U. Gather",,,,
math/0508526,"Discussion of ""Analysis of variance--why it is more important than ever""
  by A. Gelman",,,,
math/0508527,"Discussion of ""Analysis of variance--why it is more important than ever""
  by A. Gelman",,,,
math/0508528,"Discussion of ""Analysis of variance--why it is more important than ever""
  by A. Gelman",,,,
math/0508529,"Discussion of ""Analysis of variance--why it is more important than ever""
  by A. Gelman",,,,
math/0508530,"Rejoinder to ""Analysis of variance--why it is more important than ever""
  by A. Gelman",,,,
math/0508538,"A large deviation inequality for vector functions on finite reversible
  Markov Chains",,,,
math/0508592,Normalized random measures driven by increasing additive processes,,,,
math/0508593,A Bayesian \chi^2 test for goodness-of-fit,,,,
math/0508594,"Central limit theorem for sequential Monte Carlo methods and its
  application to Bayesian inference",,,,
math/0508595,Nonparametric Estimation of an Additive Model With a Link Function,,,,
math/0508596,"From finite sample to asymptotics: A geometric bridge for selection
  criteria in spline regression",,,,
math/0508597,Local linear spatial regression,,,,
math/0508598,Determining the dimension of iterative Hessian transformation,,,,
math/0508599,"Hybrid Shrinkage Estimators Using Penalty Bases For The Ordinal One-Way
  Layout",,,,
math/0508600,Estimation of nonlinear models with Berkson measurement errors,,,,
math/0508601,"Bayesian-motivated tests of function fit and their asymptotic
  frequentist properties",,,,
math/0508602,"Approximately unbiased tests of regions using multistep-multiscale
  bootstrap resampling",,,,
math/0508603,Rank-based optimal tests of the adequacy of an elliptic VARMA model,,,,
math/0508604,"Saddlepoint approximation for Student's t-statistic with no moment
  conditions",,,,
math/0508605,"Saddlepoint approximation for moment generating functions of truncated
  random variables",,,,
math/0508606,Tusnady's inequality revisited,,,,
math/0508607,Approximating a sequence of observations by a simple process,,,,
math/0509028,A comparative study of two stochastic mode reduction methods,,,,
math/0509084,"Inconsistency of the MLE for the joint distribution of interval censored
  survival times and continuous marks",,,,
math/0509132,"Two likelihood-based semiparametric estimation methods for panel count
  data with covariates",,,,
math/0509230,"Stein Shrinkage and Second-Order Efficiency for semiparametric
  estimation of the shift",,,,
math/0509256,Weak convergence in the functional autoregressive model,,,,
math/0509280,Parameter estimation in pair hidden Markov models,,,,
math/0509308,Disaggregation of Long Memory Processes on C^{\infty} Class,,,,
math/0509317,Stationary processes whose filtrations are standard,,,,
math/0509371,"Estimation of the Memory Parameter of the Infinite Source Poisson
  Process",,,,
math/0509423,"Precise finite-sample quantiles of the Jarque-Bera adjusted Lagrange
  multiplier test",,,,
math/0509493,"Nonparametric estimation of mean-squared prediction error in
  nested-error regression models",,,,
math/0509634,Sharp estimation in sup norm with random design,,,,
math/0509696,"Simultaneous adaptation to the margin and to complexity in
  classification",,,,
math/0509698,A Derivation of the Pythagorean Won-Loss Formula in Baseball,,,,
math/0510153,q-Gaussian distributions. Simplifications and simulations,,,,
math/0510188,Mass spectrometry proteomic diagnosis: enacting the validation paradigm,,,,
math/0510242,Two choice optimal stopping,,,,
math/0510271,Thresholding in Learning Theory,,,,
math/0510276,An algorithmic and a geometric characterization of Coarsening At Random,,,,
math/0510311,Adaptive density estimation under dependence,,,,
math/0510436,"Estimating high-dimensional directed acyclic graphs with the
  PC-algorithm",,,,
math/0510449,"Improving Classification When a Class Hierarchy is Available Using a
  Hierarchy-Based Prior",,,,
math/0510521,On surrogate loss functions and $f$-divergences,,,,
math/0510558,"Asymptotic Expansion of the Risk Difference of the Bayesian Spectral
  Density in the ARMA model",,,,
math/0511082,"Asymptotic analysis for the ratio of the random sum of squares to the
  square of the random sum with applications to risk measures",,,,
math/0511105,"New $M$-estimators in semi-parametric regression with errors in
  variables",,,,
math/0511111,"Nonparametric Estimation of the Regression Function in an
  Errors-in-Variables Model",,,,
math/0511140,Condorcet Winner Probabilities - A Statistical Perspective,,,,
math/0511234,"Nonlinearity, correlation and the valuation of employee stock options",,,,
math/0511299,Iterative Feature Selection In Least Square Regression Estimation,,,,
math/0511356,The distribution of rationals in residue classes,,,,
math/0511389,"Weighted Likelihood for Semiparametric Models and Two-phase Stratified
  Samples, with Application to Cox Regression",,,,
math/0511427,A permutation test for matching and its asymptotic distribution,,,,
math/0511506,Estimation in a class of semiparametric transformation models,,,,
math/0511507,Estimation in a semiparametric modulated renewal process,,,,
math/0511508,Quantile regression in transformation models,,,,
math/0511522,On-line predictive linear regression,,,,
math/0511631,"Non singularity of the asymptotic Fisher information matrix in hidden
  Markov models",,,,
math/0512068,Minimizing Squared Vertical and Squared Horizontal Errors,,,,
math/0512069,Minimizing Squared Perpendicular Errors,,,,
math/0512181,"Accompanying document to ""Point Estimation with Exponentially Tilted
  Empirical Likelihood""",,,,
math/0512427,"Generalized probabilities taking values in non-Archimedean fields and
  topological groups",,,,
math/0512444,"Closed-Form Bayesian Inferences for the Logit Model via Polynomial
  Expansions",,,,
math/0512601,"Nonparametric inference of photon energy distribution from indirect
  measurements",,,,
math/0512635,"On the spectral density of the wavelet coefficients of long memory time
  series with application to the log-regression estimation of the memory
  parameter",,,,
math/0512641,Entropy Estimate For High Dimensional Monotonic Functions,,,,
math/0601048,Conditioning by rare sources,,,,
math/0601065,"Maximum pseudo-likelihood estimator for nearest-neighbours Gibbs point
  processes",,,,
math/0601070,"A Wavelet Whittle estimator of the memory parameter of a non-stationary
  Gaussian time series",,,,
math/0601091,Penalized contrast estimator for adaptive density deconvolution,,,,
math/0601098,Finite sample penalization in adaptive density deconvolution,,,,
math/0601099,Poisson inverse problems,,,,
math/0601135,On Sample Functions Behavior of Stable Processes,,,,
math/0601346,Simultaneous confidence bands for the integrated hazard function,,,,
math/0601446,Fixed-width output analysis for Markov chain Monte Carlo,,,,
math/0601448,"On the Quality of a Semidefinite Programming Bound for Sparse Principal
  Component Analysis",,,,
math/0601548,"Uniform in bandwidth consistency of local polynomial regression function
  estimators",,,,
math/0601742,Propagation of Memory Parameter from Durations to Counts,,,,
math/0602013,A data-reconstructed fractional volatility model,,,,
math/0602121,Les p-values comme votes d'experts,,,,
math/0602133,"Statistical Challenges with High Dimensionality: Feature Selection in
  Knowledge Discovery",,,,
math/0602211,Recursive Monte Carlo filters: Algorithms and theoretical analysis,,,,
math/0602214,Estimation of sums of random variables: Examples and information bounds,,,,
math/0602217,Nonparametric estimation of mixing densities for discrete distributions,,,,
math/0602238,The topography of multivariate normal mixtures,,,,
math/0602239,"Asymptotic behavior of the unconditional NPMLE of the length-biased
  survivor function from right censored prevalent cohort data",,,,
math/0602240,"Asymptotic results for maximum likelihood estimators in joint analysis
  of repeated measurements and survival time",,,,
math/0602241,Wavelet thresholding for nonnecessarily Gaussian noise: functionality,,,,
math/0602242,Estimation of the density of regression errors,,,,
math/0602243,"Penalized log-likelihood estimation for partly linear transformation
  models with current status data",,,,
math/0602244,Asymptotic normality of the $L_k$-error of the Grenander estimator,,,,
math/0602253,"Pseudo full likelihood estimation for prospective survival analysis with
  a general semiparametric shared frailty model: asymptotic theory",,,,
math/0602254,"Empirical Bayes estimators for the reproduction parameter of
  Borel-Tanner distribution",,,,
math/0602276,A Sub-Gaussian Berry-Esseen Theorem for the Hypergeometric Distribution,,,,
math/0602292,Cross-validation in nonparametric regression with outliers,,,,
math/0602299,On adaptive estimation of linear functionals,,,,
math/0602302,"Fixed-domain asymptotics for a subclass of Mat\'{e}rn-type Gaussian
  random fields",,,,
math/0602311,"Asymptotic minimaxity of False Discovery Rate thresholding for sparse
  exponential data",,,,
math/0602325,"High moment partial sum processes of residuals in GARCH models and their
  applications",,,,
math/0602326,"Order selection for same-realization predictions in autoregressive
  processes",,,,
math/0602328,"Consistency of the jackknife-after-bootstrap variance estimator for the
  bootstrap quantiles of a studentized statistic",,,,
math/0602346,"Goodness-of-Fit Tests for Symmetric Stable Distributions -- Empirical
  Characteristic Function Approach",,,,
math/0602377,A frequentist framework of inductive reasoning,,,,
math/0602429,"Small time asymptotics in local limit theorems for Markov chains
  converging to diffusions",,,,
math/0602430,Accuracy of Diffusion Approximations for High Frequency Markov Data,,,,
math/0602455,Simulation of conditioned diffusions,,,,
math/0602505,MDL Convergence Speed for Bernoulli Sequences,,,,
math/0602611,Expertises : proc\'{e}dures statistiques d'aide \`{a} la d\'{e}cision,,,,
math/0602629,Improved Second-Order Bounds for Prediction with Expert Advice,,,,
math/0602659,Sharp adaptive estimation of the drift function for ergodic diffusions,,,,
math/0602663,Estimation of anisotropic Gaussian fields through Radon transform,,,,
math/0603040,Testing for a linear MA model against threshold MA models,,,,
math/0603043,Distribution free goodness-of-fit tests for linear processes,,,,
math/0603047,On recursive estimation for time varying autoregressive processes,,,,
math/0603058,"Design Flaws in the Implementation of the Ziggurat and Monty Python
  methods (and some remarks on Matlab randn)",,,,
math/0603071,Identification of multitype branching processes,,,,
math/0603073,"Partially observed information and inference about non-Gaussian mixed
  linear models",,,,
math/0603075,"Optimal designs for three-dimensional shape analysis with spherical
  harmonic descriptors",,,,
math/0603078,On the two-phase framework for joint model and design-based inference,,,,
math/0603079,Construction of optimal multi-level supersaturated designs,,,,
math/0603082,Majorization framework for balanced lattice designs,,,,
math/0603083,Universal optimality of Patterson's crossover designs,,,,
math/0603084,Advances on nonparametric regression for functional variables,,,,
math/0603123,Ranking and empirical minimization of U-statistics,,,,
math/0603130,"Nonparametric methods for inference in the presence of instrumental
  variables",,,,
math/0603132,Functional linear regression analysis for longitudinal data,,,,
math/0603134,Nonquadratic estimators of a quadratic functional,,,,
math/0603135,"Sobolev tests of goodness of fit of distributions on compact Riemannian
  manifolds",,,,
math/0603136,Multivariate Bayesian function estimation,,,,
math/0603221,An invariance principle for weakly dependent stationary general models,,,,
math/0603228,Nonparametric Bayesian Classification,,,,
math/0603238,Goodness-of-fit tests via phi-divergences,,,,
math/0603254,Convergence rates for density estimators of weakly dependent time series,,,,
math/0603271,Spherical Slepian functions and the polar gap in geodesy,,,,
math/0603349,Density estimation with quadratic loss: a confidence intervals method,,,,
math/0603378,"Testing statistical hypothesis on random trees and applications to the
  protein classification problem",,,,
math/0603447,"Optimal rates of aggregation in classification under low noise
  assumption",,,,
math/0603448,Lower bounds and aggregation in density estimation,,,,
math/0603495,"Iterative proportional scaling via decomposable submodels for
  contingency tables",,,,
math/0603497,"A Comparison of Information Concerning the Regression Parameter in The
  Accelerated Failure Time Model under Current Duration and Length Biased
  Sampling: Does it Pay to be Patient?",,,,
math/0603526,"Optimal oracle inequality for aggregation of classifiers under low noise
  condition",,,,
math/0603535,"Separation Theorem for Independent Subspace Analysis with Sufficient
  Conditions",,,,
math/0603603,"Conditions for swappability of records in a microdata set when some
  marginals are fixed",,,,
math/0603609,"Evaluation of per-record identification risk and swappability of records
  in a microdata set via decomposable models",,,,
math/0603636,"Linear Stochastic Differential Equations Driven by a Fractional Brownian
  Motion with Hurst Parameter less than 1/2",,,,
math/0603644,Approximation of the Multiplication Table Function,,,,
math/0603668,Parameter Estimation for Multiscale Diffusions,,,,
math/0603719,On the asymptotic distribution of certain bivariate reinsurance treaties,,,,
math/0604064,High-Dimensional Data Clustering,,,,
math/0604205,"Pattern Recognition Approaches to Solving Combinatorial Problems in Free
  Groups",,,,
math/0604214,"Exponential inequalities and functional estimations for weak dependent
  datas ; applications to dynamical systems",,,,
math/0604225,"Incidence-based Estimates of Healthy Life Expectancy for the United
  Kingdom: Coherence between Transition Probabilities and Aggregate Life Tables",,,,
math/0604233,"Generalization error bounds in semi-supervised classification under the
  cluster assumption",,,,
math/0604367,Network Delay Inference from Additive Metrics,,,,
math/0604410,Discrete Component Analysis,,,,
math/0604417,"Admissibility and minimaxity of generalized Bayes estimators for
  spherically symmetric family",,,,
math/0604488,Moments of minors of Wishart matrices,,,,
math/0604627,"A new correlation coefficient, its orthogonal decomposition and
  associated tests of independence",,,,
math/0604640,A Delayed Black and Scholes Formula I,,,,
math/0604641,A Delayed Black and Scholes Formula II,,,,
math/0605007,Generalization of the Borel-Cantelli Lemma,,,,
math/0605134,"Higher order semiparametric frequentist inference with the profile
  sampler",,,,
math/0605146,Effective support size,,,,
math/0605224,Measuring Large Scale Space Perception in Literary Texts,,,,
math/0605263,"Selection of a MCMC simulation strategy via an entropy convergence
  criterion",,,,
math/0605282,"Bahadur--Kiefer theory for sample quantiles of weakly dependent linear
  processes",,,,
math/0605283,Optimal rates in the Bahadur-Kiefer representation for GARCH sequences,,,,
math/0605322,"Sequential change-point detection when unknown parameters are present in
  the pre-change distribution",,,,
math/0605323,Consistent estimation of the basic neighborhood of Markov random fields,,,,
math/0605432,Improved minimax predictive densities under Kullback--Leibler loss,,,,
math/0605433,"Sufficient Conditions for the Invertibility of Adapted Perturbations of
  Identity on the Wiener Space",,,,
math/0605436,Spatial extremes: Models for the stationary case,,,,
math/0605437,Penalized maximum likelihood and semiparametric second-order efficiency,,,,
math/0605452,Resampling from the past to improve on MCMC algorithms,,,,
math/0605462,Adaptive confidence balls,,,,
math/0605473,Adaptive nonparametric confidence sets,,,,
math/0605498,"Cross-Entropic Learning of a Machine for the Decision in a Partially
  Observable Universe",,,,
math/0605506,"Serial and nonserial sign-and-rank statistics: asymptotic representation
  and asymptotic normality",,,,
math/0605511,Local partial-likelihood estimation for lifetime data,,,,
math/0605513,"Adaptive multiscale detection of filamentary structures in a background
  of uniform random points",,,,
math/0605582,Bayesian analysis for reversible Markov chains,,,,
math/0605607,"False discovery and false nondiscovery rates in single-step multiple
  testing procedures",,,,
math/0605609,Nonsubjective priors via predictive relative entropy regret,,,,
math/0605612,"Asymptotic normality of extreme value estimators on $C[0,1]$",,,,
math/0605613,"Stable limits of martingale transforms with application to the
  estimation of GARCH parameters",,,,
math/0605615,Sequential importance sampling for multiway tables,,,,
math/0605616,"Doubling and projection: a method of constructing two-level designs of
  resolution iv",,,,
math/0605617,Large deviations for sums defined on a Galton-Watson process,,,,
math/0605699,"On the Average Number of Sharp Crossings of Certain Gaussian Random
  Polynomials",,,,
math/0605751,Boosting for Functional Data,,,,
math/0605778,"Semiparametric estimation of volatility functions of diffusion processes
  from discretely observed data",,,,
math/0605793,PAC-Bayesian inductive and transductive learning,,,,
math/0605794,Independent Component Analysis and estimation of a quadratic functional,,,,
math/0606068,The knee-jerk mapping,,,,
math/0606080,Walking into an absolute sum,,,,
math/0606166,Adaptive density deconvolution with dependent inputs,,,,
math/0606192,"Semi-parametric estimation of the hazard function in a model with
  covariate measurement error",,,,
math/0606219,Significant edges in the case of a non-stationary Gaussian noise,,,,
math/0606238,On the Generalized Poisson Distribution,,,,
math/0606278,"Network-Based Marketing: Identifying Likely Adopters via Consumer
  Networks",,,,
math/0606315,Bayesian Regression of Piecewise Constant Functions,,,,
math/0606392,"Domain of attraction of the quasi-stationary distributions for the
  Ornstein-Uhlenbeck process",,,,
math/0606441,Classifier Technology and the Illusion of Progress,,,,
math/0606447,Comment: Classifier Technology and the Illusion of Progress,,,,
math/0606452,"Comment: Classifier Technology and the Illusion of Progress--Credit
  Scoring",,,,
math/0606455,"Elaboration on Two Points Raised in ``Classifier Technology and the
  Illusion of Progress''",,,,
math/0606457,Comment: Classifier Technology and the Illusion of Progress,,,,
math/0606461,Rejoinder: Classifier Technology and the Illusion of Progress,,,,
math/0606471,"An Algorithmic Approach to Non-self-financing Hedging in a Discrete-Time
  Incomplete Market",,,,
math/0606491,General Design Bayesian Generalized Linear Mixed Models,,,,
math/0606497,Analyzing Incomplete Discrete Longitudinal Clinical Trial Data,,,,
math/0606526,"Confidence bands for densities, logarithmic point of view",,,,
math/0606533,The Sources of Kolmogorov's Grundbegriffe,,,,
math/0606550,A Conversation with Yuan Shih Chow,,,,
