id,title,pagerank,betweenness,in_degree,out_degree
math/0703836,Forgetting of the initial distribution for Hidden Markov Models,1.3189329710618589e-06,0.0,0.0,1.0
math/0408321,"Some improvements in numerical evaluation of symmetric stable density
  and its derivatives",1.3189329710618589e-06,0.0,0.0,1.0
math/9701205,"Confidence regions for means of multivariate normal distributions and a
  non-symmetric correlation inequality for gaussian measure",1.3189329710618589e-06,0.0,0.0,1.0
math/0612361,"Goodness-of-fit testing and quadratic functional estimation from
  indirect observations",1.3189329710618589e-06,0.0,0.0,1.0
math/0601429,"Large and moderate deviations principles for recursive kernel estimators
  of a multivariate density and its partial derivatives",1.3189329710618589e-06,0.0,0.0,1.0
physics/0411003,Updating seismic hazard at Parkfield,1.3189329710618589e-06,0.0,0.0,1.0
math/0608570,"Integral representations of one dimensional projections for multivariate
  stable densities",1.3189329710618589e-06,0.0,0.0,1.0
math/0410214,Aggregation for Regression Learning,1.3189329710618589e-06,0.0,0.0,1.0
math/0605187,The Brouwer Lecture 2005: Statistical estimation with model selection,1.3189329710618589e-06,0.0,0.0,1.0
math/0406218,Central Limit Theorem and convergence to stable laws in Mallows distance,1.3189329710618589e-06,0.0,0.0,1.0
math/0411333,"The empirical distribution of the eigenvalues of a Gram matrix with a
  given variance profile",1.3189329710618589e-06,0.0,0.0,1.0
math/0002061,Is Bootstrap Really Helpful in Point Process Statistics?,1.3189329710618589e-06,0.0,0.0,2.0
math/0003098,Reconstruction of Gray-scale Images,1.3189329710618589e-06,0.0,0.0,1.0
math/0409045,Mimicking counterfactual outcomes to estimate causal effects,1.3189329710618589e-06,0.0,0.0,2.0
math/0305053,Poisson calculus for spatial neutral to the right processes,1.3189329710618589e-06,0.0,0.0,2.0
math/0510662,"Capital process and optimality properties of a Bayesian Skeptic in
  coin-tossing games",1.3189329710618589e-06,0.0,0.0,3.0
math/0511324,Multiple Multidimensional Morse Wavelets,1.3189329710618589e-06,0.0,0.0,3.0
math/0511502,"The Volume-of-Tubes Formula: Computational Methods and Statistical
  Applications",1.3189329710618589e-06,0.0,0.0,1.0
math/0608100,"Separation Theorem for K-Independent Subspace Analysis with Sufficient
  Conditions",1.3189329710618589e-06,0.0,0.0,3.0
math/0405044,"Polyhedral conditions for the nonexistence of the MLE for hierarchical
  log-linear models",1.3189329710618589e-06,0.0,0.0,1.0
math/0309355,"On the largest eigenvalue of Wishart matrices with identity covariance
  when n, p and p/n tend to infinity",1.3189329710618589e-06,0.0,0.0,8.0
math/0406077,A tutorial introduction to the minimum description length principle,1.3189329710618589e-06,0.0,0.0,1.0
math/0006233,Algorithmic Statistics,1.3189329710618589e-06,0.0,0.0,2.0
math/0508267,Multiple Testing and Error Control in Gaussian Graphical Model Selection,1.3189329710618589e-06,0.0,0.0,1.0
math/0508266,"Maximum Likelihood Estimation in Gaussian Chain Graph Models under the
  Alternative Markov Property",1.3189329710618589e-06,0.0,0.0,1.0
math/0405572,Teleportation into Quantum Statistics,1.3189329710618589e-06,0.0,0.0,2.0
math/0610846,Frequentist statistics as a theory of inductive inference,1.3189329710618589e-06,0.0,0.0,1.0
math/0110086,Randomness,1.3189329710618589e-06,0.0,0.0,1.0
math/0405595,An invitation to quantum tomography (II),1.3189329710618589e-06,0.0,0.0,1.0
math/0401379,A finiteness theorem for Markov bases of hierarchical models,1.3189329710618589e-06,0.0,0.0,1.0
math/0507151,"Likelihood inference for incompletely observed stochastic processes:
  ignorability conditions",1.3189329710618589e-06,0.0,0.0,1.0
math/0610402,"A Newton-Like Algorithm for Likelihood Maximization: The Robust-Variance
  Scoring Algorithm",1.3189329710618589e-06,0.0,0.0,1.0
math/0106002,"Extension of Fill's perfect rejection sampling algorithm to general
  chains (Extended abstract)",1.3189329710618589e-06,0.0,0.0,1.0
math/0608663,"Estimating the intensity of a random measure by histogram type
  estimators",1.3189329710618589e-06,0.0,0.0,1.0
math/0509081,"Estimation of a $k$-monotone density: limit distribution theory and the
  spline connection",1.3189329710618589e-06,0.0,0.0,1.0
q-bio/0410033,"Four basic symmetry types in the universal 7-cluster structure of 143
  complete bacterial genomic sequences",1.3189329710618589e-06,0.0,0.0,1.0
math/0606709,"Some characterizations of the spherical harmonics coefficients for
  isotropic random fields",1.3189329710618589e-06,0.0,0.0,1.0
math/0605791,Subgeometric rates of convergence of f-ergodic strong Markov processes,1.3189329710618589e-06,0.0,0.0,2.0
math/0501297,"Generalized Arithmetic and Geometric Mean Divergence Measure and their
  Statistical Aspects",1.3189329710618589e-06,0.0,0.0,1.0
cs/0112019,Distribution of Mutual Information,,,,
cs/0305052,On the Existence and Convergence Computable Universal Priors,,,,
cs/0403025,Distribution of Mutual Information from Complete and Incomplete Data,,,,
cs/0404057,Convergence of Discrete MDL for Sequential Prediction,,,,
cs/0506022,Asymptotics of Discrete MDL for Online Prediction,,,,
cs/0507060,The Entropy of a Binary Hidden Markov Process,,,,
cs/0602092,"Inconsistent parameter estimation in Markov random fields: Benefits in
  the computation-limited setting",,,,
cs/0605009,On the Foundations of Universal Sequence Prediction,,,,
cs/0605047,"Generalized Entropy Power Inequalities and Monotonicity Properties of
  Information",,,,
cs/0608049,"Solving non-uniqueness in agglomerative hierarchical clustering using
  multidendrograms",,,,
cs/0610134,A Markov Chain based method for generating long-range dependence,,,,
cs/0610135,"Markov-modulated on/off processes for long-range dependent internet
  traffic",,,,
cs/0612124,Highly robust error correction by convex programming,,,,
cs/0701052,"Time Series Forecasting: Obtaining Long Term Trends with Self-Organizing
  Maps",,,,
cs/0702018,Estimation of the Rate-Distortion Function,,,,
gr-qc/0604017,Detecting Highly Oscillatory Signals by Chirplet Path Pursuit,,,,
math-ph/0109023,"The von Neumann entropy and information rate for ideal quantum Gibbs
  ensembles",,,,
math-ph/0305016,"The von Neumann entropy and information rate for integrable quantum
  Gibbs ensembles, 2",,,,
math-ph/0509046,Uncertainty Principle and Quantum Fisher Information,,,,
math-ph/0612005,Dynamical behavior of a large complex system,,,,
math-ph/0612006,Stability of the dynamics of an asymmetric neural network,,,,
math-ph/0702041,"Universal Fluctuations in Response Parameters of Systems in Isotropic
  Random Environments",,,,
math/0011059,Statistical analysis of the inhomogeneous telegrapher's process,,,,
math/0012098,"Estimating the p-variation index of a sample function: An application to
  financial data set",,,,
math/0104083,"Sparsity vs. Statistical Independence in Adaptive Signal
  Representations: A Case Study of the Spike Process",,,,
math/0105252,"Extension of Fill's perfect rejection sampling algorithm to general
  chains",,,,
math/0107135,Nonparametric Volatility Density Estimation,,,,
math/0110103,"The Generalized Spike Process, Sparsity, and Statistical Independence",,,,
math/0111020,Fisher Information inequalities and the Central Limit Theorem,,,,
math/0111152,Approximating distribution functions by iterated function systems,,,,
math/0111153,"Statistical analysis of stochastic resonance with ergodic diffusion
  noise",,,,
math/0112032,Asymptotic normality of kernel type deconvolution estimators,,,,
math/0112298,Annuities under random rates of interest - revisited,,,,
math/0201273,Entropy and a generalisation of `Poincare's Observation',,,,
math/0202136,Interruptible exact sampling in the passive case,,,,
math/0203080,Estimating a structural distribution function by grouping,,,,
math/0206006,An Illuminating Counterexample,,,,
math/0206142,Nonparametric volatility density estimation for discrete time models,,,,
math/0207033,Stochastic apportionment,,,,
math/0207044,On-line tracking of a smooth regression function,,,,
math/0210068,"Nonlinear Filtering of Diffusion Processes in Correlated Noise: Analysis
  by Separation of Variables",,,,
math/0210425,Estimating the structural distribution function of cell probabilities,,,,
math/0211079,Combining kernel estimators in the uniform deconvolution problem,,,,
math/0212007,"Asymptotic Normality of Nonparametric Kernel Type Deconvolution Density
  Estimators: crossing the Cauchy boundary",,,,
math/0212350,"Asymptotically efficient estimation of linear functionals in inverse
  regression models",,,,
math/0212395,Emerging applications of geometric multiscale analysis,,,,
math/0212400,Pattern theory: the mathematics of perception,,,,
math/0212410,"Hidden Markov and state space models: asymptotic analysis of exact and
  approximate methods for prediction, filtering, smoothing and statistical
  inference",,,,
math/0212411,Statistical equivalence and stochastic process limit theorems,,,,
math/0302016,"Nonparametric estimation of distribution and density functions in
  presence of missing data: an IFS approach",,,,
math/0304041,"Efficient Determination of Gibbs Estimators with Submodular Energy
  Functions",,,,
math/0304311,Identifying several biased coins encountered by a hidden random walk,,,,
math/0305121,Robust Estimators under the Imprecise Dirichlet Model,,,,
math/0305234,"Efficient estimation in the accelerated failure time model under cross
  sectional sampling",,,,
math/0305273,Parametric Estimation of Diffusion Processes Sampled at First Exit Times,,,,
math/0306237,Rates of convergence for constrained deconvolution problem,,,,
math/0306326,Chernoff's bound forms,,,,
math/0308280,Markov bases of binary graph models,,,,
math/0310006,"The marginalization paradox does not imply inconsistency for improper
  priors",,,,
math/0310223,Consistent Estimation of Pricing Kernels from Noisy Price Data,,,,
math/0312056,Nonparametric Estimation in the Model of Moving Average,,,,
math/0312132,"Approximation of integrals over asymptotic sets with applications to
  probability and statistics",,,,
math/0312215,"Eigenvalue Spacing Distribution for the Ensemble of Real Symmetric
  Toeplitz Matrices",,,,
math/0404095,Towards a theory of negative dependence,,,,
math/0404277,Tracking of Historical Volatility,,,,
math/0405038,Small contingency tables with large gaps,,,,
math/0405046,The space of compatible full conditionals is a unimodular toric variety,,,,
math/0405051,"Explicit representation of finite predictor coefficients and its
  applications",,,,
math/0405345,"Bounding the generalization error of convex combinations of classifiers:
  balancing the dimensionality and the margins",,,,
math/0405425,Reductions of Hidden Information Sources,,,,
math/0405521,"Moderate deviations for non-linear functionals and empirical spectral
  density of moving average processes",,,,
math/0406173,Symmetric measures via moments,,,,
math/0406221,"Suboptimal behaviour of Bayes and MDL in classification under
  misspecification",,,,
math/0406237,Adjusted Viterbi training,,,,
math/0406424,Multiscale likelihood analysis and complexity penalized estimation,,,,
math/0406425,Confidence balls in Gaussian regression,,,,
math/0406427,Minimax estimation of linear functionals over nonconvex parameter spaces,,,,
math/0406430,Statistical inference for time-inhomogeneous volatility models,,,,
math/0406431,Estimating invariant laws of linear processes by U-statistics,,,,
math/0406432,The efficiency of the estimators of the parameters in GARCH processes,,,,
math/0406433,"Selecting optimal multistep predictors for autoregressive processes of
  unknown order",,,,
math/0406446,Survey: Information flow on trees,,,,
math/0406447,Robust reconstruction on trees is determined by the second eigenvalue,,,,
math/0406451,"Missing at random, likelihood ignorability and model completeness",,,,
math/0406452,Information bounds for Cox regression models with missing data,,,,
math/0406453,Finite sample properties of multiple imputation estimators,,,,
math/0406454,"Sufficient burn-in for Gibbs samplers for a hierarchical random effects
  model",,,,
math/0406455,Mean squared error of empirical predictor,,,,
math/0406456,Least Angle Regression,,,,
math/0406460,Training samples in objective Bayesian model selection,,,,
math/0406462,Local Whittle estimation in nonstationary and unit root cases,,,,
math/0406463,"Discussion of ""Least angle regression"" by Efron et al",,,,
math/0406464,Optimal predictive model selection,,,,
math/0406465,"Consistent covariate selection and post model selection inference in
  semiparametric regression",,,,
math/0406466,Nonconcave penalized likelihood with a diverging number of parameters,,,,
math/0406467,"Discussion of ""Least angle regression"" by Efron et al",,,,
math/0406468,"Discussion of ""Least angle regression"" by Efron et al",,,,
math/0406469,"Discussion of ""Least angle regression"" by Efron et al",,,,
math/0406470,"Discussion of ""Least angle regression"" by Efron et al",,,,
math/0406471,"Discussion of ""Least angle regression"" by Efron et al",,,,
math/0406472,"Discussion of ""Least angle regression"" by Efron et al",,,,
math/0406473,"Discussion of ""Least angle regression"" by Efron et al",,,,
math/0406474,"Rejoinder to ""Least angle regression"" by Efron et al",,,,
math/0406518,Martingale transforms goodness-of-fit tests in regression models,,,,
math/0406519,A stochastic process approach to false discovery control,,,,
math/0406520,Testing predictor contributions in sufficient dimension reduction,,,,
math/0406521,Density estimation for biased data,,,,
math/0406522,Semiparametric density estimation by local L_2-fitting,,,,
math/0406523,"Empirical-likelihood-based confidence interval for the mean with a
  heavy-tailed distribution",,,,
math/0406524,"Bounds on coverage probabilities of the empirical likelihood ratio
  confidence regions",,,,
math/0406525,"Estimation of fractal dimension for a class of Non-Gaussian stationary
  processes and fields",,,,
math/0406527,"Monomial ideals and the Scarf complex for coherent systems in
  reliability theory",,,,
math/0407281,"Improving Asymptotic Variance of MCMC Estimators: Non-reversible Chains
  are Better",,,,
math/0407396,Optimal change-point estimation from indirect observations,,,,
math/0408057,Discussion on Benford's Law and its Application,,,,
math/0409112,On the Markov chain central limit theorem,,,,
math/0409165,"Estimating the causal effect of a time-varying treatment on
  time-to-event using structural nested failure time models",,,,
math/0409180,"Estimating marginal survival function by adjusting for dependent
  censoring using many covariates",,,,
math/0409197,"Strong consistency of MLE for finite uniform mixtures when the scale
  parameters are exponentially small",,,,
math/0409230,"A maximum likelihood algorithm for the estimation and renormalization of
  exponential densities",,,,
math/0409237,Random Variables with Completely Independent Subcollections,,,,
math/0409429,Bounding Fastest Mixing,,,,
math/0409548,"On mutual information, likelihood-ratios and estimation error for the
  additive Gaussian channel",,,,
math/0410012,Geometric Ergodicity and Perfect Simulation,,,,
math/0410071,"Densities, spectral densities and modality",,,,
math/0410072,Higher criticism for detecting sparse heterogeneous mixtures,,,,
math/0410073,"Breakdown points for maximum likelihood estimators of location-scale
  mixtures",,,,
math/0410074,Asymptotic global robustness in bayesian decision theory,,,,
math/0410076,"Game theory, maximum entropy, minimum discrepancy and robust Bayesian
  decision theory",,,,
math/0410079,"Uniform asymptotics for robust location estimates when the scale is
  unknown",,,,
math/0410081,"Robust Inference for Univariate Proportional Hazards Frailty Regression
  Models",,,,
math/0410083,A Bernstein-von Mises theorem in the nonparametric right-censoring model,,,,
math/0410086,"Statistical estimation in the proportional hazards model with risk set
  sampling",,,,
math/0410087,Convergence rates for posterior distributions and adaptive estimation,,,,
math/0410088,"Needles and straw in haystacks: Empirical Bayes estimates of possibly
  sparse sequences",,,,
math/0410089,Optimality of neighbor-balanced designs for total effects,,,,
math/0410090,Construction of E(s^2)-optimal supersaturated designs,,,,
math/0410091,Complexity regularization via localized random penalties,,,,
math/0410092,Generalization bounds for averaged classifiers,,,,
math/0410093,"Statistical properties of the method of regularization with periodic
  Gaussian reproducing kernel",,,,
math/0410094,Simultaneous prediction of independent Poisson observables,,,,
math/0410095,Maximum Fisher information in mixed state quantum systems,,,,
math/0410280,Improved Vapnik Cervonenkis bounds,,,,
math/0410354,"Convergence rates for pointwise curve estimation with a degenerate
  design",,,,
math/0410385,A Generic Random Number Generator Test Suite,,,,
math/0410411,"Maxwell's daemon, the Turing machine, and Jaynes' robot",,,,
math/0410419,"An introduction to (smoothing spline) ANOVA models in RKHS with examples
  in geographical data, medicine, atmospheric science and machine learning",,,,
math/0410424,Direct pivotal predictive inference,,,,
math/0411008,"On the reconstruction of the drift of a diffusion from transition
  probabilities which are partially observed in space",,,,
math/0411033,"A hierarchical technique for estimating location parameter in the
  presence of missing data",,,,
math/0411034,A selective overview of nonparametric methods in financial econometrics,,,,
math/0411195,Average treatment effect estimation via random recursive partitioning,,,,
math/0411276,Limiting Behaviour of the Mean Residual Life,,,,
math/0411297,On Representing the Mean Residual Life in Terms of the Failure Rate,,,,
math/0411298,"On the Distribution of the Sum of n Non-Identically Distributed Uniform
  Random Variables",,,,
math/0411397,"Efficient Estimation of Stochastic Volatility Using Noisy Observations:
  A Multi-Scale Approach",,,,
math/0411515,Fast Non-Parametric Bayesian Inference on Infinite Trees,,,,
math/0411516,"On nonparametric maximum likelihood for a class of stochastic inverse
  problems",,,,
math/0411539,"An optimal series expansion of the multiparameter fractional Brownian
  motion",,,,
math/0412035,Simulations of Gaussian Processes and Neuronal Modeling,,,,
math/0412203,Consistency of Bayes estimators of a binary regression function,,,,
math/0412232,"The existence of maximum likelihood estimates in the Bradley-Terry model
  and its extensions",,,,
math/0412267,Empirical processes of dependent random variables,,,,
math/0412268,M-estimation of linear models with dependent errors,,,,
math/0412345,Stein Estimation for Infinitely Divisible Laws,,,,
math/0412351,"Nonparametric estimation for Levy processes with a view towards
  mathematical finance",,,,
math/0501221,Kernel Estimation of Density Level Sets,,,,
math/0501289,"Estimating the proportion of false null hypotheses among a large number
  of independently tested hypotheses",,,,
math/0501299,"On Unified Generalizations of Relative Jensen--Shannon and
  Arithmetic--Geometric Divergence Measures, and Their Properties",,,,
math/0501300,Generalized Non-Symmetric Divergence Measures and Inequalities,,,,
math/0501360,A Reversion of the Chernoff Bound,,,,
math/0501423,Parameter estimates for fractional autoregressive spatial processes,,,,
math/0502020,Correlated samples with fixed and nonnormal latent variables,,,,
math/0502033,Complexity regularization for nonlinear inverse problems,,,,
math/0502091,Nonparametric regression estimation for random fields in a fixed-design,,,,
math/0502285,The ARHD model,,,,
math/0502315,"Strong Asymptotic Assertions for Discrete MDL in Regression and
  Classification",,,,
math/0502324,Limit laws for random vectors with an extreme component,,,,
math/0502339,"Algebraic Characterizations of Consensus Problems for Networked Dynamic
  Systems",,,,
math/0502340,On Robust Stability of Multivariable Interval Control Systems,,,,
math/0502341,Coordination of Multiple Dynamic Agents with Asymmetric Interactions,,,,
math/0502342,"Flocking Control of Groups of Mobile Autonomous Agents via Local
  Feedback",,,,
math/0503434,"A stochastic approximation algorithm with multiplicative step size
  adaptation",,,,
math/0503495,On the shrinkage behavior of partial least squares regression,,,,
math/0503662,An adaptation theory for nonparametric confidence intervals,,,,
math/0503663,Periodic boxcar deconvolution and diophantine approximation,,,,
math/0503665,Robust nonparametric inference for the median,,,,
math/0503667,Sieve empirical likelihood ratio tests for nonparametric functions,,,,
math/0503668,The Hough transform estimator,,,,
math/0503669,Wavelet-based estimation with multiple sampling rates,,,,
math/0503671,On optimal spatial subsample size for variance estimation,,,,
math/0503672,New approaches to Bayesian consistency,,,,
math/0503673,"On the posterior distribution of the number of components in a finite
  mixture",,,,
math/0503674,"Equivalence theory for density estimation, Poisson processes and
  Gaussian white noise with drift",,,,
math/0503675,Attributing a probability to the shape of a probability density,,,,
math/0503676,Bump hunting with non-Gaussian kernels,,,,
math/0503677,Optimal designs for a class of nonlinear regression models,,,,
math/0503678,"Geometric isomorphism and minimum aberration for factorial designs with
  quantitative factors",,,,
math/0503679,"Estimators of diffusions with randomly spaced discrete observations: A
  general theory",,,,
math/0503680,"Nonparametric estimation of scalar diffusions based on low frequency
  data",,,,
math/0503681,"Asymptotic properties of the maximum likelihood estimator in
  autoregressive models with Markov regime",,,,
math/0503682,"Asymptotic operating characteristics of an optimal change point
  detection in hidden Markov models",,,,
math/0503712,"Bayesian alignment using hierarchical models, with applications in
  protein bioinformatics",,,,
math/0503715,On pointwise adaptive curve estimation with a degenerate random design,,,,
math/0503737,On the testability of the CAR assumption,,,,
math/0504064,A Statistical view of Iterative Methods for Linear Inverse Problems,,,,
math/0504378,"A Short Proof that Phylogenetic Tree Reconstruction by Maximum
  Likelihood is Hard",,,,
math/0504382,Exact oracle inequality for a sharp adaptive kernel density estimator,,,,
math/0504383,Exact minimax risk for density estimators in non-integer Sobolev classes,,,,
math/0504477,On hybrid simulation schemes for stochastic reaction dynamics,,,,
math/0504485,Some properties of the Lerch family of discrete distributions,,,,
math/0504499,Analysis of variance--why it is more important than ever,,,,
math/0504501,"General empirical Bayes wavelet methods and exactly adaptive minimax
  estimation",,,,
math/0504503,"Minimax estimation with thresholding and its application to wavelet
  analysis",,,,
math/0504505,Decision theory results for one-sided multiple comparison procedures,,,,
math/0504506,"Characterization of Bayes procedures for multiple endpoint problems and
  inadmissibility of the step-up procedure",,,,
math/0504507,"Combining information from independent sources through confidence
  distributions",,,,
math/0504508,"Nonparametric estimation over shrinking neighborhoods: Superefficiency
  and adaptation",,,,
math/0504509,"Testing convex hypotheses on the mean of a Gaussian vector. Application
  to testing qualitative hypotheses on a regression function",,,,
math/0504510,"Efficient estimation of a semiparametric partially linear varying
  coefficient model",,,,
math/0504511,Bandwidth choice for nonparametric classification,,,,
math/0504512,Efficient estimation of Banach parameters in semiparametric models,,,,
math/0504513,A robust method for cluster analysis,,,,
math/0504514,Depth weighted scatter estimators,,,,
math/0504515,Generalized bootstrap for estimating equations,,,,
math/0504516,"Iterated smoothed bootstrap confidence intervals for population
  quantiles",,,,
math/0505033,A symbolic method for k-statistics,,,,
math/0505045,"On convergence of importance sampling and other properly weighted
  samples to the target distribution",,,,
math/0505053,"Asymptotic statistical equivalence for ergodic diffusions: the
  multidimensional case",,,,
math/0505081,Estimation in autoregressive models with Markov regime,,,,
math/0505172,A Functional Wavelet-Kernel Approach for Continuous-time Prediction,,,,
math/0505184,Volatility Estmators for Discretely Sampled L\'{e}vy Processses,,,,
math/0505224,The Bezoutian and Fisher's information matrix of an ARMA process,,,,
math/0505265,"Asymptotic results on the moments of the ratio of the random sum of
  squares to the square of the random sum",,,,
math/0505333,"Recursive Aggregation of Estimators by Mirror Descent Algorithm with
  Averaging",,,,
math/0505355,A kernel type nonparametric density estimator for decompounding,,,,
math/0505374,Adapting to Unknown Sparsity by controlling the False Discovery Rate,,,,
math/0505387,"Prospective survival analysis with a general semiparametric shared
  frailty model - a pseudo full likelihood approach",,,,
math/0505444,Skew convolution semigroups and affine Markov processes,,,,
math/0505522,Perfectly random sampling of truncated multinormal distributions,,,,
math/0505527,zoo: S3 Infrastructure for Regular and Irregular Time Series,,,,
math/0505599,Selecting likelihood weights by cross-validation,,,,
